ID,Date Reported,Date Occured,Area Name,Victim Age,Victim Sex,Victim Descent,Location,Latitude,Longitude,Criminal Activities,Criminal Activities grped,Criminal Activities re-grped,
5,05/01/2010,2010-01-04,Central,23,M,B,700 W  7TH                          ST,34.048,-118.2577,Theft,Property Crime,Non-Violent Crimes,0.996459032
228,18/06/2010,2010-06-17,Central,40,M,W,1100 S  FIGUEROA                     ST,34.0437,-118.2652,Theft,Property Crime,Non-Violent Crimes,0.993467813
392,31/10/2010,2010-10-30,Central,34,F,H,FIGUEROA                     ST,34.0598,-118.2485,Theft,Property Crime,Non-Violent Crimes,0.999725843
585,12/01/2010,2010-01-10,Central,26,M,A,800    ALPINE                       ST,34.0637,-118.244,Theft,Property Crime,Non-Violent Crimes,0.999245893
632,13/01/2010,2010-01-13,Central,23,F,H,7TH                          ST,34.0487,-118.2588,Battery Crime,Bodily Harm,Violent Crimes,0.996291089
787,24/01/2010,2010-01-24,Central,52,M,W,8TH                          ST,34.0487,-118.2627,Theft,Property Crime,Non-Violent Crimes,0.995881292
1086,11/02/2010,2010-02-11,Central,48,F,H,500    SAN JULIAN                   ST,34.0446,-118.245,Assault,Bodily Harm,Violent Crimes,0.997214357
1630,17/03/2010,2010-03-17,Central,74,F,O,BROADWAY,34.0673,-118.2354,Robbery,Robbery,Violent Crimes,0.997328576
2117,14/04/2010,2010-04-14,Central,41,M,O,200 E  14TH                         ST,34.0347,-118.2602,Theft,Property Crime,Non-Violent Crimes,0.992354581
2158,17/04/2010,2010-04-17,Central,9,M,O,1ST,34.0522,-118.2434,Battery Crime,Bodily Harm,Violent Crimes,0.998978566
2196,19/04/2010,2010-04-19,Central,40,M,H,300 S  SPRING                       ST,34.0503,-118.247,Assault,Bodily Harm,Violent Crimes,0.991944431
2551,09/05/2010,2010-05-09,Central,12,M,H,1400    WRIGHT                       ST,34.0398,-118.2726,Battery Crime,Bodily Harm,Violent Crimes,0.996975018
2684,17/05/2010,2010-05-15,Central,19,M,H,100 W  3RD                          ST,34.0496,-118.2458,Battery Crime,Bodily Harm,Violent Crimes,0.992050025
3579,01/07/2010,2010-07-01,Central,53,M,H,5TH,34.0435,-118.2427,Battery Crime,Bodily Harm,Violent Crimes,0.990771896
3758,10/07/2010,2010-07-09,Central,26,M,O,300 W  8TH                          ST,34.0438,-118.2547,Theft,Property Crime,Non-Violent Crimes,0.99523542
3841,15/07/2010,2010-01-03,Central,15,F,H,SPRING,34.0661,-118.2334,Rape,Rape,Violent Crimes,0.995180238
3865,16/07/2010,2010-07-16,Central,23,M,O,5TH,34.0478,-118.2502,Battery Crime,Bodily Harm,Violent Crimes,0.996848627
4081,29/07/2010,2010-07-25,Central,35,F,W,900 N  BROADWAY,34.064,-118.2375,Theft,Property Crime,Non-Violent Crimes,0.992155275
5005,18/09/2010,2010-09-18,Central,23,M,H,400 S  BROADWAY,34.0495,-118.2494,Theft,Property Crime,Non-Violent Crimes,0.995886422
5073,22/09/2010,2010-03-01,Central,54,F,B,5TH,34.0442,-118.2439,Theft,Property Crime,Non-Violent Crimes,0.990424622
5169,26/09/2010,2010-09-26,Central,58,M,B,700 S  OLIVE                        ST,34.0467,-118.2556,Assault,Bodily Harm,Violent Crimes,0.995632471
5622,19/10/2010,2010-10-18,Central,32,M,B,900 N  HILL                         ST,34.0644,-118.2387,Theft,Property Crime,Non-Violent Crimes,0.991667208
6010,07/11/2010,2010-11-07,Central,38,M,O,800 N  BROADWAY,34.0623,-118.2383,Battery Crime,Bodily Harm,Violent Crimes,0.99095581
6363,30/11/2010,2010-11-30,Central,27,M,H,HILL                         ST,34.0474,-118.2531,Battery Crime,Bodily Harm,Violent Crimes,0.993393179
6514,09/12/2010,2010-12-09,Central,28,M,H,100 W  WASHINGTON                   BL,34.0311,-118.2646,Assault,Bodily Harm,Violent Crimes,0.990876239
6546,10/12/2010,2010-12-09,Central,33,M,B,5TH                          ST,34.0446,-118.245,Assault,Bodily Harm,Violent Crimes,0.991602985
7036,20/10/2010,2010-10-15,Rampart,21,F,A,1200 W  7TH                          ST,34.0515,-118.2658,Rape,Rape,Violent Crimes,0.997527111
7111,02/01/2010,2010-01-02,Rampart,71,M,A,700 S  BONNIE BRAE                  ST,34.0554,-118.2745,Battery Crime,Bodily Harm,Violent Crimes,0.994604815
7343,16/01/2010,2010-01-15,Rampart,64,F,W,2ND,34.0605,-118.2582,Theft,Property Crime,Non-Violent Crimes,0.999282201
7383,18/01/2010,2010-01-17,Rampart,30,M,O,400 S  LA FAYETTE                   PL,34.0462,-118.3339,Battery Crime,Bodily Harm,Violent Crimes,0.992160052
7400,19/01/2010,2010-01-16,Rampart,33,F,H,1600 W  12TH                         ST,34.0462,-118.276,Theft,Property Crime,Non-Violent Crimes,0.996868169
7496,23/01/2010,2010-01-23,Rampart,55,F,B,100 S  CARONDELET                   ST,34.0686,-118.2746,Battery Crime,Bodily Harm,Violent Crimes,0.996630315
7519,24/01/2010,2010-01-24,Rampart,23,M,B,700 S  UNION                        AV,34.0539,-118.2712,Assault,Bodily Harm,Violent Crimes,0.996202645
7544,26/01/2010,2010-01-25,Rampart,35,F,H,1400 S  BONNIE BRAE                  ST,34.0444,-118.2809,Battery Crime,Bodily Harm,Violent Crimes,0.99411749
7742,02/02/2010,2010-02-02,Rampart,54,M,H,BURLINGTON                   ST,34.0534,-118.2745,Robbery,Robbery,Violent Crimes,0.998807378
7797,05/02/2010,2010-01-22,Rampart,39,M,H,900 S  HOOVER                       ST,34.0559,-118.2842,Theft,Property Crime,Non-Violent Crimes,0.998904314
8155,20/02/2010,2010-02-19,Rampart,33,M,W,1200    MIRAMAR                      ST,34.0572,-118.2576,Theft,Property Crime,Non-Violent Crimes,0.999461157
8396,02/03/2010,2010-03-01,Rampart,27,F,W,2400 W  SUNSET                       BL,34.0788,-118.2681,Theft,Property Crime,Non-Violent Crimes,0.999606913
8438,04/03/2010,2010-02-19,Rampart,38,M,H,100 N  ALVARADO                     ST,34.0667,-118.2703,Theft,Property Crime,Non-Violent Crimes,0.995919777
8574,09/03/2010,2010-03-09,Rampart,40,F,H,500 S  WESTLAKE                     AV,34.0598,-118.2731,Battery Crime,Bodily Harm,Violent Crimes,0.994896824
8819,20/03/2010,2010-03-20,Rampart,25,M,H,1400 W  3RD                          ST,34.0583,-118.2616,Battery Crime,Bodily Harm,Violent Crimes,0.999932968
8856,21/03/2010,2010-03-21,Rampart,21,M,H,1700 W  6TH                          ST,34.0573,-118.2699,Theft,Property Crime,Non-Violent Crimes,0.997252367
8878,15/03/2010,2010-03-15,Rampart,44,F,H,300 S  BOYLSTON                     ST,34.0568,-118.2578,Theft,Property Crime,Non-Violent Crimes,0.997080748
8913,23/03/2010,2010-03-23,Rampart,23,M,H,1600    WILSHIRE                     BL,34.0554,-118.2702,Battery Crime,Bodily Harm,Violent Crimes,0.995255536
8939,24/03/2010,2010-03-24,Rampart,17,M,H,1300 S  UNION                        AV,34.0446,-118.2769,Assault,Bodily Harm,Violent Crimes,0.999850953
8966,25/03/2010,2010-03-25,Rampart,44,M,H,200 S  LAKE                         ST,34.0663,-118.2719,Battery Crime,Bodily Harm,Violent Crimes,0.996440093
8971,25/03/2010,2010-03-25,Rampart,43,M,H,1800 W  SUNSET                       BL,34.0776,-118.2594,Battery Crime,Bodily Harm,Violent Crimes,0.991764214
9046,28/03/2010,2010-03-28,Rampart,28,M,H,ALVARADO,34.0549,-118.2778,Battery Crime,Bodily Harm,Violent Crimes,0.998097288
9096,30/03/2010,2010-03-30,Rampart,23,M,H,200 S  RAMPART                      BL,34.0685,-118.2775,Murder,Murder,Violent Crimes,0.997056181
9609,21/04/2010,2010-04-21,Rampart,67,M,H,200 N  ALVARADO                     ST,34.068,-118.2695,Theft,Property Crime,Non-Violent Crimes,0.99211933
9758,28/04/2010,2010-04-28,Rampart,20,F,H,4700    WILLOW BROOK                 AV,34.0895,-118.2939,Assault,Bodily Harm,Violent Crimes,0.990942283
9870,03/05/2010,2010-05-03,Rampart,44,M,H,1800 W  OLYMPIC                      BL,34.0503,-118.2765,Robbery,Robbery,Violent Crimes,0.993877094
10101,13/05/2010,2010-05-13,Rampart,28,M,W,LEMOYNE,34.0776,-118.2594,Theft,Property Crime,Non-Violent Crimes,0.995966999
10204,16/05/2010,2010-05-16,Rampart,20,F,H,600 N  ALVARADO                     ST,34.0729,-118.2664,Battery Crime,Bodily Harm,Violent Crimes,0.999371092
10842,11/06/2010,2010-06-11,Rampart,15,F,H,200    UNION                        PL,34.0622,-118.2653,Battery Crime,Bodily Harm,Violent Crimes,0.998812349
10928,14/06/2010,2010-06-14,Rampart,46,F,W,700 N  NORMANDIE                    AV,34.0836,-118.3005,Battery Crime,Bodily Harm,Violent Crimes,0.999810213
11435,06/07/2010,2010-07-06,Rampart,42,M,H,200 S  OCCIDENTAL                   BL,34.0693,-118.2811,Theft,Property Crime,Non-Violent Crimes,0.996691606
11448,07/07/2010,2010-06-30,Rampart,50,F,H,PARK VIEW,34.0609,-118.278,Robbery,Robbery,Violent Crimes,0.994845887
11530,12/07/2010,2010-07-12,Rampart,33,M,H,600 S  BURLINGTON                   AV,34.058,-118.2715,Battery Crime,Bodily Harm,Violent Crimes,0.999196041
11542,13/07/2010,2010-07-13,Rampart,37,M,B,1600    WILSHIRE                     BL,34.0554,-118.2702,Theft,Property Crime,Non-Violent Crimes,0.996780467
11620,16/07/2010,2010-07-14,Rampart,25,M,H,4400    BURNS                        AV,34.0877,-118.2893,Theft,Property Crime,Non-Violent Crimes,0.991212446
11696,20/07/2010,2010-07-20,Rampart,50,F,H,UNION                        AV,34.0687,-118.2632,Assault,Bodily Harm,Violent Crimes,0.993820569
11731,21/07/2010,2010-07-21,Rampart,16,F,B,2700    BEVERLY                      BL,34.0699,-118.2777,Battery Crime,Bodily Harm,Violent Crimes,0.997942235
11780,23/07/2010,2010-07-09,Rampart,29,F,H,2000 W  6TH                          ST,34.059,-118.2736,Assault,Bodily Harm,Violent Crimes,0.991458907
11828,25/07/2010,2010-07-24,Rampart,2,M,H,LUCAS                        AV,34.0609,-118.26,Battery Crime,Bodily Harm,Violent Crimes,0.999366565
11895,28/07/2010,2010-07-28,Rampart,41,F,H,600 N  MARIPOSA                     AV,34.0813,-118.2992,Assault,Bodily Harm,Violent Crimes,0.994358584
12005,02/08/2010,2010-08-01,Rampart,25,F,W,900    SANBORN                      AV,34.0883,-118.2831,Theft,Property Crime,Non-Violent Crimes,0.996804288
12071,05/08/2010,2010-08-05,Rampart,31,M,H,4700    SANTA MONICA                 BL,34.0909,-118.2917,Battery Crime,Bodily Harm,Violent Crimes,0.992148216
12182,11/08/2010,2010-08-10,Rampart,45,M,H,4900    ROMAINE                      ST,34.0886,-118.2979,Theft,Property Crime,Non-Violent Crimes,0.993969617
12200,12/08/2010,2010-08-10,Rampart,34,F,H,1300 W  PICO                         BL,34.043,-118.2732,Theft,Property Crime,Non-Violent Crimes,0.990141217
12247,14/08/2010,2010-08-14,Rampart,35,F,O,ALVARADO                     BL,34.0455,-118.2806,Assault,Bodily Harm,Violent Crimes,0.998252607
12342,18/08/2010,2010-08-18,Rampart,49,M,H,800 S  UNION                        AV,34.0523,-118.2722,Battery Crime,Bodily Harm,Violent Crimes,0.990144732
12493,25/08/2010,2010-08-19,Rampart,36,F,W,4000    MONROE                       ST,34.0856,-118.2845,Theft,Property Crime,Non-Violent Crimes,0.996721434
12540,28/08/2010,2010-08-27,Rampart,21,M,H,1000 N  MARIPOSA                     AV,34.0891,-118.2992,Assault,Bodily Harm,Violent Crimes,0.993644501
12551,28/08/2010,2010-08-28,Rampart,40,F,H,500 S  WESTLAKE                     AV,34.0598,-118.2731,Assault,Bodily Harm,Violent Crimes,0.999617595
12763,07/09/2010,2010-09-03,Rampart,24,M,H,UNION                        DR,34.0569,-118.2689,Robbery,Robbery,Violent Crimes,0.998788261
12839,10/09/2010,2010-09-08,Rampart,41,M,W,6TH                          ST,34.0573,-118.2691,Battery Crime,Bodily Harm,Violent Crimes,0.999476855
13001,18/09/2010,2010-09-18,Rampart,32,M,H,4100    BEVERLY                      BL,34.0763,-118.2983,Battery Crime,Bodily Harm,Violent Crimes,0.991177822
13211,27/09/2010,2010-09-27,Rampart,12,M,H,1300    LINWOOD                      AV,34.0508,-118.2682,Battery Crime,Bodily Harm,Violent Crimes,0.99511509
13275,30/09/2010,2010-09-30,Rampart,26,F,B,200    ROBINSON                     ST,34.0742,-118.2831,Assault,Bodily Harm,Violent Crimes,0.997482215
13346,03/10/2010,2010-10-03,Rampart,27,M,H,ALVARADO                     ST,34.0473,-118.2827,Robbery,Robbery,Violent Crimes,0.991936567
13376,05/10/2010,2010-09-03,Rampart,63,F,H,600 N  VIRGIL                       AV,34.0818,-118.2868,Theft,Property Crime,Non-Violent Crimes,0.999827642
13473,09/10/2010,2010-10-09,Rampart,25,F,H,1100 S  LAKE                         ST,34.0508,-118.2819,Theft,Property Crime,Non-Violent Crimes,0.995359333
13621,15/10/2010,2010-10-15,Rampart,47,M,W,NEW HAMPSHIRE                AV,34.0836,-118.2929,Theft,Property Crime,Non-Violent Crimes,0.994491233
13691,18/10/2010,2010-10-17,Rampart,54,F,B,300    LOMA                         DR,34.0599,-118.2655,Theft,Property Crime,Non-Violent Crimes,0.996952387
13824,23/10/2010,2010-10-23,Rampart,24,M,H,MELROSE,34.0836,-118.2917,Robbery,Robbery,Violent Crimes,0.999991127
13846,23/10/2010,2010-10-23,Rampart,25,M,W,VERMONT                      AV,34.0909,-118.2917,Battery Crime,Bodily Harm,Violent Crimes,0.992257717
13899,26/10/2010,2010-10-26,Rampart,15,F,H,4000    MONROE                       ST,34.0856,-118.2845,Battery Crime,Bodily Harm,Violent Crimes,0.994099614
13929,27/10/2010,2010-10-27,Rampart,20,M,H,VENDOME,34.0843,-118.2743,Assault,Bodily Harm,Violent Crimes,0.990735035
13974,30/10/2010,2010-10-23,Rampart,16,F,H,NORMAL,34.0867,-118.2845,Rape,Rape,Violent Crimes,0.999000694
14177,07/11/2010,2010-11-06,Rampart,51,F,H,1000 N  BONNIE BRAE                  ST,34.0759,-118.263,Battery Crime,Bodily Harm,Violent Crimes,0.999920487
14194,07/11/2010,2010-11-07,Rampart,37,M,W,200    CRANDALL                     ST,34.0667,-118.2728,Assault,Bodily Harm,Violent Crimes,0.998373859
14263,11/11/2010,2010-11-11,Rampart,22,F,H,8TH                          ST,34.0559,-118.28,Robbery,Robbery,Violent Crimes,0.995761078
14269,11/11/2010,2010-11-11,Rampart,20,M,H,OLYMPIC                      BL,34.0522,-118.281,Robbery,Robbery,Violent Crimes,0.99575298
14798,06/12/2010,2010-12-06,Rampart,33,F,H,SUNSET,34.0793,-118.2691,Assault,Bodily Harm,Violent Crimes,0.994263876
15223,26/12/2010,2010-12-26,Rampart,46,F,H,PICO                         BL,34.0446,-118.2769,Assault,Bodily Harm,Violent Crimes,0.995696743
15541,20/04/2010,2010-04-20,Southwest,31,M,O,4000    CRENSHAW                     BL,34.0124,-118.3351,Theft,Property Crime,Non-Violent Crimes,0.994834242
15600,08/05/2010,2010-05-08,Southwest,17,M,B,VERMONT,34.0109,-118.2915,Robbery,Robbery,Violent Crimes,0.999217788
15624,15/05/2010,2010-05-13,Southwest,6,M,B,4000    6TH                          AV,34.0127,-118.3241,Assault,Bodily Harm,Violent Crimes,0.992086967
15628,17/05/2010,2010-05-16,Southwest,14,F,H,1400 W  37TH                         PL,34.02,-118.3002,Battery Crime,Bodily Harm,Violent Crimes,0.990983518
16136,05/01/2010,2010-01-04,Southwest,28,M,B,CRENSHAW,34.011,-118.3351,Battery Crime,Bodily Harm,Violent Crimes,0.995221162
16285,09/01/2010,2010-01-08,Southwest,42,F,H,27TH                         ST,34.0305,-118.2915,Theft,Property Crime,Non-Violent Crimes,0.995962416
16345,12/01/2010,2010-01-10,Southwest,25,M,H,4800    LINSCOTT                     PL,34.0188,-118.3505,Theft,Property Crime,Non-Violent Crimes,0.991189013
16441,14/01/2010,2010-01-11,Southwest,11,F,B,4100    11TH                         AV,34.01,-118.3296,Robbery,Robbery,Violent Crimes,0.991900803
16508,14/01/2010,2010-01-13,Southwest,21,F,H,3100    WALTON                       AV,34.0263,-118.2948,Theft,Property Crime,Non-Violent Crimes,0.998655972
16598,20/01/2010,2010-01-18,Southwest,54,M,B,4000    MARLTON                      AV,34.0124,-118.3378,Theft,Property Crime,Non-Violent Crimes,0.991087556
16954,30/01/2010,2010-01-30,Southwest,42,M,H,3700 S  VERMONT                      AV,34.0175,-118.2915,Battery Crime,Bodily Harm,Violent Crimes,0.993294216
16964,29/01/2010,2010-01-29,Southwest,21,M,A,1000 W  34TH                         ST,34.0243,-118.2876,Theft,Property Crime,Non-Violent Crimes,0.99735837
17090,03/02/2010,2010-02-02,Southwest,17,F,H,1200 W  41ST                         ST,34.0091,-118.2959,Theft,Property Crime,Non-Violent Crimes,0.993780846
17095,03/02/2010,2010-02-02,Southwest,29,M,H,800 W  43RD                         ST,34.0055,-118.2872,Assault,Bodily Harm,Violent Crimes,0.996486554
17579,20/02/2010,2010-02-19,Southwest,54,F,B,4200    DEGNAN                       BL,34.0085,-118.3314,Theft,Property Crime,Non-Violent Crimes,0.993603421
17809,27/02/2010,2010-02-27,Southwest,15,M,H,W  39TH                         PL,34.0155,-118.3002,Robbery,Robbery,Violent Crimes,0.993509174
17877,27/02/2010,2010-02-26,Southwest,23,F,H,600 W  23RD                         ST,34.0311,-118.2749,Theft,Property Crime,Non-Violent Crimes,0.992631912
17959,03/03/2010,2010-03-03,Southwest,22,M,B,3500    RODEO                        PL,34.0199,-118.3344,Theft,Property Crime,Non-Violent Crimes,0.991272544
18089,08/03/2010,2010-03-07,Southwest,50,F,W,3900    DUBLIN                       AV,34.0146,-118.3222,Theft,Property Crime,Non-Violent Crimes,0.993460833
18242,12/03/2010,2010-03-11,Southwest,45,M,B,10TH                         AV,34.0085,-118.3287,Theft,Property Crime,Non-Violent Crimes,0.995790316
18244,12/03/2010,2010-03-11,Southwest,14,F,B,4000    SANTO TOMAS                  DR,34.0093,-118.3437,Theft,Property Crime,Non-Violent Crimes,0.998066473
18297,14/03/2010,2010-03-14,Southwest,27,F,B,3200 W  43RD                         PL,34.0044,-118.3283,Assault,Bodily Harm,Violent Crimes,0.995420772
18343,16/03/2010,2010-03-02,Southwest,54,F,B,3700    DON FELIPE                   DR,34.0059,-118.3393,Theft,Property Crime,Non-Violent Crimes,0.991540837
18628,26/03/2010,2010-03-23,Southwest,22,F,B,SAN BERNARDINO               FY,34.0067,-118.3515,Theft,Property Crime,Non-Violent Crimes,0.994708233
19271,12/04/2010,2010-04-10,Southwest,7,F,H,3000    5TH                          AV,34.0276,-118.3224,Assault,Bodily Harm,Violent Crimes,0.996436197
19308,13/04/2010,2010-04-13,Southwest,31,F,B,4100    MARLTON                      AV,34.0105,-118.3398,Theft,Property Crime,Non-Violent Crimes,0.998704686
19353,14/04/2010,2010-04-14,Southwest,17,F,B,VINEYARD,34.028,-118.3469,Assault,Bodily Harm,Violent Crimes,0.997140116
19748,25/04/2010,2010-04-24,Southwest,40,F,H,3700    3RD                          AV,34.0203,-118.3201,Theft,Property Crime,Non-Violent Crimes,0.997830841
19817,27/04/2010,2010-04-27,Southwest,31,F,H,3000 S  NORMANDIE                    AV,34.0273,-118.3002,Battery Crime,Bodily Harm,Violent Crimes,0.99328177
20291,11/05/2010,2010-05-11,Southwest,16,F,B,4100 S  VERMONT                      AV,34.0091,-118.2915,Battery Crime,Bodily Harm,Violent Crimes,0.993654444
20365,13/05/2010,2010-05-05,Southwest,39,M,H,2000 W  22ND                         ST,34.0364,-118.3062,Theft,Property Crime,Non-Violent Crimes,0.997783384
20629,21/05/2010,2010-05-20,Southwest,80,M,B,4100    CRENSHAW                     BL,34.0102,-118.3351,Theft,Property Crime,Non-Violent Crimes,0.998234809
21249,07/06/2010,2010-06-04,Southwest,59,M,B,3700    LA SALLE                     AV,34.02,-118.3051,Theft,Property Crime,Non-Violent Crimes,0.994195129
21461,13/06/2010,2010-06-13,Southwest,49,M,H,2600    HALLDALE                     AV,34.0327,-118.3028,Assault,Bodily Harm,Violent Crimes,0.9940381
21507,14/06/2010,2010-06-13,Southwest,27,M,B,4600    COLISEUM                     ST,34.017,-118.3471,Theft,Property Crime,Non-Violent Crimes,0.998639673
21600,16/06/2010,2010-06-04,Southwest,28,F,H,1100 W  41ST                         PL,34.0082,-118.2941,Theft,Property Crime,Non-Violent Crimes,0.9990875
21672,19/06/2010,2010-06-19,Southwest,18,M,H,3800 S  GRAMERCY                     PL,34.0174,-118.3132,Robbery,Robbery,Violent Crimes,0.999956673
21726,21/06/2010,2010-06-17,Southwest,42,F,B,1600 W  42ND                         PL,34.0061,-118.3067,Theft,Property Crime,Non-Violent Crimes,0.996084234
21937,26/06/2010,2010-06-25,Southwest,21,M,H,MENLO,34.0182,-118.2901,Robbery,Robbery,Violent Crimes,0.995125121
22176,30/06/2010,2010-06-30,Southwest,48,M,W,1600 W  25TH                         ST,34.0337,-118.2975,Theft,Property Crime,Non-Violent Crimes,0.99448671
22206,01/07/2010,2010-07-01,Southwest,52,M,H,1400 W  36TH                         PL,34.0219,-118.3002,Theft,Property Crime,Non-Violent Crimes,0.992031403
22355,06/07/2010,2010-06-30,Southwest,40,M,O,4800    LINSCOTT                     PL,34.0188,-118.3505,Theft,Property Crime,Non-Violent Crimes,0.994699781
22367,06/07/2010,2010-03-01,Southwest,31,F,B,4500    PINAFORE                     ST,34.0133,-118.3486,Theft,Property Crime,Non-Violent Crimes,0.996216806
22500,10/07/2010,2010-07-10,Southwest,41,F,B,5900    BOWCROFT                     ST,34.0191,-118.3759,Theft,Property Crime,Non-Violent Crimes,0.998819494
22542,12/07/2010,2010-07-12,Southwest,20,F,B,1600 W  MARTIN LUTHER KING JR        BL,34.0109,-118.3067,Theft,Property Crime,Non-Violent Crimes,0.999780102
22946,22/07/2010,2010-07-22,Southwest,25,F,B,1300 W  36TH                         PL,34.0219,-118.2974,Theft,Property Crime,Non-Violent Crimes,0.991077573
23013,24/07/2010,2010-07-24,Southwest,19,F,H,1400 W  35TH                         PL,34.0237,-118.3002,Assault,Bodily Harm,Violent Crimes,0.991537473
23156,27/07/2010,2010-07-27,Southwest,52,M,H,3700    SANTA ROSALIA                DR,34.0072,-118.3373,Theft,Property Crime,Non-Violent Crimes,0.999789065
23183,28/07/2010,2010-07-25,Southwest,57,F,B,3500    8TH                          AV,34.0241,-118.326,Theft,Property Crime,Non-Violent Crimes,0.993249121
23320,03/08/2010,2010-07-30,Southwest,32,F,B,4000    URSULA                       AV,34.0149,-118.3524,Theft,Property Crime,Non-Violent Crimes,0.992877436
23332,02/08/2010,2010-07-30,Southwest,30,F,H,1100 W  27TH                         ST,34.0303,-118.284,Theft,Property Crime,Non-Violent Crimes,0.996971064
23580,09/08/2010,2010-08-09,Southwest,13,M,H,4100 S  VERMONT                      AV,34.0091,-118.2915,Robbery,Robbery,Violent Crimes,0.999138298
23606,11/08/2010,2010-08-10,Southwest,20,F,H,4100    DENKER                       AV,34.0091,-118.3045,Theft,Property Crime,Non-Violent Crimes,0.993147451
23692,09/08/2010,2010-08-07,Southwest,21,F,W,1200 W  ADAMS                        BL,34.0328,-118.2864,Theft,Property Crime,Non-Violent Crimes,0.99500044
23936,20/08/2010,2010-08-20,Southwest,26,M,H,3500 S  LA CIENEGA                   BL,34.0242,-118.3722,Theft,Property Crime,Non-Violent Crimes,0.999372462
24480,05/09/2010,2010-09-05,Southwest,36,F,H,1000    LEIGHTON                     AV,34.0132,-118.2915,Assault,Bodily Harm,Violent Crimes,0.991279212
24512,05/09/2010,2010-09-05,Southwest,30,F,H,2000 W  VERNON                       AV,34.0037,-118.3158,Theft,Property Crime,Non-Violent Crimes,0.99288025
24588,08/09/2010,2010-09-08,Southwest,44,M,B,1400    EXPOSITION                   BL,34.0182,-118.303,Theft,Property Crime,Non-Violent Crimes,0.994477253
24943,19/09/2010,2010-09-11,Southwest,53,M,H,1400 W  25TH                         ST,34.0337,-118.2915,Theft,Property Crime,Non-Violent Crimes,0.99010134
25165,24/09/2010,2010-09-24,Southwest,21,F,W,1200 W  36TH                         PL,34.0221,-118.2944,Robbery,Robbery,Violent Crimes,0.996180579
25233,28/09/2010,2010-09-28,Southwest,52,F,H,2600 S  HOBART                       BL,34.0327,-118.3078,Theft,Property Crime,Non-Violent Crimes,0.995071012
25254,29/09/2010,2010-09-28,Southwest,57,M,B,2000 W  JEFFERSON                    BL,34.0256,-118.3151,Assault,Bodily Harm,Violent Crimes,0.995602486
25578,08/10/2010,2010-10-08,Southwest,41,M,H,W  JEFFERSON                    BL,34.0255,-118.2915,Robbery,Robbery,Violent Crimes,0.991716319
25881,17/10/2010,2010-10-17,Southwest,26,F,H,2ND                          AV,34.0108,-118.3193,Battery Crime,Bodily Harm,Violent Crimes,0.991585112
26216,25/10/2010,2010-10-25,Southwest,35,F,B,4100    CRENSHAW                     BL,34.0102,-118.3351,Theft,Property Crime,Non-Violent Crimes,0.99788462
26238,28/10/2010,2010-10-27,Southwest,24,F,H,4000    CRENSHAW                     BL,34.0124,-118.3351,Theft,Property Crime,Non-Violent Crimes,0.999732799
26441,02/11/2010,2010-10-30,Southwest,19,M,H,W  32ND                         ST,34.0252,-118.2827,Robbery,Robbery,Violent Crimes,0.99297828
26495,03/11/2010,2010-08-01,Southwest,34,M,B,3800 W  27TH                         ST,34.0312,-118.3262,Theft,Property Crime,Non-Violent Crimes,0.99921766
26651,08/11/2010,2010-11-08,Southwest,49,F,B,1500 W  36TH                         PL,34.0219,-118.3031,Theft,Property Crime,Non-Violent Crimes,0.991277058
26727,10/11/2010,2010-11-10,Southwest,46,F,H,2800    WESTVIEW,34.0382,-118.5385,Assault,Bodily Harm,Violent Crimes,0.99964017
26779,11/11/2010,2010-11-11,Southwest,22,M,H,2600    WEST VIEW                    ST,34.0283,-118.3492,Theft,Property Crime,Non-Violent Crimes,0.994368699
26800,12/11/2010,2010-11-10,Southwest,55,F,B,2700 W  43RD                         PL,34.0045,-118.3222,Theft,Property Crime,Non-Violent Crimes,0.996117703
27466,02/12/2010,2010-12-01,Southwest,53,F,B,EDGEHILL,34.0085,-118.3304,Theft,Property Crime,Non-Violent Crimes,0.994285762
27485,02/12/2010,2010-12-01,Southwest,58,M,B,1600 W  36TH                         ST,34.0228,-118.306,Theft,Property Crime,Non-Violent Crimes,0.995473873
27598,05/12/2010,2010-12-04,Southwest,35,M,B,MIDDLETON                    AV,34.0156,-118.3089,Battery Crime,Bodily Harm,Violent Crimes,0.994451962
27762,09/12/2010,2010-12-09,Southwest,83,F,B,3700    CHERRYWOOD                   AV,34.0201,-118.329,Theft,Property Crime,Non-Violent Crimes,0.993271668
27935,14/12/2010,2010-12-14,Southwest,54,M,B,1800 W  38TH                         PL,34.0165,-118.3132,Robbery,Robbery,Violent Crimes,0.999795734
28140,21/12/2010,2010-12-20,Southwest,26,F,B,LA BREA,34.0183,-118.3556,Battery Crime,Bodily Harm,Violent Crimes,0.99740071
28151,21/12/2010,2010-12-20,Southwest,29,M,H,4000    CRENSHAW                     BL,34.0124,-118.3351,Theft,Property Crime,Non-Violent Crimes,0.994509092
28206,21/12/2010,2010-11-23,Southwest,50,F,B,3200 W  ADAMS                        BL,34.0327,-118.3189,Theft,Property Crime,Non-Violent Crimes,0.995690517
28246,23/12/2010,2010-12-22,Southwest,50,M,B,3400    VIRGINIA                     RD,34.0256,-118.3395,Theft,Property Crime,Non-Violent Crimes,0.990601276
28497,31/12/2010,2010-12-30,Southwest,50,M,B,4200    9TH                          AV,34.0065,-118.3268,Theft,Property Crime,Non-Violent Crimes,0.99484672
28596,07/03/2010,2010-03-07,Hollenbeck,33,F,B,2600 N  GRIFFIN                      AV,34.0765,-118.2118,Theft,Property Crime,Non-Violent Crimes,0.997157973
28603,13/03/2010,2010-03-12,Hollenbeck,52,M,F,2500    CHELSEA                      ST,34.0565,-118.2006,Battery Crime,Bodily Harm,Violent Crimes,0.996768643
29287,16/01/2010,2010-01-16,Hollenbeck,45,F,H,4500    HOMER                        ST,34.0945,-118.2038,Theft,Property Crime,Non-Violent Crimes,0.990742991
29631,03/02/2010,2010-02-03,Hollenbeck,55,F,B,1900    MARENGO                      ST,34.0578,-118.2102,Battery Crime,Bodily Harm,Violent Crimes,0.992098802
29694,08/02/2010,2010-02-02,Hollenbeck,53,M,H,1100    ESPERANZA                    ST,34.0219,-118.1984,Theft,Property Crime,Non-Violent Crimes,0.996135927
29851,16/02/2010,2010-02-16,Hollenbeck,46,F,H,1500    TREMONT                      ST,34.0598,-118.1969,Theft,Property Crime,Non-Violent Crimes,0.996364982
30040,27/02/2010,2010-02-01,Hollenbeck,26,F,H,100 E  AVENUE 32,34.082,-118.214,Theft,Property Crime,Non-Violent Crimes,0.990791503
30129,06/03/2010,2010-03-06,Hollenbeck,30,M,H,BREED                        ST,34.0473,-118.2089,Battery Crime,Bodily Harm,Violent Crimes,0.995131974
30223,11/03/2010,2010-03-11,Hollenbeck,26,M,H,EASTERN,34.0689,-118.1878,Robbery,Robbery,Violent Crimes,0.993282947
30386,20/03/2010,2010-03-20,Hollenbeck,22,F,H,3400    EAGLE                        ST,34.0332,-118.1974,Assault,Bodily Harm,Violent Crimes,0.99889263
31149,29/04/2010,2010-04-29,Hollenbeck,44,M,H,3100    MALABAR                      ST,34.0459,-118.1966,Battery Crime,Bodily Harm,Violent Crimes,0.994507833
31304,07/05/2010,2010-05-07,Hollenbeck,20,M,H,VALLEY                       BL,34.0653,-118.1805,Assault,Bodily Harm,Violent Crimes,0.996691275
31312,07/05/2010,2010-04-12,Hollenbeck,74,M,A,3000 E  OLYMPIC                      BL,34.0218,-118.214,Theft,Property Crime,Non-Violent Crimes,0.995163562
31318,08/05/2010,2010-05-08,Hollenbeck,28,F,H,4500    VALLEY                       BL,34.0747,-118.1619,Robbery,Robbery,Violent Crimes,0.999371702
31371,10/05/2010,2010-05-10,Hollenbeck,16,M,H,BROADWAY,34.0737,-118.2131,Battery Crime,Bodily Harm,Violent Crimes,0.995494189
31575,21/05/2010,2010-05-21,Hollenbeck,24,M,H,2500 N  SOTO                         ST,34.0741,-118.1941,Theft,Property Crime,Non-Violent Crimes,0.99157019
32138,21/06/2010,2010-06-21,Hollenbeck,44,M,H,400 W  AVENUE 26,34.0819,-118.2203,Robbery,Robbery,Violent Crimes,0.991712234
32328,02/07/2010,2010-06-07,Hollenbeck,38,F,W,4600    HARRIMAN                     AV,34.0976,-118.1785,Theft,Property Crime,Non-Violent Crimes,0.991830499
33348,25/08/2010,2010-08-25,Hollenbeck,35,M,H,2200    NORFOLK                      ST,34.0606,-118.2007,Battery Crime,Bodily Harm,Violent Crimes,0.991741764
33444,31/08/2010,2010-08-31,Hollenbeck,35,F,H,1500 N  SOTO                         ST,34.0607,-118.1991,Battery Crime,Bodily Harm,Violent Crimes,0.990645329
33537,05/09/2010,2010-08-29,Hollenbeck,31,F,W,3000    SIERRA                       ST,34.0805,-118.2017,Battery Crime,Bodily Harm,Violent Crimes,0.993237917
33580,08/09/2010,2010-09-05,Hollenbeck,31,F,H,3800    GRIFFIN                      AV,34.0879,-118.2077,Theft,Property Crime,Non-Violent Crimes,0.991703598
33644,13/09/2010,2010-07-27,Hollenbeck,8,M,H,2800 N  MAIN                         ST,34.066,-118.2129,Assault,Bodily Harm,Violent Crimes,0.99767438
33880,23/09/2010,2010-09-22,Hollenbeck,53,F,H,3200    MALABAR                      ST,34.0449,-118.1943,Battery Crime,Bodily Harm,Violent Crimes,0.993086681
34178,10/10/2010,2010-10-10,Hollenbeck,33,M,H,400 N  BERNAL                       AV,34.0407,-118.1939,Assault,Bodily Harm,Violent Crimes,0.994686003
34766,11/11/2010,2010-11-11,Hollenbeck,31,F,H,2200    WHITTIER                     BL,34.0381,-118.2262,Robbery,Robbery,Violent Crimes,0.99391547
34851,15/11/2010,2010-11-15,Hollenbeck,16,M,H,SOTO,34.0569,-118.2014,Robbery,Robbery,Violent Crimes,0.992691711
34926,20/11/2010,2010-11-20,Hollenbeck,37,M,H,2000 E  CESAR E CHAVEZ               AV,34.049,-118.2127,Theft,Property Crime,Non-Violent Crimes,0.990951309
35314,12/12/2010,2010-12-12,Hollenbeck,13,F,H,2600    HANCOCK                      WK,34.0769,-118.2092,Battery Crime,Bodily Harm,Violent Crimes,0.995440204
35405,16/12/2010,2010-12-16,Hollenbeck,44,M,H,5300    EDNA                         ST,34.0839,-118.1684,Battery Crime,Bodily Harm,Violent Crimes,0.994413806
35969,03/04/2010,2010-04-03,Harbor,55,F,H,500 E  OPP                          ST,33.783,-118.2572,Assault,Bodily Harm,Violent Crimes,0.995067937
36032,20/04/2010,2010-04-20,Harbor,50,M,W,1400 W  223RD                        ST,33.8246,-118.3016,Theft,Property Crime,Non-Violent Crimes,0.992582932
36081,05/05/2010,2010-05-05,Harbor,36,F,W,1500    PALOS VERDES                 DR,33.7801,-118.3016,Theft,Property Crime,Non-Violent Crimes,0.995586691
36277,30/06/2010,2010-06-30,Harbor,34,F,H,1400 S  MESA                         ST,33.7315,-118.2857,Assault,Bodily Harm,Violent Crimes,0.994920516
36298,07/07/2010,2010-07-06,Harbor,19,F,W,ANAHEIM,33.7799,-118.2648,Assault,Bodily Harm,Violent Crimes,0.990056096
36388,01/08/2010,2010-08-01,Harbor,34,M,H,1900    CUMBRE                       DR,33.7294,-118.3185,Assault,Bodily Harm,Violent Crimes,0.996922712
36393,01/08/2010,2010-07-30,Harbor,18,M,W,300    MIRALESTE                    DR,33.7426,-118.3195,Theft,Property Crime,Non-Violent Crimes,0.994697544
36443,18/08/2010,2010-08-18,Harbor,25,M,O,184TH                        ST,33.8638,-118.3048,Robbery,Robbery,Violent Crimes,0.997610915
36616,01/10/2010,2010-10-01,Harbor,26,M,H,1500 E  O                            ST,33.7927,-118.2455,Assault,Bodily Harm,Violent Crimes,0.991344822
36718,01/11/2010,2010-10-31,Harbor,18,F,H,800    BAYVIEW                      AV,33.7796,-118.2699,Assault,Bodily Harm,Violent Crimes,0.999010486
36740,10/11/2010,2010-11-10,Harbor,13,F,H,BELLE PORTE,33.7948,-118.3011,Battery Crime,Bodily Harm,Violent Crimes,0.993534343
36748,12/11/2010,2010-11-12,Harbor,25,F,H,7TH,33.7378,-118.2835,Assault,Bodily Harm,Violent Crimes,0.995811942
36915,23/12/2010,2010-12-23,Harbor,50,M,H,PACIFIC COAST                HY,33.7913,-118.2616,Assault,Bodily Harm,Violent Crimes,0.995099174
36984,05/01/2010,2010-01-05,Harbor,20,F,W,500 W  10TH                         ST,33.7352,-118.2879,Theft,Property Crime,Non-Violent Crimes,0.991597136
37000,06/01/2010,2010-01-01,Harbor,16,F,H,1500 W  222ND                        ST,33.8257,-118.3038,Battery Crime,Bodily Harm,Violent Crimes,0.99011461
37007,05/01/2010,2010-01-05,Harbor,23,F,B,1400 W  185TH                        ST,33.8629,-118.2996,Assault,Bodily Harm,Violent Crimes,0.991190476
37047,08/01/2010,2010-01-08,Harbor,18,F,H,100 N  GAFFEY                       ST,33.7433,-118.2923,Theft,Property Crime,Non-Violent Crimes,0.998635601
37763,11/02/2010,2010-02-11,Harbor,37,F,O,900 W  18TH                         ST,33.7279,-118.2968,Theft,Property Crime,Non-Violent Crimes,0.996073131
37850,16/02/2010,2010-02-15,Harbor,29,F,H,900 S  MEYLER                       ST,33.7361,-118.2968,Theft,Property Crime,Non-Violent Crimes,0.990853269
37898,18/02/2010,2010-02-18,Harbor,17,M,H,2200 S  GRAND                        AV,33.7243,-118.2902,Robbery,Robbery,Violent Crimes,0.992882447
37966,22/02/2010,2010-02-21,Harbor,18,F,W,1700 N  GAFFEY                       ST,33.7601,-118.2928,Theft,Property Crime,Non-Violent Crimes,0.996498581
38165,02/03/2010,2010-03-02,Harbor,39,F,W,1500 W  204TH                        ST,33.8449,-118.304,Assault,Bodily Harm,Violent Crimes,0.993774815
38216,05/03/2010,2010-03-05,Harbor,61,F,W,1400 N  CABRILLO                     AV,33.7564,-118.2958,Theft,Property Crime,Non-Violent Crimes,0.998911342
38221,05/03/2010,2010-03-05,Harbor,12,M,B,1500 S  CABRILLO                     AV,33.7306,-118.2946,Battery Crime,Bodily Harm,Violent Crimes,0.997404304
38227,05/03/2010,2010-03-03,Harbor,33,F,H,1300 W  27TH                         DR,33.7189,-118.3055,Theft,Property Crime,Non-Violent Crimes,0.996042141
38330,09/03/2010,2010-03-09,Harbor,46,M,W,2900    ANCHOVY                      AV,33.7248,-118.3226,Theft,Property Crime,Non-Violent Crimes,0.991775495
38561,20/03/2010,2010-03-20,Harbor,31,F,A,800 S  GAFFEY                       ST,33.737,-118.2923,Robbery,Robbery,Violent Crimes,0.997072782
38696,26/03/2010,2010-03-26,Harbor,54,M,H,1000 W  G                            ST,33.7779,-118.274,Battery Crime,Bodily Harm,Violent Crimes,0.995432722
38722,27/03/2010,2010-03-25,Harbor,35,M,H,1400 W  PACIFIC COAST                HY,33.7907,-118.2827,Theft,Property Crime,Non-Violent Crimes,0.992983162
38829,01/04/2010,2010-03-31,Harbor,69,F,W,1200 W  26TH                         ST,33.7208,-118.3032,Theft,Property Crime,Non-Violent Crimes,0.992706724
39037,10/04/2010,2010-04-10,Harbor,31,M,H,1600 W  219TH                        ST,33.8291,-118.3065,Robbery,Robbery,Violent Crimes,0.998843391
39101,13/04/2010,2010-04-13,Harbor,53,F,W,700 W  13TH                         ST,33.7324,-118.2924,Theft,Property Crime,Non-Violent Crimes,0.99437234
39121,14/04/2010,2010-04-14,Harbor,36,M,H,9TH                          ST,33.7361,-118.2879,Robbery,Robbery,Violent Crimes,0.991780198
39382,26/04/2010,2010-04-23,Harbor,43,M,O,900 W  BASIN                        ST,33.7555,-118.2967,Theft,Property Crime,Non-Violent Crimes,0.9999068
39539,04/05/2010,2010-05-04,Harbor,37,M,H,1500    LAKME                        AV,33.7935,-118.2607,Battery Crime,Bodily Harm,Violent Crimes,0.991189348
39603,07/05/2010,2010-05-07,Harbor,56,M,O,18200 S  FIGUEROA                     ST,33.8663,-118.2816,Theft,Property Crime,Non-Violent Crimes,0.995820652
39724,12/05/2010,2010-05-12,Harbor,20,F,H,900 N  FRIES                        AV,33.7815,-118.265,Battery Crime,Bodily Harm,Violent Crimes,0.997245193
39990,25/05/2010,2010-05-24,Harbor,21,F,W,900 W  SEPULVEDA                    ST,33.7456,-118.2967,Theft,Property Crime,Non-Violent Crimes,0.995549609
40006,25/05/2010,2010-05-25,Harbor,35,M,H,600 W  14TH                         ST,33.7315,-118.2902,Assault,Bodily Harm,Violent Crimes,0.996398006
40424,12/06/2010,2010-06-12,Harbor,25,F,H,00    BERTH,33.7257,-118.2766,Theft,Property Crime,Non-Violent Crimes,0.998626858
40486,15/06/2010,2010-06-15,Harbor,41,M,B,19500    NORMANDIE                    AV,33.8542,-118.2992,Theft,Property Crime,Non-Violent Crimes,0.99766007
40539,17/06/2010,2010-06-17,Harbor,20,M,B,SEPULVEDA                    ST,33.7451,-118.2835,Assault,Bodily Harm,Violent Crimes,0.99701493
40543,17/06/2010,2010-06-17,Harbor,31,F,H,1700    WILMINGTON                   BL,33.7969,-118.2752,Theft,Property Crime,Non-Violent Crimes,0.995495516
40572,19/06/2010,2010-06-18,Harbor,37,F,H,1400 W  240TH                        ST,33.8072,-118.3014,Theft,Property Crime,Non-Violent Crimes,0.992599825
40622,19/06/2010,2010-06-12,Harbor,46,M,W,1400 W  256TH                        ST,33.7915,-118.3011,Theft,Property Crime,Non-Violent Crimes,0.99698983
40623,18/06/2010,2010-06-17,Harbor,48,F,H,200 W  OFARRELL                     ST,33.746,-118.2817,Theft,Property Crime,Non-Violent Crimes,0.998745383
40757,25/06/2010,2010-06-24,Harbor,66,F,W,25400    DODGE                        AV,33.7932,-118.2889,Theft,Property Crime,Non-Violent Crimes,0.998539842
41172,18/07/2010,2010-07-18,Harbor,20,F,H,I,33.7808,-118.2666,Assault,Bodily Harm,Violent Crimes,0.997785171
41272,21/07/2010,2010-07-21,Harbor,40,M,H,1000 W  PACIFIC COAST                HY,33.7905,-118.275,Robbery,Robbery,Violent Crimes,0.99515305
41310,22/07/2010,2010-07-22,Harbor,18,M,H,1500    NEPTUNE                      AV,33.793,-118.2699,Battery Crime,Bodily Harm,Violent Crimes,0.999173369
41361,23/07/2010,2010-07-23,Harbor,14,M,H,1100    NAGOYA                       WY,33.7343,-118.2782,Battery Crime,Bodily Harm,Violent Crimes,0.990800577
41483,30/07/2010,2010-07-30,Harbor,32,M,H,400 W  20TH                         ST,33.7261,-118.2858,Assault,Bodily Harm,Violent Crimes,0.997929097
41547,01/08/2010,2010-08-01,Harbor,55,F,W,900 W  BATTERY                      ST,33.7547,-118.2967,Theft,Property Crime,Non-Violent Crimes,0.992746708
41655,06/08/2010,2010-08-06,Harbor,35,M,H,1200    FRIGATE                      AV,33.786,-118.2779,Theft,Property Crime,Non-Violent Crimes,0.992487594
41826,15/08/2010,2010-08-15,Harbor,36,M,H,400    MARINE                       AV,33.7741,-118.2633,Battery Crime,Bodily Harm,Violent Crimes,0.995811752
41892,18/08/2010,2010-08-18,Harbor,32,F,B,1000 W  254TH                        ST,33.7938,-118.2937,Theft,Property Crime,Non-Violent Crimes,0.994983156
42178,02/09/2010,2010-08-06,Harbor,44,F,W,700    NEW DOCK                     ST,33.7551,-118.2544,Fraud,White Collar Crime,Non-Violent Crimes,0.995234735
42336,09/09/2010,2010-09-09,Harbor,28,F,H,700 S  WALKER                       AV,33.7379,-118.3034,Battery Crime,Bodily Harm,Violent Crimes,0.995540235
42346,11/09/2010,2010-09-10,Harbor,68,F,W,1200 W  16TH                         ST,33.7297,-118.3034,Theft,Property Crime,Non-Violent Crimes,0.999052109
42611,22/09/2010,2010-09-21,Harbor,46,M,H,600    CHANNEL                      ST,33.7538,-118.2914,Battery Crime,Bodily Harm,Violent Crimes,0.992027013
43348,26/10/2010,2010-10-26,Harbor,92,M,A,1500 W  184TH                        ST,33.8638,-118.3033,Theft,Property Crime,Non-Violent Crimes,0.99117366
43504,02/11/2010,2010-11-01,Harbor,29,M,H,2200    ROSEGLEN                     AV,33.7657,-118.3004,Theft,Property Crime,Non-Violent Crimes,0.997412649
43580,07/11/2010,2010-11-07,Harbor,45,F,W,2200    GRENADIER                    DR,33.7285,-118.3237,Theft,Property Crime,Non-Violent Crimes,0.992289304
43775,16/11/2010,2010-07-20,Harbor,50,M,H,AVALON,33.78,-118.2624,Battery Crime,Bodily Harm,Violent Crimes,0.991059388
44265,09/12/2010,2010-12-09,Harbor,58,F,W,1600 W  27TH                         ST,33.7225,-118.3146,Theft,Property Crime,Non-Violent Crimes,0.999451239
45210,03/01/2010,2010-01-02,Hollywood,45,M,W,6100    TEMPLE HILL                  DR,34.1112,-118.3224,Theft,Property Crime,Non-Violent Crimes,0.991173805
45481,17/01/2010,2010-01-16,Hollywood,26,F,A,1700 N  IVAR                         AV,34.1016,-118.3282,Theft,Property Crime,Non-Violent Crimes,0.995430582
45620,24/01/2010,2010-01-22,Hollywood,32,F,B,6800    HOLLYWOOD                    BL,34.1016,-118.3387,Theft,Property Crime,Non-Violent Crimes,0.993765041
45999,09/02/2010,2010-02-07,Hollywood,23,F,H,7000    HOLLYWOOD                    BL,34.1016,-118.3417,Theft,Property Crime,Non-Violent Crimes,0.997740476
46128,15/02/2010,2010-02-14,Hollywood,34,M,H,ELEANOR,34.0898,-118.3266,Theft,Property Crime,Non-Violent Crimes,0.995284152
46368,26/02/2010,2010-02-25,Hollywood,53,M,H,700    VINE                         ST,34.0835,-118.3266,Theft,Property Crime,Non-Violent Crimes,0.994106753
46397,27/02/2010,2010-02-26,Hollywood,51,M,O,7000    HOLLYWOOD                    BL,34.1016,-118.3417,Theft,Property Crime,Non-Violent Crimes,0.998935832
46473,02/03/2010,2010-03-02,Hollywood,33,F,H,5000    MELROSE                      AV,34.0835,-118.3091,Theft,Property Crime,Non-Violent Crimes,0.999031813
46996,25/03/2010,2010-03-24,Hollywood,42,M,H,6100    FOUNTAIN                     AV,34.0944,-118.3223,Theft,Property Crime,Non-Violent Crimes,0.999867782
47027,26/03/2010,2010-03-24,Hollywood,58,M,W,9400    SIERRA MAR                   DR,34.0956,-118.3951,Theft,Property Crime,Non-Violent Crimes,0.996492336
47207,02/04/2010,2010-04-02,Hollywood,34,F,B,5300    HOLLYWOOD                    BL,34.1018,-118.3056,Theft,Property Crime,Non-Violent Crimes,0.992205211
48059,09/05/2010,2010-05-07,Hollywood,42,F,H,1700    CANYON                       DR,34.1041,-118.3164,Battery Crime,Bodily Harm,Violent Crimes,0.994135261
48274,19/05/2010,2010-04-30,Hollywood,40,F,O,7600    FOUNTAIN                     AV,34.0944,-118.355,Theft,Property Crime,Non-Violent Crimes,0.992539575
48304,19/05/2010,2010-05-15,Hollywood,43,M,W,2200    MARAVILLA                    DR,34.1098,-118.3432,Fraud,White Collar Crime,Non-Violent Crimes,0.995080066
48720,07/06/2010,2010-06-06,Hollywood,21,F,H,KINGSLEY,34.0908,-118.3025,Assault,Bodily Harm,Violent Crimes,0.997970758
49003,18/06/2010,2010-06-18,Hollywood,25,F,H,HOLLYWOOD,34.1016,-118.3267,Assault,Bodily Harm,Violent Crimes,0.999554719
49638,14/07/2010,2010-07-13,Hollywood,15,M,H,HOLLYWOOD,34.1016,-118.3387,Assault,Bodily Harm,Violent Crimes,0.997829199
49736,16/07/2010,2010-07-16,Hollywood,19,F,W,ROMAINE,34.0889,-118.3332,Theft,Property Crime,Non-Violent Crimes,0.992496901
49836,21/07/2010,2010-07-21,Hollywood,37,M,B,6800    HOLLYWOOD                    BL,34.1016,-118.3387,Theft,Property Crime,Non-Violent Crimes,0.997475063
49923,25/07/2010,2010-07-25,Hollywood,25,M,W,HAWTHORN,34.1004,-118.3414,Assault,Bodily Harm,Violent Crimes,0.9931571
50002,22/07/2010,2010-07-22,Hollywood,28,M,O,HOLLYWOOD,34.1035,-118.318,Robbery,Robbery,Violent Crimes,0.999585769
50097,01/08/2010,2010-08-01,Hollywood,20,F,W,6300 W  SUNSET                       BL,34.098,-118.3267,Theft,Property Crime,Non-Violent Crimes,0.997963545
50425,12/08/2010,2010-08-12,Hollywood,20,M,H,FRANKLIN,34.1053,-118.3304,Theft,Property Crime,Non-Violent Crimes,0.993008084
50458,14/08/2010,2010-08-12,Hollywood,87,F,W,2500    CANYON                       DR,34.1163,-118.3162,Fraud,White Collar Crime,Non-Violent Crimes,0.992998308
50618,21/08/2010,2010-08-21,Hollywood,25,M,W,FRANKLIN,34.1053,-118.3304,Theft,Property Crime,Non-Violent Crimes,0.991161076
50712,24/08/2010,2010-08-21,Hollywood,32,F,W,FRANKLIN,34.1053,-118.3213,Robbery,Robbery,Violent Crimes,0.99514768
50898,01/09/2010,2010-09-01,Hollywood,60,M,W,9200    KINGLET                      DR,34.1022,-118.3891,Assault,Bodily Harm,Violent Crimes,0.999748453
51126,10/09/2010,2010-09-10,Hollywood,36,M,W,6700    HOLLYWOOD                    BL,34.1016,-118.3361,Battery Crime,Bodily Harm,Violent Crimes,0.996311165
51193,14/09/2010,2010-09-03,Hollywood,37,M,W,7200    HOLLYWOOD                    BL,34.1016,-118.3468,Theft,Property Crime,Non-Violent Crimes,0.991901142
51209,15/09/2010,2010-09-14,Hollywood,25,M,W,5600    MELROSE                      AV,34.0835,-118.3226,Theft,Property Crime,Non-Violent Crimes,0.994254233
52270,30/10/2010,2010-10-30,Hollywood,10,F,W,6100    DE LONGPRE                   AV,34.0962,-118.3223,Assault,Bodily Harm,Violent Crimes,0.991307774
52304,31/10/2010,2010-10-28,Hollywood,59,M,W,2800    DURAND                       DR,34.1195,-118.3257,Theft,Property Crime,Non-Violent Crimes,0.990705361
52378,02/11/2010,2010-11-02,Hollywood,26,F,W,900    WILCOX                       AV,34.0871,-118.331,Assault,Bodily Harm,Violent Crimes,0.997362447
52514,09/11/2010,2010-11-08,Hollywood,19,F,W,7300    HAWTHORN                     AV,34.0998,-118.3489,Assault,Bodily Harm,Violent Crimes,0.996198388
52614,13/11/2010,2010-09-26,Hollywood,46,M,W,7000    HOLLYWOOD                    BL,34.1016,-118.3417,Battery Crime,Bodily Harm,Violent Crimes,0.990893855
52758,18/11/2010,2010-11-18,Hollywood,32,M,W,700    VINE                         ST,34.0835,-118.3266,Battery Crime,Bodily Harm,Violent Crimes,0.995775324
52836,22/11/2010,2010-11-21,Hollywood,26,F,B,1100 N  GOWER                        ST,34.0908,-118.3223,Assault,Bodily Harm,Violent Crimes,0.994741136
52869,23/11/2010,2010-11-23,Hollywood,93,M,W,1400    ORIOLE                       DR,34.0969,-118.3882,Theft,Property Crime,Non-Violent Crimes,0.99506351
53355,13/12/2010,2010-12-13,Hollywood,25,F,W,VISTA                        DR,34.1035,-118.3519,Theft,Property Crime,Non-Violent Crimes,0.996867454
53462,19/12/2010,2010-12-17,Hollywood,27,M,W,1100 N  EL CENTRO                    AV,34.0908,-118.3244,Theft,Property Crime,Non-Violent Crimes,0.991801779
53657,29/12/2010,2010-12-28,Hollywood,40,F,W,5300    SANTA MONICA                 BL,34.0908,-118.305,Theft,Property Crime,Non-Violent Crimes,0.992314927
54023,03/09/2010,2010-09-03,Wilshire,38,M,H,100    THE GROVE                    DR,34.0761,-118.3563,Theft,Property Crime,Non-Violent Crimes,0.991043602
54087,05/11/2010,2010-11-04,Wilshire,44,F,K,500 N  HIGHLAND                     AV,34.0803,-118.3386,Theft,Property Crime,Non-Violent Crimes,0.999199842
54265,09/01/2010,2010-01-09,Wilshire,29,F,B,2100    6TH                          AV,34.038,-118.3236,Assault,Bodily Harm,Violent Crimes,0.994087273
54383,13/01/2010,2010-01-13,Wilshire,29,M,A,600 S  LA BREA                      AV,34.0649,-118.344,Theft,Property Crime,Non-Violent Crimes,0.999348107
54396,15/01/2010,2010-01-14,Wilshire,31,M,A,1600    6TH                          AV,34.0436,-118.3237,Theft,Property Crime,Non-Violent Crimes,0.999038556
54441,18/01/2010,2010-01-17,Wilshire,28,M,W,300 N  OGDEN                        DR,34.0761,-118.3594,Theft,Property Crime,Non-Violent Crimes,0.990605206
54616,25/01/2010,2010-01-09,Wilshire,27,F,H,8700    BEVERLY                      BL,34.0763,-118.3778,Theft,Property Crime,Non-Violent Crimes,0.999872399
54804,03/02/2010,2010-02-01,Wilshire,67,M,W,800 N  GENESEE                      AV,34.0854,-118.3584,Theft,Property Crime,Non-Violent Crimes,0.998724707
55209,24/02/2010,2010-02-24,Wilshire,39,F,W,8400    BEVERLY                      BL,34.0761,-118.3731,Theft,Property Crime,Non-Violent Crimes,0.991873725
55368,04/03/2010,2010-02-11,Wilshire,34,M,O,6100    ORANGE                       ST,34.064,-118.3614,Theft,Property Crime,Non-Violent Crimes,0.996909088
55437,09/03/2010,2010-03-05,Wilshire,39,F,H,1500    2ND                          AV,34.0455,-118.3189,Battery Crime,Bodily Harm,Violent Crimes,0.997453437
55497,11/03/2010,2010-03-11,Wilshire,40,M,W,CADILLAC                     AV,34.0375,-118.3742,Robbery,Robbery,Violent Crimes,0.999917729
55592,15/03/2010,2010-03-14,Wilshire,66,F,W,900 S  MUIRFIELD                    RD,34.059,-118.3304,Theft,Property Crime,Non-Violent Crimes,0.999489002
55673,21/03/2010,2010-03-21,Wilshire,41,M,B,2300    LUCERNE                      AV,34.0362,-118.3413,Battery Crime,Bodily Harm,Violent Crimes,0.994191815
56178,14/04/2010,2010-04-14,Wilshire,57,M,W,6500    SAN VICENTE                  BL,34.0625,-118.3696,Theft,Property Crime,Non-Violent Crimes,0.994693121
56458,28/04/2010,2010-04-28,Wilshire,20,F,H,3300 W  17TH                         ST,34.0418,-118.3201,Battery Crime,Bodily Harm,Violent Crimes,0.992812969
56725,11/05/2010,2010-05-10,Wilshire,23,M,W,500 N  GOWER                        ST,34.079,-118.3227,Theft,Property Crime,Non-Violent Crimes,0.99036545
56902,19/05/2010,2010-05-16,Wilshire,28,M,B,WASHINGTON,34.0399,-118.3311,Kidnapping,Abduction,Violent Crimes,0.999712621
56932,20/05/2010,2010-05-08,Wilshire,30,F,W,900 S  DETROIT                      ST,34.0589,-118.3464,Theft,Property Crime,Non-Violent Crimes,0.998620046
57080,28/05/2010,2010-05-27,Wilshire,32,M,W,200 S  LA BREA                      AV,34.0711,-118.344,Theft,Property Crime,Non-Violent Crimes,0.999529761
57121,31/05/2010,2010-05-29,Wilshire,36,M,W,1700    VINEYARD                     AV,34.0441,-118.3382,Theft,Property Crime,Non-Violent Crimes,0.994122172
57192,04/06/2010,2010-06-04,Wilshire,26,M,W,5300    SAN VICENTE                  BL,34.0522,-118.3499,Assault,Bodily Harm,Violent Crimes,0.998400019
57576,24/06/2010,2010-06-24,Wilshire,31,F,W,700 N  HARPER                       AV,34.0837,-118.3691,Theft,Property Crime,Non-Violent Crimes,0.99729664
57671,27/06/2010,2010-06-25,Wilshire,64,M,W,300 S  DETROIT                      ST,34.0689,-118.3451,Theft,Property Crime,Non-Violent Crimes,0.996036067
57682,28/06/2010,2010-06-27,Wilshire,46,M,H,700 N  STANLEY                      AV,34.0837,-118.3564,Theft,Property Crime,Non-Violent Crimes,0.99042977
57808,05/07/2010,2010-07-05,Wilshire,43,M,H,WASHINGTON                   BL,34.0399,-118.3398,Robbery,Robbery,Violent Crimes,0.991376197
58139,20/07/2010,2010-07-19,Wilshire,57,F,H,HOLLYWOOD,34.0798,-118.3285,Theft,Property Crime,Non-Violent Crimes,0.991110141
58254,26/07/2010,2010-07-24,Wilshire,51,F,W,5700 W  3RD                          ST,34.0689,-118.344,Theft,Property Crime,Non-Violent Crimes,0.995060321
58631,14/08/2010,2010-08-14,Wilshire,45,M,W,WILLOUGHBY,34.0871,-118.3732,Robbery,Robbery,Violent Crimes,0.994471976
58679,16/08/2010,2010-08-12,Wilshire,54,F,W,100 S  DOHENY                       DR,34.0753,-118.3897,Theft,Property Crime,Non-Violent Crimes,0.992408828
58748,20/08/2010,2010-08-18,Wilshire,43,F,W,200 N  ARDEN                        BL,34.0746,-118.326,Theft,Property Crime,Non-Violent Crimes,0.997003703
58889,24/08/2010,2010-07-20,Wilshire,29,M,O,8200    BEVERLY                      BL,34.0761,-118.368,Embezzlement,Property Crime,Non-Violent Crimes,0.997607636
58916,27/08/2010,2010-08-27,Wilshire,17,M,B,CRENSHAW                     BL,34.0447,-118.3284,Robbery,Robbery,Violent Crimes,0.995795951
58920,27/08/2010,2010-08-27,Wilshire,21,M,B,21ST                         ST,34.038,-118.3276,Assault,Bodily Harm,Violent Crimes,0.993765988
58969,30/08/2010,2010-08-29,Wilshire,55,M,O,800 N  MC CADDEN                    PL,34.0853,-118.3374,Theft,Property Crime,Non-Violent Crimes,0.999686723
59174,08/09/2010,2010-09-07,Wilshire,27,M,W,LA JOLLA                     AV,34.0871,-118.368,Theft,Property Crime,Non-Violent Crimes,0.99564025
59330,15/09/2010,2010-08-27,Wilshire,24,F,K,1100    BRONSON                      AV,34.0527,-118.3227,Theft,Property Crime,Non-Violent Crimes,0.995880778
59416,20/09/2010,2010-09-09,Wilshire,49,M,W,1000    CARMONA                      AV,34.0554,-118.3553,Theft,Property Crime,Non-Violent Crimes,0.991281801
59521,26/09/2010,2010-09-26,Wilshire,45,F,W,300 S  MANSFIELD                    AV,34.0689,-118.3408,Theft,Property Crime,Non-Violent Crimes,0.994913733
60046,20/10/2010,2010-10-16,Wilshire,77,F,O,800 S  PLYMOUTH                     BL,34.0598,-118.3238,Theft,Property Crime,Non-Violent Crimes,0.990993557
60820,27/11/2010,2010-11-26,Wilshire,30,M,X,8500    BEVERLY                      BL,34.0761,-118.3766,Battery Crime,Bodily Harm,Violent Crimes,0.996863486
60956,03/12/2010,2010-12-03,Wilshire,67,F,W,100 S  MARTEL                       AV,34.0736,-118.3511,Theft,Property Crime,Non-Violent Crimes,0.990997863
61028,07/12/2010,2010-12-06,Wilshire,66,M,W,600    WILCOX                       AV,34.0816,-118.3311,Theft,Property Crime,Non-Violent Crimes,0.990211054
61253,16/12/2010,2010-12-15,Wilshire,56,M,B,2100    4TH                          AV,34.038,-118.3213,Theft,Property Crime,Non-Violent Crimes,0.995054473
61352,21/12/2010,2010-12-20,Wilshire,46,M,H,6400    LINDENHURST                  AV,34.0665,-118.3678,Theft,Property Crime,Non-Violent Crimes,0.993720089
61465,26/12/2010,2010-12-26,Wilshire,28,M,W,5500    WILSHIRE                     BL,34.0623,-118.3483,Theft,Property Crime,Non-Violent Crimes,0.995808312
61657,04/03/2010,2010-03-03,West LA,54,M,W,1800 S  LA CIENEGA                   BL,34.0445,-118.3768,Theft,Property Crime,Non-Violent Crimes,0.991743451
61698,24/03/2010,2010-03-23,West LA,27,F,W,2800    LA CIENEGA                   AV,34.0329,-118.3784,Assault,Bodily Harm,Violent Crimes,0.992225046
61911,22/06/2010,2010-06-22,West LA,27,M,H,10200    SANTA MONICA                 BL,34.0605,-118.4193,Theft,Property Crime,Non-Violent Crimes,0.999792416
62018,06/09/2010,2010-09-06,West LA,29,F,H,1900 S  BEDFORD                      ST,34.0442,-118.3827,Battery Crime,Bodily Harm,Violent Crimes,0.99242847
62084,10/10/2010,2010-10-10,West LA,56,M,B,1400 S  LA CIENEGA                   BL,34.0534,-118.3762,Robbery,Robbery,Violent Crimes,0.997043936
62440,16/01/2010,2010-01-16,West LA,47,M,H,SANTA MONICA                 BL,34.0438,-118.456,Assault,Bodily Harm,Violent Crimes,0.992584084
62711,02/02/2010,2010-02-01,West LA,46,F,H,8700 W  PICO                         BL,34.0544,-118.3816,Theft,Property Crime,Non-Violent Crimes,0.994018636
62819,07/02/2010,2010-02-06,West LA,44,M,W,2000    MANNING                      AV,34.0499,-118.4288,Battery Crime,Bodily Harm,Violent Crimes,0.995001128
62978,16/02/2010,2010-02-06,West LA,69,M,V,400 S  BARRINGTON                   AV,34.0611,-118.4684,Battery Crime,Bodily Harm,Violent Crimes,0.999156559
63208,28/02/2010,2010-02-16,West LA,66,M,W,8600    GREGORY                      WY,34.063,-118.3783,Theft,Property Crime,Non-Violent Crimes,0.996712869
63292,05/03/2010,2010-03-01,West LA,41,M,H,2500    COTNER                       AV,34.034,-118.4344,Battery Crime,Bodily Harm,Violent Crimes,0.994220382
63481,14/03/2010,2010-03-13,West LA,46,F,W,11600    WILSHIRE                     BL,34.0508,-118.4592,Theft,Property Crime,Non-Violent Crimes,0.995103619
63515,16/03/2010,2010-03-15,West LA,63,M,W,CORINTH,34.0455,-118.4489,Theft,Property Crime,Non-Violent Crimes,0.990986961
63805,31/03/2010,2010-03-30,West LA,21,M,W,10200    SANTA MONICA                 BL,34.0605,-118.4193,Theft,Property Crime,Non-Violent Crimes,0.99949763
63979,11/04/2010,2010-04-11,West LA,24,M,W,600    LEVERING                     AV,34.0665,-118.4534,Assault,Bodily Harm,Violent Crimes,0.992469751
64039,13/04/2010,2010-04-12,West LA,49,M,W,2900    BEVERLY GLEN                 CI,34.1268,-118.4444,Theft,Property Crime,Non-Violent Crimes,0.991980934
64080,17/04/2010,2010-04-08,West LA,54,F,W,1400    GLENVILLE                    DR,34.0553,-118.3932,Theft,Property Crime,Non-Violent Crimes,0.997309353
64081,17/04/2010,2010-04-14,West LA,25,M,B,1300    BROCKTON                     AV,34.0443,-118.4638,Theft,Property Crime,Non-Violent Crimes,0.998912646
64200,22/04/2010,2010-03-30,West LA,10,M,W,1300    ROXBURY                      DR,34.0559,-118.4036,Assault,Bodily Harm,Violent Crimes,0.997896712
64210,27/04/2010,2010-03-08,West LA,43,F,W,600    VETERAN                      AV,34.0668,-118.4547,Theft,Property Crime,Non-Violent Crimes,0.992631471
64297,29/04/2010,2010-04-28,West LA,59,M,B,11800 W  OLYMPIC                      BL,34.0332,-118.4499,Theft,Property Crime,Non-Violent Crimes,0.993200185
64507,09/05/2010,2010-05-08,West LA,37,M,O,11700    DOROTHY                      ST,34.0533,-118.4652,Theft,Property Crime,Non-Violent Crimes,0.991672507
64586,14/05/2010,2010-05-14,West LA,49,M,W,1400    BUTLER                       AV,34.0484,-118.4544,Theft,Property Crime,Non-Violent Crimes,0.999280197
64618,14/05/2010,2010-05-14,West LA,24,F,W,1200    MCCLELLAN                    DR,34.0423,-118.4697,Theft,Property Crime,Non-Violent Crimes,0.999597187
65116,12/06/2010,2010-06-12,West LA,20,M,W,300    BEIRUT                       AV,34.0359,-118.5309,Battery Crime,Bodily Harm,Violent Crimes,0.997604015
65445,27/06/2010,2010-06-11,West LA,76,F,W,1400    FLORESTA                     PL,34.0614,-118.5463,Fraud,White Collar Crime,Non-Violent Crimes,0.992789953
65546,02/07/2010,2010-07-02,West LA,22,M,H,10200    SANTA MONICA                 BL,34.0605,-118.4193,Theft,Property Crime,Non-Violent Crimes,0.992892843
66144,02/08/2010,2010-07-31,West LA,45,M,O,200    26TH                         ST,34.0483,-118.4918,Theft,Property Crime,Non-Violent Crimes,0.994393339
66158,02/08/2010,2010-08-02,West LA,72,M,W,11500 W  SUNSET                       BL,34.0708,-118.469,Theft,Property Crime,Non-Violent Crimes,0.994015075
66318,09/08/2010,2010-08-08,West LA,50,M,B,1700 S  LA CIENEGA                   BL,34.0471,-118.3762,Battery Crime,Bodily Harm,Violent Crimes,0.993147757
66365,10/08/2010,2010-06-01,West LA,40,F,O,10900    WELLWORTH                    AV,34.057,-118.4428,Theft,Property Crime,Non-Violent Crimes,0.991989351
66440,15/08/2010,2010-08-14,West LA,34,M,W,1300    ROXBURY                      DR,34.0559,-118.4036,Theft,Property Crime,Non-Violent Crimes,0.993311436
66699,28/08/2010,2010-08-20,West LA,50,M,W,2600    ANGELO                       DR,34.1211,-118.443,Theft,Property Crime,Non-Violent Crimes,0.993666333
66875,03/09/2010,2010-09-03,West LA,29,F,W,WESTWOOD                     BL,34.0588,-118.4439,Battery Crime,Bodily Harm,Violent Crimes,0.991835337
66943,11/09/2010,2010-08-18,West LA,32,F,O,600    HANLEY                       AV,34.07,-118.4857,Theft,Property Crime,Non-Violent Crimes,0.991022355
67112,20/09/2010,2010-06-18,West LA,65,M,W,700 N  KENTER                       AV,34.0714,-118.4886,Theft,Property Crime,Non-Violent Crimes,0.998684652
67267,29/09/2010,2010-09-28,West LA,50,M,B,LA CIENEGA                   BL,34.0571,-118.3762,Battery Crime,Bodily Harm,Violent Crimes,0.996786084
67549,12/10/2010,2010-10-12,West LA,41,F,W,500 S  BARRINGTON                   AV,34.0597,-118.4685,Battery Crime,Bodily Harm,Violent Crimes,0.990911892
67572,13/10/2010,2010-10-13,West LA,39,F,W,1400    DAVIES                       DR,34.0973,-118.4368,Battery Crime,Bodily Harm,Violent Crimes,0.994294288
67668,19/10/2010,2010-10-13,West LA,28,M,W,11700    KIOWA                        AV,34.0511,-118.4626,Fraud,White Collar Crime,Non-Violent Crimes,0.998332309
68040,06/11/2010,2010-11-04,West LA,34,M,W,2500 S  SEPULVEDA                    BL,34.0352,-118.4341,Theft,Property Crime,Non-Violent Crimes,0.999491845
68821,09/12/2010,2010-12-01,West LA,64,M,W,1300    AVENIDA DE CORTEZ,34.0708,-118.5583,Theft,Property Crime,Non-Violent Crimes,0.993676027
68921,14/12/2010,2010-12-13,West LA,62,F,W,400 S  BENTLEY                      AV,34.0691,-118.4596,Theft,Property Crime,Non-Violent Crimes,0.996801113
69087,20/12/2010,2010-12-20,West LA,37,M,H,1800 S  LA CIENEGA                   BL,34.0445,-118.3768,Battery Crime,Bodily Harm,Violent Crimes,0.996580576
69254,29/12/2010,2010-12-29,West LA,56,M,W,10200    SANTA MONICA                 BL,34.0605,-118.4193,Robbery,Robbery,Violent Crimes,0.997185873
69262,30/12/2010,2010-12-28,West LA,52,F,W,1800 S  HOLT                         AV,34.0452,-118.38,Battery Crime,Bodily Harm,Violent Crimes,0.99226416
69292,15/01/2010,2010-01-15,Van Nuys,64,M,O,5300    BEVIS                        AV,34.1667,-118.4563,Theft,Property Crime,Non-Violent Crimes,0.998984743
69383,02/04/2010,2010-03-30,Van Nuys,27,F,W,14900    SATICOY                      ST,34.2085,-118.4575,Assault,Bodily Harm,Violent Crimes,0.996206313
69613,22/10/2010,2010-10-22,Van Nuys,22,F,H,5600    KESTER                       AV,34.1721,-118.4574,Assault,Bodily Harm,Violent Crimes,0.995539073
69710,23/12/2010,2010-12-23,Van Nuys,10,M,W,5500    GREENBUSH                    AV,34.1703,-118.4257,Assault,Bodily Harm,Violent Crimes,0.993166566
70233,23/01/2010,2010-01-19,Van Nuys,40,M,W,7400    SEPULVEDA                    BL,34.2132,-118.4662,Theft,Property Crime,Non-Violent Crimes,0.995494104
70410,25/01/2010,2010-01-06,Van Nuys,47,M,W,15100    COVELLO                      ST,34.2075,-118.4618,Theft,Property Crime,Non-Violent Crimes,0.997132946
70427,31/01/2010,2010-01-31,Van Nuys,37,M,W,14700    CUMPSTON                     ST,34.1694,-118.4538,Assault,Bodily Harm,Violent Crimes,0.998981046
70491,02/02/2010,2010-02-01,Van Nuys,40,F,W,15100    BURBANK                      BL,34.1721,-118.4618,Theft,Property Crime,Non-Violent Crimes,0.997018382
70496,02/02/2010,2010-01-25,Van Nuys,22,M,W,13800    OXNARD                       ST,34.1794,-118.4334,Theft,Property Crime,Non-Violent Crimes,0.99968352
70584,05/02/2010,2010-02-04,Van Nuys,34,M,W,4500    SYLMAR                       AV,34.153,-118.4465,Theft,Property Crime,Non-Violent Crimes,0.992775172
70599,06/02/2010,2010-02-05,Van Nuys,35,F,H,13200    OXNARD                       ST,34.1794,-118.4204,Theft,Property Crime,Non-Violent Crimes,0.995457404
70609,06/02/2010,2010-02-05,Van Nuys,52,M,H,13600    WYANDOTTE                    ST,34.203,-118.4291,Theft,Property Crime,Non-Violent Crimes,0.990223621
70827,15/02/2010,2010-02-15,Van Nuys,18,M,H,VANOWEN                      ST,34.1939,-118.4662,Robbery,Robbery,Violent Crimes,0.993356798
71177,28/02/2010,2010-02-28,Van Nuys,22,F,H,4900    SALOMA                       AV,34.1582,-118.4591,Assault,Bodily Harm,Violent Crimes,0.999568709
71272,04/03/2010,2010-03-04,Van Nuys,57,F,F,15000    SHERMAN                      WY,34.2012,-118.4596,Assault,Bodily Harm,Violent Crimes,0.99910139
71287,05/03/2010,2010-03-05,Van Nuys,23,F,H,CALHOUN,34.1785,-118.4422,Assault,Bodily Harm,Violent Crimes,0.994283356
71364,08/03/2010,2010-03-07,Van Nuys,51,M,W,14500    BENEFIT                      ST,34.1491,-118.4491,Theft,Property Crime,Non-Violent Crimes,0.99565911
71898,26/03/2010,2010-03-26,Van Nuys,30,M,H,5400 N  SEPULVEDA                    BL,34.1685,-118.4662,Battery Crime,Bodily Harm,Violent Crimes,0.994420735
72171,06/04/2010,2010-04-06,Van Nuys,52,F,H,14900    VICTORY                      BL,34.1867,-118.4575,Battery Crime,Bodily Harm,Violent Crimes,0.997154974
72193,07/04/2010,2010-04-07,Van Nuys,23,F,H,SEPULVEDA                    BL,34.1649,-118.4662,Theft,Property Crime,Non-Violent Crimes,0.997688197
72218,09/04/2010,2010-04-09,Van Nuys,40,F,W,13400    MAGNOLIA                     BL,34.1649,-118.425,Theft,Property Crime,Non-Violent Crimes,0.996117827
72420,15/04/2010,2010-04-15,Van Nuys,21,F,H,KESTER,34.1867,-118.4575,Theft,Property Crime,Non-Violent Crimes,0.991993746
72499,18/04/2010,2010-04-17,Van Nuys,13,M,O,OXNARD,34.1794,-118.4312,Battery Crime,Bodily Harm,Violent Crimes,0.990262195
73061,07/05/2010,2010-05-06,Van Nuys,48,M,H,6500    ORION                        AV,34.1887,-118.4705,Theft,Property Crime,Non-Violent Crimes,0.994984636
73101,09/05/2010,2010-05-09,Van Nuys,27,F,H,15500    VANOWEN                      ST,34.1939,-118.4705,Assault,Bodily Harm,Violent Crimes,0.994427435
73113,09/05/2010,2010-05-09,Van Nuys,35,F,H,12600    RIVERSIDE                    DR,34.1576,-118.4074,Theft,Property Crime,Non-Violent Crimes,0.998513326
73225,13/05/2010,2010-05-13,Van Nuys,29,F,B,7300    LENNOX                       AV,34.203,-118.4458,Assault,Bodily Harm,Violent Crimes,0.99793771
73349,18/05/2010,2010-05-18,Van Nuys,26,M,O,14900    VICTORY                      BL,34.1867,-118.4575,Robbery,Robbery,Violent Crimes,0.996577165
73510,23/05/2010,2010-05-23,Van Nuys,20,F,H,6900    HAZELTINE                    AV,34.1958,-118.44,Assault,Bodily Harm,Violent Crimes,0.995899465
73535,24/05/2010,2010-05-24,Van Nuys,36,M,H,15000    MARTHA                       ST,34.1731,-118.4596,Theft,Property Crime,Non-Violent Crimes,0.994807534
73543,25/05/2010,2010-05-24,Van Nuys,55,F,H,7300    VAN NUYS                     BL,34.203,-118.4488,Battery Crime,Bodily Harm,Violent Crimes,0.994612905
73583,26/05/2010,2010-05-25,Van Nuys,36,F,W,14200    DICKENS                      ST,34.1486,-118.4425,Assault,Bodily Harm,Violent Crimes,0.994228309
73816,04/06/2010,2010-06-03,Van Nuys,31,M,H,14000    VANOWEN                      ST,34.1939,-118.4378,Theft,Property Crime,Non-Violent Crimes,0.996928501
73866,05/06/2010,2010-06-05,Van Nuys,51,M,H,SHERMAN                      WY,34.2012,-118.4487,Battery Crime,Bodily Harm,Violent Crimes,0.99241371
73891,05/06/2010,2010-06-04,Van Nuys,43,M,W,3500    VISTA HAVEN                  RD,34.133,-118.4699,Assault,Bodily Harm,Violent Crimes,0.998913088
73896,06/06/2010,2010-06-06,Van Nuys,40,F,H,15000    VOSE                         ST,34.1985,-118.4598,Assault,Bodily Harm,Violent Crimes,0.996853065
73994,10/06/2010,2010-06-10,Van Nuys,29,F,H,15000    VANOWEN                      ST,34.1939,-118.4596,Assault,Bodily Harm,Violent Crimes,0.997360367
74251,19/06/2010,2010-06-19,Van Nuys,40,F,W,4400    HAZELTINE                    AV,34.1505,-118.44,Theft,Property Crime,Non-Violent Crimes,0.999546953
74335,23/06/2010,2010-06-23,Van Nuys,18,F,H,BURNET                       AV,34.2085,-118.4629,Battery Crime,Bodily Harm,Violent Crimes,0.995035885
74634,03/07/2010,2010-07-03,Van Nuys,30,F,W,15400    SHERMAN                      WY,34.2012,-118.4684,Assault,Bodily Harm,Violent Crimes,0.995285326
74660,06/07/2010,2010-07-05,Van Nuys,35,M,W,15300    VENTURA                      BL,34.1538,-118.4662,Theft,Property Crime,Non-Violent Crimes,0.998278865
74849,14/07/2010,2010-07-14,Van Nuys,41,M,W,14600    FRIAR                        ST,34.1857,-118.4509,Assault,Bodily Harm,Violent Crimes,0.998369286
75026,22/07/2010,2010-07-21,Van Nuys,23,F,W,4400    MAMMOTH                      AV,34.1504,-118.4326,Theft,Property Crime,Non-Violent Crimes,0.995303878
75063,22/07/2010,2010-07-12,Van Nuys,45,M,H,6600    SYLMAR                       AV,34.1907,-118.4465,Theft,Property Crime,Non-Violent Crimes,0.991087303
75231,30/07/2010,2010-07-29,Van Nuys,41,M,H,13700    VENTURA                      BL,34.148,-118.4312,Theft,Property Crime,Non-Violent Crimes,0.991801597
75564,14/08/2010,2010-08-14,Van Nuys,38,M,H,14800    WYANDOTTE                    ST,34.203,-118.4556,Robbery,Robbery,Violent Crimes,0.991142679
75683,18/08/2010,2010-08-18,Van Nuys,28,F,O,6200    WOODMAN                      AV,34.1831,-118.4312,Theft,Property Crime,Non-Violent Crimes,0.997965303
75706,17/08/2010,2010-07-18,Van Nuys,47,M,H,6200    WOODMAN                      AV,34.1831,-118.4312,Theft,Property Crime,Non-Violent Crimes,0.993945712
75983,30/08/2010,2010-08-30,Van Nuys,48,F,W,4600    BURNET                       AV,34.1543,-118.4628,Assault,Bodily Harm,Violent Crimes,0.997586091
76103,03/09/2010,2010-09-02,Van Nuys,59,F,W,VENTURA,34.1571,-118.4487,Battery Crime,Bodily Harm,Violent Crimes,0.99533604
76110,05/09/2010,2010-09-05,Van Nuys,20,M,W,VICTORY,34.1867,-118.4662,Assault,Bodily Harm,Violent Crimes,0.992514942
76472,20/09/2010,2010-09-20,Van Nuys,83,M,W,4900    MAMMOTH                      AV,34.16,-118.4325,Theft,Property Crime,Non-Violent Crimes,0.990779625
76592,25/09/2010,2010-09-25,Van Nuys,31,M,W,13700    RIVERSIDE                    DR,34.1576,-118.4312,Theft,Property Crime,Non-Violent Crimes,0.995375153
76899,08/10/2010,2010-09-30,Van Nuys,17,M,B,6500    CEDROS                       AV,34.1887,-118.4531,Theft,Property Crime,Non-Violent Crimes,0.996475005
77406,28/10/2010,2010-10-23,Van Nuys,32,F,H,5300 N  SEPULVEDA                    BL,34.1667,-118.4662,Assault,Bodily Harm,Violent Crimes,0.992146672
77461,31/10/2010,2010-08-09,Van Nuys,37,F,W,4200    GREENBUSH                    AV,34.1472,-118.4261,Fraud,White Collar Crime,Non-Violent Crimes,0.992591489
77738,13/11/2010,2010-11-13,Van Nuys,18,M,H,VAN NUYS,34.2048,-118.4488,Battery Crime,Bodily Harm,Violent Crimes,0.994175553
78517,16/12/2010,2010-12-05,Van Nuys,63,F,W,13200    ADDISON                      ST,34.1613,-118.4203,Theft,Property Crime,Non-Violent Crimes,0.998182367
78761,26/12/2010,2010-12-24,Van Nuys,43,F,H,14200    VICTORY                      BL,34.1867,-118.4421,Theft,Property Crime,Non-Violent Crimes,0.998690907
78893,17/01/2010,2010-01-17,West Valley,41,M,W,18900    SHERMAN                      WY,34.2011,-118.5448,Assault,Bodily Harm,Violent Crimes,0.997074673
78895,17/01/2010,2010-01-17,West Valley,24,F,B,19100    SHERMAN                      WY,34.201,-118.5492,Assault,Bodily Harm,Violent Crimes,0.995419768
79113,18/09/2010,2010-09-18,West Valley,23,F,H,7500    JAMIESON                     AV,34.2066,-118.5219,Assault,Bodily Harm,Violent Crimes,0.994137206
79854,31/01/2010,2010-01-30,West Valley,42,F,H,16300    VENTURA                      BL,34.157,-118.488,Assault,Bodily Harm,Violent Crimes,0.992488616
80030,08/02/2010,2010-02-07,West Valley,52,M,W,6800    WOODLEY                      AV,34.1939,-118.4836,Assault,Bodily Harm,Violent Crimes,0.996866081
80051,09/02/2010,2010-02-08,West Valley,23,F,H,19300    WYANDOTTE                    ST,34.203,-118.5535,Assault,Bodily Harm,Violent Crimes,0.991084102
80067,09/02/2010,2010-01-22,West Valley,54,M,W,15800    ROYAL OAK                    RD,34.1435,-118.4776,Fraud,White Collar Crime,Non-Violent Crimes,0.994828073
80248,17/02/2010,2010-02-16,West Valley,25,M,O,7000    RESEDA                       BL,34.1977,-118.5361,Battery Crime,Bodily Harm,Violent Crimes,0.996806026
80401,23/02/2010,2010-02-23,West Valley,34,F,W,5400    WHITE OAK                    AV,34.1686,-118.5186,Battery Crime,Bodily Harm,Violent Crimes,0.997562662
80417,24/02/2010,2010-02-22,West Valley,66,F,W,BALBOA                       BL,34.2048,-118.54,Theft,Property Crime,Non-Violent Crimes,0.995448016
80581,02/03/2010,2010-03-02,West Valley,42,M,B,17200    BURBANK                      BL,34.1723,-118.5076,Theft,Property Crime,Non-Violent Crimes,0.998456866
80965,20/03/2010,2010-03-19,West Valley,61,M,W,17300    GILMORE                      ST,34.1877,-118.5101,Assault,Bodily Harm,Violent Crimes,0.992705887
81032,24/03/2010,2010-03-21,West Valley,53,F,O,17300    CALIFA                       ST,34.1783,-118.5104,Theft,Property Crime,Non-Violent Crimes,0.998933303
81067,25/03/2010,2010-03-24,West Valley,28,F,O,5200    ZELZAH                       AV,34.1654,-118.522,Theft,Property Crime,Non-Violent Crimes,0.996018192
81235,02/04/2010,2010-04-01,West Valley,40,M,W,4900    CALVIN                       AV,34.1618,-118.5623,Assault,Bodily Harm,Violent Crimes,0.995841781
81373,09/04/2010,2010-04-08,West Valley,23,M,H,15700    SATICOY                      ST,34.2085,-118.4749,Theft,Property Crime,Non-Violent Crimes,0.991252607
81575,17/04/2010,2010-04-16,West Valley,38,F,O,16800    ENCINO HILLS                 DR,34.1392,-118.4991,Theft,Property Crime,Non-Violent Crimes,0.991619249
81733,23/04/2010,2010-04-22,West Valley,55,F,W,18600    COLLINS                      ST,34.1745,-118.5384,Battery Crime,Bodily Harm,Violent Crimes,0.9908137
81864,23/04/2010,2010-04-22,West Valley,14,M,H,7200    DE CELIS                     PL,34.2012,-118.4946,Theft,Property Crime,Non-Violent Crimes,0.996559821
81890,30/04/2010,2010-04-29,West Valley,61,M,W,7000    RESEDA                       BL,34.1977,-118.5361,Theft,Property Crime,Non-Violent Crimes,0.990159655
82640,01/06/2010,2010-05-31,West Valley,24,F,H,BALBOA,34.1722,-118.5012,Battery Crime,Bodily Harm,Violent Crimes,0.996900624
82747,04/06/2010,2010-06-03,West Valley,19,F,H,15800    SATICOY                      ST,34.2085,-118.4771,Theft,Property Crime,Non-Violent Crimes,0.990946351
82937,13/06/2010,2010-06-12,West Valley,40,M,W,5400    SYLVIA                       AV,34.1691,-118.5523,Assault,Bodily Harm,Violent Crimes,0.998529821
82972,14/06/2010,2010-06-09,West Valley,61,F,W,5200    WHITE OAK                    AV,34.1654,-118.5186,Theft,Property Crime,Non-Violent Crimes,0.993061438
82987,15/06/2010,2010-06-14,West Valley,30,M,B,18700    WYANDOTTE                    ST,34.203,-118.5415,Assault,Bodily Harm,Violent Crimes,0.996673081
83016,16/06/2010,2010-06-16,West Valley,65,M,H,16800    SHERMAN                      WY,34.2012,-118.4989,Theft,Property Crime,Non-Violent Crimes,0.994031549
83081,18/06/2010,2010-06-18,West Valley,50,M,W,7100    YOLANDA                      AV,34.1993,-118.5404,Battery Crime,Bodily Harm,Violent Crimes,0.991073899
83140,21/06/2010,2010-06-18,West Valley,28,F,W,18500    SATICOY                      ST,34.2084,-118.536,Theft,Property Crime,Non-Violent Crimes,0.997447914
83282,28/06/2010,2010-06-27,West Valley,41,M,W,4900    PALO                         DR,34.1584,-118.5566,Theft,Property Crime,Non-Violent Crimes,0.991008735
83314,28/06/2010,2010-06-05,West Valley,40,F,H,17800    HEMMINGWAY                   ST,34.2134,-118.5215,Assault,Bodily Harm,Violent Crimes,0.999970972
83352,30/06/2010,2010-06-30,West Valley,37,F,O,6300    BALBOA                       BL,34.184,-118.5011,Theft,Property Crime,Non-Violent Crimes,0.997029807
83540,09/07/2010,2010-07-04,West Valley,60,M,O,19000    WELLS                        DR,34.1632,-118.5466,Theft,Property Crime,Non-Violent Crimes,0.996700742
83561,10/07/2010,2010-07-07,West Valley,37,M,H,19100    VICTORY                      BL,34.1866,-118.5491,Theft,Property Crime,Non-Violent Crimes,0.993721296
83564,10/07/2010,2010-07-09,West Valley,32,M,H,6400    ZELZAH                       AV,34.1868,-118.5229,Theft,Property Crime,Non-Violent Crimes,0.997745955
83626,13/07/2010,2010-07-12,West Valley,36,F,H,VICTORY,34.1866,-118.5011,Theft,Property Crime,Non-Violent Crimes,0.992662766
83744,17/07/2010,2010-07-16,West Valley,64,F,A,17800    BURTON                       ST,34.2201,-118.5214,Theft,Property Crime,Non-Violent Crimes,0.99977822
83895,23/07/2010,2010-07-20,West Valley,37,M,H,7200    SHIRLEY                      AV,34.2012,-118.5579,Theft,Property Crime,Non-Violent Crimes,0.994182649
84025,30/07/2010,2010-07-30,West Valley,37,M,W,19100    TOPHAM                       ST,34.1802,-118.5493,Theft,Property Crime,Non-Violent Crimes,0.995366641
84031,29/07/2010,2010-07-29,West Valley,45,F,W,5300    NEWCASTLE                    AV,34.1667,-118.5243,Assault,Bodily Harm,Violent Crimes,0.99476905
84513,18/08/2010,2010-08-17,West Valley,38,M,H,7500    NESTLE                       AV,34.2066,-118.5306,Battery Crime,Bodily Harm,Violent Crimes,0.995496202
84857,01/09/2010,2010-08-30,West Valley,43,M,H,HASKELL                      AV,34.2157,-118.475,Robbery,Robbery,Violent Crimes,0.993128138
84905,03/09/2010,2010-08-16,West Valley,23,M,O,5100    GARDEN GROVE                 AV,34.1641,-118.5292,Theft,Property Crime,Non-Violent Crimes,0.990139894
85073,11/09/2010,2010-09-11,West Valley,56,M,W,17500    VENTURA                      BL,34.1615,-118.5142,Battery Crime,Bodily Harm,Violent Crimes,0.996689132
85165,15/09/2010,2010-09-14,West Valley,40,F,W,7300    LEESCOTT                     AV,34.2028,-118.5042,Theft,Property Crime,Non-Violent Crimes,0.992251291
85300,21/09/2010,2010-08-14,West Valley,40,F,W,5200    NEWCASTLE                    AV,34.1645,-118.5244,Assault,Bodily Harm,Violent Crimes,0.993576639
85427,26/09/2010,2010-09-25,West Valley,29,M,H,7500    WOODLEY                      AV,34.2066,-118.4837,Theft,Property Crime,Non-Violent Crimes,0.994524467
85594,04/10/2010,2010-10-03,West Valley,22,F,H,6800    CORBIN                       AV,34.1938,-118.5623,Assault,Bodily Harm,Violent Crimes,0.996729881
85756,10/10/2010,2010-10-09,West Valley,57,F,H,6400    GAVIOTA                      AV,34.1867,-118.4815,Theft,Property Crime,Non-Violent Crimes,0.993418061
86350,03/11/2010,2010-11-03,West Valley,70,F,W,TAMPA                        AV,34.1866,-118.5535,Theft,Property Crime,Non-Violent Crimes,0.993312733
86631,17/11/2010,2010-11-15,West Valley,33,M,W,5500    LINDLEY                      AV,34.1713,-118.5273,Theft,Property Crime,Non-Violent Crimes,0.994919207
86731,19/11/2010,2010-11-19,West Valley,28,M,H,17400    SATICOY                      ST,34.2084,-118.5121,Battery Crime,Bodily Harm,Violent Crimes,0.996273823
87026,07/12/2010,2010-12-06,West Valley,38,M,H,8000    HESPERIA                     AV,34.2157,-118.5263,Battery Crime,Bodily Harm,Violent Crimes,0.990980541
87030,07/12/2010,2010-12-06,West Valley,22,M,W,19000    KITTRIDGE                    ST,34.1902,-118.5469,Theft,Property Crime,Non-Violent Crimes,0.990669757
87135,11/12/2010,2010-12-10,West Valley,38,F,W,4400    VANALDEN                     AV,34.1496,-118.5552,Theft,Property Crime,Non-Violent Crimes,0.995169592
87279,17/12/2010,2010-12-16,West Valley,19,F,H,5400    NEWCASTLE                    AV,34.1687,-118.5244,Battery Crime,Bodily Harm,Violent Crimes,0.993466278
87357,21/12/2010,2010-12-21,West Valley,63,F,W,18900    COLLINS                      ST,34.1745,-118.5447,Theft,Property Crime,Non-Violent Crimes,0.997231889
87578,31/12/2010,2010-12-30,West Valley,15,M,W,VICTORY                      BL,34.1867,-118.4836,Robbery,Robbery,Violent Crimes,0.99596667
87610,01/01/2010,2010-01-01,Northeast,40,M,H,1000    ISABEL                       ST,34.0952,-118.222,Assault,Bodily Harm,Violent Crimes,0.998177023
87851,23/05/2010,2010-05-23,Northeast,25,M,H,2300 W  AVENUE 33,34.1077,-118.2328,Assault,Bodily Harm,Violent Crimes,0.992260794
87996,20/08/2010,2010-08-19,Northeast,40,M,W,1600    BLAKE                        AV,34.0939,-118.2398,Battery Crime,Bodily Harm,Violent Crimes,0.997818536
88293,03/01/2010,2010-01-01,Northeast,30,F,W,3700    MONON                        ST,34.1097,-118.2739,Battery Crime,Bodily Harm,Violent Crimes,0.993066399
88436,15/01/2010,2010-01-13,Northeast,69,M,H,3000    VERDUGO                      RD,34.1052,-118.2376,Theft,Property Crime,Non-Violent Crimes,0.997055092
88830,30/01/2010,2010-01-30,Northeast,26,F,H,4700    CRYSTAL SPRINGS              DR,34.1209,-118.2729,Theft,Property Crime,Non-Violent Crimes,0.997803295
89423,22/02/2010,2010-02-21,Northeast,20,F,H,4500 N  FIGUEROA                     ST,34.0961,-118.2072,Battery Crime,Bodily Harm,Violent Crimes,0.99083368
89552,27/02/2010,2010-02-26,Northeast,40,M,W,AVENUE 33,34.1117,-118.2361,Theft,Property Crime,Non-Violent Crimes,0.99822211
89586,01/03/2010,2010-02-28,Northeast,21,F,H,EAGLE ROCK                   BL,34.1078,-118.2376,Battery Crime,Bodily Harm,Violent Crimes,0.990583498
89737,05/03/2010,2010-03-04,Northeast,31,M,O,2900    PARTRIDGE                    AV,34.1047,-118.2469,Theft,Property Crime,Non-Violent Crimes,0.99932878
89778,08/03/2010,2010-03-07,Northeast,29,F,H,1300    ALLESANDRO                   ST,34.0795,-118.2636,Assault,Bodily Harm,Violent Crimes,0.990277916
89796,08/03/2010,2010-02-26,Northeast,68,F,H,5200    LINCOLN                      AV,34.1198,-118.2029,Theft,Property Crime,Non-Violent Crimes,0.990134525
90106,19/03/2010,2010-03-11,Northeast,66,F,H,1800    REDESDALE                    AV,34.0918,-118.2687,Theft,Property Crime,Non-Violent Crimes,0.990687309
90234,23/03/2010,2010-03-23,Northeast,18,F,H,2600    THORPE                       AV,34.091,-118.2277,Assault,Bodily Harm,Violent Crimes,0.991238575
90442,30/03/2010,2010-03-30,Northeast,28,F,H,1300 N  VERMONT                      AV,34.0956,-118.2918,Battery Crime,Bodily Harm,Violent Crimes,0.995923849
90936,18/04/2010,2010-04-17,Northeast,66,F,W,4900    EAGLE ROCK                   BL,34.1351,-118.2153,Theft,Property Crime,Non-Violent Crimes,0.995309735
91672,13/05/2010,2010-05-13,Northeast,37,M,W,4400    SUNNYCREST                   DR,34.1301,-118.2353,Theft,Property Crime,Non-Violent Crimes,0.996143412
91873,21/05/2010,2010-05-20,Northeast,20,F,H,3300    DREW                         ST,34.1199,-118.2431,Battery Crime,Bodily Harm,Violent Crimes,0.992367122
92356,06/06/2010,2010-06-06,Northeast,27,M,H,FRENCH                       AV,34.0889,-118.2129,Robbery,Robbery,Violent Crimes,0.994670509
93124,06/07/2010,2010-07-04,Northeast,56,M,W,1500    SILVERWOOD                   DR,34.1293,-118.1988,Theft,Property Crime,Non-Violent Crimes,0.998951548
93379,16/07/2010,2010-07-15,Northeast,41,M,W,2100    COVE                         AV,34.0924,-118.2544,Theft,Property Crime,Non-Violent Crimes,0.999429474
93526,21/07/2010,2010-07-19,Northeast,74,M,W,1900    HYPERION                     AV,34.0972,-118.2757,Battery Crime,Bodily Harm,Violent Crimes,0.992211899
93719,20/07/2010,2010-03-01,Northeast,15,F,W,1800    YOSEMITE                     DR,34.1335,-118.2065,Battery Crime,Bodily Harm,Violent Crimes,0.993926526
93765,30/07/2010,2010-07-29,Northeast,21,F,W,3700    LOS FELIZ                    BL,34.1157,-118.2733,Theft,Property Crime,Non-Violent Crimes,0.995079855
94291,18/08/2010,2010-08-18,Northeast,18,F,H,2800    COLORADO                     BL,34.1428,-118.226,Theft,Property Crime,Non-Violent Crimes,0.99293983
94578,27/08/2010,2010-08-15,Northeast,51,M,H,3900    WEST POINT                   DR,34.0951,-118.2171,Theft,Property Crime,Non-Violent Crimes,0.999248712
94663,30/08/2010,2010-08-30,Northeast,33,M,W,FRANKLIN,34.1054,-118.3006,Robbery,Robbery,Violent Crimes,0.994929073
94780,05/09/2010,2010-09-03,Northeast,36,F,H,6100    PIEDMONT                     AV,34.1131,-118.1894,Battery Crime,Bodily Harm,Violent Crimes,0.995152759
94810,06/09/2010,2010-09-06,Northeast,50,M,B,1600 N  VERMONT                      AV,34.1002,-118.2918,Theft,Property Crime,Non-Violent Crimes,0.991359297
94821,07/09/2010,2010-08-10,Northeast,85,M,W,4500    SAN ANDREAS                  AV,34.1099,-118.2179,Theft,Property Crime,Non-Violent Crimes,0.995481385
95071,17/09/2010,2010-09-16,Northeast,32,F,W,PROSPECT,34.1018,-118.2896,Battery Crime,Bodily Harm,Violent Crimes,0.992520255
95687,09/10/2010,2010-10-09,Northeast,35,M,H,6100 N  FIGUEROA                     ST,34.1121,-118.188,Robbery,Robbery,Violent Crimes,0.991789805
95740,10/10/2010,2010-09-30,Northeast,88,F,W,4000    GARDEN                       AV,34.1241,-118.2675,Theft,Property Crime,Non-Violent Crimes,0.998662703
95874,16/10/2010,2010-10-16,Northeast,23,F,W,1600 N  HOOVER                       ST,34.1,-118.284,Theft,Property Crime,Non-Violent Crimes,0.998746705
95892,16/10/2010,2010-09-16,Northeast,54,F,H,2000    NORWALK                      AV,34.133,-118.2115,Theft,Property Crime,Non-Violent Crimes,0.99119229
95923,18/10/2010,2010-10-17,Northeast,56,M,H,2500 W  SUNSET                       BL,34.0795,-118.269,Theft,Property Crime,Non-Violent Crimes,0.999781776
96265,31/10/2010,2010-10-31,Northeast,54,F,A,1500    ECHO PARK                    AV,34.0799,-118.2554,Assault,Bodily Harm,Violent Crimes,0.992179439
96490,10/11/2010,2010-11-04,Northeast,44,M,W,4500    LOS FELIZ                    BL,34.1119,-118.2874,Theft,Property Crime,Non-Violent Crimes,0.997764669
96509,11/11/2010,2010-11-11,Northeast,27,F,H,5500    MERIDIAN                     ST,34.1207,-118.1981,Battery Crime,Bodily Harm,Violent Crimes,0.998465019
96581,14/11/2010,2010-11-14,Northeast,52,F,H,1100 N  MADISON                      AV,34.0909,-118.2893,Assault,Bodily Harm,Violent Crimes,0.995740926
96856,26/11/2010,2010-10-02,Northeast,21,F,B,1700    PHILLIPS                     WY,34.123,-118.2008,Rape,Rape,Violent Crimes,0.991233457
97079,05/12/2010,2010-12-04,Northeast,41,M,W,4500    MELBOURNE                    AV,34.1036,-118.2874,Theft,Property Crime,Non-Violent Crimes,0.995533391
97096,06/12/2010,2010-12-06,Northeast,22,F,A,6000    ANNAN                        WY,34.1291,-118.1895,Assault,Bodily Harm,Violent Crimes,0.995629175
97322,14/12/2010,2010-12-14,Northeast,26,M,H,2000 N  FIGUEROA                     ST,34.0814,-118.2257,Theft,Property Crime,Non-Violent Crimes,0.991014449
97409,18/12/2010,2010-12-14,Northeast,44,M,W,3100    FERNWOOD                     AV,34.0986,-118.2705,Theft,Property Crime,Non-Violent Crimes,0.99302611
97420,19/12/2010,2010-12-17,Northeast,65,F,O,SUNSET                       BL,34.0976,-118.2862,Robbery,Robbery,Violent Crimes,0.993884267
97434,19/12/2010,2010-12-19,Northeast,35,M,W,2100    HYPERION                     AV,34.0989,-118.2739,Theft,Property Crime,Non-Violent Crimes,0.991932851
97545,23/12/2010,2010-12-23,Northeast,23,F,B,6900 N  FIGUEROA                     ST,34.1275,-118.1872,Battery Crime,Bodily Harm,Violent Crimes,0.991918568
97833,12/05/2010,2010-05-12,77th Street,17,F,H,1300 W  74TH                         ST,33.9727,-118.2981,Battery Crime,Bodily Harm,Violent Crimes,0.997739858
97836,17/05/2010,2010-05-16,77th Street,68,M,A,4500 S  NORMANDIE                    AV,34.0027,-118.3002,Assault,Bodily Harm,Violent Crimes,0.995404294
98117,05/01/2010,2010-01-05,77th Street,35,F,B,2300 W  54TH                         ST,33.9932,-118.3182,Theft,Property Crime,Non-Violent Crimes,0.998853477
98276,11/01/2010,2010-01-10,77th Street,28,M,H,6900    DENVER                       AV,33.9774,-118.2838,Theft,Property Crime,Non-Violent Crimes,0.996816632
98376,13/01/2010,2010-01-11,77th Street,27,F,H,600 E  79TH                         ST,33.9675,-118.2651,Theft,Property Crime,Non-Violent Crimes,0.99960324
98598,20/01/2010,2010-01-20,77th Street,17,F,H,500 W  49TH                         ST,33.9988,-118.2827,Assault,Bodily Harm,Violent Crimes,0.995594289
98700,23/01/2010,2010-01-23,77th Street,25,F,B,6300    WEST                         BL,33.9827,-118.3352,Battery Crime,Bodily Harm,Violent Crimes,0.993640689
98830,26/01/2010,2010-01-26,77th Street,34,F,B,1800 W  87TH                         ST,33.9591,-118.309,Battery Crime,Bodily Harm,Violent Crimes,0.997238326
98832,26/01/2010,2010-01-24,77th Street,31,F,W,6500    ARLINGTON                    AV,33.9806,-118.3187,Battery Crime,Bodily Harm,Violent Crimes,0.993066437
98978,30/01/2010,2010-01-30,77th Street,39,F,H,1400 W  69TH                         ST,33.977,-118.3003,Assault,Bodily Harm,Violent Crimes,0.992275247
99094,01/02/2010,2010-02-01,77th Street,61,F,H,1600 W  62ND                         ST,33.9833,-118.3046,Theft,Property Crime,Non-Violent Crimes,0.996728554
99097,02/02/2010,2010-02-02,77th Street,50,F,B,1200 W  61ST                         ST,33.9842,-118.2958,Theft,Property Crime,Non-Violent Crimes,0.994318832
99631,18/02/2010,2010-02-17,77th Street,23,F,B,600 W  45TH                         ST,34.0028,-118.2842,Kidnapping,Abduction,Violent Crimes,0.999915655
99754,21/02/2010,2010-02-21,77th Street,28,M,H,600 W  66TH                         ST,33.9795,-118.2838,Battery Crime,Bodily Harm,Violent Crimes,0.997664928
100228,06/03/2010,2010-03-06,77th Street,37,M,H,1800 W  SLAUSON                      AV,33.9892,-118.3089,Robbery,Robbery,Violent Crimes,0.998021539
100514,14/03/2010,2010-03-13,77th Street,29,F,B,200 W  78TH                         ST,33.9689,-118.2761,Theft,Property Crime,Non-Violent Crimes,0.99020986
100555,16/03/2010,2010-03-16,77th Street,27,M,B,100 E  84TH                         PL,33.9619,-118.2739,Assault,Bodily Harm,Violent Crimes,0.992595198
100834,23/03/2010,2010-03-22,77th Street,28,F,B,71ST,33.9757,-118.3324,Assault,Bodily Harm,Violent Crimes,0.999326657
100880,24/03/2010,2010-03-23,77th Street,49,F,H,FLORENCE                     AV,33.9746,-118.3003,Robbery,Robbery,Violent Crimes,0.999844296
101015,28/03/2010,2010-03-28,77th Street,32,F,H,100 W  79TH                         ST,33.9679,-118.2739,Assault,Bodily Harm,Violent Crimes,0.993165858
101226,02/04/2010,2010-04-02,77th Street,27,M,H,5100 S  VERMONT                      AV,33.9965,-118.2915,Assault,Bodily Harm,Violent Crimes,0.993061317
101230,03/04/2010,2010-04-02,77th Street,48,M,B,3100 W  59TH                         ST,33.9872,-118.3264,Assault,Bodily Harm,Violent Crimes,0.990266096
101333,06/04/2010,2010-04-05,77th Street,54,M,H,VERMONT                      AV,33.9746,-118.2918,Robbery,Robbery,Violent Crimes,0.990402829
101350,10/04/2010,2010-04-09,77th Street,25,F,H,5900    CRENSHAW                     BL,33.9872,-118.3308,Theft,Property Crime,Non-Violent Crimes,0.995855487
101850,18/04/2010,2010-04-18,77th Street,15,M,B,3500 W  FLORENCE                     AV,33.9745,-118.333,Robbery,Robbery,Violent Crimes,0.998804074
101885,20/04/2010,2010-04-19,77th Street,25,F,H,900 W  48TH                         ST,33.9996,-118.2893,Battery Crime,Bodily Harm,Violent Crimes,0.992699885
102134,25/04/2010,2010-04-25,77th Street,17,M,H,4800 S  FIGUEROA                     ST,33.9992,-118.2827,Robbery,Robbery,Violent Crimes,0.996543938
102204,28/04/2010,2010-04-26,77th Street,35,M,B,73RD                         ST,33.9739,-118.2739,Assault,Bodily Harm,Violent Crimes,0.997961811
102322,01/05/2010,2010-04-30,77th Street,22,F,H,700 W  52ND                         PL,33.995,-118.2856,Battery Crime,Bodily Harm,Violent Crimes,0.996051868
102485,05/05/2010,2010-05-04,77th Street,50,M,B,54TH                         ST,33.9932,-118.3193,Assault,Bodily Harm,Violent Crimes,0.996881845
102672,10/05/2010,2010-05-09,77th Street,55,F,B,1000 W  57TH                         ST,33.9905,-118.2915,Battery Crime,Bodily Harm,Violent Crimes,0.995240649
102782,13/05/2010,2010-05-12,77th Street,49,M,B,5100 S  VERMONT                      AV,33.9965,-118.2915,Assault,Bodily Harm,Violent Crimes,0.997308517
103159,23/05/2010,2010-05-22,77th Street,25,M,O,4800 S  NORMANDIE                    AV,33.9997,-118.3002,Theft,Property Crime,Non-Violent Crimes,0.992054787
103260,25/05/2010,2010-05-24,77th Street,46,F,B,600 E  78TH                         ST,33.9684,-118.2651,Theft,Property Crime,Non-Violent Crimes,0.995187092
103360,27/05/2010,2010-05-19,77th Street,63,F,B,1600 W  57TH                         ST,33.9906,-118.3044,Battery Crime,Bodily Harm,Violent Crimes,0.993934772
103458,30/05/2010,2010-05-30,77th Street,34,F,H,900 W  66TH                         ST,33.9792,-118.2892,Assault,Bodily Harm,Violent Crimes,0.999524766
103674,04/06/2010,2010-05-24,77th Street,54,M,B,1300 W  65TH                         PL,33.9799,-118.2981,Theft,Property Crime,Non-Violent Crimes,0.992445228
103693,06/06/2010,2010-06-03,77th Street,44,F,B,5600 S  HOOVER                       ST,33.9915,-118.2871,Theft,Property Crime,Non-Violent Crimes,0.996677161
104024,14/06/2010,2010-06-14,77th Street,40,M,B,5900    ARLINGTON                    AV,33.9873,-118.3186,Theft,Property Crime,Non-Violent Crimes,0.997941607
104047,14/06/2010,2010-06-14,77th Street,45,M,B,1200 W  81ST                         ST,33.9658,-118.2959,Theft,Property Crime,Non-Violent Crimes,0.992695343
104441,24/06/2010,2010-06-17,77th Street,42,M,H,1000 W  57TH                         ST,33.9905,-118.2915,Theft,Property Crime,Non-Violent Crimes,0.995731597
104542,27/06/2010,2010-06-27,77th Street,26,M,H,700 W  47TH                         ST,34.0006,-118.2856,Theft,Property Crime,Non-Violent Crimes,0.990920353
104544,27/06/2010,2010-06-26,77th Street,20,F,B,VERMONT                      AV,33.9746,-118.2914,Battery Crime,Bodily Harm,Violent Crimes,0.999452381
104560,27/06/2010,2010-06-27,77th Street,41,M,B,8600 S  VERMONT                      AV,33.9676,-118.2918,Theft,Property Crime,Non-Violent Crimes,0.993742087
104655,30/06/2010,2010-06-30,77th Street,28,F,B,84TH                         PL,33.9617,-118.3003,Assault,Bodily Harm,Violent Crimes,0.99102243
104747,02/07/2010,2010-07-02,77th Street,59,M,H,3100 W  57TH                         ST,33.9909,-118.327,Theft,Property Crime,Non-Violent Crimes,0.992808747
104778,03/07/2010,2010-07-03,77th Street,55,M,A,1000 E  FLORENCE                     AV,33.9748,-118.2575,Assault,Bodily Harm,Violent Crimes,0.999956086
104780,04/07/2010,2010-07-03,77th Street,49,F,B,82ND,33.9643,-118.2914,Battery Crime,Bodily Harm,Violent Crimes,0.992873261
104918,06/07/2010,2010-07-06,77th Street,16,M,B,67TH                         ST,33.9782,-118.3294,Robbery,Robbery,Violent Crimes,0.998145302
105133,12/07/2010,2010-07-12,77th Street,13,F,B,ARLINGTON                    ST,33.9932,-118.3177,Assault,Bodily Harm,Violent Crimes,0.998129201
105291,16/07/2010,2010-07-15,77th Street,31,F,B,8500 S  FIGUEROA                     ST,33.9611,-118.2827,Battery Crime,Bodily Harm,Violent Crimes,0.990028228
105428,18/07/2010,2010-07-18,77th Street,19,M,B,HARVARD,33.9511,-118.3068,Battery Crime,Bodily Harm,Violent Crimes,0.996296301
105435,19/07/2010,2010-07-15,77th Street,2,M,H,900 W  66TH                         ST,33.9792,-118.2892,Assault,Bodily Harm,Violent Crimes,0.991294257
105482,20/07/2010,2010-07-19,77th Street,21,F,H,78TH                         ST,33.9689,-118.2739,Robbery,Robbery,Violent Crimes,0.990500559
106027,02/08/2010,2010-07-31,77th Street,44,F,B,8900 S  GRAMERCY                     PL,33.9564,-118.3134,Battery Crime,Bodily Harm,Violent Crimes,0.991860599
106133,05/08/2010,2010-08-01,77th Street,23,F,B,200 E  77TH                         ST,33.9697,-118.2717,Theft,Property Crime,Non-Violent Crimes,0.99522156
106222,08/08/2010,2010-08-07,77th Street,45,F,H,600 W  82ND                         ST,33.9644,-118.2842,Assault,Bodily Harm,Violent Crimes,0.99128106
106444,13/08/2010,2010-08-13,77th Street,39,M,H,1000 W  75TH                         ST,33.9719,-118.2918,Theft,Property Crime,Non-Violent Crimes,0.996907153
106481,13/08/2010,2010-07-30,77th Street,38,F,B,8400 S  BROADWAY,33.9633,-118.2783,Robbery,Robbery,Violent Crimes,0.99064797
106520,15/08/2010,2010-08-14,77th Street,33,F,B,200 W  78TH                         ST,33.9689,-118.2761,Robbery,Robbery,Violent Crimes,0.9969876
106626,19/08/2010,2010-08-18,77th Street,40,F,B,6500 S  VICTORIA                     AV,33.9806,-118.3323,Theft,Property Crime,Non-Violent Crimes,0.992554785
106639,19/08/2010,2010-07-16,77th Street,23,M,H,700 E  80TH                         ST,33.9665,-118.2629,Assault,Bodily Harm,Violent Crimes,0.994274101
106646,23/08/2010,2010-08-18,77th Street,50,F,B,1700 W  45TH                         ST,34.0028,-118.3089,Theft,Property Crime,Non-Violent Crimes,0.99374524
106700,23/08/2010,2010-08-22,77th Street,51,M,H,9200 S  HOBART                       BL,33.9527,-118.3079,Theft,Property Crime,Non-Violent Crimes,0.99014582
107088,31/08/2010,2010-08-30,77th Street,38,F,H,4700 S  NORMANDIE                    AV,34.0007,-118.3002,Assault,Bodily Harm,Violent Crimes,0.998703684
107450,10/09/2010,2010-09-10,77th Street,55,M,B,1800 W  SLAUSON                      AV,33.9892,-118.3089,Theft,Property Crime,Non-Violent Crimes,0.995141693
107637,15/09/2010,2010-09-15,77th Street,67,F,H,1400 W  60TH                         ST,33.9859,-118.3002,Robbery,Robbery,Violent Crimes,0.996687079
107823,20/09/2010,2010-09-19,77th Street,56,M,A,1800 W  MANCHESTER                   AV,33.96,-118.309,Theft,Property Crime,Non-Violent Crimes,0.99976442
107831,21/09/2010,2010-08-24,77th Street,90,F,B,3100 W  78TH                         ST,33.9691,-118.3265,Fraud,White Collar Crime,Non-Violent Crimes,0.990921238
107838,21/09/2010,2010-09-20,77th Street,43,M,H,6500 S  HOOVER                       ST,33.9802,-118.287,Theft,Property Crime,Non-Violent Crimes,0.993253809
107967,24/09/2010,2010-09-24,77th Street,45,M,B,6300    CRENSHAW                     BL,33.9829,-118.3309,Assault,Bodily Harm,Violent Crimes,0.992043128
108155,28/09/2010,2010-09-28,77th Street,28,M,B,4200 W  SLAUSON                      AV,33.9889,-118.3481,Theft,Property Crime,Non-Violent Crimes,0.999950534
108226,30/09/2010,2010-09-30,77th Street,38,M,B,1800 W  SLAUSON                      AV,33.9892,-118.3089,Theft,Property Crime,Non-Violent Crimes,0.994690279
108401,06/10/2010,2010-10-05,77th Street,27,M,B,8100    DENKER                       AV,33.9655,-118.3046,Kidnapping,Abduction,Violent Crimes,0.990420305
108445,07/10/2010,2010-10-07,77th Street,30,F,B,3500 W  67TH                         ST,33.9781,-118.3338,Assault,Bodily Harm,Violent Crimes,0.991283357
108913,20/10/2010,2010-10-18,77th Street,59,F,B,5700 S  BUDLONG                      AV,33.9906,-118.2958,Theft,Property Crime,Non-Violent Crimes,0.996085632
109049,23/10/2010,2010-10-23,77th Street,22,F,B,6400    WEST                         BL,33.9818,-118.3352,Assault,Bodily Harm,Violent Crimes,0.997303122
109409,02/11/2010,2010-11-02,77th Street,21,F,H,69TH                         ST,33.9773,-118.2914,Battery Crime,Bodily Harm,Violent Crimes,0.998804799
109474,04/11/2010,2010-11-04,77th Street,49,M,B,1800 W  73RD                         ST,33.9737,-118.309,Battery Crime,Bodily Harm,Violent Crimes,0.994686194
109582,07/11/2010,2010-11-01,77th Street,47,F,B,1200 W  VERNON                       AV,34.0037,-118.2959,Theft,Property Crime,Non-Violent Crimes,0.991353457
110138,23/11/2010,2010-11-23,77th Street,46,F,W,5800 S  VERMONT                      AV,33.9888,-118.2915,Theft,Property Crime,Non-Violent Crimes,0.991161217
110394,30/11/2010,2010-11-29,77th Street,52,M,B,2100 W  97TH                         ST,33.9482,-118.3156,Theft,Property Crime,Non-Violent Crimes,0.994731465
110841,12/12/2010,2010-12-11,77th Street,18,F,B,1800 W  84TH                         PL,33.9618,-118.309,Battery Crime,Bodily Harm,Violent Crimes,0.998453617
111137,18/12/2010,2010-12-17,77th Street,17,M,H,6800 S  FIGUEROA                     ST,33.9783,-118.2827,Theft,Property Crime,Non-Violent Crimes,0.990085715
111280,22/12/2010,2010-12-22,77th Street,21,F,B,7600    LA SALLE                     AV,33.9709,-118.3057,Battery Crime,Bodily Harm,Violent Crimes,0.992474245
111749,23/10/2010,2010-10-23,Newton,50,F,H,AVALON                       BL,33.9788,-118.2652,Assault,Bodily Harm,Violent Crimes,0.990206682
111839,02/01/2010,2010-01-02,Newton,59,F,B,1300 E  43RD                         PL,34.0048,-118.2521,Theft,Property Crime,Non-Violent Crimes,0.99368643
111977,09/01/2010,2010-01-09,Newton,29,F,H,1100 E  47TH                         PL,34.0006,-118.2565,Theft,Property Crime,Non-Violent Crimes,0.993874171
112365,24/01/2010,2010-01-24,Newton,23,M,H,1200 E  34TH                         ST,34.0128,-118.2541,Assault,Bodily Harm,Violent Crimes,0.992946247
112387,25/01/2010,2010-01-25,Newton,47,M,H,42ND,34.0074,-118.2794,Robbery,Robbery,Violent Crimes,0.998520033
112452,27/01/2010,2010-01-27,Newton,28,F,H,700 E  48TH                         ST,33.9997,-118.2634,Assault,Bodily Harm,Violent Crimes,0.996434221
112824,11/02/2010,2010-02-10,Newton,31,F,B,4200    AVALON                       BL,34.0076,-118.2653,Theft,Property Crime,Non-Violent Crimes,0.995846626
112939,15/02/2010,2010-02-15,Newton,61,M,H,3200 S  CENTRAL                      AV,34.0146,-118.2565,Battery Crime,Bodily Harm,Violent Crimes,0.994402881
113308,02/03/2010,2010-03-02,Newton,35,F,A,900 E  11TH                         ST,34.0329,-118.2493,Battery Crime,Bodily Harm,Violent Crimes,0.994439734
113442,07/03/2010,2010-03-07,Newton,14,F,H,200 W  41ST                         ST,34.0091,-118.2762,Kidnapping,Abduction,Violent Crimes,0.993488498
113566,11/03/2010,2010-03-11,Newton,23,F,H,100 W  52ND                         ST,33.9956,-118.274,Assault,Bodily Harm,Violent Crimes,0.99289806
114069,28/03/2010,2010-03-28,Newton,25,F,H,1200 E  54TH                         ST,33.9939,-118.2543,Battery Crime,Bodily Harm,Violent Crimes,0.992954831
114394,10/04/2010,2010-04-07,Newton,31,M,H,100 W  71ST                         ST,33.9756,-118.2739,Kidnapping,Abduction,Violent Crimes,0.991436293
114527,14/04/2010,2010-04-14,Newton,19,M,H,AVALON                       BL,33.9998,-118.2652,Assault,Bodily Harm,Violent Crimes,0.995185073
114533,17/04/2010,2010-04-16,Newton,63,M,H,4700 S  BROADWAY,34.001,-118.2783,Theft,Property Crime,Non-Violent Crimes,0.994774399
114826,26/04/2010,2010-04-26,Newton,14,M,H,AVALON,33.9916,-118.2652,Battery Crime,Bodily Harm,Violent Crimes,0.998459285
114979,01/05/2010,2010-05-01,Newton,33,M,H,300 W  52ND                         ST,33.9958,-118.2783,Theft,Property Crime,Non-Violent Crimes,0.990078734
115022,03/05/2010,2010-05-03,Newton,42,F,B,BROADWAY,33.9747,-118.2783,Battery Crime,Bodily Harm,Violent Crimes,0.993042108
115127,08/05/2010,2010-05-07,Newton,30,M,H,41ST                         PL,34.0083,-118.2521,Theft,Property Crime,Non-Violent Crimes,0.99165456
115209,11/05/2010,2010-05-11,Newton,18,M,H,39TH                         ST,34.0144,-118.2705,Assault,Bodily Harm,Violent Crimes,0.991355668
115479,21/05/2010,2010-05-21,Newton,16,M,H,JEFFERSON                    BL,34.0139,-118.2619,Robbery,Robbery,Violent Crimes,0.996578821
115486,21/05/2010,2010-05-21,Newton,22,M,H,47TH                         ST,34.001,-118.2441,Robbery,Robbery,Violent Crimes,0.992829481
115752,31/05/2010,2010-05-31,Newton,20,M,B,1100 E  VERNON                       AV,34.0039,-118.2565,Assault,Bodily Harm,Violent Crimes,0.995779486
115877,06/06/2010,2010-06-06,Newton,22,M,H,300 W  67TH                         ST,33.979,-118.2783,Assault,Bodily Harm,Violent Crimes,0.996786638
115932,09/06/2010,2010-06-09,Newton,64,M,H,1700 E  7TH                          ST,34.0348,-118.2362,Theft,Property Crime,Non-Violent Crimes,0.991602539
115955,14/06/2010,2010-06-14,Newton,40,M,H,1400 E  57TH                         ST,33.9912,-118.2499,Theft,Property Crime,Non-Violent Crimes,0.99624192
115990,11/06/2010,2010-06-08,Newton,64,F,H,27TH                         ST,34.0216,-118.2638,Robbery,Robbery,Violent Crimes,0.996910542
116151,18/06/2010,2010-06-17,Newton,38,M,W,WASHINGTON,34.0338,-118.2708,Assault,Bodily Harm,Violent Crimes,0.998949443
116465,28/06/2010,2010-06-28,Newton,43,F,B,400 E  67TH                         ST,33.9788,-118.2672,Assault,Bodily Harm,Violent Crimes,0.99466203
116905,14/07/2010,2010-07-14,Newton,27,M,B,1500 E  41ST                         ST,34.0086,-118.2474,Battery Crime,Bodily Harm,Violent Crimes,0.998010377
117573,06/08/2010,2010-08-06,Newton,16,M,H,1700 E  7TH                          ST,34.0348,-118.2362,Robbery,Robbery,Violent Crimes,0.990752944
117588,07/08/2010,2010-07-08,Newton,56,M,H,4900    ASCOT                        AV,33.9984,-118.2499,Theft,Property Crime,Non-Violent Crimes,0.999027168
117683,11/08/2010,2010-08-05,Newton,38,F,H,1900    ADAIR                        ST,34.0281,-118.2582,Theft,Property Crime,Non-Violent Crimes,0.991740015
117768,15/08/2010,2010-08-15,Newton,26,F,H,1400 E  41ST                         PL,34.0081,-118.2495,Battery Crime,Bodily Harm,Violent Crimes,0.994719288
117948,21/08/2010,2010-08-21,Newton,30,F,O,400 E  11TH                         ST,34.0371,-118.2551,Theft,Property Crime,Non-Violent Crimes,0.998006963
118138,30/08/2010,2010-08-30,Newton,29,F,H,12TH,34.0344,-118.2543,Robbery,Robbery,Violent Crimes,0.994984135
118162,30/08/2010,2010-08-26,Newton,59,F,H,4100 S  CENTRAL                      AV,34.008,-118.2565,Theft,Property Crime,Non-Violent Crimes,0.994927898
118876,28/09/2010,2010-09-27,Newton,54,F,B,700    WAREHOUSE                    ST,34.0353,-118.239,Theft,Property Crime,Non-Violent Crimes,0.99275665
118900,29/09/2010,2010-09-27,Newton,12,F,H,100 W  50TH                         ST,33.9974,-118.274,Assault,Bodily Harm,Violent Crimes,0.99056101
119249,12/10/2010,2010-10-12,Newton,22,M,W,FLOWER,34.0324,-118.2717,Robbery,Robbery,Violent Crimes,0.995231961
119894,05/11/2010,2010-11-02,Newton,58,M,H,1900 S  HILL                         ST,34.032,-118.2667,Theft,Property Crime,Non-Violent Crimes,0.991831
119930,06/11/2010,2010-11-06,Newton,38,M,H,MARTIN LUTHER KING JR        BL,34.0111,-118.2774,Robbery,Robbery,Violent Crimes,0.999446841
120254,20/11/2010,2010-11-20,Newton,44,F,B,22ND                         ST,34.0221,-118.2527,Theft,Property Crime,Non-Violent Crimes,0.997334695
120281,21/11/2010,2010-11-21,Newton,40,F,A,MAPLE,34.0157,-118.2704,Robbery,Robbery,Violent Crimes,0.996233653
120401,26/11/2010,2010-11-26,Newton,23,F,H,1100 E  43RD                         ST,34.0058,-118.2565,Theft,Property Crime,Non-Violent Crimes,0.99060178
120477,30/11/2010,2010-11-30,Newton,23,M,H,1400 E  41ST                         ST,34.0089,-118.2494,Assault,Bodily Harm,Violent Crimes,0.994894898
120713,11/12/2010,2010-12-10,Newton,30,F,H,4400 S  MAIN                         ST,34.0038,-118.274,Battery Crime,Bodily Harm,Violent Crimes,0.990462204
120733,11/12/2010,2010-12-11,Newton,55,F,H,12TH                         ST,34.0337,-118.2533,Theft,Property Crime,Non-Violent Crimes,0.992390235
120883,17/12/2010,2010-12-15,Newton,13,F,H,6900 S  BROADWAY,33.9774,-118.2783,Battery Crime,Bodily Harm,Violent Crimes,0.998628738
120995,22/12/2010,2010-12-22,Newton,31,M,H,54TH,33.9933,-118.2783,Robbery,Robbery,Violent Crimes,0.99095919
121074,26/12/2010,2010-12-26,Newton,42,M,H,MARTIN LUTHER KING JR        BL,34.011,-118.2565,Assault,Bodily Harm,Violent Crimes,0.999913967
121124,28/12/2010,2010-12-26,Newton,60,M,H,1600 S  CENTRAL                      AV,34.0264,-118.2488,Theft,Property Crime,Non-Violent Crimes,0.993182944
121164,29/12/2010,2010-12-28,Newton,23,F,H,700 E  43RD                         ST,34.0057,-118.2635,Battery Crime,Bodily Harm,Violent Crimes,0.99868742
121417,26/07/2010,2010-07-24,Pacific,23,M,H,3000    DELL                         AV,33.9816,-118.464,Assault,Bodily Harm,Violent Crimes,0.990056541
121602,31/12/2010,2010-12-29,Pacific,18,M,W,3100    SAWTELLE                     BL,34.0255,-118.4308,Robbery,Robbery,Violent Crimes,0.994602252
121657,05/01/2010,2010-01-02,Pacific,27,M,B,10100    TABOR                        ST,34.0269,-118.4037,Battery Crime,Bodily Harm,Violent Crimes,0.992807493
121776,11/01/2010,2010-01-10,Pacific,52,M,W,5TH                          AV,33.9928,-118.4697,Robbery,Robbery,Violent Crimes,0.993015663
121952,16/01/2010,2010-01-16,Pacific,63,M,W,00    FLEET                        ST,33.9762,-118.4637,Battery Crime,Bodily Harm,Violent Crimes,0.991006729
122122,24/01/2010,2010-01-24,Pacific,49,F,W,5500 W  82ND                         ST,33.964,-118.3753,Theft,Property Crime,Non-Violent Crimes,0.998088406
122184,26/01/2010,2010-01-25,Pacific,29,M,W,INGLEWOOD,34.0056,-118.4284,Battery Crime,Bodily Harm,Violent Crimes,0.996475777
122570,08/02/2010,2010-02-01,Pacific,38,M,W,00    CLUBHOUSE                    AV,34.1296,-118.1753,Theft,Property Crime,Non-Violent Crimes,0.993205462
122604,10/02/2010,2010-01-07,Pacific,25,F,J,3200    SAWTELLE                     BL,34.0237,-118.4294,Theft,Property Crime,Non-Violent Crimes,0.995299375
122825,17/02/2010,2010-02-17,Pacific,55,F,O,9700    GLASGOW                      PL,33.9481,-118.3722,Theft,Property Crime,Non-Violent Crimes,0.990557516
123045,27/02/2010,2010-02-27,Pacific,22,M,W,7000    ALVERN                       ST,33.9758,-118.3767,Theft,Property Crime,Non-Violent Crimes,0.999886576
123099,01/03/2010,2010-03-01,Pacific,21,M,B,11400    BARMAN                       AV,34,-118.4105,Theft,Property Crime,Non-Violent Crimes,0.994297814
123551,17/03/2010,2010-03-16,Pacific,22,M,W,10700    LAWLER                       ST,34.0253,-118.4121,Theft,Property Crime,Non-Violent Crimes,0.991665642
124352,13/04/2010,2010-04-06,Pacific,29,M,W,00    BROOKS                       AV,33.9909,-118.4764,Theft,Property Crime,Non-Violent Crimes,0.995692093
124864,03/05/2010,2010-04-23,Pacific,47,F,W,800    DICKSON                      ST,33.986,-118.4517,Theft,Property Crime,Non-Violent Crimes,0.992840898
125313,19/05/2010,2010-05-18,Pacific,34,M,W,4000    REDWOOD                      AV,33.989,-118.4385,Theft,Property Crime,Non-Violent Crimes,0.995835678
125555,27/05/2010,2010-03-28,Pacific,28,M,W,10100    TABOR                        ST,34.0269,-118.4037,Theft,Property Crime,Non-Violent Crimes,0.99050421
125651,31/05/2010,2010-05-14,Pacific,36,F,W,400    SHERMAN CANAL                CT,33.983,-118.4652,Fraud,White Collar Crime,Non-Violent Crimes,0.997928472
125716,02/06/2010,2010-05-31,Pacific,19,F,W,8700    PERSHING                     DR,33.9547,-118.4413,Theft,Property Crime,Non-Violent Crimes,0.997618902
125814,06/06/2010,2010-03-11,Pacific,52,F,W,11900    ANETA                        ST,33.9874,-118.406,Theft,Property Crime,Non-Violent Crimes,0.997075062
125832,06/06/2010,2010-06-03,Pacific,30,F,W,11300    VENICE                       BL,34.0114,-118.4197,Theft,Property Crime,Non-Violent Crimes,0.997366458
126221,20/06/2010,2010-06-19,Pacific,21,F,H,WESTCHESTER                  AV,33.9546,-118.3962,Theft,Property Crime,Non-Violent Crimes,0.993768014
126239,20/06/2010,2010-06-20,Pacific,50,F,H,11900    AVON                         WY,33.9969,-118.4179,Battery Crime,Bodily Harm,Violent Crimes,0.996188755
126801,09/07/2010,2010-07-02,Pacific,47,M,W,6400 W  82ND                         ST,33.9646,-118.3993,Theft,Property Crime,Non-Violent Crimes,0.990574772
127007,14/07/2010,2010-07-13,Pacific,37,M,B,7400    ARIZONA                      AV,33.974,-118.3961,Theft,Property Crime,Non-Violent Crimes,0.994815634
127240,22/07/2010,2010-07-21,Pacific,14,F,H,VERNON,33.9943,-118.4748,Battery Crime,Bodily Harm,Violent Crimes,0.996013013
127259,22/07/2010,2010-07-17,Pacific,28,F,W,MANCHESTER                   AV,33.9598,-118.4193,Theft,Property Crime,Non-Violent Crimes,0.993089183
127288,23/07/2010,2010-07-22,Pacific,27,F,B,800    INDIANA                      AV,33.9984,-118.4652,Theft,Property Crime,Non-Violent Crimes,0.992583045
127300,24/07/2010,2010-07-22,Pacific,39,F,O,400    WORLD                        WY,33.9433,-118.4072,Theft,Property Crime,Non-Violent Crimes,0.994010341
127790,09/08/2010,2010-08-09,Pacific,20,F,O,OCEAN FRONT                  WK,33.9947,-118.4805,Battery Crime,Bodily Harm,Violent Crimes,0.993506023
127829,11/08/2010,2010-08-10,Pacific,41,F,W,12100    CULVER                       BL,33.9939,-118.4186,Theft,Property Crime,Non-Violent Crimes,0.990121628
128126,23/08/2010,2010-08-22,Pacific,16,M,W,WINDWARD,33.9869,-118.4736,Battery Crime,Bodily Harm,Violent Crimes,0.994265065
128597,08/09/2010,2010-09-08,Pacific,32,F,B,5500 W  MANCHESTER                   BL,33.9599,-118.3777,Battery Crime,Bodily Harm,Violent Crimes,0.993056471
128965,21/09/2010,2010-08-20,Pacific,59,F,O,4700    IMLAY                        AV,33.9996,-118.4057,Theft,Property Crime,Non-Violent Crimes,0.9977252
129498,09/10/2010,2010-10-08,Pacific,44,F,W,8000    LOYOLA                       BL,33.9659,-118.4167,Theft,Property Crime,Non-Violent Crimes,0.991427067
129566,11/10/2010,2010-10-11,Pacific,39,M,W,7100    GLASGOW                      AV,33.9723,-118.3723,Theft,Property Crime,Non-Violent Crimes,0.997904746
129993,25/10/2010,2010-10-25,Pacific,50,M,B,5700 W  CENTINELA                    AV,33.9765,-118.381,Theft,Property Crime,Non-Violent Crimes,0.995616518
130117,29/10/2010,2010-10-29,Pacific,30,M,W,12100    ALLIN                        ST,33.9903,-118.4147,Theft,Property Crime,Non-Violent Crimes,0.991533334
130153,31/10/2010,2010-10-29,Pacific,29,F,W,VENICE,33.9845,-118.4697,Theft,Property Crime,Non-Violent Crimes,0.99098044
130387,06/11/2010,2010-10-13,Pacific,38,F,H,4700    LA VILLA MARINA,33.982,-118.4382,Theft,Property Crime,Non-Violent Crimes,0.993469282
130786,22/11/2010,2010-11-21,Pacific,42,F,W,VENICE                       BL,34.0037,-118.4335,Robbery,Robbery,Violent Crimes,0.992538561
130893,26/11/2010,2010-11-25,Pacific,39,F,B,17TH                         PL,33.9864,-118.4732,Battery Crime,Bodily Harm,Violent Crimes,0.990247341
131151,05/12/2010,2010-11-28,Pacific,27,F,B,6700    LA TIJERA                    BL,33.9787,-118.3703,Theft,Property Crime,Non-Violent Crimes,0.993286556
131159,05/12/2010,2010-12-04,Pacific,27,F,W,2200    DELL                         AV,33.9855,-118.4673,Theft,Property Crime,Non-Violent Crimes,0.99456453
131429,14/12/2010,2010-12-11,Pacific,20,M,W,SEPULVEDA                    BL,33.9456,-118.3961,Theft,Property Crime,Non-Violent Crimes,0.998859354
131497,16/12/2010,2010-12-15,Pacific,18,M,H,10400    TABOR                        ST,34.0249,-118.4074,Theft,Property Crime,Non-Violent Crimes,0.991862272
131575,19/12/2010,2010-12-18,Pacific,28,F,W,1200    ABBOT KINNEY                 BL,33.9915,-118.4691,Theft,Property Crime,Non-Violent Crimes,0.992401176
131996,28/02/2010,2010-02-27,N Hollywood,58,M,W,12200    MAGNOLIA                     BL,34.1649,-118.3985,Theft,Property Crime,Non-Violent Crimes,0.994785265
132238,07/06/2010,2010-06-05,N Hollywood,7,M,H,10800    VICTORY                      BL,34.1867,-118.3659,Assault,Bodily Harm,Violent Crimes,0.991456167
132265,26/06/2010,2010-06-16,N Hollywood,72,F,W,10900    OTSEGO                       ST,34.1627,-118.368,Theft,Property Crime,Non-Violent Crimes,0.994358603
132384,16/08/2010,2010-08-15,N Hollywood,70,F,W,5900    WHITSETT                     AV,34.1776,-118.4052,Theft,Property Crime,Non-Violent Crimes,0.992132438
132507,11/10/2010,2010-10-11,N Hollywood,20,F,W,CHANDLER,34.1689,-118.379,Robbery,Robbery,Violent Crimes,0.994446984
132814,07/01/2010,2010-01-07,N Hollywood,60,M,O,4900    CARPENTER                    AV,34.1595,-118.3911,Theft,Property Crime,Non-Violent Crimes,0.999216384
132895,11/01/2010,2010-01-07,N Hollywood,42,M,W,12600    VENTURA                      BL,34.1437,-118.4074,Theft,Property Crime,Non-Violent Crimes,0.990321214
132986,14/01/2010,2010-01-13,N Hollywood,37,M,W,12100    MIRANDA                      ST,34.1744,-118.3976,Theft,Property Crime,Non-Violent Crimes,0.993847609
133146,19/01/2010,2010-01-19,N Hollywood,35,M,H,11600    SHERMAN                      WY,34.2012,-118.3845,Theft,Property Crime,Non-Violent Crimes,0.993126225
133642,04/02/2010,2010-02-03,N Hollywood,41,M,W,4500    KRAFT                        AV,34.1522,-118.3801,Theft,Property Crime,Non-Violent Crimes,0.997516297
133673,07/02/2010,2010-02-07,N Hollywood,43,M,W,6700    VINELAND                     AV,34.1922,-118.3703,Assault,Bodily Harm,Violent Crimes,0.999246681
133768,07/02/2010,2010-02-07,N Hollywood,44,F,H,11900    HART                         ST,34.1976,-118.3921,Battery Crime,Bodily Harm,Violent Crimes,0.990061784
133844,11/02/2010,2010-02-10,N Hollywood,28,M,W,11300    MOORPARK                     ST,34.1504,-118.3769,Theft,Property Crime,Non-Violent Crimes,0.99180934
133847,11/02/2010,2010-02-10,N Hollywood,46,F,F,6200    WILLOWCREST                  AV,34.1831,-118.3626,Battery Crime,Bodily Harm,Violent Crimes,0.993411186
133946,14/02/2010,2010-02-13,N Hollywood,32,F,H,1000    UNIVERSAL CI                 PA,34.1361,-118.357,Assault,Bodily Harm,Violent Crimes,0.990493631
134142,21/02/2010,2010-02-20,N Hollywood,14,M,W,LAUREL CANYON                BL,34.1649,-118.3965,Robbery,Robbery,Violent Crimes,0.996435238
134318,26/02/2010,2010-02-25,N Hollywood,58,F,H,12300    BURBANK                      BL,34.1722,-118.4012,Theft,Property Crime,Non-Violent Crimes,0.9968321
134438,03/03/2010,2010-03-01,N Hollywood,53,F,O,3700    MULTIVIEW                    DR,34.1312,-118.3588,Theft,Property Crime,Non-Violent Crimes,0.994581263
134666,11/03/2010,2010-03-10,N Hollywood,32,F,A,11000    MAGNOLIA                     BL,34.1649,-118.3706,Theft,Property Crime,Non-Violent Crimes,0.991893945
135140,29/03/2010,2010-03-27,N Hollywood,40,M,W,12200    BURBANK                      BL,34.1722,-118.3987,Theft,Property Crime,Non-Violent Crimes,0.999581272
135341,05/04/2010,2010-04-03,N Hollywood,28,M,W,11600    RIVERSIDE                    DR,34.1577,-118.3855,Murder,Murder,Violent Crimes,0.993576945
135367,05/04/2010,2010-03-05,N Hollywood,24,F,H,11900    CHANDLER                     BL,34.1684,-118.3921,Assault,Bodily Harm,Violent Crimes,0.990506067
135714,19/04/2010,2010-04-18,N Hollywood,42,M,H,5000    KLUMP                        AV,34.1608,-118.3757,Theft,Property Crime,Non-Violent Crimes,0.997720768
135747,18/04/2010,2010-04-18,N Hollywood,23,F,H,6300    LAUREL CANYON                BL,34.1849,-118.3965,Theft,Property Crime,Non-Violent Crimes,0.990659458
136163,04/05/2010,2010-04-23,N Hollywood,74,M,W,11900    BRIARVALE                    LN,34.1293,-118.3922,Theft,Property Crime,Non-Violent Crimes,0.991744274
136235,06/05/2010,2010-05-06,N Hollywood,30,M,H,12400    RIVERSIDE                    DR,34.1576,-118.4031,Robbery,Robbery,Violent Crimes,0.991516462
136613,19/05/2010,2010-05-17,N Hollywood,56,F,H,6000    CRANER                       AV,34.1794,-118.3692,Theft,Property Crime,Non-Violent Crimes,0.990178325
136956,01/06/2010,2010-05-30,N Hollywood,17,F,A,3700    BARHAM                       BL,34.1389,-118.3416,Theft,Property Crime,Non-Violent Crimes,0.998520527
137347,13/06/2010,2010-06-12,N Hollywood,40,F,W,LAUREL CANYON,34.1372,-118.3929,Theft,Property Crime,Non-Violent Crimes,0.993740649
137476,17/06/2010,2010-03-26,N Hollywood,61,M,W,12300    TIARA                        ST,34.1784,-118.4012,Theft,Property Crime,Non-Violent Crimes,0.992894047
137626,23/06/2010,2010-06-17,N Hollywood,36,M,B,BLAKESLEE                    AV,34.1681,-118.3724,Theft,Property Crime,Non-Violent Crimes,0.992819285
137683,24/06/2010,2010-05-14,N Hollywood,48,F,H,5700    LAUREL CANYON                BL,34.174,-118.3965,Theft,Property Crime,Non-Violent Crimes,0.992954852
137734,26/06/2010,2010-06-25,N Hollywood,61,F,W,11500    BURBANK                      BL,34.1722,-118.3822,Theft,Property Crime,Non-Violent Crimes,0.991079149
137911,02/07/2010,2010-07-01,N Hollywood,33,F,A,12900    SHERMAN                      WY,34.2012,-118.4138,Theft,Property Crime,Non-Violent Crimes,0.99020875
137973,04/07/2010,2010-06-23,N Hollywood,62,F,W,11600    VENTURA                      BL,34.1403,-118.3848,Theft,Property Crime,Non-Violent Crimes,0.992121102
137993,06/07/2010,2010-07-04,N Hollywood,18,M,H,5200    AUCKLAND                     AV,34.1649,-118.3604,Theft,Property Crime,Non-Violent Crimes,0.999830382
138060,08/07/2010,2010-07-08,N Hollywood,18,M,H,13000    VANOWEN                      ST,34.194,-118.4163,Assault,Bodily Harm,Violent Crimes,0.992619753
138182,12/07/2010,2010-07-12,N Hollywood,33,F,H,11500    SHERMAN                      WY,34.2012,-118.3822,Battery Crime,Bodily Harm,Violent Crimes,0.991670489
138195,13/07/2010,2010-07-12,N Hollywood,40,F,H,12300    SHERMAN                      WY,34.201,-118.3998,Theft,Property Crime,Non-Violent Crimes,0.991750627
138434,21/07/2010,2010-06-30,N Hollywood,30,F,B,5500    BONNER                       AV,34.17,-118.3741,Theft,Property Crime,Non-Violent Crimes,0.99513049
139093,16/08/2010,2010-08-16,N Hollywood,30,F,B,6300    BECK                         AV,34.1849,-118.3834,Assault,Bodily Harm,Violent Crimes,0.995807233
139161,18/08/2010,2010-08-17,N Hollywood,34,M,H,6800    RADFORD                      AV,34.194,-118.3921,Theft,Property Crime,Non-Violent Crimes,0.996446036
139234,19/08/2010,2010-08-19,N Hollywood,36,M,B,11400    MAGNOLIA                     BL,34.1649,-118.379,Battery Crime,Bodily Harm,Violent Crimes,0.997357386
139317,24/08/2010,2010-08-23,N Hollywood,53,M,W,4500    BEEMAN                       AV,34.1526,-118.4073,Theft,Property Crime,Non-Violent Crimes,0.990592941
139396,26/08/2010,2010-08-26,N Hollywood,60,F,H,OXNARD,34.1794,-118.3703,Battery Crime,Bodily Harm,Violent Crimes,0.996805868
139583,01/09/2010,2010-08-31,N Hollywood,26,F,W,11300    MARTHA                       ST,34.1731,-118.3768,Theft,Property Crime,Non-Violent Crimes,0.994337377
139746,07/09/2010,2010-09-06,N Hollywood,23,F,O,10500    CHANDLER                     BL,34.1688,-118.3574,Theft,Property Crime,Non-Violent Crimes,0.990778006
140217,23/09/2010,2010-09-23,N Hollywood,39,M,H,12200    VANOWEN                      ST,34.194,-118.3987,Assault,Bodily Harm,Violent Crimes,0.999515469
140258,25/09/2010,2010-09-25,N Hollywood,19,M,H,5600    ELMER                        AV,34.1722,-118.3763,Robbery,Robbery,Violent Crimes,0.992274491
140320,29/09/2010,2010-09-28,N Hollywood,34,M,W,3400    CAHUENGA                     BL,34.1316,-118.352,Theft,Property Crime,Non-Violent Crimes,0.997817504
140754,14/10/2010,2010-10-14,N Hollywood,23,M,H,MAGNOLIA,34.1649,-118.3922,Robbery,Robbery,Violent Crimes,0.999669458
141153,28/10/2010,2010-10-27,N Hollywood,19,F,H,12500    OXNARD                       ST,34.1794,-118.4052,Theft,Property Crime,Non-Violent Crimes,0.995031418
141415,09/11/2010,2010-11-05,N Hollywood,24,F,B,5900    WHITSETT                     AV,34.1776,-118.4052,Battery Crime,Bodily Harm,Violent Crimes,0.994167666
141515,12/11/2010,2010-11-10,N Hollywood,42,M,H,11600    VENTURA                      BL,34.1403,-118.3848,Battery Crime,Bodily Harm,Violent Crimes,0.995110571
141705,18/11/2010,2010-08-20,N Hollywood,61,M,O,12100    MAGNOLIA                     BL,34.1649,-118.3965,Fraud,White Collar Crime,Non-Violent Crimes,0.99014151
141806,22/11/2010,2010-11-19,N Hollywood,34,F,O,10900    MAGNOLIA                     BL,34.1649,-118.3683,Battery Crime,Bodily Harm,Violent Crimes,0.995461695
141853,23/11/2010,2010-10-23,N Hollywood,38,M,W,10900    BLUFFSIDE                    DR,34.1414,-118.3686,Assault,Bodily Harm,Violent Crimes,0.997649512
141961,28/11/2010,2010-11-28,N Hollywood,25,F,H,11000    LEMAY                        ST,34.1911,-118.3718,Assault,Bodily Harm,Violent Crimes,0.999256667
141965,29/11/2010,2010-11-28,N Hollywood,26,M,H,DENNY                        ST,34.1649,-118.3648,Battery Crime,Bodily Harm,Violent Crimes,0.994322495
142563,22/12/2010,2010-12-22,N Hollywood,38,F,H,6400    LANKERSHIM                   BL,34.1867,-118.3878,Battery Crime,Bodily Harm,Violent Crimes,0.997355097
143026,29/04/2010,2010-04-28,Foothill,5,F,H,11400    FENTON                       AV,34.2768,-118.3858,Assault,Bodily Harm,Violent Crimes,0.999506198
143085,15/06/2010,2010-06-15,Foothill,37,F,H,12100    VAN NUYS                     BL,34.2845,-118.3968,Battery Crime,Bodily Harm,Violent Crimes,0.997632227
143087,17/06/2010,2010-06-17,Foothill,49,M,H,10800    SUTTER                       AV,34.2671,-118.4218,Battery Crime,Bodily Harm,Violent Crimes,0.994759687
143111,10/07/2010,2010-07-10,Foothill,44,M,H,8000    VINELAND                     AV,34.2157,-118.3703,Theft,Property Crime,Non-Violent Crimes,0.99623052
143397,03/01/2010,2010-01-03,Foothill,41,F,H,HADDON                       ST,34.2619,-118.4296,Robbery,Robbery,Violent Crimes,0.993098352
143521,10/01/2010,2010-01-09,Foothill,11,F,H,OSBORNE,34.2493,-118.4162,Assault,Bodily Harm,Violent Crimes,0.993038364
143668,15/01/2010,2010-01-11,Foothill,35,M,H,8600    FOOTHILL                     BL,34.2597,-118.3201,Theft,Property Crime,Non-Violent Crimes,0.992035043
143704,15/01/2010,2010-01-15,Foothill,42,M,H,9900    SAN FERNANDO                 RD,34.2502,-118.4053,Battery Crime,Bodily Harm,Violent Crimes,0.997414274
143727,19/01/2010,2010-01-06,Foothill,27,M,H,SAN FERNANDO,34.257,-118.3994,Theft,Property Crime,Non-Violent Crimes,0.999300938
143738,18/01/2010,2010-01-18,Foothill,23,M,H,SHELDON                      ST,34.2362,-118.398,Robbery,Robbery,Violent Crimes,0.997202911
144049,01/02/2010,2010-02-01,Foothill,25,M,H,WHITEGATE,34.256,-118.3045,Robbery,Robbery,Violent Crimes,0.992563585
144471,20/02/2010,2010-02-20,Foothill,44,M,H,VAN NUYS                     BL,34.2689,-118.4182,Battery Crime,Bodily Harm,Violent Crimes,0.99423623
144501,22/02/2010,2010-02-18,Foothill,2,M,H,10900    SUTTER                       AV,34.2682,-118.4229,Assault,Bodily Harm,Violent Crimes,0.990803397
144534,23/02/2010,2010-02-23,Foothill,26,F,H,9800    LAUREL CANYON                BL,34.2479,-118.4206,Theft,Property Crime,Non-Violent Crimes,0.997180402
144547,24/02/2010,2010-02-23,Foothill,15,F,H,9100    TELFAIR                      AV,34.2348,-118.395,Battery Crime,Bodily Harm,Violent Crimes,0.996767873
144684,02/03/2010,2010-03-02,Foothill,36,M,W,13100    KAGEL CANYON                 ST,34.2517,-118.4202,Assault,Bodily Harm,Violent Crimes,0.992488059
144760,06/03/2010,2010-02-28,Foothill,51,M,H,12700    GAIN                         ST,34.2668,-118.4093,Assault,Bodily Harm,Violent Crimes,0.99029988
144816,08/03/2010,2010-03-07,Foothill,39,M,O,10200    PINEWOOD                     AV,34.2544,-118.2859,Theft,Property Crime,Non-Violent Crimes,0.996739548
145880,23/04/2010,2010-04-22,Foothill,43,M,H,12000    STRATHERN                    ST,34.2158,-118.3944,Theft,Property Crime,Non-Violent Crimes,0.996988681
145881,23/04/2010,2010-04-20,Foothill,55,M,W,8600    FOOTHILL                     BL,34.2597,-118.3201,Battery Crime,Bodily Harm,Violent Crimes,0.997115942
145955,23/04/2010,2010-04-23,Foothill,24,F,W,LANKERSHIM,34.2337,-118.3878,Rape,Rape,Violent Crimes,0.997756652
146217,06/05/2010,2010-05-05,Foothill,24,F,O,10600    LAS LUNITAS                  AV,34.2613,-118.2913,Theft,Property Crime,Non-Violent Crimes,0.992427485
146285,09/05/2010,2010-05-09,Foothill,22,F,W,10700    NEW HAVEN                    ST,34.2265,-118.3644,Theft,Property Crime,Non-Violent Crimes,0.992858545
146420,14/05/2010,2010-05-14,Foothill,20,M,H,11900    DRONFIELD                    AV,34.2862,-118.4133,Assault,Bodily Harm,Violent Crimes,0.994210073
146465,17/05/2010,2010-05-17,Foothill,31,M,H,13600    VAN NUYS                     BL,34.2612,-118.4288,Theft,Property Crime,Non-Violent Crimes,0.998742702
146703,26/05/2010,2010-05-25,Foothill,33,M,H,12500    ROSCOE                       BL,34.2217,-118.4053,Theft,Property Crime,Non-Violent Crimes,0.990351441
147048,09/06/2010,2010-06-08,Foothill,62,M,W,7000    GREELEY                      ST,34.2489,-118.2839,Theft,Property Crime,Non-Violent Crimes,0.997254907
147109,12/06/2010,2010-06-06,Foothill,94,M,H,12500    MINEOLA                      ST,34.25,-118.408,Theft,Property Crime,Non-Violent Crimes,0.991863304
147413,24/06/2010,2010-06-23,Foothill,35,M,W,10300    WILSEY                       AV,34.256,-118.2969,Assault,Bodily Harm,Violent Crimes,0.994756673
147447,25/06/2010,2010-06-13,Foothill,14,F,H,12000    ALLEGHENY                    ST,34.2361,-118.3945,Rape,Rape,Violent Crimes,0.999260727
147643,03/07/2010,2010-07-03,Foothill,32,F,A,LAUREL CANYON                BL,34.2469,-118.4195,Battery Crime,Bodily Harm,Violent Crimes,0.990721156
147750,07/07/2010,2010-07-07,Foothill,16,M,H,VAN NUYS                     BL,34.263,-118.4264,Assault,Bodily Harm,Violent Crimes,0.995336904
147890,12/07/2010,2010-07-04,Foothill,19,F,H,OSBORNE                      ST,34.2647,-118.4019,Theft,Property Crime,Non-Violent Crimes,0.992327982
147894,12/07/2010,2010-07-09,Foothill,51,M,W,10200    NORRIS                       AV,34.2552,-118.4008,Theft,Property Crime,Non-Violent Crimes,0.99220971
148184,23/07/2010,2010-07-23,Foothill,16,M,O,ARMINTA,34.2139,-118.3965,Robbery,Robbery,Violent Crimes,0.991767182
148512,04/08/2010,2010-07-24,Foothill,39,M,H,10700    FLORALITA                    AV,34.2634,-118.3184,Theft,Property Crime,Non-Violent Crimes,0.995555375
148799,18/08/2010,2010-08-12,Foothill,53,M,O,8900    FOOTHILL                     BL,34.2613,-118.3255,Theft,Property Crime,Non-Violent Crimes,0.991410685
149023,27/08/2010,2010-08-27,Foothill,38,M,B,8300    SAN FERNANDO                 RD,34.2209,-118.3717,Battery Crime,Bodily Harm,Violent Crimes,0.990019642
149209,05/09/2010,2010-09-04,Foothill,36,F,H,11200    DE GARMO                     AV,34.2737,-118.4146,Battery Crime,Bodily Harm,Violent Crimes,0.995648772
149268,08/09/2010,2010-08-30,Foothill,5,M,H,11900    SPROULE                      AV,34.2869,-118.4152,Assault,Bodily Harm,Violent Crimes,0.999544738
150383,26/10/2010,2010-10-25,Foothill,19,F,H,7800    GLENOAKS                     BL,34.213,-118.3482,Theft,Property Crime,Non-Violent Crimes,0.993796208
150559,01/11/2010,2010-05-01,Foothill,36,M,H,8200    WHITSETT                     AV,34.2199,-118.4053,Theft,Property Crime,Non-Violent Crimes,0.994476324
150569,05/11/2010,2010-11-05,Foothill,55,M,H,7800    RHODES                       AV,34.2121,-118.4015,Theft,Property Crime,Non-Violent Crimes,0.996492174
150588,06/11/2010,2010-11-06,Foothill,24,F,H,11400    DRONFIELD                    AV,34.2766,-118.4032,Theft,Property Crime,Non-Violent Crimes,0.996057163
150607,06/11/2010,2010-11-06,Foothill,28,M,H,SAN FERNANDO                 RD,34.2191,-118.369,Assault,Bodily Harm,Violent Crimes,0.992464676
150674,10/11/2010,2010-11-01,Foothill,50,F,O,9100    TELFAIR                      AV,34.2348,-118.395,Theft,Property Crime,Non-Violent Crimes,0.993421992
150944,23/11/2010,2010-11-22,Foothill,23,M,H,OSBORNE,34.2469,-118.4195,Theft,Property Crime,Non-Violent Crimes,0.996233372
151039,28/11/2010,2010-11-28,Foothill,32,M,W,12900    MONTFORD                     ST,34.2808,-118.4134,Assault,Bodily Harm,Violent Crimes,0.996857019
151420,16/12/2010,2010-12-16,Foothill,30,F,W,11300    KELOWNA                      ST,34.2821,-118.3768,Theft,Property Crime,Non-Violent Crimes,0.997289772
151541,22/12/2010,2010-12-22,Foothill,39,M,W,10200    TUJUNGA CANYON               BL,34.2512,-118.2906,Theft,Property Crime,Non-Violent Crimes,0.992676701
151697,10/01/2010,2010-01-10,Devonshire,30,M,H,15900    SAN JOSE                     ST,34.261,-118.4783,Battery Crime,Bodily Harm,Violent Crimes,0.998698447
152379,09/01/2010,2010-01-07,Devonshire,57,F,W,10700    MCLENNAN                     AV,34.2658,-118.5014,Theft,Property Crime,Non-Violent Crimes,0.994842189
152390,08/01/2010,2010-01-08,Devonshire,49,M,W,16900    LABRADOR                     ST,34.2494,-118.5002,Theft,Property Crime,Non-Violent Crimes,0.994196794
152417,11/01/2010,2010-01-10,Devonshire,25,M,H,8800    CORBIN                       AV,34.2304,-118.5623,Theft,Property Crime,Non-Violent Crimes,0.999261199
152438,11/01/2010,2010-01-11,Devonshire,41,F,B,9900    ODESSA                       AV,34.2571,-118.4914,Assault,Bodily Harm,Violent Crimes,0.993405413
152454,12/01/2010,2010-01-12,Devonshire,49,M,B,10600    WOODLEY                      AV,34.2629,-118.4848,Theft,Property Crime,Non-Violent Crimes,0.991657228
152926,30/01/2010,2010-01-29,Devonshire,50,F,W,9900    BOTHWELL                     RD,34.2508,-118.5617,Theft,Property Crime,Non-Violent Crimes,0.998909279
153137,07/02/2010,2010-02-05,Devonshire,52,F,H,16900    CHATSWORTH                   ST,34.2648,-118.5001,Theft,Property Crime,Non-Violent Crimes,0.995687934
153146,08/02/2010,2010-02-05,Devonshire,54,M,W,16900    FLANDERS                     ST,34.2802,-118.4995,Battery Crime,Bodily Harm,Violent Crimes,0.992135345
153580,23/02/2010,2010-02-23,Devonshire,65,F,W,11400    VALJEAN                      AV,34.2778,-118.4871,Theft,Property Crime,Non-Violent Crimes,0.997235926
154453,26/03/2010,2010-03-25,Devonshire,63,M,W,10000    RUDNICK                      AV,34.2523,-118.6126,Theft,Property Crime,Non-Violent Crimes,0.999294258
154645,01/04/2010,2010-04-01,Devonshire,48,M,B,16300    JONFIN                       ST,34.2687,-118.4877,Theft,Property Crime,Non-Violent Crimes,0.993588329
155152,20/04/2010,2010-04-20,Devonshire,47,F,A,10500    RESEDA                       BL,34.2609,-118.5361,Theft,Property Crime,Non-Violent Crimes,0.999963041
155484,03/05/2010,2010-05-02,Devonshire,72,M,W,20000    CHASE                        ST,34.2246,-118.5688,Theft,Property Crime,Non-Violent Crimes,0.999152827
156256,11/06/2010,2010-06-11,Devonshire,25,F,O,19300    NORDHOFF                     ST,34.2355,-118.5536,Theft,Property Crime,Non-Violent Crimes,0.990278297
156414,07/06/2010,2010-06-07,Devonshire,25,M,I,17300    CHATSWORTH                   ST,34.2649,-118.511,Theft,Property Crime,Non-Violent Crimes,0.997454235
156562,13/06/2010,2010-06-12,Devonshire,31,F,O,9100    HAYVENHURST                  AV,34.2357,-118.4938,Fraud,White Collar Crime,Non-Violent Crimes,0.997282701
156728,19/06/2010,2010-03-22,Devonshire,11,F,O,8600    OAKDALE                      AV,34.2264,-118.5667,Theft,Property Crime,Non-Violent Crimes,0.99801868
156733,20/06/2010,2010-06-19,Devonshire,20,M,H,9300    TAMPA                        AV,34.2564,-118.5536,Theft,Property Crime,Non-Violent Crimes,0.998917079
157073,02/07/2010,2010-06-28,Devonshire,15,F,W,10500    ZELZAH                       AV,34.2613,-118.5234,Theft,Property Crime,Non-Violent Crimes,0.995759567
157927,04/08/2010,2010-08-03,Devonshire,57,M,O,10100    WOODLEY                      AV,34.2538,-118.4849,Theft,Property Crime,Non-Violent Crimes,0.990640368
158145,11/08/2010,2010-08-11,Devonshire,39,F,W,11100    BALBOA                       BL,34.272,-118.5022,Theft,Property Crime,Non-Violent Crimes,0.993267326
158498,24/08/2010,2010-08-22,Devonshire,55,F,H,9400    WYSTONE                      AV,34.2411,-118.5459,Theft,Property Crime,Non-Violent Crimes,0.992641749
158772,03/09/2010,2010-09-03,Devonshire,28,M,W,17300    CHATSWORTH                   ST,34.2649,-118.511,Theft,Property Crime,Non-Violent Crimes,0.998290838
159131,17/09/2010,2010-09-17,Devonshire,59,F,H,20200    HIAWATHA                     ST,34.2587,-118.5729,Robbery,Robbery,Violent Crimes,0.995642356
159299,22/09/2010,2010-09-22,Devonshire,29,F,H,ROSCOE                       BL,34.2205,-118.5536,Assault,Bodily Harm,Violent Crimes,0.992995638
159335,24/09/2010,2010-09-24,Devonshire,70,F,H,ROSCOE                       BL,34.2207,-118.5361,Theft,Property Crime,Non-Violent Crimes,0.997839097
159517,01/10/2010,2010-09-30,Devonshire,17,M,B,20900    KNAPP                        ST,34.2383,-118.5885,Battery Crime,Bodily Harm,Violent Crimes,0.992225067
159562,02/10/2010,2010-10-02,Devonshire,31,F,O,19200    NORDHOFF                     ST,34.2355,-118.5517,Assault,Bodily Harm,Violent Crimes,0.997076906
159634,06/10/2010,2010-10-05,Devonshire,39,F,W,8500    BALBOA                       BL,34.2251,-118.5027,Theft,Property Crime,Non-Violent Crimes,0.996927371
159763,10/10/2010,2010-10-07,Devonshire,41,F,W,9500    FULLBRIGHT                   AV,34.243,-118.5774,Assault,Bodily Harm,Violent Crimes,0.991715892
159817,13/10/2010,2010-08-17,Devonshire,29,M,W,17900    CHATSWORTH                   ST,34.2649,-118.5234,Theft,Property Crime,Non-Violent Crimes,0.996218137
159840,13/10/2010,2010-10-12,Devonshire,51,F,W,19500    CELTIC                       ST,34.2711,-118.5582,Assault,Bodily Harm,Violent Crimes,0.993024708
159852,14/10/2010,2010-09-27,Devonshire,19,M,O,18400    PRAIRIE                      ST,34.2391,-118.5338,Battery Crime,Bodily Harm,Violent Crimes,0.993251006
160155,26/10/2010,2010-10-18,Devonshire,20,M,W,8800    CORBIN                       AV,34.2304,-118.5623,Fraud,White Collar Crime,Non-Violent Crimes,0.999633114
160231,29/10/2010,2010-10-28,Devonshire,35,F,H,11400    WOODLEY                      AV,34.2776,-118.4847,Theft,Property Crime,Non-Violent Crimes,0.993082024
160235,28/10/2010,2010-10-15,Devonshire,44,M,H,16900    BLACKHAWK                    ST,34.2589,-118.5006,Theft,Property Crime,Non-Violent Crimes,0.993213736
160421,04/11/2010,2010-11-03,Devonshire,24,M,W,18500    MAYALL                       ST,34.2533,-118.5361,Theft,Property Crime,Non-Violent Crimes,0.993588642
160514,07/11/2010,2010-11-06,Devonshire,26,M,W,SEPTO                        ST,34.2509,-118.5723,Theft,Property Crime,Non-Violent Crimes,0.994770629
161220,07/12/2010,2010-10-30,Devonshire,58,F,A,19700    TURTLE SPRINGS               WY,34.2927,-118.5626,Theft,Property Crime,Non-Violent Crimes,0.995511478
161280,09/12/2010,2010-12-09,Devonshire,27,M,H,15600    KALISHER                     ST,34.2764,-118.4723,Battery Crime,Bodily Harm,Violent Crimes,0.996493016
161735,27/12/2010,2010-12-26,Devonshire,27,M,W,9900    WYSTONE                      AV,34.2503,-118.547,Theft,Property Crime,Non-Violent Crimes,0.995550502
161971,13/03/2010,2010-03-13,Southeast,22,F,B,11400    ALVARO                       ST,33.931,-118.2532,Assault,Bodily Harm,Violent Crimes,0.993579416
162026,10/04/2010,2010-04-10,Southeast,19,F,B,9400 S  MAIN                         ST,33.9511,-118.2739,Assault,Bodily Harm,Violent Crimes,0.995517082
162121,26/05/2010,2010-05-25,Southeast,41,F,B,700 W  137TH                        ST,33.9077,-118.2872,Assault,Bodily Harm,Violent Crimes,0.991598159
162399,10/10/2010,2010-10-10,Southeast,44,F,H,500 W  149TH                        ST,33.8975,-118.2832,Theft,Property Crime,Non-Violent Crimes,0.990178467
162461,14/12/2010,2010-12-14,Southeast,51,F,H,1700 E  112TH                        ST,33.933,-118.2434,Theft,Property Crime,Non-Violent Crimes,0.992578373
162493,03/03/2011,2010-11-22,Southeast,6,F,B,800 W  92ND                         ST,33.9528,-118.2893,Battery Crime,Bodily Harm,Violent Crimes,0.993777577
162568,27/12/2010,2010-12-26,Southeast,34,F,B,600 W  COLDEN                       AV,33.9492,-118.2848,Assault,Bodily Harm,Violent Crimes,0.998183906
162611,02/01/2010,2010-01-01,Southeast,50,F,H,100 W  91ST                         ST,33.9538,-118.2739,Battery Crime,Bodily Harm,Violent Crimes,0.997561522
163193,25/01/2010,2010-01-25,Southeast,29,M,H,300 W  93RD                         ST,33.9519,-118.2784,Theft,Property Crime,Non-Violent Crimes,0.998813681
163355,01/02/2010,2010-01-31,Southeast,26,F,H,600 W  107TH                        ST,33.9391,-118.2848,Battery Crime,Bodily Harm,Violent Crimes,0.998614311
163715,17/02/2010,2010-02-17,Southeast,39,M,B,400 W  108TH                        ST,33.9383,-118.2805,Theft,Property Crime,Non-Violent Crimes,0.994032245
163778,19/02/2010,2010-02-19,Southeast,30,M,B,200 W  92ND                         ST,33.9528,-118.2761,Assault,Bodily Harm,Violent Crimes,0.995989803
163805,21/02/2010,2010-02-20,Southeast,39,F,B,2000 E  111TH                        ST,33.9343,-118.2363,Assault,Bodily Harm,Violent Crimes,0.993721627
163895,24/02/2010,2010-02-20,Southeast,20,F,H,119TH                        ST,33.9249,-118.2826,Theft,Property Crime,Non-Violent Crimes,0.990536193
163970,28/02/2010,2010-02-28,Southeast,32,F,H,8800    AVALON                       BL,33.9561,-118.2651,Theft,Property Crime,Non-Violent Crimes,0.998250417
164040,03/03/2010,2010-03-02,Southeast,19,F,B,8600 S  FIGUEROA                     ST,33.9601,-118.2827,Assault,Bodily Harm,Violent Crimes,0.992038668
164075,04/03/2010,2010-03-04,Southeast,31,F,B,10200    AVALON                       BL,33.9442,-118.2652,Robbery,Robbery,Violent Crimes,0.998347187
164182,09/03/2010,2010-03-09,Southeast,32,F,B,8900 S  VERMONT                      AV,33.9563,-118.2915,Assault,Bodily Harm,Violent Crimes,0.992728424
164502,21/03/2010,2010-03-20,Southeast,18,F,H,CENTURY                      BL,33.9457,-118.243,Battery Crime,Bodily Harm,Violent Crimes,0.999574511
165141,10/04/2010,2010-04-02,Southeast,61,F,B,800 W  111TH                        ST,33.9346,-118.2894,Theft,Property Crime,Non-Violent Crimes,0.991357163
165329,18/04/2010,2010-04-18,Southeast,21,M,H,9800 S  GRANDEE                      AV,33.9474,-118.2435,Assault,Bodily Harm,Violent Crimes,0.999027681
165922,07/05/2010,2010-05-07,Southeast,57,M,B,700 W  124TH                        ST,33.9201,-118.287,Theft,Property Crime,Non-Violent Crimes,0.998076389
166152,16/05/2010,2010-05-16,Southeast,23,F,B,700    EL SEGUNDO                   BL,33.9164,-118.287,Assault,Bodily Harm,Violent Crimes,0.997097504
166279,20/05/2010,2010-05-20,Southeast,59,M,B,114TH                        ST,33.9315,-118.2335,Assault,Bodily Harm,Violent Crimes,0.99122254
166337,22/05/2010,2010-05-22,Southeast,22,F,B,89TH                         ST,33.956,-118.2782,Assault,Bodily Harm,Violent Crimes,0.994173678
166427,25/05/2010,2010-05-25,Southeast,45,F,H,200 E  89TH                         ST,33.9556,-118.2717,Theft,Property Crime,Non-Violent Crimes,0.990225599
166797,08/06/2010,2010-05-23,Southeast,81,F,H,800 E  109TH                        ST,33.9373,-118.2608,Theft,Property Crime,Non-Violent Crimes,0.998310463
167425,30/06/2010,2010-06-27,Southeast,47,F,H,11500    CROESUS                      AV,33.9306,-118.2335,Theft,Property Crime,Non-Violent Crimes,0.997023653
167775,13/07/2010,2010-06-03,Southeast,18,F,B,114TH,33.9311,-118.2493,Theft,Property Crime,Non-Violent Crimes,0.991069906
168017,21/07/2010,2010-06-21,Southeast,30,F,B,800 E  101ST                        ST,33.9448,-118.2608,Theft,Property Crime,Non-Violent Crimes,0.994790293
168144,26/07/2010,2010-07-05,Southeast,29,M,B,1300 E  107TH                        ST,33.9388,-118.2517,Assault,Bodily Harm,Violent Crimes,0.998490843
168748,18/08/2010,2010-08-18,Southeast,22,M,H,CLOVIS,33.9457,-118.2565,Robbery,Robbery,Violent Crimes,0.990125446
169000,27/08/2010,2010-08-23,Southeast,33,M,H,2000 E  111TH                        ST,33.9343,-118.2363,Theft,Property Crime,Non-Violent Crimes,0.997787952
169012,28/08/2010,2010-08-27,Southeast,67,F,B,800 W  134TH                        ST,33.9103,-118.2892,Theft,Property Crime,Non-Violent Crimes,0.999818166
169100,01/09/2010,2010-08-31,Southeast,19,F,H,108TH                        ST,33.9383,-118.2608,Robbery,Robbery,Violent Crimes,0.993554695
169289,07/09/2010,2010-09-07,Southeast,17,F,H,11400    COMPTON                      AV,33.9311,-118.2463,Robbery,Robbery,Violent Crimes,0.995366217
169582,19/09/2010,2010-09-18,Southeast,45,F,H,8900    BARING CROSS                 AV,33.9565,-118.2893,Theft,Property Crime,Non-Violent Crimes,0.995300343
169610,20/09/2010,2010-09-19,Southeast,41,F,B,8900 S  MAIN                         ST,33.9556,-118.2739,Theft,Property Crime,Non-Violent Crimes,0.999645069
169623,21/09/2010,2010-09-20,Southeast,36,F,B,9300    CLOVIS                       AV,33.9521,-118.2564,Battery Crime,Bodily Harm,Violent Crimes,0.991936761
169658,22/09/2010,2010-09-21,Southeast,41,F,B,10700 S  MAIN                         ST,33.9392,-118.2739,Battery Crime,Bodily Harm,Violent Crimes,0.993697352
169727,24/09/2010,2010-09-24,Southeast,20,M,H,8700 S  REGINA                       CT,33.9587,-118.2847,Assault,Bodily Harm,Violent Crimes,0.994503055
169796,26/09/2010,2010-09-26,Southeast,75,M,B,1500 E  CENTURY                      BL,33.9456,-118.2481,Theft,Property Crime,Non-Violent Crimes,0.996757183
169814,27/09/2010,2010-09-27,Southeast,43,M,B,COMPTON                      AV,33.9348,-118.2463,Battery Crime,Bodily Harm,Violent Crimes,0.996817381
169962,02/10/2010,2010-09-28,Southeast,8,M,H,200 W  87TH                         PL,33.9579,-118.2761,Assault,Bodily Harm,Violent Crimes,0.995347505
170013,03/10/2010,2010-10-03,Southeast,31,F,B,8700 S  BROADWAY,33.9587,-118.2782,Robbery,Robbery,Violent Crimes,0.990575597
170121,07/10/2010,2010-10-03,Southeast,51,F,B,200 E  92ND                         ST,33.9529,-118.2717,Theft,Property Crime,Non-Violent Crimes,0.999661949
170307,13/10/2010,2010-10-13,Southeast,33,F,H,700 E  COLDEN                       AV,33.9493,-118.263,Theft,Property Crime,Non-Violent Crimes,0.990719631
170549,22/10/2010,2010-10-19,Southeast,39,M,O,11300 S  FIGUEROA                     ST,33.932,-118.2826,Theft,Property Crime,Non-Violent Crimes,0.991488235
170665,26/10/2010,2010-10-26,Southeast,34,F,H,700 E  120TH                        ST,33.9237,-118.2621,Theft,Property Crime,Non-Violent Crimes,0.996196408
171192,15/11/2010,2010-11-14,Southeast,21,F,B,113TH                        ST,33.9321,-118.2443,Assault,Bodily Harm,Violent Crimes,0.990020038
171215,15/11/2010,2010-11-10,Southeast,13,M,H,200 E  112TH                        ST,33.933,-118.2717,Assault,Bodily Harm,Violent Crimes,0.997443067
171281,17/11/2010,2010-11-17,Southeast,20,F,B,10100    PALOMA                       AV,33.9448,-118.2638,Battery Crime,Bodily Harm,Violent Crimes,0.997970723
171343,19/11/2010,2010-11-19,Southeast,26,F,B,11400 S  VERMONT                      AV,33.931,-118.2916,Battery Crime,Bodily Harm,Violent Crimes,0.993838321
172077,16/12/2010,2010-12-15,Southeast,51,F,B,108TH,33.9383,-118.2781,Assault,Bodily Harm,Violent Crimes,0.994803724
172349,26/12/2010,2010-12-24,Southeast,42,F,B,200 W  94TH                         ST,33.951,-118.2766,Theft,Property Crime,Non-Violent Crimes,0.994063955
172428,30/12/2010,2010-12-23,Southeast,53,M,H,168TH                        ST,33.8794,-118.2825,Robbery,Robbery,Violent Crimes,0.993974269
172562,10/04/2010,2010-04-09,Mission,27,M,H,FOOTHILL                     AV,34.3075,-118.4303,Assault,Bodily Harm,Violent Crimes,0.999010373
173001,06/01/2010,2010-01-06,Mission,23,F,W,13200    COMMUNITY                    ST,34.2235,-118.4199,Theft,Property Crime,Non-Violent Crimes,0.992653771
173150,13/01/2010,2010-01-13,Mission,77,M,W,13200    DEBELL                       ST,34.2393,-118.4203,Theft,Property Crime,Non-Violent Crimes,0.994834339
173245,18/01/2010,2010-01-17,Mission,38,F,H,8800    ORION                        AV,34.2301,-118.472,Theft,Property Crime,Non-Violent Crimes,0.998230986
173339,21/01/2010,2010-01-21,Mission,33,F,H,OSBORNE                      ST,34.2325,-118.4394,Theft,Property Crime,Non-Violent Crimes,0.999016823
173470,26/01/2010,2010-01-26,Mission,13,F,H,NOBLE,34.2215,-118.4612,Battery Crime,Bodily Harm,Violent Crimes,0.990589289
173650,02/02/2010,2010-02-02,Mission,15,F,H,13200    MACLAY                       ST,34.2985,-118.4205,Battery Crime,Bodily Harm,Violent Crimes,0.993688843
173658,03/02/2010,2010-02-02,Mission,32,M,H,14500    FORTUNA                      LN,34.2423,-118.448,Theft,Property Crime,Non-Violent Crimes,0.999211849
173803,08/02/2010,2010-02-07,Mission,37,F,H,8500    WILLIS                       AV,34.2247,-118.4553,Battery Crime,Bodily Harm,Violent Crimes,0.992603395
173871,10/02/2010,2010-02-10,Mission,24,F,H,13900    TUCKER                       AV,34.3245,-118.4076,Theft,Property Crime,Non-Violent Crimes,0.992173592
173974,15/02/2010,2010-02-13,Mission,56,M,H,8800    VAN NUYS                     BL,34.2299,-118.4503,Battery Crime,Bodily Harm,Violent Crimes,0.990045141
173989,15/02/2010,2010-02-15,Mission,22,F,W,9100    SEPULVEDA                    BL,34.2355,-118.4676,Theft,Property Crime,Non-Violent Crimes,0.995290004
174018,16/02/2010,2010-02-16,Mission,45,M,W,10000    BURNET                       AV,34.2518,-118.463,Theft,Property Crime,Non-Violent Crimes,0.99759363
174276,27/02/2010,2010-02-15,Mission,51,M,O,14900    LASSEN                       ST,34.25,-118.4565,Theft,Property Crime,Non-Violent Crimes,0.994813958
174665,13/03/2010,2010-03-08,Mission,15,F,W,13000    BORDEN                       AV,34.3061,-118.4414,Battery Crime,Bodily Harm,Violent Crimes,0.993171527
174708,14/03/2010,2010-03-14,Mission,21,F,H,15500    RAYEN                        ST,34.2319,-118.4698,Robbery,Robbery,Violent Crimes,0.998307033
174769,15/03/2010,2010-03-15,Mission,42,F,H,8100    LANGDON                      AV,34.218,-118.4688,Theft,Property Crime,Non-Violent Crimes,0.994284528
175091,26/03/2010,2010-03-25,Mission,17,M,H,13100    DRONFIELD                    AV,34.3089,-118.4386,Theft,Property Crime,Non-Violent Crimes,0.999154196
175210,30/03/2010,2010-03-30,Mission,27,F,H,13600    OSBORNE                      ST,34.2397,-118.4293,Theft,Property Crime,Non-Violent Crimes,0.998956851
175229,31/03/2010,2010-03-24,Mission,61,M,W,15400    GLENOAKS                     BL,34.3232,-118.4695,Theft,Property Crime,Non-Violent Crimes,0.992225732
175466,10/04/2010,2010-04-09,Mission,93,F,W,8300    VAN NUYS                     BL,34.2216,-118.4488,Theft,Property Crime,Non-Violent Crimes,0.995920339
175655,16/04/2010,2010-04-15,Mission,23,F,B,9100    SEPULVEDA                    BL,34.2355,-118.4676,Battery Crime,Bodily Harm,Violent Crimes,0.990451708
175699,18/04/2010,2010-04-17,Mission,33,F,H,12700    DE FOE                       AV,34.3008,-118.4458,Assault,Bodily Harm,Violent Crimes,0.99264201
176484,14/05/2010,2010-05-13,Mission,50,M,H,15100    FLORENTINE                   ST,34.2935,-118.4598,Battery Crime,Bodily Harm,Violent Crimes,0.990613996
176611,19/05/2010,2010-05-18,Mission,26,F,W,10300    COLUMBUS                     AV,34.2573,-118.465,Battery Crime,Bodily Harm,Violent Crimes,0.99283732
176640,20/05/2010,2010-05-19,Mission,28,M,H,10200    WISNER                       AV,34.255,-118.4619,Theft,Property Crime,Non-Violent Crimes,0.998890135
176689,22/05/2010,2010-05-14,Mission,15,M,H,8000    VAN NUYS                     BL,34.2162,-118.4488,Battery Crime,Bodily Harm,Violent Crimes,0.994206486
176723,24/05/2010,2010-05-23,Mission,23,F,H,14900    ROSCOE                       BL,34.2215,-118.4575,Assault,Bodily Harm,Violent Crimes,0.998555143
176780,26/05/2010,2010-05-18,Mission,52,F,H,14600    RAYEN                        ST,34.2318,-118.4503,Theft,Property Crime,Non-Violent Crimes,0.995852157
177076,08/06/2010,2010-03-24,Mission,21,F,H,8300    WILLIS                       AV,34.2215,-118.4553,Theft,Property Crime,Non-Violent Crimes,0.99677649
177771,03/07/2010,2010-07-03,Mission,26,F,H,OSBORNE,34.2447,-118.4225,Assault,Bodily Harm,Violent Crimes,0.9979278
177868,07/07/2010,2010-07-06,Mission,30,F,B,14600    GLEDHILL                     ST,34.2414,-118.4502,Theft,Property Crime,Non-Violent Crimes,0.993326999
178036,15/07/2010,2010-07-14,Mission,40,M,W,9000    WOODMAN                      AV,34.233,-118.4386,Theft,Property Crime,Non-Violent Crimes,0.991258486
178140,16/07/2010,2010-07-16,Mission,53,F,H,13200    MONTAGUE                     ST,34.2409,-118.4204,Theft,Property Crime,Non-Violent Crimes,0.994776112
178189,19/07/2010,2010-07-19,Mission,23,F,B,14000    FOOTHILL                     BL,34.317,-118.4426,Battery Crime,Bodily Harm,Violent Crimes,0.992148892
178518,02/08/2010,2010-08-01,Mission,20,M,H,SAYRE                        ST,34.2976,-118.4505,Robbery,Robbery,Violent Crimes,0.991171861
178576,03/08/2010,2010-07-19,Mission,50,F,H,8100    LEMONA                       AV,34.2179,-118.4601,Theft,Property Crime,Non-Violent Crimes,0.991053186
178662,05/08/2010,2010-08-05,Mission,32,F,H,15800    LARKSPUR                     ST,34.3049,-118.4756,Assault,Bodily Harm,Violent Crimes,0.995171777
178666,06/08/2010,2010-08-06,Mission,60,F,W,14800    NEEDLES                      ST,34.2472,-118.4543,Theft,Property Crime,Non-Violent Crimes,0.995070197
179449,06/09/2010,2010-09-06,Mission,39,F,H,13800    ALMETZ                       ST,34.3273,-118.4342,Battery Crime,Bodily Harm,Violent Crimes,0.99695893
179489,08/09/2010,2010-09-07,Mission,16,F,H,13800    GLADSTONE                    AV,34.3227,-118.4436,Theft,Property Crime,Non-Violent Crimes,0.998364519
179726,16/09/2010,2010-09-08,Mission,31,F,H,14200    COMMUNITY                    ST,34.2226,-118.4438,Assault,Bodily Harm,Violent Crimes,0.993008961
179756,17/09/2010,2010-09-16,Mission,21,M,H,14800    LARKSPUR                     ST,34.3226,-118.4557,Theft,Property Crime,Non-Violent Crimes,0.990835833
180251,05/10/2010,2010-10-05,Mission,25,M,W,16600    FOOTHILL                     BL,34.3216,-118.4958,Theft,Property Crime,Non-Violent Crimes,0.992611665
180387,13/10/2010,2010-10-13,Mission,36,F,H,14900    SEPTO                        ST,34.2509,-118.4565,Theft,Property Crime,Non-Violent Crimes,0.991884627
180776,25/10/2010,2010-10-22,Mission,51,M,H,13800    PIERCE                       ST,34.2534,-118.4323,Theft,Property Crime,Non-Violent Crimes,0.999290267
180861,30/10/2010,2010-10-28,Mission,58,F,W,15000    SAN JOSE                     ST,34.2609,-118.4586,Theft,Property Crime,Non-Violent Crimes,0.997478201
181201,12/11/2010,2010-11-12,Mission,26,F,H,9000    TOBIAS                       AV,34.2336,-118.4517,Assault,Bodily Harm,Violent Crimes,0.994402125
181227,13/11/2010,2010-11-12,Mission,48,M,H,14800    BLYTHE                       ST,34.2152,-118.4553,Assault,Bodily Harm,Violent Crimes,0.997815355
181354,18/11/2010,2010-11-12,Mission,45,M,H,13800    FOOTHILL                     BL,34.3102,-118.4338,Theft,Property Crime,Non-Violent Crimes,0.990575617
181443,22/11/2010,2010-11-21,Mission,31,F,H,9000    TOBIAS                       AV,34.2336,-118.4517,Theft,Property Crime,Non-Violent Crimes,0.995681408
181548,26/11/2010,2010-11-26,Mission,63,F,H,13200    CROWLEY                      ST,34.2299,-118.4197,Theft,Property Crime,Non-Violent Crimes,0.994913102
181813,07/12/2010,2010-12-06,Mission,4,M,H,9200    KESTER                       AV,34.2374,-118.4565,Kidnapping,Abduction,Violent Crimes,0.991619818
182268,26/12/2010,2010-12-24,Mission,22,F,H,15200    NORDHOFF                     ST,34.2355,-118.4632,Assault,Bodily Harm,Violent Crimes,0.996084995
182452,01/01/2010,2010-01-01,Olympic,27,M,A,5TH                          ST,34.0654,-118.3029,Robbery,Robbery,Violent Crimes,0.995036291
182610,09/01/2010,2010-01-03,Olympic,29,F,H,200 S  KENMORE                      AV,34.0712,-118.2966,Fraud,White Collar Crime,Non-Violent Crimes,0.999950792
182699,13/01/2010,2010-01-13,Olympic,34,M,H,1300 W  20TH                         ST,34.0382,-118.284,Theft,Property Crime,Non-Violent Crimes,0.994053287
183045,29/01/2010,2010-01-29,Olympic,24,M,K,VERMONT                      AV,34.0545,-118.2916,Battery Crime,Bodily Harm,Violent Crimes,0.994526233
183318,09/02/2010,2010-02-08,Olympic,39,M,K,400 S  NEW HAMPSHIRE                AV,34.0674,-118.2929,Theft,Property Crime,Non-Violent Crimes,0.997228379
183891,07/03/2010,2010-03-07,Olympic,19,M,H,1600 S  WESTERN                      AV,34.0436,-118.309,Theft,Property Crime,Non-Violent Crimes,0.999764587
184085,15/03/2010,2010-03-15,Olympic,23,F,H,NEW HAMPSHIRE                AV,34.0654,-118.2929,Battery Crime,Bodily Harm,Violent Crimes,0.996687886
184222,21/03/2010,2010-02-19,Olympic,63,F,A,3900    INGRAHAM                     ST,34.0607,-118.3112,Theft,Property Crime,Non-Violent Crimes,0.999565686
184224,21/03/2010,2010-03-08,Olympic,46,M,H,NORMANDIE                    AV,34.069,-118.3004,Robbery,Robbery,Violent Crimes,0.992146657
184426,28/03/2010,2010-03-28,Olympic,51,M,O,700 S  WESTERN                      AV,34.0597,-118.3091,Battery Crime,Bodily Harm,Violent Crimes,0.992771013
184689,08/04/2010,2010-04-07,Olympic,20,M,H,900 S  BERENDO                      ST,34.056,-118.2941,Theft,Property Crime,Non-Violent Crimes,0.991572614
184784,13/04/2010,2010-04-13,Olympic,43,M,H,OXFORD,34.0545,-118.3078,Robbery,Robbery,Violent Crimes,0.997994761
185120,27/04/2010,2010-04-26,Olympic,34,M,H,100 S  VIRGIL                       AV,34.0735,-118.2868,Theft,Property Crime,Non-Violent Crimes,0.993139014
185186,30/04/2010,2010-04-26,Olympic,19,M,W,2200 W  21ST                         ST,34.0378,-118.312,Theft,Property Crime,Non-Violent Crimes,0.997049039
185498,13/05/2010,2010-05-13,Olympic,24,F,H,400 S  ALEXANDRIA                   AV,34.0672,-118.2979,Battery Crime,Bodily Harm,Violent Crimes,0.991439126
185649,21/05/2010,2010-05-21,Olympic,21,F,B,WESTMORELAND                 AV,34.0436,-118.3065,Assault,Bodily Harm,Violent Crimes,0.994109055
185686,23/05/2010,2010-05-23,Olympic,9,M,H,3400 W  3RD                          ST,34.0691,-118.2894,Theft,Property Crime,Non-Violent Crimes,0.994427617
185986,06/06/2010,2010-06-06,Olympic,18,M,H,900 S  MANHATTAN                    PL,34.0559,-118.3102,Assault,Bodily Harm,Violent Crimes,0.998516347
186008,06/06/2010,2010-06-06,Olympic,38,F,H,WESTMORELAND,34.0524,-118.2891,Robbery,Robbery,Violent Crimes,0.996478592
186024,06/06/2010,2010-06-06,Olympic,2,F,H,1100 S  BERENDO                      ST,34.0509,-118.2937,Battery Crime,Bodily Harm,Violent Crimes,0.992249444
186036,06/06/2010,2010-06-06,Olympic,23,M,K,3100 W  OLYMPIC                      BL,34.0526,-118.3031,Battery Crime,Bodily Harm,Violent Crimes,0.993237551
186484,27/06/2010,2010-06-25,Olympic,22,M,W,600 S  GRAMERCY                     PL,34.0635,-118.3128,Theft,Property Crime,Non-Violent Crimes,0.993154294
186522,28/06/2010,2010-06-28,Olympic,22,F,O,2900 W  PICO                         BL,34.0472,-118.3047,Theft,Property Crime,Non-Violent Crimes,0.997400394
186876,14/07/2010,2010-07-13,Olympic,22,M,B,300 N  OXFORD                       AV,34.0763,-118.3079,Theft,Property Crime,Non-Violent Crimes,0.996301819
186980,18/07/2010,2010-07-18,Olympic,40,M,W,800 S  NORMANDIE                    AV,34.0577,-118.2998,Assault,Bodily Harm,Violent Crimes,0.991696426
187130,23/07/2010,2010-07-23,Olympic,69,M,O,2700 W  OLYMPIC                      BL,34.0526,-118.2916,Assault,Bodily Harm,Violent Crimes,0.994356723
187534,10/08/2010,2010-08-10,Olympic,37,M,K,500 S  KENMORE                      AV,34.0654,-118.2966,Battery Crime,Bodily Harm,Violent Crimes,0.995451111
188247,10/09/2010,2010-09-10,Olympic,20,M,B,1600 S  WESTERN                      AV,34.0436,-118.309,Theft,Property Crime,Non-Violent Crimes,0.995100461
188899,09/10/2010,2010-10-09,Olympic,72,F,B,1500 S  HOBART                       BL,34.0454,-118.3053,Assault,Bodily Harm,Violent Crimes,0.999626992
189322,27/10/2010,2010-10-25,Olympic,78,F,K,100 S  SAINT ANDREWS                PL,34.0731,-118.3113,Robbery,Robbery,Violent Crimes,0.992618844
189807,17/11/2010,2010-11-14,Olympic,23,F,B,400 S  CATALINA                     ST,34.0674,-118.2954,Theft,Property Crime,Non-Violent Crimes,0.990426617
190150,03/12/2010,2010-12-03,Olympic,48,M,W,500 N  GOWER                        ST,34.079,-118.3227,Theft,Property Crime,Non-Violent Crimes,0.994629432
190257,08/12/2010,2010-10-04,Olympic,82,F,O,500 S  IRVING                       BL,34.0653,-118.3185,Theft,Property Crime,Non-Violent Crimes,0.994598675
190274,09/12/2010,2010-12-06,Olympic,70,F,H,JAMES M WOOD,34.0559,-118.2916,Robbery,Robbery,Violent Crimes,0.99036951
190526,21/12/2010,2010-12-06,Olympic,38,M,H,300 S  MANHATTAN                    PL,34.069,-118.3104,Theft,Property Crime,Non-Violent Crimes,0.999840508
190669,29/12/2010,2010-12-29,Olympic,54,F,K,3600 W  3RD                          ST,34.0691,-118.2941,Battery Crime,Bodily Harm,Violent Crimes,0.996535172
190731,15/01/2010,2010-01-15,Topanga,16,F,W,20600    VENTURA                      BL,34.1679,-118.5804,Assault,Bodily Harm,Violent Crimes,0.999433058
190795,30/04/2010,2010-04-30,Topanga,49,M,W,22300    WELBY                        WY,34.1929,-118.6124,Theft,Property Crime,Non-Violent Crimes,0.992794906
190950,24/10/2010,2010-10-24,Topanga,22,M,H,20800    VENTURA                      BL,34.1665,-118.5859,Theft,Property Crime,Non-Violent Crimes,0.996003599
190984,11/12/2010,2010-12-05,Topanga,21,M,X,6700    TOPANGA CANYON               BL,34.1926,-118.6059,Theft,Property Crime,Non-Violent Crimes,0.99266613
191138,07/01/2010,2010-01-07,Topanga,29,M,B,TOPANGA CANYON               BL,34.2197,-118.606,Assault,Bodily Harm,Violent Crimes,0.995433067
191154,09/01/2010,2010-01-08,Topanga,96,M,W,WOODLAKE                     AV,34.2207,-118.632,Assault,Bodily Harm,Violent Crimes,0.990711046
191483,21/01/2010,2010-01-21,Topanga,52,M,W,23200    HATTERAS                     ST,34.1756,-118.6321,Theft,Property Crime,Non-Violent Crimes,0.991583977
191608,27/01/2010,2010-01-27,Topanga,75,F,W,23600    HATTERAS                     ST,34.1755,-118.6408,Theft,Property Crime,Non-Violent Crimes,0.992337769
191748,01/02/2010,2010-02-01,Topanga,19,F,W,6600    TOPANGA CANYON               BL,34.1905,-118.6059,Theft,Property Crime,Non-Violent Crimes,0.996312468
191816,04/02/2010,2010-02-03,Topanga,51,F,W,VENTURA,34.171,-118.5709,Theft,Property Crime,Non-Violent Crimes,0.994752265
192100,16/02/2010,2010-02-16,Topanga,26,M,W,21800    VICTORY                      BL,34.1875,-118.603,Theft,Property Crime,Non-Violent Crimes,0.99725944
192180,18/02/2010,2010-02-18,Topanga,50,F,H,7700    SHOUP                        AV,34.2103,-118.6147,Theft,Property Crime,Non-Violent Crimes,0.994877575
192482,03/03/2010,2010-03-02,Topanga,64,M,W,VICTORY,34.1857,-118.5709,Theft,Property Crime,Non-Violent Crimes,0.99811575
192622,07/03/2010,2010-03-07,Topanga,30,M,B,20400    SATICOY                      ST,34.2083,-118.5776,Assault,Bodily Harm,Violent Crimes,0.995113393
192802,14/03/2010,2010-03-14,Topanga,35,F,B,5300    CAMPO                        RD,34.1662,-118.598,Battery Crime,Bodily Harm,Violent Crimes,0.990316088
192876,18/03/2010,2010-03-18,Topanga,23,M,W,8300    NORTHGATE                    AV,34.221,-118.604,Assault,Bodily Harm,Violent Crimes,0.994963479
193390,07/04/2010,2010-04-05,Topanga,15,M,H,7300    VARIEL                       AV,34.2029,-118.5929,Assault,Bodily Harm,Violent Crimes,0.994338666
193597,17/04/2010,2010-04-17,Topanga,26,M,O,8600    TOPANGA CANYON               BL,34.2276,-118.6045,Battery Crime,Bodily Harm,Violent Crimes,0.996628938
193735,22/04/2010,2010-04-22,Topanga,22,F,W,ERWIN,34.1829,-118.6015,Robbery,Robbery,Violent Crimes,0.995486071
193740,22/04/2010,2010-04-22,Topanga,15,M,B,5400    VALLEY CIRCLE                BL,34.1684,-118.6426,Theft,Property Crime,Non-Violent Crimes,0.999407389
193806,25/04/2010,2010-04-25,Topanga,67,F,B,6500    WOODLAKE                     AV,34.1882,-118.6315,Battery Crime,Bodily Harm,Violent Crimes,0.99083853
194025,05/05/2010,2010-05-05,Topanga,19,M,W,6900    MILWOOD                      AV,34.1956,-118.5943,Battery Crime,Bodily Harm,Violent Crimes,0.995620463
194213,11/05/2010,2010-05-10,Topanga,74,M,W,23300    BURBANK                      BL,34.1719,-118.6343,Theft,Property Crime,Non-Violent Crimes,0.994712439
194273,13/05/2010,2010-05-10,Topanga,54,M,W,20500    VANOWEN                      ST,34.1938,-118.5797,Theft,Property Crime,Non-Violent Crimes,0.999360832
194348,16/05/2010,2010-05-15,Topanga,58,M,W,22400    VENIDO                       RD,34.1614,-118.6136,Theft,Property Crime,Non-Violent Crimes,0.995095334
194435,21/05/2010,2010-05-19,Topanga,45,F,W,24200    MARTHA                       ST,34.1731,-118.6536,Theft,Property Crime,Non-Violent Crimes,0.996278242
195121,15/06/2010,2010-06-15,Topanga,69,F,W,20900    VENTURA                      BL,34.1664,-118.5883,Theft,Property Crime,Non-Violent Crimes,0.995548185
195164,18/06/2010,2010-06-18,Topanga,32,F,B,4900    CANOGA                       AV,34.1575,-118.5962,Theft,Property Crime,Non-Violent Crimes,0.998755541
195989,17/07/2010,2010-07-17,Topanga,42,F,B,21700    SATICOY                      ST,34.2083,-118.6016,Battery Crime,Bodily Harm,Violent Crimes,0.998331597
196397,04/08/2010,2010-07-25,Topanga,57,M,O,21900    ROSCOE                       BL,34.2197,-118.6045,Fraud,White Collar Crime,Non-Violent Crimes,0.992482432
196492,07/08/2010,2010-08-07,Topanga,35,M,O,22400    MACFARLANE                   DR,34.163,-118.6145,Theft,Property Crime,Non-Violent Crimes,0.999108469
196927,24/08/2010,2010-08-03,Topanga,56,F,W,20400    LANARK                       ST,34.2182,-118.5779,Theft,Property Crime,Non-Violent Crimes,0.995613136
196940,24/08/2010,2010-08-24,Topanga,57,M,O,21900    VENTURA                      BL,34.1685,-118.6038,Theft,Property Crime,Non-Violent Crimes,0.998220263
197033,28/08/2010,2010-08-28,Topanga,23,M,H,8200    TOPANGA CANYON               BL,34.2176,-118.606,Theft,Property Crime,Non-Violent Crimes,0.992925828
197205,04/09/2010,2010-09-04,Topanga,37,M,H,7400    OWENSMOUTH                   AV,34.2047,-118.6016,Battery Crime,Bodily Harm,Violent Crimes,0.992930905
197517,16/09/2010,2010-08-31,Topanga,22,M,W,8600    INTERNATIONAL                AV,34.2258,-118.5994,Theft,Property Crime,Non-Violent Crimes,0.991000331
198258,16/10/2010,2010-06-02,Topanga,70,F,W,23300    BASSETT                      ST,34.1955,-118.6346,Theft,Property Crime,Non-Violent Crimes,0.994636715
198292,16/10/2010,2010-10-16,Topanga,50,M,H,MULHOLLAND                   DR,34.1449,-118.5982,Theft,Property Crime,Non-Violent Crimes,0.997388818
198299,17/10/2010,2010-10-17,Topanga,28,M,W,8300    NORTHGATE                    AV,34.221,-118.604,Battery Crime,Bodily Harm,Violent Crimes,0.99131422
198352,19/10/2010,2010-10-19,Topanga,27,M,O,6600    TOPANGA CANYON               BL,34.1905,-118.6059,Robbery,Robbery,Violent Crimes,0.995223243
198502,25/10/2010,2010-10-07,Topanga,34,F,W,21400    BURBANK                      BL,34.1733,-118.5974,Theft,Property Crime,Non-Violent Crimes,0.993908447
198516,26/10/2010,2010-10-25,Topanga,52,F,W,22800    VICTORY                      BL,34.1864,-118.6234,Theft,Property Crime,Non-Violent Crimes,0.991590442
198558,27/10/2010,2010-10-27,Topanga,51,F,W,22100    CALVERT                      ST,34.1812,-118.6077,Battery Crime,Bodily Harm,Violent Crimes,0.997245036
198611,30/10/2010,2010-10-26,Topanga,16,F,H,5400    MANTON                       AV,34.1688,-118.6409,Battery Crime,Bodily Harm,Violent Crimes,0.992422744
198818,06/11/2010,2010-11-06,Topanga,29,M,B,19900    SATICOY                      ST,34.2084,-118.5666,Theft,Property Crime,Non-Violent Crimes,0.997160901
198907,10/11/2010,2010-11-09,Topanga,52,M,H,21900    WYANDOTTE                    ST,34.2029,-118.6044,Theft,Property Crime,Non-Violent Crimes,0.994497256
199004,14/11/2010,2010-11-14,Topanga,20,M,W,21800    VICTORY                      BL,34.1875,-118.603,Theft,Property Crime,Non-Violent Crimes,0.996748123
199153,19/11/2010,2010-11-16,Topanga,56,M,A,21800    ROSCOE                       BL,34.2197,-118.6031,Theft,Property Crime,Non-Violent Crimes,0.997726605
199360,29/11/2010,2010-11-12,Topanga,47,M,H,20200    LORNE                        ST,34.2172,-118.5729,Theft,Property Crime,Non-Violent Crimes,0.992002712
199419,01/12/2010,2010-11-24,Topanga,22,F,H,8800    TOPANGA CANYON               BL,34.23,-118.6034,Theft,Property Crime,Non-Violent Crimes,0.991070738
199597,08/12/2010,2010-12-07,Topanga,24,F,H,22300    MOREA                        WY,34.1814,-118.6132,Theft,Property Crime,Non-Violent Crimes,0.991524387
199608,09/12/2010,2010-10-26,Topanga,37,M,W,6700    VARIEL                       AV,34.1921,-118.5928,Theft,Property Crime,Non-Violent Crimes,0.990909707
200004,24/12/2010,2010-08-08,Topanga,56,F,W,6100    DE SOTO                      AV,34.181,-118.5904,Theft,Property Crime,Non-Violent Crimes,0.999035081
200144,30/12/2010,2010-12-30,Topanga,49,F,W,7000    FALLBROOK                    AV,34.1972,-118.6234,Theft,Property Crime,Non-Violent Crimes,0.998240994
200244,26/02/2011,2010-01-01,Central,44,M,B,600 S  SAN PEDRO                    ST,34.0423,-118.2452,Battery Crime,Bodily Harm,Violent Crimes,0.998190338
200380,26/01/2011,2010-11-14,Rampart,43,F,H,500 N  KENMORE                      AV,34.079,-118.2967,Theft,Property Crime,Non-Violent Crimes,0.999781122
200614,14/01/2011,2010-10-26,Southwest,53,M,W,4000    VICTORIA                     AV,34.0169,-118.3365,Embezzlement,Property Crime,Non-Violent Crimes,0.993283605
200967,31/12/2010,2010-12-30,Harbor,27,M,H,1300    WATSON                       AV,33.7909,-118.2481,Assault,Bodily Harm,Violent Crimes,0.993401669
201394,17/05/2011,2010-07-01,Hollywood,47,M,H,1200 N  SAINT ANDREWS                PL,34.0928,-118.3109,Theft,Property Crime,Non-Violent Crimes,0.992054421
201446,12/12/2011,2010-09-01,Hollywood,25,F,O,5300    LOMA LINDA                   AV,34.103,-118.305,Theft,Property Crime,Non-Violent Crimes,0.992875133
201879,02/03/2011,2010-12-24,West LA,48,M,W,11700    SAN VICENTE                  BL,34.0536,-118.4655,Fraud,White Collar Crime,Non-Violent Crimes,0.997812786
201913,28/03/2011,2010-12-28,West LA,42,F,H,2800    WESTWOOD                     BL,34.0334,-118.4232,Theft,Property Crime,Non-Violent Crimes,0.998300381
201924,08/04/2011,2010-06-01,West LA,29,M,W,900    HILGARD                      AV,34.0641,-118.4411,Theft,Property Crime,Non-Violent Crimes,0.994265227
201949,11/05/2011,2010-12-05,West LA,33,M,W,3000 S  ROBERTSON                    BL,34.0331,-118.3898,Theft,Property Crime,Non-Violent Crimes,0.991581599
201995,30/08/2011,2010-11-15,West LA,90,M,W,1200    LAS PULGAS                   RD,34.0538,-118.5383,Theft,Property Crime,Non-Violent Crimes,0.992526484
202046,06/01/2011,2010-12-23,Van Nuys,36,M,H,VAN NUYS                     BL,34.1806,-118.4487,Theft,Property Crime,Non-Violent Crimes,0.99892396
202177,23/02/2011,2010-11-01,Van Nuys,57,F,B,14500    CLARK                        ST,34.1685,-118.4487,Theft,Property Crime,Non-Violent Crimes,0.995825229
202284,16/07/2011,2010-07-15,Van Nuys,16,M,H,14100    COHASSET                     ST,34.2066,-118.4409,Assault,Bodily Harm,Violent Crimes,0.992531715
202529,24/03/2011,2010-12-14,West Valley,49,F,H,4700    ORION                        AV,34.1558,-118.4697,Theft,Property Crime,Non-Violent Crimes,0.991944116
202549,16/04/2011,2010-11-10,West Valley,57,F,B,5500    LINDLEY                      AV,34.1713,-118.5273,Theft,Property Crime,Non-Violent Crimes,0.992937885
202599,03/07/2011,2010-10-01,West Valley,52,F,O,5700    ETIWANDA                     AV,34.1749,-118.5308,Fraud,White Collar Crime,Non-Violent Crimes,0.999213087
202860,07/04/2011,2010-04-07,Northeast,24,F,W,100 S  AVENUE 63,34.1148,-118.1826,Assault,Bodily Harm,Violent Crimes,0.996017123
202896,07/06/2011,2010-12-22,Northeast,27,M,O,1100 N  EDGEMONT                     ST,34.0909,-118.2961,Fraud,White Collar Crime,Non-Violent Crimes,0.995763715
203015,03/01/2011,2010-01-23,77th Street,60,M,H,500 W  52ND                         PL,33.995,-118.2827,Theft,Property Crime,Non-Violent Crimes,0.991849261
203068,18/01/2011,2010-02-11,77th Street,27,F,H,200 E  83RD                         ST,33.9637,-118.2717,Theft,Property Crime,Non-Violent Crimes,0.999219777
203127,15/02/2011,2010-04-01,77th Street,12,F,H,1100 W  70TH                         ST,33.9762,-118.2937,Rape,Rape,Violent Crimes,0.996517415
203192,01/04/2011,2010-10-01,77th Street,29,F,H,200 W  74TH                         ST,33.9728,-118.2761,Battery Crime,Bodily Harm,Violent Crimes,0.991729151
203307,04/11/2011,2010-06-01,77th Street,5,M,H,600 E  81ST                         ST,33.9656,-118.2651,Theft,Property Crime,Non-Violent Crimes,0.999541289
203385,17/01/2011,2010-12-29,Newton,44,M,H,100 W  51ST                         ST,33.9965,-118.274,Theft,Property Crime,Non-Violent Crimes,0.99764528
203680,16/01/2011,2010-01-15,Pacific,28,M,W,3700    CARDIFF                      AV,34.0272,-118.3977,Battery Crime,Bodily Harm,Violent Crimes,0.991042741
203845,14/06/2011,2010-08-01,Pacific,69,M,W,5300    INGLEWOOD                    BL,33.9872,-118.4092,Theft,Property Crime,Non-Violent Crimes,0.996489222
204868,19/01/2011,2010-12-11,Southeast,49,M,H,100 W  CENTURY                      BL,33.9456,-118.2739,Theft,Property Crime,Non-Violent Crimes,0.996038024
204937,25/03/2011,2010-07-01,Southeast,28,M,H,200 W  97TH                         ST,33.9483,-118.276,Theft,Property Crime,Non-Violent Crimes,0.998558417
205441,15/01/2011,2010-09-27,Olympic,55,M,A,900    WESTCHESTER                  PL,34.0535,-118.316,Theft,Property Crime,Non-Violent Crimes,0.999048018
205518,23/04/2011,2010-08-31,Olympic,35,F,H,2800    LEEWARD                      AV,34.0588,-118.2842,Theft,Property Crime,Non-Violent Crimes,0.999686737
205606,15/02/2011,2010-12-15,Topanga,23,F,H,21100    SATICOY                      ST,34.2083,-118.5929,Battery Crime,Bodily Harm,Violent Crimes,0.994980195
205836,10/05/2011,2010-09-01,Topanga,66,M,W,20200    KAMLIN                       ST,34.1915,-118.5843,Theft,Property Crime,Non-Violent Crimes,0.995988093
206024,02/08/2012,2010-01-01,Southwest,60,F,H,2000 W  22ND                         ST,34.0364,-118.3062,Theft,Property Crime,Non-Violent Crimes,0.993795589
206047,30/10/2012,2010-08-10,Southwest,67,F,B,2300    RAYMOND                      AV,34.0355,-118.2975,Theft,Property Crime,Non-Violent Crimes,0.997786236
206376,25/09/2010,2010-05-09,Northeast,57,M,H,5500    NORDYKE                      ST,34.1281,-118.1976,Theft,Property Crime,Non-Violent Crimes,0.999632507
206942,28/02/2013,2010-06-01,Central,31,F,W,300 S  HOPE                         ST,34.0537,-118.2523,Rape,Rape,Violent Crimes,0.996007394
206944,02/03/2013,2010-01-01,Central,84,F,O,600 W  SUNSET                       BL,34.0596,-118.2427,Theft,Property Crime,Non-Violent Crimes,0.997229309
206988,24/01/2013,2010-01-01,Southwest,33,M,H,3900    BRIGHTON                     AV,34.0155,-118.3013,Theft,Property Crime,Non-Violent Crimes,0.992147604
207223,03/04/2013,2010-06-16,Northeast,46,F,H,800    CHESTNUT                     AV,34.1176,-118.1714,Theft,Property Crime,Non-Violent Crimes,0.990179975
207517,30/05/2014,2010-12-02,Rampart,83,F,H,1000 N  CORONADO                     ST,34.0782,-118.2698,Theft,Property Crime,Non-Violent Crimes,0.992613036
207637,06/08/2014,2010-01-01,Van Nuys,41,M,H,13800    BURBANK                      BL,34.1722,-118.4334,Theft,Property Crime,Non-Violent Crimes,0.997036568
207647,05/11/2014,2010-06-06,Van Nuys,33,M,O,14600    BURBANK                      BL,34.1721,-118.4509,Theft,Property Crime,Non-Violent Crimes,0.996348222
207701,15/01/2014,2010-01-01,77th Street,33,F,B,6800 S  HOOVER                       ST,33.9782,-118.2871,Theft,Property Crime,Non-Violent Crimes,0.995517536
207772,17/10/2014,2010-10-01,N Hollywood,19,F,H,6700    RIVERTON                     AV,34.1922,-118.3659,Theft,Property Crime,Non-Violent Crimes,0.994954844
207976,07/07/2015,2010-07-19,West LA,68,F,O,11200 W  OLYMPIC                      BL,34.0389,-118.4401,Theft,Property Crime,Non-Violent Crimes,0.995716452
208529,27/02/2017,2010-06-01,Foothill,32,M,W,11800    ARMINTA                      ST,34.2139,-118.3899,Theft,Property Crime,Non-Violent Crimes,0.992464963
208543,29/12/2017,2010-10-04,Devonshire,21,F,W,16700    GRESHAM                      ST,34.2303,-118.4971,Theft,Property Crime,Non-Violent Crimes,0.992014154
209022,15/04/2010,2010-04-15,Northeast,29,M,H,1800 N  VERMONT                      AV,34.1095,-118.2958,Assault,Bodily Harm,Violent Crimes,0.991782399
209662,18/05/2011,2011-05-18,Southwest,46,M,H,4200 S  VERMONT                      AV,34.0073,-118.2915,Theft,Property Crime,Non-Violent Crimes,0.998081449
209746,19/02/2011,2011-02-19,Rampart,28,M,B,400    HARTFORD                     AV,34.0567,-118.2636,Robbery,Robbery,Violent Crimes,0.995618689
209749,01/06/2012,2011-05-24,Newton,40,M,H,54TH,33.9934,-118.2652,Theft,Property Crime,Non-Violent Crimes,0.99586123
209808,10/05/2011,2011-04-30,N Hollywood,46,F,B,6200    BAKMAN                       AV,34.1831,-118.3779,Theft,Property Crime,Non-Violent Crimes,0.99151816
210333,12/11/2011,2011-11-12,Olympic,13,F,H,2700    SAN MARINO                   ST,34.055,-118.2865,Assault,Bodily Harm,Violent Crimes,0.997258884
210695,23/05/2011,2011-05-23,Rampart,24,M,W,LAKE                         ST,34.0601,-118.2761,Robbery,Robbery,Violent Crimes,0.999590357
210748,10/07/2011,2011-06-06,Rampart,36,M,H,4000    OAKWOOD                      AV,34.0777,-118.2932,Fraud,White Collar Crime,Non-Violent Crimes,0.990515608
210780,16/08/2011,2011-08-16,Harbor,89,F,W,700 W  30TH                         ST,33.7164,-118.2936,Assault,Bodily Harm,Violent Crimes,0.998231894
210967,15/05/2011,2011-05-14,West Valley,39,M,A,7700    LINDLEY                      AV,34.2103,-118.5273,Theft,Property Crime,Non-Violent Crimes,0.997712589
211062,03/06/2011,2011-06-03,Southeast,10,M,H,200 E  112TH                        ST,33.933,-118.2717,Robbery,Robbery,Violent Crimes,0.992705189
211087,15/12/2011,2011-12-15,Hollywood,38,M,O,HOLLYWOOD,34.1016,-118.337,Battery Crime,Bodily Harm,Violent Crimes,0.996529407
211280,09/10/2011,2011-10-09,Hollywood,24,F,O,HOLLYWOOD                    BL,34.1016,-118.3414,Battery Crime,Bodily Harm,Violent Crimes,0.992035541
211284,20/09/2011,2011-09-20,Central,27,M,H,600 W  7TH                          ST,34.0473,-118.2566,Robbery,Robbery,Violent Crimes,0.994608822
211377,04/11/2011,2011-11-03,Newton,37,F,B,1000 E  52ND                         PL,33.9951,-118.2581,Theft,Property Crime,Non-Violent Crimes,0.997672345
211423,27/11/2011,2011-11-22,Mission,53,F,H,10300    SHARP                        AV,34.2579,-118.4371,Theft,Property Crime,Non-Violent Crimes,0.992975273
211800,20/03/2011,2011-03-20,Hollywood,24,M,B,1800 N  CAHUENGA                     BL,34.104,-118.3297,Battery Crime,Bodily Harm,Violent Crimes,0.993918529
211956,17/12/2011,2011-12-16,Southeast,41,F,H,2000    SANTA ANA                    BL,33.9369,-118.2369,Theft,Property Crime,Non-Violent Crimes,0.99292214
212044,01/11/2011,2011-10-31,Mission,39,M,H,7800    RANCHITO                     AV,34.2122,-118.4311,Theft,Property Crime,Non-Violent Crimes,0.991016882
212176,29/06/2011,2011-06-28,Van Nuys,22,F,W,7300    TYRONE                       AV,34.203,-118.4443,Theft,Property Crime,Non-Violent Crimes,0.996833206
212301,20/10/2011,2011-10-20,Van Nuys,87,F,H,14400    BURBANK                      BL,34.1721,-118.4463,Theft,Property Crime,Non-Violent Crimes,0.994349915
212439,16/01/2011,2011-01-15,Foothill,26,F,H,10200    TUJUNGA CANYON               BL,34.2512,-118.2906,Assault,Bodily Harm,Violent Crimes,0.995364522
212549,22/11/2011,2011-11-22,Harbor,16,M,H,1500    LAKME                        AV,33.7935,-118.2607,Battery Crime,Bodily Harm,Violent Crimes,0.997453535
213371,04/09/2011,2011-09-04,N Hollywood,29,M,H,VICTORY                      BL,34.1851,-118.3604,Assault,Bodily Harm,Violent Crimes,0.997767775
213541,21/06/2011,2011-06-20,77th Street,17,F,B,2300 W  73RD                         ST,33.9737,-118.3188,Battery Crime,Bodily Harm,Violent Crimes,0.992692931
213733,12/07/2011,2011-07-12,Southwest,21,F,B,5100    5TH                          AV,33.9963,-118.3225,Theft,Property Crime,Non-Violent Crimes,0.995016549
213868,28/11/2011,2011-11-26,Olympic,43,M,B,900 S  SAINT ANDREWS                PL,34.0536,-118.3112,Theft,Property Crime,Non-Violent Crimes,0.991391973
214031,30/05/2011,2011-05-29,Southwest,53,F,B,3000    CRENSHAW                     BL,34.0276,-118.3351,Theft,Property Crime,Non-Violent Crimes,0.991824188
214045,15/06/2011,2011-06-14,Devonshire,12,M,H,12300    BRADFORD                     PL,34.2942,-118.5118,Battery Crime,Bodily Harm,Violent Crimes,0.997540782
214480,19/02/2011,2011-02-18,Central,34,M,B,1800 S  MAIN                         ST,34.0317,-118.2641,Theft,Property Crime,Non-Violent Crimes,0.995082101
214706,26/10/2011,2011-10-26,Hollywood,8,M,H,900 N  OXFORD                       AV,34.0862,-118.3078,Assault,Bodily Harm,Violent Crimes,0.990062337
214771,02/03/2011,2011-01-01,West Valley,24,F,H,18400    COLLINS                      ST,34.1749,-118.5344,Battery Crime,Bodily Harm,Violent Crimes,0.991479045
214785,24/06/2011,2011-06-24,Hollywood,20,F,H,1700    VINE                         ST,34.1016,-118.3267,Battery Crime,Bodily Harm,Violent Crimes,0.991839234
214831,06/06/2011,2011-06-05,77th Street,53,F,B,7800 S  WESTERN                      AV,33.9691,-118.309,Battery Crime,Bodily Harm,Violent Crimes,0.996678964
214864,04/09/2011,2011-09-03,Newton,51,F,B,4300 S  MAIN                         ST,34.0057,-118.274,Theft,Property Crime,Non-Violent Crimes,0.99936815
214921,17/04/2011,2011-02-15,Harbor,65,F,B,100 S  HANFORD                      AV,33.7434,-118.302,Theft,Property Crime,Non-Violent Crimes,0.99150008
214924,13/02/2011,2011-02-13,Newton,25,M,H,600 E  46TH                         ST,34.0016,-118.2652,Robbery,Robbery,Violent Crimes,0.996737866
214940,31/10/2013,2011-01-01,Olympic,81,M,O,5000    ELMWOOD                      AV,34.0785,-118.3157,Theft,Property Crime,Non-Violent Crimes,0.990784051
214966,02/03/2011,2011-03-02,Rampart,35,F,O,800 S  WESTLAKE                     AV,34.0544,-118.2767,Assault,Bodily Harm,Violent Crimes,0.993569426
215191,19/10/2011,2011-10-18,Southwest,31,M,H,3400    ARLINGTON                    BL,34.0256,-118.3177,Theft,Property Crime,Non-Violent Crimes,0.994249704
215562,15/02/2011,2011-02-15,Foothill,17,F,H,10900    HERRICK                      AV,34.2683,-118.4118,Theft,Property Crime,Non-Violent Crimes,0.99739314
215597,20/10/2011,2011-10-20,Foothill,17,F,H,13200    VAUGHN                       ST,34.282,-118.422,Assault,Bodily Harm,Violent Crimes,0.997587832
215655,12/11/2011,2011-11-12,Van Nuys,67,M,O,14800    SUTTON                       ST,34.1482,-118.4561,Theft,Property Crime,Non-Violent Crimes,0.9925413
216232,24/10/2011,2011-10-24,Olympic,39,F,A,600 S  WESTERN                      AV,34.0635,-118.3091,Assault,Bodily Harm,Violent Crimes,0.99079907
216252,05/06/2011,2011-06-05,Central,24,F,O,700 W  7TH                          ST,34.048,-118.2577,Assault,Bodily Harm,Violent Crimes,0.997171233
216497,01/06/2011,2011-06-01,Hollywood,27,M,B,1700 N  WESTERN                      AV,34.1017,-118.3093,Theft,Property Crime,Non-Violent Crimes,0.994631097
216649,30/11/2011,2011-11-30,Van Nuys,27,M,O,SEPULVEDA,34.1867,-118.4662,Assault,Bodily Harm,Violent Crimes,0.998351609
216733,07/07/2011,2011-02-01,Northeast,55,F,H,300 N  AVENUE 53,34.1092,-118.1998,Theft,Property Crime,Non-Violent Crimes,0.994823722
217320,26/09/2011,2011-09-13,West Valley,80,M,W,5400    YARMOUTH                     AV,34.1686,-118.5203,Theft,Property Crime,Non-Violent Crimes,0.995119268
217400,15/11/2011,2011-11-10,Devonshire,21,M,H,17600    CHATSWORTH                   ST,34.2649,-118.5176,Battery Crime,Bodily Harm,Violent Crimes,0.995633261
217508,22/11/2011,2011-11-22,Pacific,58,F,H,10900    VENICE                       BL,34.0159,-118.4118,Theft,Property Crime,Non-Violent Crimes,0.997988305
217992,16/01/2011,2011-01-15,West Valley,50,F,H,5900    RESEDA                       BL,34.1775,-118.536,Theft,Property Crime,Non-Violent Crimes,0.993148786
218754,01/12/2011,2011-11-20,Van Nuys,49,F,H,7300    HAZELTINE                    AV,34.2031,-118.44,Fraud,White Collar Crime,Non-Violent Crimes,0.991332988
219003,06/07/2011,2011-07-05,Olympic,51,M,H,WASHINGTON,34.04,-118.309,Theft,Property Crime,Non-Violent Crimes,0.993342355
219448,11/05/2011,2011-05-11,77th Street,29,F,B,1000 W  77TH                         ST,33.9703,-118.2918,Assault,Bodily Harm,Violent Crimes,0.995383852
219732,13/04/2011,2011-04-12,Southwest,28,M,H,RAYMOND                      AV,34.0246,-118.2981,Theft,Property Crime,Non-Violent Crimes,0.9938366
219806,08/09/2011,2011-09-08,Pacific,37,M,W,2200    LOUELLA                      AV,33.999,-118.4503,Theft,Property Crime,Non-Violent Crimes,0.998768548
220160,29/08/2011,2011-02-15,Wilshire,65,F,W,5700    VENICE                       BL,34.0429,-118.3641,Theft,Property Crime,Non-Violent Crimes,0.995560562
220386,07/07/2011,2011-07-07,Northeast,29,F,H,500    CHESTNUT                     AV,34.1156,-118.174,Assault,Bodily Harm,Violent Crimes,0.998377318
220508,06/07/2011,2011-07-05,Wilshire,39,M,W,7900 W  3RD                          ST,34.0719,-118.3635,Theft,Property Crime,Non-Violent Crimes,0.999248258
220671,20/10/2011,2011-10-19,Northeast,69,M,A,2400    HYPERION                     AV,34.1029,-118.2733,Theft,Property Crime,Non-Violent Crimes,0.99324287
220730,15/05/2011,2011-05-14,Newton,21,M,H,400 E  41ST                         PL,34.0082,-118.2681,Theft,Property Crime,Non-Violent Crimes,0.99381985
220731,16/11/2013,2011-05-06,Northeast,43,M,W,1600    MORTON                       AV,34.0814,-118.2541,Embezzlement,Property Crime,Non-Violent Crimes,0.997418954
220765,30/11/2011,2011-11-28,Harbor,51,M,W,200    WATCHORN                     WK,33.7216,-118.2818,Theft,Property Crime,Non-Violent Crimes,0.99651424
220867,22/04/2011,2011-04-22,Mission,37,M,H,14500    VAN NUYS                     BL,34.2471,-118.4482,Robbery,Robbery,Violent Crimes,0.995608645
221574,21/12/2011,2011-12-20,Southeast,57,M,B,81ST                         ST,33.9656,-118.2586,Assault,Bodily Harm,Violent Crimes,0.998189124
221786,22/03/2011,2011-03-22,Southwest,26,F,B,4100    MUIRFIELD                    RD,34.0111,-118.3477,Assault,Bodily Harm,Violent Crimes,0.99578189
222140,12/05/2011,2011-05-12,Rampart,33,F,B,1300    INGRAHAM                     ST,34.0531,-118.2671,Assault,Bodily Harm,Violent Crimes,0.993359216
222235,16/08/2011,2011-08-16,Harbor,60,F,H,400 N  WALKER                       AV,33.7462,-118.3042,Theft,Property Crime,Non-Violent Crimes,0.9937521
222261,07/09/2011,2011-09-06,Southwest,42,M,B,LEIGHTON                     AV,34.0128,-118.3057,Assault,Bodily Harm,Violent Crimes,0.999835593
222345,11/05/2011,2011-05-11,Devonshire,56,M,W,17100    OSBORNE                      ST,34.2334,-118.5069,Theft,Property Crime,Non-Violent Crimes,0.992164347
222716,13/03/2011,2011-03-13,West LA,26,M,O,8500 W  OLYMPIC                      BL,34.0595,-118.3762,Theft,Property Crime,Non-Violent Crimes,0.991140157
222722,01/08/2011,2011-07-31,Northeast,26,M,W,4400    SUNSET                       DR,34.0982,-118.2852,Theft,Property Crime,Non-Violent Crimes,0.995515698
222832,18/11/2011,2011-11-18,Rampart,21,F,W,600 S  UNION                        AV,34.057,-118.2691,Battery Crime,Bodily Harm,Violent Crimes,0.993271195
222914,01/12/2011,2011-11-30,Devonshire,59,M,O,9900    ETON                         AV,34.2513,-118.5951,Theft,Property Crime,Non-Violent Crimes,0.999075979
223055,17/10/2011,2011-10-01,Rampart,34,M,B,1500 W  2ND                          ST,34.061,-118.2615,Robbery,Robbery,Violent Crimes,0.994858727
223115,24/08/2011,2011-08-01,Southwest,23,F,H,3700 S  GRAMERCY                     PL,34.0208,-118.3138,Theft,Property Crime,Non-Violent Crimes,0.99019105
223328,15/01/2011,2011-01-15,Harbor,23,F,H,1300    AMAR                         ST,33.7478,-118.3042,Assault,Bodily Harm,Violent Crimes,0.993038663
223398,02/08/2011,2011-08-02,Rampart,32,M,H,1600    WILSHIRE                     BL,34.0554,-118.2702,Theft,Property Crime,Non-Violent Crimes,0.996702362
223899,07/06/2011,2011-06-06,West LA,22,F,W,10600    KINNARD                      AV,34.0561,-118.4313,Theft,Property Crime,Non-Violent Crimes,0.998740858
224779,20/07/2011,2011-07-19,77th Street,56,F,B,5200 S  HOOVER                       ST,33.9954,-118.2871,Theft,Property Crime,Non-Violent Crimes,0.997202471
224979,05/08/2011,2011-08-05,West Valley,18,F,H,VANOWEN,34.1938,-118.5623,Robbery,Robbery,Violent Crimes,0.993337799
225285,09/06/2011,2011-06-09,Southeast,19,M,H,100 W  103RD                        ST,33.9429,-118.2739,Robbery,Robbery,Violent Crimes,0.993259073
225330,28/09/2011,2011-09-27,Southeast,5,M,H,700 E  91ST                         ST,33.9538,-118.263,Assault,Bodily Harm,Violent Crimes,0.993735572
225809,04/03/2011,2011-03-04,Northeast,42,F,H,5200    LINCOLN                      AV,34.1198,-118.2029,Assault,Bodily Harm,Violent Crimes,0.997507044
225819,20/01/2011,2011-01-19,N Hollywood,58,M,W,11500    KILLION                      ST,34.1713,-118.3822,Theft,Property Crime,Non-Violent Crimes,0.99395461
226166,29/01/2011,2011-01-29,Southwest,19,M,H,1400 W  27TH                         ST,34.0305,-118.2915,Theft,Property Crime,Non-Violent Crimes,0.997572153
226219,24/10/2011,2011-10-11,Central,24,M,W,100 S  HOPE                         ST,34.0564,-118.2498,Theft,Property Crime,Non-Violent Crimes,0.991084227
226314,03/09/2011,2011-09-03,77th Street,19,M,B,1400 W  69TH                         ST,33.977,-118.3003,Assault,Bodily Harm,Violent Crimes,0.993758312
226387,10/08/2011,2011-08-08,Wilshire,52,M,W,8700    BEVERLY                      BL,34.0763,-118.3778,Battery Crime,Bodily Harm,Violent Crimes,0.992331187
226406,26/09/2011,2011-09-26,Olympic,36,F,H,700 S  CATALINA                     ST,34.0598,-118.2954,Battery Crime,Bodily Harm,Violent Crimes,0.998091015
226489,19/03/2011,2011-03-18,Topanga,21,M,W,WOODLAKE,34.2097,-118.6322,Theft,Property Crime,Non-Violent Crimes,0.993114857
226601,24/03/2011,2011-03-24,Harbor,18,M,H,WESTERN,33.7434,-118.3097,Theft,Property Crime,Non-Violent Crimes,0.997454512
226859,24/07/2011,2011-07-05,Hollywood,40,M,O,1600    SUNSET PLAZA                 DR,34.1002,-118.3805,Theft,Property Crime,Non-Violent Crimes,0.999716429
226905,26/07/2011,2011-07-26,Southwest,30,F,H,3500 W  ADAMS                        BL,34.0326,-118.3224,Assault,Bodily Harm,Violent Crimes,0.999175682
227517,27/09/2011,2011-09-27,Harbor,28,F,H,600 W  18TH                         ST,33.7279,-118.2902,Assault,Bodily Harm,Violent Crimes,0.995769017
227690,07/12/2011,2011-12-06,77th Street,45,M,H,900 W  75TH                         ST,33.9717,-118.2893,Theft,Property Crime,Non-Violent Crimes,0.992853444
227891,11/10/2011,2011-10-11,Pacific,58,M,H,VENICE,34.0254,-118.395,Robbery,Robbery,Violent Crimes,0.990939131
228143,04/10/2011,2011-09-29,Newton,20,F,H,200 E  69TH                         ST,33.977,-118.2717,Battery Crime,Bodily Harm,Violent Crimes,0.990431611
228161,26/04/2011,2011-04-25,Van Nuys,44,F,W,13900    MOORPARK                     ST,34.1504,-118.4355,Theft,Property Crime,Non-Violent Crimes,0.998344335
228458,01/11/2011,2011-11-01,Hollywood,15,F,H,HOLLYWOOD                    BL,34.1017,-118.318,Theft,Property Crime,Non-Violent Crimes,0.999405096
228577,10/06/2011,2011-06-09,Pacific,26,F,B,7600    TRUXTON                      AV,33.9714,-118.3902,Theft,Property Crime,Non-Violent Crimes,0.990771462
228881,22/05/2011,2011-05-19,Rampart,42,M,H,900    EDGECLIFFE                   DR,34.0863,-118.2806,Theft,Property Crime,Non-Violent Crimes,0.999256971
229100,01/11/2011,2011-11-01,Newton,27,M,O,900 S  CENTRAL                      AV,34.032,-118.2441,Assault,Bodily Harm,Violent Crimes,0.992162047
229220,15/11/2011,2011-11-15,Central,78,M,O,400    CASANOVA                     ST,34.0713,-118.2291,Theft,Property Crime,Non-Violent Crimes,0.995870723
229442,07/11/2011,2011-11-03,Northeast,15,M,H,NORWALK,34.1325,-118.216,Assault,Bodily Harm,Violent Crimes,0.994645093
229471,13/11/2011,2011-11-13,West LA,60,M,W,11200    SANTA MONICA                 BL,34.047,-118.4467,Battery Crime,Bodily Harm,Violent Crimes,0.999813774
229546,15/03/2011,2011-03-14,West LA,55,F,W,11800    WILSHIRE                     BL,34.048,-118.4625,Theft,Property Crime,Non-Violent Crimes,0.997362662
229900,11/03/2011,2011-03-11,Devonshire,18,F,H,9600    GEYSER                       AV,34.2455,-118.543,Assault,Bodily Harm,Violent Crimes,0.992182886
230079,24/05/2012,2011-10-01,Van Nuys,34,M,W,6400    MATILIJA                     AV,34.1867,-118.4334,Theft,Property Crime,Non-Violent Crimes,0.997906549
230183,20/09/2011,2011-09-20,77th Street,34,F,H,80TH                         ST,33.9671,-118.2739,Theft,Property Crime,Non-Violent Crimes,0.997159656
230292,28/02/2011,2011-02-27,Southeast,34,M,H,AVALON                       BL,33.9311,-118.2652,Robbery,Robbery,Violent Crimes,0.990765675
230468,23/07/2011,2011-07-23,Pacific,46,M,H,4100 S  CENTINELA                    AV,33.9864,-118.4151,Theft,Property Crime,Non-Violent Crimes,0.990291048
230531,04/01/2012,2011-12-20,Harbor,75,M,W,2800    VIA CABRILLO MARINA,33.7192,-118.2839,Theft,Property Crime,Non-Violent Crimes,0.998680656
230561,08/04/2011,2011-04-03,Pacific,40,F,A,800    FLOWER                       AV,34.0008,-118.4667,Theft,Property Crime,Non-Violent Crimes,0.99649341
230977,03/02/2012,2011-04-04,West Valley,20,F,B,18800    VANOWEN                      ST,34.1939,-118.5443,Theft,Property Crime,Non-Violent Crimes,0.990128574
230988,03/07/2011,2011-07-02,Rampart,19,M,A,700 S  BIXEL                        ST,34.0509,-118.2642,Theft,Property Crime,Non-Violent Crimes,0.999312626
231008,13/03/2011,2011-03-04,Topanga,60,M,W,22200    STRATHERN                    ST,34.2156,-118.6104,Theft,Property Crime,Non-Violent Crimes,0.997899847
231170,05/07/2011,2011-07-05,Hollywood,41,M,O,6800    HOLLYWOOD                    BL,34.1016,-118.3387,Battery Crime,Bodily Harm,Violent Crimes,0.999559327
231564,14/06/2011,2011-06-08,Hollywood,17,F,B,1700    CAMINO PALMERO,34.1016,-118.35,Battery Crime,Bodily Harm,Violent Crimes,0.996561434
231582,24/05/2011,2011-05-24,Foothill,20,F,B,LANKERSHIM                   BL,34.2279,-118.3878,Robbery,Robbery,Violent Crimes,0.992754607
231601,04/11/2011,2011-11-04,Rampart,37,F,B,1000 W  18TH                         ST,34.0388,-118.2786,Assault,Bodily Harm,Violent Crimes,0.993293138
231823,23/01/2011,2011-01-23,Hollywood,49,M,W,8300    SUNSET VIEW                  DR,34.1002,-118.3716,Assault,Bodily Harm,Violent Crimes,0.996869214
231832,08/06/2011,2011-06-05,N Hollywood,28,M,W,12500    VENTURA                      BL,34.1427,-118.4052,Theft,Property Crime,Non-Violent Crimes,0.999554698
232244,27/10/2011,2011-10-26,Pacific,52,M,W,MARKET                       ST,33.9875,-118.4741,Assault,Bodily Harm,Violent Crimes,0.994670165
232598,14/07/2011,2011-07-14,N Hollywood,21,F,B,6000    HAZELHURST                   PL,34.1794,-118.3856,Assault,Bodily Harm,Violent Crimes,0.996932136
232730,28/02/2011,2011-02-27,Mission,35,M,H,9700    WOODMAN                      AV,34.2467,-118.4479,Theft,Property Crime,Non-Violent Crimes,0.9966003
232755,31/10/2011,2011-10-31,Olympic,21,M,H,1800 S  VERMONT                      AV,34.0413,-118.2916,Battery Crime,Bodily Harm,Violent Crimes,0.999945519
233047,27/09/2011,2011-09-27,Harbor,29,M,W,700 W  MIRAFLORES                   AV,33.7529,-118.2943,Theft,Property Crime,Non-Violent Crimes,0.999750331
233117,05/05/2011,2011-05-04,Mission,53,F,H,14200    GAGER                        ST,34.2442,-118.4436,Theft,Property Crime,Non-Violent Crimes,0.991715886
233130,02/04/2012,2011-12-12,77th Street,21,F,H,1300 W  77TH                         ST,33.9702,-118.2981,Theft,Property Crime,Non-Violent Crimes,0.997600933
233270,11/06/2011,2011-06-11,Central,49,F,B,CENTRAL,34.0374,-118.2406,Battery Crime,Bodily Harm,Violent Crimes,0.998371324
233335,04/05/2012,2011-12-19,N Hollywood,23,M,W,4000    RADFORD                      AV,34.1436,-118.3929,Theft,Property Crime,Non-Violent Crimes,0.990691001
233391,09/05/2011,2011-05-09,Wilshire,58,M,A,1800 S  HIGHLAND                     AV,34.0421,-118.3456,Theft,Property Crime,Non-Violent Crimes,0.991962708
234009,09/08/2011,2011-08-09,Pacific,37,M,O,500    WORLD                        WY,33.9427,-118.4053,Theft,Property Crime,Non-Violent Crimes,0.994775025
234274,27/07/2011,2011-07-22,Southeast,68,M,W,13300 S  FIGUEROA                     ST,33.9113,-118.2827,Theft,Property Crime,Non-Violent Crimes,0.992520026
234335,16/12/2011,2011-12-13,Foothill,84,M,H,10700    TELFAIR                      AV,34.2644,-118.4264,Theft,Property Crime,Non-Violent Crimes,0.990516101
234841,17/07/2011,2011-07-16,Southeast,31,F,H,11100 S  BROADWAY,33.9348,-118.2781,Battery Crime,Bodily Harm,Violent Crimes,0.993317685
234890,18/01/2011,2011-01-18,77th Street,45,M,B,1800 W  84TH                         PL,33.9618,-118.309,Theft,Property Crime,Non-Violent Crimes,0.998076834
235107,06/05/2011,2011-05-06,Devonshire,52,M,H,16600    CLYMER                       ST,34.2628,-118.4947,Theft,Property Crime,Non-Violent Crimes,0.992171495
235364,10/03/2011,2011-03-10,N Hollywood,48,M,O,6900    SIMPSON                      AV,34.1958,-118.3889,Assault,Bodily Harm,Violent Crimes,0.991587312
235405,18/04/2011,2011-04-17,Harbor,46,F,H,300 W  18TH                         ST,33.7279,-118.2836,Theft,Property Crime,Non-Violent Crimes,0.990963492
235588,10/10/2011,2011-10-06,Northeast,45,M,O,2900    DENBY                        AV,34.1035,-118.2443,Theft,Property Crime,Non-Violent Crimes,0.997185531
235606,20/07/2011,2011-07-19,Southwest,61,F,B,1700 W  41ST                         ST,34.0099,-118.3089,Theft,Property Crime,Non-Violent Crimes,0.997239625
235771,22/07/2011,2011-07-22,Newton,42,F,H,100 W  69TH                         ST,33.9774,-118.2739,Theft,Property Crime,Non-Violent Crimes,0.997731861
235852,21/10/2011,2011-10-17,Newton,69,M,B,2400 S  CENTRAL                      AV,34.0202,-118.2544,Theft,Property Crime,Non-Violent Crimes,0.995737372
236330,18/10/2011,2011-08-22,Southeast,5,F,H,600 E  116TH                        ST,33.9292,-118.2652,Assault,Bodily Harm,Violent Crimes,0.990819671
236331,16/07/2011,2011-07-15,Southwest,58,M,B,1400 W  MARTIN LUTHER KING JR        BL,34.0109,-118.3002,Theft,Property Crime,Non-Violent Crimes,0.999188138
236555,06/10/2011,2011-10-06,Devonshire,59,M,H,10300    AMESTOY                      AV,34.2576,-118.5067,Theft,Property Crime,Non-Violent Crimes,0.998588922
236562,22/12/2011,2011-12-20,Hollywood,39,M,W,1900    CHEREMOYA                    AV,34.1053,-118.3204,Theft,Property Crime,Non-Violent Crimes,0.993065443
236582,29/10/2011,2011-10-29,Central,48,F,H,400 S  LOS ANGELES                  ST,34.0473,-118.2462,Robbery,Robbery,Violent Crimes,0.998799894
236585,10/07/2011,2011-07-09,Southeast,21,F,B,300 W  118TH                        PL,33.9256,-118.2782,Assault,Bodily Harm,Violent Crimes,0.992764262
236765,15/10/2011,2011-10-14,Southwest,31,M,H,4400    5TH                          AV,34.0037,-118.3225,Theft,Property Crime,Non-Violent Crimes,0.995128317
236926,16/09/2011,2011-09-16,Northeast,74,M,W,3800    BRUNSWICK                    AV,34.1213,-118.2625,Theft,Property Crime,Non-Violent Crimes,0.994597474
237184,09/12/2011,2011-12-08,N Hollywood,54,M,O,7100    TEESDALE                     AV,34.1994,-118.4083,Theft,Property Crime,Non-Violent Crimes,0.998249323
237406,25/10/2011,2011-10-23,77th Street,21,M,B,500 W  81ST                         ST,33.9656,-118.2827,Robbery,Robbery,Violent Crimes,0.993334931
237485,28/01/2012,2011-03-24,West LA,47,F,A,15000    MCKENDREE                    AV,34.0518,-118.5232,Theft,Property Crime,Non-Violent Crimes,0.993972396
237606,11/07/2011,2011-07-10,Rampart,46,M,H,1800 W  3RD                          ST,34.0613,-118.2689,Theft,Property Crime,Non-Violent Crimes,0.995811269
237886,24/10/2011,2011-10-22,Central,33,M,H,1200 S  FIGUEROA                     ST,34.0423,-118.2666,Battery Crime,Bodily Harm,Violent Crimes,0.996233674
238099,07/12/2011,2011-12-07,West LA,30,M,O,1000 S  BARRINGTON                   AV,34.0518,-118.4634,Theft,Property Crime,Non-Violent Crimes,0.992793452
238330,01/06/2011,2011-05-31,West LA,41,M,O,1200    DANIELS                      DR,34.0558,-118.4017,Theft,Property Crime,Non-Violent Crimes,0.990599887
238371,30/01/2011,2011-01-30,Olympic,33,M,H,900 S  VERMONT                      AV,34.0559,-118.2916,Assault,Bodily Harm,Violent Crimes,0.991423095
238499,11/02/2011,2011-02-10,Devonshire,26,F,W,10200    LINDLEY                      AV,34.2549,-118.5274,Theft,Property Crime,Non-Violent Crimes,0.999027892
238674,21/11/2011,2011-11-19,77th Street,33,F,B,6400    HAAS                         AV,33.9819,-118.3168,Theft,Property Crime,Non-Violent Crimes,0.992671546
238996,29/06/2011,2011-06-27,77th Street,64,F,H,200 W  78TH                         ST,33.9689,-118.2761,Theft,Property Crime,Non-Violent Crimes,0.99199709
239176,22/07/2011,2011-07-18,West Valley,38,F,W,18600    CLARK                        ST,34.171,-118.5384,Theft,Property Crime,Non-Violent Crimes,0.997867004
239224,24/10/2011,2011-10-24,Central,57,M,H,400 S  MAIN                         ST,34.0482,-118.2472,Assault,Bodily Harm,Violent Crimes,0.990653825
239860,27/10/2011,2011-10-26,77th Street,49,M,H,CRENSHAW                     BL,33.9782,-118.3309,Robbery,Robbery,Violent Crimes,0.999889524
240094,25/10/2011,2011-10-22,Wilshire,29,M,H,6300 W  3RD                          ST,34.0712,-118.359,Theft,Property Crime,Non-Violent Crimes,0.997560427
240706,16/11/2011,2011-09-26,77th Street,54,F,B,2100 W  CENTURY                      BL,33.9455,-118.3036,Theft,Property Crime,Non-Violent Crimes,0.997539341
240868,12/02/2011,2011-02-12,N Hollywood,21,F,H,11600    FRIAR                        ST,34.1858,-118.3847,Assault,Bodily Harm,Violent Crimes,0.998686442
240974,10/12/2011,2011-12-10,Newton,26,M,H,4600 S  CENTRAL                      AV,34.0018,-118.2565,Assault,Bodily Harm,Violent Crimes,0.996032673
241259,29/10/2011,2011-10-28,Southeast,23,F,H,800 W  165TH                        PL,33.8808,-118.2891,Battery Crime,Bodily Harm,Violent Crimes,0.9922674
241467,22/03/2011,2011-03-22,Devonshire,49,F,A,10100    OSO                          AV,34.2536,-118.5751,Robbery,Robbery,Violent Crimes,0.999326499
241597,14/03/2011,2011-03-11,Hollenbeck,13,F,H,1400    NIETO                        LN,34.0562,-118.194,Assault,Bodily Harm,Violent Crimes,0.996518954
241999,27/03/2011,2011-03-26,Devonshire,43,F,W,16400    JERSEY                       ST,34.2675,-118.4902,Theft,Property Crime,Non-Violent Crimes,0.997827172
242183,13/09/2011,2011-09-13,Olympic,15,M,H,700 S  CATALINA                     ST,34.0598,-118.2954,Battery Crime,Bodily Harm,Violent Crimes,0.999486016
242431,05/12/2011,2011-12-05,Northeast,71,F,H,FIGUEROA,34.109,-118.194,Theft,Property Crime,Non-Violent Crimes,0.992949119
242498,29/08/2011,2011-08-29,Hollenbeck,31,M,H,2200    HANCOCK                      ST,34.0702,-118.209,Battery Crime,Bodily Harm,Violent Crimes,0.999962199
242502,19/06/2011,2011-06-19,Southwest,70,F,H,4100    MARLTON                      AV,34.0105,-118.3398,Theft,Property Crime,Non-Violent Crimes,0.99691028
242973,05/04/2011,2011-04-05,Central,52,M,B,SAN PEDRO,34.0423,-118.2452,Assault,Bodily Harm,Violent Crimes,0.996305537
243235,26/07/2011,2011-07-26,Van Nuys,27,F,H,FULTON                       AV,34.1903,-118.4225,Robbery,Robbery,Violent Crimes,0.994264883
243305,30/04/2011,2011-04-29,77th Street,20,M,B,76TH                         ST,33.9709,-118.3308,Robbery,Robbery,Violent Crimes,0.995798329
243322,18/05/2011,2011-05-18,Central,47,M,B,BROADWAY,34.0452,-118.2534,Theft,Property Crime,Non-Violent Crimes,0.992488593
243594,19/01/2011,2011-01-19,Van Nuys,39,M,W,5200    LEGHORN                      AV,34.1649,-118.4159,Theft,Property Crime,Non-Violent Crimes,0.994353444
243826,25/04/2011,2011-04-25,Pacific,21,M,W,OCEAN FRONT                  WK,33.9869,-118.4736,Theft,Property Crime,Non-Violent Crimes,0.995438217
243955,22/02/2011,2011-02-22,N Hollywood,17,M,H,6500    CLEON                        AV,34.1885,-118.3681,Robbery,Robbery,Violent Crimes,0.99637258
243963,20/10/2011,2011-10-20,77th Street,23,F,B,54TH                         ST,33.9931,-118.3308,Battery Crime,Bodily Harm,Violent Crimes,0.99568212
244189,07/12/2011,2011-12-07,Rampart,37,M,W,400    CORONADO                     TR,34.072,-118.2722,Theft,Property Crime,Non-Violent Crimes,0.998893416
244267,14/07/2011,2011-07-13,77th Street,38,M,H,100 E  81ST                         ST,33.9662,-118.2739,Theft,Property Crime,Non-Violent Crimes,0.997382645
244768,05/05/2011,2011-05-05,Devonshire,35,M,W,10900    PETIT                        AV,34.2686,-118.4981,Theft,Property Crime,Non-Violent Crimes,0.994854282
245145,20/01/2011,2011-01-18,Harbor,9,F,H,1400 W  225TH                        ST,33.8223,-118.3015,Assault,Bodily Harm,Violent Crimes,0.992268778
245332,19/11/2011,2011-10-26,Topanga,35,M,B,21800    DUMETZ                       RD,34.1569,-118.6029,Theft,Property Crime,Non-Violent Crimes,0.992946582
245342,11/12/2011,2011-12-10,Olympic,23,F,W,3400    COUNCIL                      ST,34.075,-118.2838,Theft,Property Crime,Non-Violent Crimes,0.996189645
245390,20/07/2011,2011-07-20,77th Street,32,F,H,1000 W  56TH                         ST,33.9914,-118.2915,Battery Crime,Bodily Harm,Violent Crimes,0.997203308
245745,09/05/2011,2011-05-09,Hollywood,29,M,W,6200    HOLLYWOOD                    BL,34.1017,-118.3245,Battery Crime,Bodily Harm,Violent Crimes,0.992457816
245850,30/08/2011,2011-08-23,Rampart,23,F,O,600    MALTMAN                      AV,34.0802,-118.2832,Theft,Property Crime,Non-Violent Crimes,0.994372945
246046,02/05/2011,2011-05-02,Rampart,30,F,H,600 S  BURLINGTON                   AV,34.058,-118.2715,Assault,Bodily Harm,Violent Crimes,0.996131611
246294,27/02/2011,2011-02-26,Wilshire,40,F,B,1800 S  ORANGE                       DR,34.043,-118.3488,Assault,Bodily Harm,Violent Crimes,0.991247528
246756,07/08/2011,2011-08-07,Newton,29,F,H,100 E  35TH                         ST,34.0179,-118.2731,Assault,Bodily Harm,Violent Crimes,0.993869796
246922,08/09/2011,2011-09-06,Southwest,25,F,B,2800 S  SYCAMORE                     AV,34.0296,-118.3554,Rape,Rape,Violent Crimes,0.993740504
246969,03/02/2011,2011-02-03,Wilshire,39,M,H,1300    3RD                          AV,34.0472,-118.3201,Assault,Bodily Harm,Violent Crimes,0.993953186
247111,01/07/2011,2011-06-30,77th Street,52,M,B,1600 W  65TH                         ST,33.9806,-118.3046,Assault,Bodily Harm,Violent Crimes,0.995868973
247149,10/03/2011,2011-03-07,Mission,33,M,H,13600    RAYEN                        ST,34.2385,-118.4293,Theft,Property Crime,Non-Violent Crimes,0.992603187
247661,25/07/2011,2011-07-24,Van Nuys,26,F,O,4300    MAMMOTH                      AV,34.1483,-118.4326,Theft,Property Crime,Non-Violent Crimes,0.990814944
247714,26/05/2011,2011-05-26,Newton,27,F,H,200 W  54TH                         ST,33.9933,-118.2761,Assault,Bodily Harm,Violent Crimes,0.998611847
247734,17/02/2011,2011-02-17,Topanga,33,M,H,6100    CANOGA                       AV,34.1805,-118.5975,Theft,Property Crime,Non-Violent Crimes,0.998629491
247807,08/02/2011,2011-02-06,Devonshire,57,F,H,19100    PARTHENIA                    ST,34.2283,-118.5492,Rape,Rape,Violent Crimes,0.99151612
248008,06/07/2011,2011-07-05,Wilshire,79,F,W,300 N  HAYWORTH                     AV,34.0761,-118.3626,Battery Crime,Bodily Harm,Violent Crimes,0.995922151
248497,31/10/2011,2011-10-28,77th Street,23,F,H,4700 S  HOOVER                       ST,34.0006,-118.2871,Theft,Property Crime,Non-Violent Crimes,0.995898211
248628,14/06/2011,2011-06-13,Pacific,47,F,W,6600    PACIFIC                      AV,33.9603,-118.4516,Theft,Property Crime,Non-Violent Crimes,0.994314939
249012,09/08/2011,2011-08-08,Topanga,54,M,O,22700    SATICOY                      ST,34.2083,-118.6213,Theft,Property Crime,Non-Violent Crimes,0.995291045
249093,13/09/2011,2011-09-12,77th Street,22,M,H,MANHATTAN                    PL,33.9933,-118.3101,Assault,Bodily Harm,Violent Crimes,0.995819206
249103,29/06/2011,2011-06-29,Devonshire,44,F,H,TOPANGA CANYON,34.2661,-118.6153,Theft,Property Crime,Non-Violent Crimes,0.990238708
249644,19/07/2011,2011-07-19,Southwest,36,F,B,VERMONT,34.0037,-118.2915,Assault,Bodily Harm,Violent Crimes,0.995947735
249669,13/04/2012,2011-01-01,77th Street,37,F,B,9800 S  HARVARD                      BL,33.9468,-118.3068,Theft,Property Crime,Non-Violent Crimes,0.994408783
249710,17/11/2011,2011-11-17,N Hollywood,28,M,H,5200    HERMITAGE                    AV,34.1649,-118.4003,Assault,Bodily Harm,Violent Crimes,0.994543447
249769,20/06/2011,2011-06-18,Devonshire,51,M,F,11900    SALEM                        DR,34.2865,-118.5052,Theft,Property Crime,Non-Violent Crimes,0.996595904
250047,17/09/2011,2011-09-16,Northeast,37,M,W,HOLLYWOOD,34.0995,-118.2892,Theft,Property Crime,Non-Violent Crimes,0.993761644
250109,29/08/2011,2011-08-29,Southeast,22,F,H,1600 E  115TH                        ST,33.9303,-118.2463,Battery Crime,Bodily Harm,Violent Crimes,0.994610337
250266,31/12/2011,2011-12-30,Northeast,58,F,H,1500 N  AVENUE 47,34.1228,-118.2138,Assault,Bodily Harm,Violent Crimes,0.991022757
250607,12/05/2011,2011-05-10,Pacific,16,F,H,600    5TH                          AV,33.9961,-118.4722,Theft,Property Crime,Non-Violent Crimes,0.99137572
251046,13/04/2011,2011-04-13,Wilshire,44,F,W,6100    WILSHIRE                     BL,34.063,-118.3614,Fraud,White Collar Crime,Non-Violent Crimes,0.998016681
251341,18/09/2011,2011-09-17,Central,24,F,H,FIGUEROA                     ST,34.0423,-118.2666,Battery Crime,Bodily Harm,Violent Crimes,0.992317188
251497,05/04/2011,2011-04-04,Southeast,15,M,H,100 E  87TH                         ST,33.9591,-118.2739,Theft,Property Crime,Non-Violent Crimes,0.998404448
251500,27/12/2011,2011-08-28,Foothill,43,F,W,11200    PENDLETON                    ST,34.2369,-118.3754,Battery Crime,Bodily Harm,Violent Crimes,0.990808241
251607,16/04/2011,2011-04-14,Mission,37,F,H,15000    ROSALES                      ST,34.3108,-118.461,Battery Crime,Bodily Harm,Violent Crimes,0.998256486
252057,27/04/2011,2011-04-26,Northeast,60,M,O,5000    LOS FELIZ                    BL,34.1099,-118.2985,Theft,Property Crime,Non-Violent Crimes,0.993070999
252106,10/12/2011,2011-12-07,Olympic,31,M,A,200 S  COMMONWEALTH                 AV,34.0705,-118.2857,Fraud,White Collar Crime,Non-Violent Crimes,0.999129895
252273,15/04/2011,2011-04-15,77th Street,28,M,H,3200 W  SLAUSON                      AV,33.9891,-118.3285,Robbery,Robbery,Violent Crimes,0.995036302
252308,18/02/2011,2011-02-07,Topanga,54,M,H,23300    BALMORAL                     LN,34.1974,-118.6353,Theft,Property Crime,Non-Violent Crimes,0.991347991
252649,07/03/2011,2011-03-07,Van Nuys,25,F,H,6700    WOODMAN                      AV,34.1922,-118.4312,Assault,Bodily Harm,Violent Crimes,0.991800784
252721,09/05/2011,2011-05-08,Northeast,40,F,H,EAGLE ROCK                   BL,34.1173,-118.2345,Robbery,Robbery,Violent Crimes,0.990879447
253019,19/05/2011,2011-05-18,Wilshire,38,M,O,5600 W  OLYMPIC                      BL,34.0574,-118.3514,Theft,Property Crime,Non-Violent Crimes,0.993526469
253428,21/12/2011,2011-12-04,Central,20,M,W,800 S  SPRING                       ST,34.0431,-118.2536,Theft,Property Crime,Non-Violent Crimes,0.99673287
253547,15/11/2011,2011-08-27,Hollenbeck,42,F,O,300 N  SOTO                         ST,34.0468,-118.2078,Theft,Property Crime,Non-Violent Crimes,0.990433156
253619,27/08/2011,2011-08-27,Harbor,25,M,B,300 W  18TH                         ST,33.7279,-118.2836,Assault,Bodily Harm,Violent Crimes,0.993983316
253668,23/05/2011,2011-05-08,Olympic,60,M,H,600 S  GRAMERCY                     PL,34.0635,-118.3128,Theft,Property Crime,Non-Violent Crimes,0.999045362
253788,14/03/2011,2011-03-13,Topanga,58,M,O,21100    VENTURA                      BL,34.167,-118.5928,Theft,Property Crime,Non-Violent Crimes,0.992278832
254084,25/12/2011,2011-12-24,Newton,50,F,H,100 E  54TH                         ST,33.9934,-118.2739,Theft,Property Crime,Non-Violent Crimes,0.998327534
254169,04/07/2011,2011-07-04,Harbor,42,F,W,TIMMS,33.7303,-118.276,Assault,Bodily Harm,Violent Crimes,0.995654929
254299,14/11/2011,2011-04-01,West Valley,70,M,O,7900    LINDLEY                      AV,34.2139,-118.5273,Embezzlement,Property Crime,Non-Violent Crimes,0.990397337
254318,22/10/2011,2011-10-22,Foothill,22,F,W,9200    SCOTMONT                     DR,34.237,-118.277,Theft,Property Crime,Non-Violent Crimes,0.998084832
254489,01/04/2011,2011-03-31,Newton,42,M,H,2100 S  CENTRAL                      AV,34.0225,-118.2523,Robbery,Robbery,Violent Crimes,0.99303571
254715,13/01/2011,2011-01-13,Wilshire,24,M,H,8500    BEVERLY                      BL,34.0761,-118.3766,Theft,Property Crime,Non-Violent Crimes,0.99233598
254819,28/09/2011,2011-09-27,Mission,35,F,H,VAN NUYS,34.2289,-118.4503,Assault,Bodily Harm,Violent Crimes,0.992372254
255007,15/08/2011,2011-07-31,Devonshire,18,F,O,21700    CHATSWORTH                   ST,34.2645,-118.6017,Theft,Property Crime,Non-Violent Crimes,0.998918841
255957,25/02/2016,2011-01-01,Wilshire,32,M,B,1400    ELLSMERE                     AV,34.05,-118.3604,Theft,Property Crime,Non-Violent Crimes,0.996865089
256082,05/12/2011,2011-12-04,Hollenbeck,33,F,W,1100 N  MISSION                      RD,34.0606,-118.2144,Assault,Bodily Harm,Violent Crimes,0.999665701
256340,23/05/2011,2011-05-23,Southwest,20,F,B,MARTIN LUTHER KING JR        BL,34.0109,-118.3089,Battery Crime,Bodily Harm,Violent Crimes,0.991377074
256347,03/11/2011,2011-10-18,Southwest,28,M,B,2900    HILLCREST                    DR,34.0294,-118.3429,Fraud,White Collar Crime,Non-Violent Crimes,0.995143224
256833,26/07/2011,2011-04-15,Mission,20,F,H,10100    SALOMA                       AV,34.2536,-118.4576,Theft,Property Crime,Non-Violent Crimes,0.99925077
256940,24/12/2011,2011-12-24,West LA,22,F,H,10600    WILSHIRE                     BL,34.0616,-118.4337,Assault,Bodily Harm,Violent Crimes,0.992253355
257052,09/02/2011,2011-02-09,Hollywood,20,M,W,6400    SELMA                        AV,34.0998,-118.3295,Assault,Bodily Harm,Violent Crimes,0.99243622
257072,14/03/2011,2011-03-14,Harbor,40,F,H,100 W  5TH                          ST,33.7405,-118.2797,Theft,Property Crime,Non-Violent Crimes,0.994524911
257079,08/04/2011,2011-04-08,Mission,22,F,H,9600    SYLMAR                       AV,34.244,-118.4475,Theft,Property Crime,Non-Violent Crimes,0.997750325
257091,26/04/2011,2011-04-26,N Hollywood,23,F,W,6500    LANKERSHIM                   BL,34.1887,-118.3877,Theft,Property Crime,Non-Violent Crimes,0.997270033
257295,11/09/2011,2011-09-11,Hollywood,59,M,W,1200 N  ORANGE                       DR,34.0926,-118.3416,Assault,Bodily Harm,Violent Crimes,0.996838598
257580,12/04/2011,2011-04-12,Hollywood,16,F,H,1300 N  WILTON                       PL,34.0948,-118.3136,Battery Crime,Bodily Harm,Violent Crimes,0.990341301
257690,23/03/2011,2011-03-19,Hollywood,32,F,W,1600 N  POINSETTIA                   PL,34.0998,-118.3479,Theft,Property Crime,Non-Violent Crimes,0.996510275
257782,16/05/2011,2011-05-13,Mission,53,M,W,15800    LARKSPUR                     ST,34.3049,-118.4756,Theft,Property Crime,Non-Violent Crimes,0.993770345
257907,05/09/2011,2011-09-05,Van Nuys,19,M,B,14400    KITTRIDGE                    ST,34.1907,-118.4465,Assault,Bodily Harm,Violent Crimes,0.992412415
258098,11/07/2011,2011-07-09,Mission,67,M,H,12100    MEMPHIS                      AV,34.2892,-118.4528,Battery Crime,Bodily Harm,Violent Crimes,0.998918674
258367,10/03/2011,2011-03-10,Newton,46,M,H,500 E  22ND                         ST,34.0268,-118.2618,Robbery,Robbery,Violent Crimes,0.994444839
258486,20/06/2011,2011-06-20,Southwest,21,F,H,1500 W  ADAMS                        BL,34.0328,-118.2943,Assault,Bodily Harm,Violent Crimes,0.997763603
258513,12/03/2011,2011-03-08,Pacific,61,M,W,600    SANTA CLARA                  AV,33.9925,-118.4665,Theft,Property Crime,Non-Violent Crimes,0.9937159
258694,23/11/2011,2011-11-23,Topanga,48,M,H,MASON                        AV,34.2083,-118.5798,Robbery,Robbery,Violent Crimes,0.997858171
258745,11/11/2011,2011-11-10,Mission,41,F,H,8700    TOBIAS                       AV,34.2279,-118.4516,Assault,Bodily Harm,Violent Crimes,0.99659278
258755,22/08/2011,2011-08-22,77th Street,15,F,H,4600 S  HOOVER                       ST,34.0017,-118.2871,Robbery,Robbery,Violent Crimes,0.99277051
258979,09/04/2011,2011-04-08,Wilshire,29,M,W,2700 S  LA CIENEGA                   BL,34.0336,-118.3762,Theft,Property Crime,Non-Violent Crimes,0.999941594
258985,26/09/2011,2011-09-26,77th Street,43,F,B,7600    CRENSHAW                     BL,33.9709,-118.3308,Battery Crime,Bodily Harm,Violent Crimes,0.993164414
259037,29/10/2011,2011-10-29,Northeast,48,M,H,1600    EDGECLIFFE                   DR,34.0909,-118.2775,Battery Crime,Bodily Harm,Violent Crimes,0.994198917
259134,01/11/2011,2011-10-31,77th Street,60,F,B,6600    BRYNHURST                    AV,33.9793,-118.3338,Theft,Property Crime,Non-Violent Crimes,0.995347815
259201,19/07/2011,2011-07-07,Newton,63,M,H,2600    STANFORD                     AV,34.0208,-118.2595,Fraud,White Collar Crime,Non-Violent Crimes,0.996084201
259437,18/01/2012,2011-09-12,77th Street,34,F,B,6700    WEST                         BL,33.9781,-118.3352,Theft,Property Crime,Non-Violent Crimes,0.999968613
259440,15/09/2011,2011-09-14,Central,53,M,B,600 S  SAN PEDRO                    ST,34.0423,-118.2452,Theft,Property Crime,Non-Violent Crimes,0.992172102
259657,17/01/2011,2011-01-17,Topanga,43,F,W,23200    MARIANO                      ST,34.1683,-118.6321,Theft,Property Crime,Non-Violent Crimes,0.998060571
259882,29/09/2011,2011-09-28,Mission,47,M,H,14300    FOOTHILL                     BL,34.3192,-118.4455,Theft,Property Crime,Non-Violent Crimes,0.997698148
260604,15/02/2011,2011-02-14,West LA,45,M,W,500    AVONDALE                     AV,34.0488,-118.4896,Theft,Property Crime,Non-Violent Crimes,0.997192064
260619,01/04/2011,2011-04-01,Topanga,36,F,W,22500    COVELLO                      ST,34.2073,-118.6169,Theft,Property Crime,Non-Violent Crimes,0.996935755
260675,10/03/2011,2011-03-10,Mission,26,F,H,9000    CEDROS                       AV,34.2337,-118.4536,Battery Crime,Bodily Harm,Violent Crimes,0.993959713
260771,06/10/2011,2011-10-06,Harbor,17,M,H,G,33.7783,-118.2675,Robbery,Robbery,Violent Crimes,0.995121189
260776,28/05/2011,2011-05-26,West Valley,24,F,W,7500    GAVIOTA                      AV,34.2066,-118.4814,Theft,Property Crime,Non-Violent Crimes,0.992739191
260894,09/09/2011,2011-09-08,Foothill,20,M,H,8700    NORRIS                       AV,34.2272,-118.3697,Battery Crime,Bodily Harm,Violent Crimes,0.994461964
261129,21/03/2011,2011-03-19,77th Street,48,M,O,1200 W  69TH                         ST,33.977,-118.2959,Theft,Property Crime,Non-Violent Crimes,0.995455977
261151,01/12/2011,2011-11-30,Mission,38,M,H,13100    REEDLEY                      ST,34.2288,-118.4188,Theft,Property Crime,Non-Violent Crimes,0.992661476
261179,12/02/2011,2011-02-11,Wilshire,22,F,O,WILSHIRE                     BL,34.0623,-118.344,Theft,Property Crime,Non-Violent Crimes,0.999245362
261424,15/11/2011,2011-11-15,Olympic,30,F,W,500 S  KENMORE                      AV,34.0654,-118.2966,Assault,Bodily Harm,Violent Crimes,0.997331383
261475,10/04/2011,2011-04-10,77th Street,16,M,B,82ND                         ST,33.9651,-118.2827,Robbery,Robbery,Violent Crimes,0.996899261
261630,01/11/2011,2011-10-28,Newton,19,M,H,1600 E  41ST                         ST,34.0084,-118.2455,Theft,Property Crime,Non-Violent Crimes,0.996319368
261653,04/05/2011,2011-05-01,Van Nuys,46,M,W,5500    VAN NUYS                     BL,34.1703,-118.4486,Theft,Property Crime,Non-Violent Crimes,0.996047763
262178,26/04/2011,2011-04-25,Pacific,57,M,W,3100    MIDVALE                      AV,34.0288,-118.4208,Theft,Property Crime,Non-Violent Crimes,0.993099642
262354,29/07/2011,2011-07-29,Mission,33,F,H,14200    TERRA BELLA                  ST,34.2409,-118.4422,Assault,Bodily Harm,Violent Crimes,0.993968526
262781,14/12/2011,2011-12-13,Rampart,43,F,H,200 S  WESTLAKE                     AV,34.0648,-118.2696,Assault,Bodily Harm,Violent Crimes,0.9994545
262904,31/12/2011,2011-12-31,Southwest,29,F,H,3800 S  NORMANDIE                    AV,34.0173,-118.3002,Assault,Bodily Harm,Violent Crimes,0.998093239
262916,26/11/2011,2011-11-26,Southwest,31,F,W,3600    TROUSDALE                    PY,34.0215,-118.2868,Battery Crime,Bodily Harm,Violent Crimes,0.995888844
263006,03/05/2011,2011-05-02,77th Street,23,F,H,7400 S  FIGUEROA                     ST,33.9727,-118.2827,Battery Crime,Bodily Harm,Violent Crimes,0.994962639
263133,14/04/2011,2011-04-14,Central,40,M,B,500 S  SAN PEDRO                    ST,34.0442,-118.2439,Battery Crime,Bodily Harm,Violent Crimes,0.999326716
263139,13/03/2011,2011-03-13,Hollywood,44,M,K,SANTA MONICA                 BL,34.0908,-118.3092,Battery Crime,Bodily Harm,Violent Crimes,0.994025664
263462,16/11/2011,2011-11-01,Foothill,36,F,H,10200    GLENOAKS                     BL,34.2554,-118.3934,Theft,Property Crime,Non-Violent Crimes,0.998111704
263522,29/07/2011,2011-07-14,Southwest,53,M,W,2300 W  23RD                         ST,34.036,-118.3148,Theft,Property Crime,Non-Violent Crimes,0.998043864
263705,05/01/2011,2011-01-04,Olympic,29,F,H,PICO                         BL,34.0473,-118.2891,Theft,Property Crime,Non-Violent Crimes,0.993501366
264124,24/05/2011,2011-05-24,West LA,75,F,W,900    GRETNA GREEN                 WY,34.0477,-118.472,Battery Crime,Bodily Harm,Violent Crimes,0.991655697
264621,07/05/2015,2011-04-08,Newton,25,F,B,200 W  57TH                         ST,33.9906,-118.2761,Theft,Property Crime,Non-Violent Crimes,0.993491713
265006,22/06/2011,2011-06-22,Southeast,52,M,H,8600    ORCHARD                      AV,33.9601,-118.2881,Battery Crime,Bodily Harm,Violent Crimes,0.991906327
265339,03/07/2011,2011-07-01,Southeast,40,M,H,1900 E  103RD                        ST,33.9431,-118.2391,Theft,Property Crime,Non-Violent Crimes,0.995864438
266045,16/02/2011,2011-01-18,N Hollywood,36,M,W,5700    WILKINSON                    AV,34.1745,-118.4041,Theft,Property Crime,Non-Violent Crimes,0.997713802
266057,28/08/2011,2011-08-28,N Hollywood,45,F,H,LANKERSHIM                   BL,34.1681,-118.3765,Battery Crime,Bodily Harm,Violent Crimes,0.997967318
266060,24/12/2011,2011-12-23,Harbor,46,F,W,1400    SUNNYSIDE                    TR,33.7311,-118.3097,Theft,Property Crime,Non-Violent Crimes,0.992294805
266185,27/07/2011,2011-07-26,Southeast,27,M,H,10300    WILMINGTON                   AV,33.9431,-118.2391,Theft,Property Crime,Non-Violent Crimes,0.99081616
266381,17/03/2011,2011-03-17,Olympic,14,F,H,VERMONT,34.0509,-118.2916,Battery Crime,Bodily Harm,Violent Crimes,0.994565952
266427,28/03/2011,2011-03-27,Devonshire,21,F,W,11600    GERALD                       AV,34.2818,-118.4945,Theft,Property Crime,Non-Violent Crimes,0.992437541
266701,17/04/2011,2011-04-10,N Hollywood,62,F,W,3300    DONA LOLA                    PL,34.1318,-118.3789,Theft,Property Crime,Non-Violent Crimes,0.993598259
266715,01/02/2011,2011-01-31,Devonshire,62,M,O,16800    TRIBUNE                      ST,34.2663,-118.4979,Theft,Property Crime,Non-Violent Crimes,0.998419556
266724,03/09/2011,2011-09-01,Southwest,53,F,B,3700    CRENSHAW                     BL,34.0182,-118.3349,Theft,Property Crime,Non-Violent Crimes,0.991157773
267201,09/01/2011,2011-01-08,Rampart,28,M,O,800 N  MARIPOSA                     AV,34.0853,-118.299,Theft,Property Crime,Non-Violent Crimes,0.99081306
267238,13/11/2011,2011-11-08,Devonshire,53,M,W,8600    COMANCHE                     AV,34.2265,-118.5725,Theft,Property Crime,Non-Violent Crimes,0.995750052
268119,17/01/2011,2011-01-16,Southeast,34,F,B,10200 S  SAN PEDRO                    ST,33.9438,-118.2695,Theft,Property Crime,Non-Violent Crimes,0.997256982
268629,18/06/2011,2011-06-17,Olympic,37,F,H,3700 W  1ST                          ST,34.0727,-118.2929,Assault,Bodily Harm,Violent Crimes,0.994481932
268728,31/03/2011,2011-03-31,Van Nuys,83,F,W,4300    MAMMOTH                      AV,34.1483,-118.4326,Theft,Property Crime,Non-Violent Crimes,0.991148181
268743,06/09/2011,2011-09-06,Southeast,47,F,H,100 E  101ST                        ST,33.9447,-118.2739,Assault,Bodily Harm,Violent Crimes,0.994047875
268796,29/06/2011,2011-06-29,Hollywood,21,F,H,1300 N  LAS PALMAS                   AV,34.0944,-118.3363,Assault,Bodily Harm,Violent Crimes,0.994883594
268971,02/10/2011,2011-10-02,Southeast,31,M,H,104TH,33.9419,-118.2762,Robbery,Robbery,Violent Crimes,0.997592413
269079,31/08/2011,2011-08-29,Southwest,22,F,H,MARTIN LUTHER KING JR        BL,34.0109,-118.3002,Robbery,Robbery,Violent Crimes,0.994010965
269158,25/06/2011,2011-06-24,77th Street,65,F,H,5700    2ND                          AV,33.991,-118.3193,Theft,Property Crime,Non-Violent Crimes,0.99574778
269163,08/08/2011,2011-08-08,77th Street,50,M,W,7600 S  VERMONT                      AV,33.9707,-118.2914,Robbery,Robbery,Violent Crimes,0.99795749
269224,03/11/2011,2011-10-30,Devonshire,40,M,H,16200    NORDHOFF                     ST,34.2356,-118.4851,Battery Crime,Bodily Harm,Violent Crimes,0.991053111
269445,23/10/2011,2011-10-20,Southeast,16,M,H,AVALON,33.9322,-118.2652,Robbery,Robbery,Violent Crimes,0.991592947
269561,24/01/2011,2011-01-24,Rampart,53,M,H,1000    VALENCIA                     ST,34.0484,-118.2724,Assault,Bodily Harm,Violent Crimes,0.998589279
269693,31/07/2011,2011-07-31,Central,30,F,A,HILL                         ST,34.065,-118.2384,Battery Crime,Bodily Harm,Violent Crimes,0.997758682
269756,31/12/2011,2011-12-30,Northeast,62,M,W,SUNSET                       BL,34.0899,-118.277,Robbery,Robbery,Violent Crimes,0.99916179
269773,01/02/2011,2011-01-31,West Valley,28,F,A,6300    RESEDA                       BL,34.1848,-118.536,Assault,Bodily Harm,Violent Crimes,0.994907271
269806,02/01/2011,2011-01-01,Foothill,45,M,W,13200    VAUGHN                       ST,34.282,-118.422,Theft,Property Crime,Non-Violent Crimes,0.994170853
270118,05/11/2011,2011-11-05,Central,40,F,W,600 S  MAIN                         ST,34.0453,-118.2499,Assault,Bodily Harm,Violent Crimes,0.996309352
270137,30/08/2011,2011-08-30,Van Nuys,23,F,H,5100    LONGRIDGE                    AV,34.1631,-118.4214,Assault,Bodily Harm,Violent Crimes,0.997734576
270247,02/05/2011,2011-04-29,Hollywood,23,F,H,900 N  ARDMORE                      AV,34.0863,-118.3019,Assault,Bodily Harm,Violent Crimes,0.994337913
270334,23/01/2011,2011-01-23,Central,23,F,B,600 S  SAN PEDRO                    ST,34.0423,-118.2452,Battery Crime,Bodily Harm,Violent Crimes,0.994768485
270417,27/08/2011,2011-08-26,Northeast,21,M,H,6100 N  FIGUEROA                     ST,34.1121,-118.188,Robbery,Robbery,Violent Crimes,0.997111437
270846,07/07/2011,2011-07-07,Hollenbeck,22,F,H,2600    MICHIGAN                     AV,34.0442,-118.2063,Assault,Bodily Harm,Violent Crimes,0.998606859
271066,31/07/2011,2011-07-31,Southwest,19,F,B,3100    ORCHARD                      AV,34.0265,-118.2882,Battery Crime,Bodily Harm,Violent Crimes,0.997250625
271131,26/10/2011,2011-10-26,Olympic,28,M,O,600 S  BERENDO                      ST,34.0636,-118.2941,Assault,Bodily Harm,Violent Crimes,0.990626478
271201,22/02/2011,2011-02-22,Southeast,29,F,H,200 E  97TH                         ST,33.9483,-118.2717,Battery Crime,Bodily Harm,Violent Crimes,0.990222053
271257,20/03/2011,2011-03-17,Southeast,46,M,H,9600 S  GRANDEE                      AV,33.9494,-118.2435,Theft,Property Crime,Non-Violent Crimes,0.999834592
271354,13/11/2012,2011-10-18,Topanga,46,M,H,20300    SATICOY                      ST,34.2083,-118.5754,Theft,Property Crime,Non-Violent Crimes,0.991354058
271631,19/09/2011,2011-09-18,77th Street,39,M,H,800 W  75TH                         ST,33.9717,-118.2871,Robbery,Robbery,Violent Crimes,0.993889047
271999,29/09/2011,2011-09-28,Van Nuys,29,M,O,7400    WOODMAN                      AV,34.2049,-118.4313,Theft,Property Crime,Non-Violent Crimes,0.998719079
272272,04/01/2011,2011-01-04,Topanga,25,M,X,6700    TOPANGA CANYON               BL,34.1926,-118.6059,Theft,Property Crime,Non-Violent Crimes,0.99230427
272457,05/07/2011,2011-07-05,Southwest,32,M,H,1000 W  23RD                         ST,34.0342,-118.2816,Battery Crime,Bodily Harm,Violent Crimes,0.992428962
272534,26/10/2011,2011-10-26,Van Nuys,16,F,O,BRANTON                      PL,34.164,-118.4365,Battery Crime,Bodily Harm,Violent Crimes,0.993139749
272687,18/10/2011,2011-10-18,Southwest,27,M,X,900 W  34TH                         ST,34.0235,-118.2858,Theft,Property Crime,Non-Violent Crimes,0.998742521
273212,16/09/2011,2011-08-29,77th Street,48,M,H,900 E  77TH                         ST,33.9694,-118.2586,Fraud,White Collar Crime,Non-Violent Crimes,0.998691605
273222,22/02/2011,2011-02-20,Mission,45,F,H,BRIMFIELD,34.2215,-118.4588,Assault,Bodily Harm,Violent Crimes,0.995920584
273832,18/11/2011,2011-11-17,77th Street,63,M,H,800 W  75TH                         ST,33.9717,-118.2871,Theft,Property Crime,Non-Violent Crimes,0.997594015
273886,20/07/2011,2011-07-20,Hollenbeck,37,F,O,BREED                        ST,34.0412,-118.213,Rape,Rape,Violent Crimes,0.996838943
274267,16/04/2011,2011-04-10,Wilshire,50,M,H,BRONSON,34.0399,-118.3297,Robbery,Robbery,Violent Crimes,0.992276154
274348,09/10/2011,2011-10-07,N Hollywood,54,F,W,11000    MAGNOLIA                     BL,34.1649,-118.3706,Theft,Property Crime,Non-Violent Crimes,0.994170028
274386,01/05/2011,2011-05-01,Hollywood,26,F,W,5700    LEXINGTON                    AV,34.0928,-118.3136,Assault,Bodily Harm,Violent Crimes,0.990764631
274843,14/01/2011,2011-01-07,Pacific,36,F,W,700    MACHADO                      DR,34.0016,-118.4711,Theft,Property Crime,Non-Violent Crimes,0.994671375
275039,27/05/2011,2011-05-23,Newton,23,F,H,1200 E  43RD                         ST,34.0058,-118.2538,Assault,Bodily Harm,Violent Crimes,0.99783495
275134,26/12/2011,2011-12-23,N Hollywood,58,F,W,11000    COHASSET                     ST,34.2067,-118.3703,Theft,Property Crime,Non-Violent Crimes,0.993372881
275247,05/09/2011,2011-07-01,Southwest,29,M,H,1400 W  30TH                         ST,34.0272,-118.2948,Theft,Property Crime,Non-Violent Crimes,0.998500654
275384,12/07/2011,2011-07-09,N Hollywood,28,M,W,4900 E  CAHUENGA                     BL,34.1595,-118.3615,Assault,Bodily Harm,Violent Crimes,0.995590099
275557,29/03/2011,2011-03-28,Pacific,30,M,W,1300    OCEAN FRONT                  WK,33.9885,-118.475,Battery Crime,Bodily Harm,Violent Crimes,0.994417898
275665,30/04/2011,2011-04-26,Hollenbeck,57,F,H,1200 S  LORENA                       ST,34.0216,-118.2048,Theft,Property Crime,Non-Violent Crimes,0.99579484
275815,28/04/2011,2011-04-28,Van Nuys,33,M,W,6900    HAZELTINE                    AV,34.1958,-118.44,Theft,Property Crime,Non-Violent Crimes,0.999712735
275826,24/01/2011,2011-01-24,Central,24,M,W,5TH                          ST,34.0454,-118.2466,Battery Crime,Bodily Harm,Violent Crimes,0.992057894
275831,21/05/2011,2011-05-20,Van Nuys,36,M,H,6500    WOODMAN                      AV,34.1886,-118.4312,Theft,Property Crime,Non-Violent Crimes,0.997653884
276124,30/11/2011,2011-11-07,West Valley,49,F,O,4100    FALLING LEAF                 DR,34.1457,-118.5263,Theft,Property Crime,Non-Violent Crimes,0.99613592
276393,02/12/2011,2011-12-02,Hollywood,42,M,W,1600 N  HIGHLAND                     AV,34.0997,-118.3387,Battery Crime,Bodily Harm,Violent Crimes,0.994935293
276452,27/09/2011,2011-09-27,Olympic,47,M,K,6TH                          ST,34.0635,-118.3128,Theft,Property Crime,Non-Violent Crimes,0.996999872
276634,13/07/2011,2011-07-13,Wilshire,18,F,B,REDONDO                      BL,34.0407,-118.353,Battery Crime,Bodily Harm,Violent Crimes,0.991840358
276749,22/01/2011,2011-01-22,Southwest,52,F,B,4000 W  28TH                         ST,34.0315,-118.3292,Battery Crime,Bodily Harm,Violent Crimes,0.994247446
276781,08/12/2011,2011-10-25,Foothill,32,F,B,12300    OSBORNE                      ST,34.2647,-118.4019,Assault,Bodily Harm,Violent Crimes,0.995753934
276905,01/09/2011,2011-08-31,Southeast,17,F,H,11900 S  VERMONT                      AV,33.9251,-118.2915,Theft,Property Crime,Non-Violent Crimes,0.99988685
276912,25/02/2011,2011-02-11,Wilshire,46,F,W,700 N  DETROIT                      ST,34.0835,-118.3452,Theft,Property Crime,Non-Violent Crimes,0.998090619
277146,13/05/2011,2011-05-13,Newton,43,F,H,31ST                         ST,34.0148,-118.2573,Robbery,Robbery,Violent Crimes,0.993789756
277326,06/07/2011,2011-07-06,Pacific,24,F,B,LA CIENEGA                   BL,33.9799,-118.3701,Battery Crime,Bodily Harm,Violent Crimes,0.999035912
277584,10/03/2011,2011-01-02,77th Street,44,F,H,7500 S  BROADWAY,33.9718,-118.2783,Theft,Property Crime,Non-Violent Crimes,0.998185611
277595,28/06/2011,2011-06-27,Southeast,22,M,H,400 E  CENTURY                      BL,33.9456,-118.2673,Battery Crime,Bodily Harm,Violent Crimes,0.999560665
277663,25/11/2011,2011-11-24,77th Street,72,M,B,1400 W  89TH                         ST,33.9567,-118.3003,Theft,Property Crime,Non-Violent Crimes,0.997008342
278501,16/07/2011,2011-07-16,Hollenbeck,33,F,H,2800    WYNWOOD                      LN,34.026,-118.2162,Assault,Bodily Harm,Violent Crimes,0.997001272
278569,19/05/2011,2011-05-17,Southeast,19,F,B,12600 S  FIGUEROA                     ST,33.9188,-118.283,Battery Crime,Bodily Harm,Violent Crimes,0.994461582
278617,03/10/2011,2011-09-29,Northeast,44,M,W,1400 N  AVENUE 57,34.1251,-118.1939,Theft,Property Crime,Non-Violent Crimes,0.997438348
278922,17/07/2011,2011-07-16,Southeast,39,M,H,87TH,33.9593,-118.2564,Theft,Property Crime,Non-Violent Crimes,0.996669465
279050,07/03/2011,2011-03-07,N Hollywood,53,M,O,12700    LORNE                        ST,34.2186,-118.4104,Theft,Property Crime,Non-Violent Crimes,0.99333946
279106,16/04/2011,2011-04-16,Pacific,23,M,B,SPEEDWAY                     AV,33.9863,-118.4727,Assault,Bodily Harm,Violent Crimes,0.999784581
279118,19/04/2011,2011-04-19,Rampart,42,F,B,WESTLAKE                     AV,34.0529,-118.2776,Battery Crime,Bodily Harm,Violent Crimes,0.997193838
279312,22/06/2011,2011-06-15,West LA,40,F,W,11900    MONTANA                      AV,34.0524,-118.4702,Theft,Property Crime,Non-Violent Crimes,0.993757463
279414,29/05/2011,2011-05-29,Topanga,45,M,B,22600    CALIFA                       ST,34.1772,-118.6195,Theft,Property Crime,Non-Violent Crimes,0.999629405
279468,16/03/2011,2011-03-15,Harbor,32,M,W,3100 S  LELAND                       ST,33.7186,-118.3012,Theft,Property Crime,Non-Violent Crimes,0.996311598
279543,08/03/2011,2011-03-07,Van Nuys,18,M,W,14200    GILMORE                      ST,34.1877,-118.4421,Theft,Property Crime,Non-Violent Crimes,0.993952793
279603,26/05/2011,2011-05-26,N Hollywood,32,F,A,500    UNIVERSAL TERRACE            PY,34.1361,-118.357,Theft,Property Crime,Non-Violent Crimes,0.991689206
280025,15/12/2011,2011-12-12,Southeast,59,F,B,100 E  LANZIT                       AV,33.9294,-118.2739,Battery Crime,Bodily Harm,Violent Crimes,0.995453978
280382,24/02/2011,2011-02-23,Topanga,55,F,W,20200    DELITA                       DR,34.1641,-118.5742,Theft,Property Crime,Non-Violent Crimes,0.999518229
280393,04/12/2011,2011-12-04,Southwest,33,M,H,3900 S  BUDLONG                      AV,34.0155,-118.2959,Assault,Bodily Harm,Violent Crimes,0.997277003
280508,01/09/2011,2011-09-01,West LA,66,F,W,2500    MOTOR                        AV,34.0481,-118.4091,Theft,Property Crime,Non-Violent Crimes,0.997885723
280556,09/08/2011,2011-08-09,Mission,31,M,B,7800    VAN NUYS                     BL,34.212,-118.4488,Theft,Property Crime,Non-Violent Crimes,0.992521328
280653,03/01/2012,2011-12-31,West Valley,60,M,W,19100    VICTORY                      BL,34.1866,-118.5491,Theft,Property Crime,Non-Violent Crimes,0.995050915
281074,05/01/2011,2011-01-04,Hollywood,38,M,O,700    VINE                         ST,34.0835,-118.3266,Theft,Property Crime,Non-Violent Crimes,0.990047284
281185,12/04/2011,2011-04-11,Central,56,M,W,1300 N  SPRING                       ST,34.0661,-118.2334,Theft,Property Crime,Non-Violent Crimes,0.991664532
281260,06/03/2011,2011-03-06,Mission,32,F,H,15000    ROXFORD                      ST,34.3219,-118.4602,Theft,Property Crime,Non-Violent Crimes,0.993216456
281270,18/12/2014,2011-03-22,Foothill,39,F,W,10200    PINEWOOD                     AV,34.2544,-118.2859,Theft,Property Crime,Non-Violent Crimes,0.99555286
281299,17/04/2011,2011-04-16,Central,28,M,W,1ST,34.0486,-118.2351,Theft,Property Crime,Non-Violent Crimes,0.99006026
281352,08/11/2011,2011-11-03,Devonshire,35,F,O,20700    CAMPANIA                     LN,34.2802,-118.5844,Fraud,White Collar Crime,Non-Violent Crimes,0.993418728
281535,04/05/2011,2011-05-04,Southeast,13,M,B,1600 E  104TH                        ST,33.9415,-118.2462,Assault,Bodily Harm,Violent Crimes,0.996910969
281619,26/03/2011,2011-03-26,77th Street,67,F,B,VERNON                       AV,34.0037,-118.3089,Theft,Property Crime,Non-Violent Crimes,0.996187589
281986,11/04/2011,2011-04-11,Northeast,23,F,H,4900    SYCAMORE                     TR,34.103,-118.2033,Assault,Bodily Harm,Violent Crimes,0.99346306
282122,27/12/2011,2011-12-27,Newton,23,F,H,4200 S  GRAND                        AV,34.0074,-118.2805,Assault,Bodily Harm,Violent Crimes,0.993003455
282429,10/08/2011,2011-08-09,77th Street,49,F,H,5400 S  FIGUEROA                     ST,33.9933,-118.2827,Battery Crime,Bodily Harm,Violent Crimes,0.993133144
282756,31/03/2011,2011-03-30,Northeast,52,F,H,1600    SARGENT                      CT,34.0803,-118.2522,Theft,Property Crime,Non-Violent Crimes,0.999483217
282774,17/05/2011,2011-05-17,77th Street,21,F,B,900 W  62ND                         PL,33.9828,-118.2892,Assault,Bodily Harm,Violent Crimes,0.990322824
282798,30/10/2011,2011-10-30,Southeast,27,F,B,109TH                        ST,33.9371,-118.239,Assault,Bodily Harm,Violent Crimes,0.995649541
282850,02/10/2011,2011-10-02,Central,24,M,H,300 E  1ST                          ST,34.0504,-118.2409,Battery Crime,Bodily Harm,Violent Crimes,0.990677366
282888,11/11/2011,2011-11-08,Central,41,M,O,400    TOWNE                        AV,34.0444,-118.2407,Theft,Property Crime,Non-Violent Crimes,0.990457734
282899,11/08/2011,2011-08-11,Hollywood,54,M,H,5400    CARLTON                      WY,34.1005,-118.3071,Robbery,Robbery,Violent Crimes,0.9997566
282986,07/12/2011,2011-12-07,West Valley,19,F,H,6600    HESPERIA                     AV,34.1903,-118.5262,Assault,Bodily Harm,Violent Crimes,0.991762463
283084,02/06/2011,2011-06-02,Newton,18,F,H,1100 E  35TH                         ST,34.0119,-118.2565,Theft,Property Crime,Non-Violent Crimes,0.995771855
283411,16/08/2011,2011-08-16,Southeast,53,F,B,500 W  98TH                         ST,33.9472,-118.2826,Robbery,Robbery,Violent Crimes,0.991406917
283622,09/07/2011,2011-07-09,Hollywood,30,F,O,6600    HOLLYWOOD                    BL,34.1016,-118.3333,Theft,Property Crime,Non-Violent Crimes,0.992944229
283633,05/07/2011,2011-07-04,Devonshire,45,F,W,16200    KEELER                       DR,34.2865,-118.486,Theft,Property Crime,Non-Violent Crimes,0.992342579
283693,12/03/2011,2011-03-12,West Valley,43,F,H,16000    SHERMAN                      WY,34.2012,-118.4815,Robbery,Robbery,Violent Crimes,0.991428764
283797,30/05/2011,2011-05-23,Wilshire,75,M,W,100    HUDSON                       PL,34.074,-118.3328,Fraud,White Collar Crime,Non-Violent Crimes,0.996421296
283871,25/04/2011,2011-04-20,Topanga,38,M,W,7600    MILWOOD                      AV,34.2083,-118.5943,Theft,Property Crime,Non-Violent Crimes,0.998671366
283886,14/01/2011,2011-01-14,Olympic,28,F,H,1200 S  WESTERN                      AV,34.0491,-118.309,Battery Crime,Bodily Harm,Violent Crimes,0.99854963
284009,14/04/2011,2011-04-08,Central,30,M,W,500 S  LOS ANGELES                  ST,34.0461,-118.2476,Battery Crime,Bodily Harm,Violent Crimes,0.992290174
284456,29/10/2011,2011-10-29,Hollywood,40,M,K,1100    VINE                         ST,34.0908,-118.3266,Theft,Property Crime,Non-Violent Crimes,0.991355544
284509,30/03/2011,2011-03-29,Hollenbeck,13,F,H,2600    PASADENA                     AV,34.0765,-118.2157,Battery Crime,Bodily Harm,Violent Crimes,0.998172001
284707,15/02/2011,2011-02-15,Rampart,39,M,H,1800 W  3RD                          ST,34.0613,-118.2689,Battery Crime,Bodily Harm,Violent Crimes,0.991516378
284761,20/08/2011,2011-08-19,Southeast,24,F,B,9700 S  SAN PEDRO                    ST,33.9483,-118.2695,Theft,Property Crime,Non-Violent Crimes,0.99180607
284906,18/09/2011,2011-09-18,Southwest,48,F,W,5200    WESTHAVEN                    ST,34.0299,-118.3564,Theft,Property Crime,Non-Violent Crimes,0.992847092
284942,01/05/2011,2011-04-30,Olympic,27,M,B,3400    WILSHIRE                     BL,34.0618,-118.2979,Assault,Bodily Harm,Violent Crimes,0.993009854
285155,11/01/2011,2011-01-11,N Hollywood,44,M,B,10600    VALLEYHEART                  DR,34.1419,-118.3609,Battery Crime,Bodily Harm,Violent Crimes,0.995327238
285170,19/12/2011,2011-12-18,77th Street,22,F,B,57TH                         ST,33.9905,-118.2871,Rape,Rape,Violent Crimes,0.996125001
285191,04/06/2011,2011-06-04,Southwest,37,F,B,2700 S  SYCAMORE                     AV,34.0313,-118.3547,Battery Crime,Bodily Harm,Violent Crimes,0.992080566
285217,02/02/2011,2011-01-28,Rampart,40,M,H,1300    COURT                        ST,34.0641,-118.2567,Theft,Property Crime,Non-Violent Crimes,0.999226213
285367,22/12/2011,2011-12-22,Devonshire,40,F,W,11000    ETIWANDA                     AV,34.27,-118.5317,Theft,Property Crime,Non-Violent Crimes,0.99082032
285999,28/12/2011,2011-12-27,Southwest,35,F,B,9TH,34.0088,-118.327,Battery Crime,Bodily Harm,Violent Crimes,0.992949393
286071,23/09/2015,2011-02-01,Foothill,23,M,H,9900    OMELVENY                     AV,34.2502,-118.4187,Theft,Property Crime,Non-Violent Crimes,0.996507176
286296,24/12/2011,2011-12-24,Hollywood,29,M,O,6600    HOLLYWOOD                    BL,34.1016,-118.3333,Battery Crime,Bodily Harm,Violent Crimes,0.991614293
286404,01/12/2011,2011-11-30,77th Street,21,F,H,73RD                         ST,33.9737,-118.2871,Robbery,Robbery,Violent Crimes,0.993184926
286550,14/12/2011,2011-12-13,Southwest,26,F,H,3900 S  BUDLONG                      AV,34.0155,-118.2959,Theft,Property Crime,Non-Violent Crimes,0.993036894
286650,28/05/2011,2011-05-27,Mission,27,M,H,11100 N  SEPULVEDA                    BL,34.2721,-118.4675,Battery Crime,Bodily Harm,Violent Crimes,0.997775626
286833,02/11/2011,2011-11-01,Southeast,60,M,H,500 E  MANCHESTER                   AV,33.9601,-118.2659,Theft,Property Crime,Non-Violent Crimes,0.992417276
286991,05/12/2011,2011-12-05,Southwest,42,M,H,4300    3RD                          AV,34.0055,-118.3204,Theft,Property Crime,Non-Violent Crimes,0.992171246
287220,24/02/2011,2011-02-10,West Valley,53,M,W,16200    DORILEE                      LN,34.1336,-118.4855,Theft,Property Crime,Non-Violent Crimes,0.996508175
287417,24/09/2011,2011-09-23,Wilshire,49,M,O,7200    MELROSE                      AV,34.0835,-118.3462,Theft,Property Crime,Non-Violent Crimes,0.991649172
287517,30/07/2013,2011-01-01,West LA,39,M,W,17300 W  SUNSET                       BL,34.0419,-118.554,Theft,Property Crime,Non-Violent Crimes,0.990584746
287560,14/07/2011,2011-07-13,Wilshire,36,F,B,200 S  ROSSMORE                     AV,34.0707,-118.3274,Theft,Property Crime,Non-Violent Crimes,0.999628945
287958,21/09/2011,2011-09-20,Southwest,21,F,B,43RD                         PL,34.0046,-118.3089,Battery Crime,Bodily Harm,Violent Crimes,0.992826346
288035,02/05/2011,2011-05-02,Northeast,25,M,H,200    BRANCH                       ST,34.1174,-118.1861,Assault,Bodily Harm,Violent Crimes,0.996256569
288189,12/09/2011,2011-09-08,Topanga,45,F,W,8400    FAUST                        AV,34.2229,-118.6203,Theft,Property Crime,Non-Violent Crimes,0.99965719
288247,11/06/2011,2011-06-10,Olympic,51,F,O,900 S  SERRANO                      AV,34.0559,-118.3066,Theft,Property Crime,Non-Violent Crimes,0.994729926
288429,27/03/2011,2011-03-27,Hollywood,29,M,H,1400 N  CAHUENGA                     BL,34.0962,-118.3295,Battery Crime,Bodily Harm,Violent Crimes,0.991666632
288785,22/01/2011,2011-01-22,77th Street,53,F,B,6100    BRYNHURST                    AV,33.9846,-118.3338,Assault,Bodily Harm,Violent Crimes,0.999740575
288826,26/05/2011,2011-05-26,Rampart,30,M,H,1000 W  17TH                         ST,34.0398,-118.278,Battery Crime,Bodily Harm,Violent Crimes,0.999502909
288952,10/10/2011,2011-09-26,Newton,43,M,H,HOLMES,33.9896,-118.2412,Robbery,Robbery,Violent Crimes,0.995321274
289092,18/08/2011,2011-08-18,Olympic,41,F,K,3100 W  8TH                          ST,34.0577,-118.2971,Battery Crime,Bodily Harm,Violent Crimes,0.990563065
289670,18/05/2011,2011-05-18,77th Street,47,M,B,67TH                         ST,33.9785,-118.3046,Assault,Bodily Harm,Violent Crimes,0.991130665
289813,24/12/2011,2011-12-23,77th Street,20,M,H,800 W  77TH                         ST,33.9698,-118.2871,Theft,Property Crime,Non-Violent Crimes,0.995185554
290012,29/06/2011,2011-06-29,Foothill,37,F,H,SAN FERNANDO                 RD,34.2631,-118.4189,Robbery,Robbery,Violent Crimes,0.992169138
290274,07/10/2011,2011-09-12,Pacific,49,M,B,500    INDIANA                      CT,33.9947,-118.4712,Theft,Property Crime,Non-Violent Crimes,0.993993189
290395,11/01/2011,2011-01-11,Olympic,15,F,H,ORCHARD                      AV,34.04,-118.2882,Robbery,Robbery,Violent Crimes,0.995126005
290517,21/09/2011,2011-09-17,Rampart,55,M,B,7TH                          ST,34.0598,-118.2842,Battery Crime,Bodily Harm,Violent Crimes,0.993742402
290559,13/06/2011,2011-06-13,Van Nuys,42,M,H,6100    SEPULVEDA                    BL,34.1806,-118.4662,Theft,Property Crime,Non-Violent Crimes,0.999372108
290641,01/12/2011,2011-12-01,Central,53,M,W,400    TOWNE                        AV,34.0444,-118.2407,Theft,Property Crime,Non-Violent Crimes,0.997501946
291074,25/11/2013,2011-10-08,Pacific,-1,M,X,1300    6TH                          AV,33.9925,-118.4665,Theft,Property Crime,Non-Violent Crimes,0.991675527
291106,20/10/2011,2011-10-20,Wilshire,22,F,B,1900 S  LA BREA                      AV,34.0404,-118.3475,Assault,Bodily Harm,Violent Crimes,0.992586581
291310,09/11/2011,2011-11-09,Newton,56,M,H,6100 S  SAN PEDRO                    ST,33.9843,-118.2695,Battery Crime,Bodily Harm,Violent Crimes,0.99943526
291698,15/04/2011,2011-04-15,Pacific,33,F,H,200    WORLD                        WY,33.9449,-118.4059,Assault,Bodily Harm,Violent Crimes,0.990072365
292107,30/11/2011,2011-11-29,Pacific,21,F,W,800    VENICE                       BL,33.9914,-118.4578,Theft,Property Crime,Non-Violent Crimes,0.996739374
292713,08/03/2011,2011-03-07,Olympic,54,M,O,2800 W  OLYMPIC                      BL,34.0527,-118.2963,Battery Crime,Bodily Harm,Violent Crimes,0.99182843
292933,03/04/2011,2011-04-03,N Hollywood,34,F,H,11600    SYLVAN                       ST,34.1849,-118.3845,Robbery,Robbery,Violent Crimes,0.996221675
293138,29/12/2011,2011-12-29,Newton,28,M,H,100 W  59TH                         PL,33.9861,-118.2739,Battery Crime,Bodily Harm,Violent Crimes,0.994464292
293565,17/07/2011,2011-07-17,Southwest,57,M,H,VERMONT                      AV,34.0037,-118.2915,Battery Crime,Bodily Harm,Violent Crimes,0.994162577
293569,04/07/2011,2011-07-04,Van Nuys,39,M,H,4800    RANCHITO                     AV,34.1576,-118.4352,Assault,Bodily Harm,Violent Crimes,0.995154622
293656,03/12/2011,2011-11-30,Southwest,32,M,H,1200    ROLLAND CURTIS               PL,34.0165,-118.2988,Theft,Property Crime,Non-Violent Crimes,0.993421845
293708,25/09/2011,2011-09-25,Wilshire,25,M,O,MELROSE                      AV,34.0835,-118.3386,Robbery,Robbery,Violent Crimes,0.990585305
293964,07/11/2011,2011-11-06,West LA,26,M,W,1500 S  BUNDY                        DR,34.0406,-118.4633,Theft,Property Crime,Non-Violent Crimes,0.990464709
294006,08/12/2011,2011-12-07,Southeast,20,F,B,106TH                        ST,33.9397,-118.2462,Battery Crime,Bodily Harm,Violent Crimes,0.996825654
294193,24/10/2011,2011-10-23,Newton,26,M,H,51ST                         ST,33.9966,-118.2696,Assault,Bodily Harm,Violent Crimes,0.994597971
294622,09/12/2011,2011-12-08,N Hollywood,57,F,W,4800    GENTRY                       AV,34.1576,-118.3932,Theft,Property Crime,Non-Violent Crimes,0.998918316
294777,03/02/2011,2011-02-03,N Hollywood,50,F,W,6200    LAUREL CANYON                BL,34.183,-118.3965,Theft,Property Crime,Non-Violent Crimes,0.997813593
294781,02/11/2011,2011-06-17,Foothill,27,F,H,11100    PENROSE                      ST,34.2284,-118.3725,Theft,Property Crime,Non-Violent Crimes,0.991413245
294903,13/10/2011,2011-10-13,Hollywood,49,M,W,1700 N  ORCHID                       AV,34.1016,-118.3402,Battery Crime,Bodily Harm,Violent Crimes,0.990358494
294906,20/01/2011,2011-01-20,N Hollywood,45,M,H,11500    HAYNES                       ST,34.1894,-118.3843,Theft,Property Crime,Non-Violent Crimes,0.998974143
295037,13/12/2011,2011-12-13,Southeast,38,F,H,100 E  112TH                        ST,33.933,-118.2739,Assault,Bodily Harm,Violent Crimes,0.99817768
295070,30/03/2011,2011-03-30,Rampart,24,M,H,1200 W  7TH                          ST,34.0515,-118.2658,Battery Crime,Bodily Harm,Violent Crimes,0.990948776
295106,28/05/2011,2011-04-19,Van Nuys,55,F,W,5200    TILDEN                       AV,34.1649,-118.4475,Theft,Property Crime,Non-Violent Crimes,0.991241878
295394,16/12/2011,2011-12-09,Newton,44,F,H,3400 S  CENTRAL                      AV,34.0128,-118.2565,Battery Crime,Bodily Harm,Violent Crimes,0.999903838
295535,24/10/2011,2011-10-23,Topanga,14,F,O,5400    WINNETKA                     AV,34.1682,-118.571,Assault,Bodily Harm,Violent Crimes,0.996751578
295700,25/05/2011,2011-05-25,N Hollywood,22,F,W,12400    CHANDLER                     BL,34.1684,-118.4034,Assault,Bodily Harm,Violent Crimes,0.999318521
295770,22/07/2011,2011-07-21,Southeast,21,F,H,10000 S  HOOVER                       ST,33.9455,-118.2869,Theft,Property Crime,Non-Violent Crimes,0.990474919
295780,05/12/2011,2011-12-04,Topanga,69,M,W,21800    SHERMAN                      WY,34.201,-118.6029,Theft,Property Crime,Non-Violent Crimes,0.995520541
295800,20/09/2011,2011-09-18,77th Street,41,M,B,1700 W  CENTURY                      BL,33.9455,-118.3068,Battery Crime,Bodily Harm,Violent Crimes,0.994246363
295915,06/10/2011,2011-10-06,Rampart,23,F,B,700 S  RAMPART                      BL,34.0594,-118.2832,Battery Crime,Bodily Harm,Violent Crimes,0.995337772
295943,17/08/2011,2011-08-17,Harbor,16,M,B,100 S  MESA                         ST,33.7433,-118.2857,Battery Crime,Bodily Harm,Violent Crimes,0.996078576
296354,06/10/2011,2011-10-06,N Hollywood,25,F,W,4900    LANKERSHIM                   BL,34.16,-118.3716,Theft,Property Crime,Non-Violent Crimes,0.991864263
296371,22/01/2011,2011-01-21,Foothill,47,M,H,10600    EL DORADO                    AV,34.2629,-118.4217,Battery Crime,Bodily Harm,Violent Crimes,0.993551501
296428,25/04/2013,2011-01-01,West Valley,53,F,H,7000    WOODLEY                      AV,34.1976,-118.4837,Theft,Property Crime,Non-Violent Crimes,0.993034213
296696,25/09/2011,2011-09-25,Wilshire,32,M,H,CRENSHAW                     BL,34.0547,-118.323,Robbery,Robbery,Violent Crimes,0.997580298
296899,20/07/2011,2011-07-20,West Valley,18,F,W,SHERMAN                      WY,34.2011,-118.536,Theft,Property Crime,Non-Violent Crimes,0.999188966
296926,18/10/2011,2011-10-18,77th Street,56,M,B,1500 W  45TH                         ST,34.0028,-118.3035,Theft,Property Crime,Non-Violent Crimes,0.994002207
297220,10/04/2011,2011-04-10,Rampart,49,M,H,VENICE,34.0438,-118.2841,Battery Crime,Bodily Harm,Violent Crimes,0.996799449
297321,31/01/2013,2011-01-10,Topanga,41,F,W,7900    GLADE                        AV,34.214,-118.6082,Fraud,White Collar Crime,Non-Violent Crimes,0.999003005
297372,09/01/2012,2011-12-27,Olympic,28,M,H,WILSHIRE                     BL,34.0618,-118.2916,Theft,Property Crime,Non-Violent Crimes,0.990600258
297491,15/07/2011,2011-07-15,Wilshire,30,M,O,MELROSE,34.0836,-118.3511,Assault,Bodily Harm,Violent Crimes,0.997244626
297543,12/06/2011,2011-06-12,West Valley,19,F,H,6600    ETIWANDA                     AV,34.1903,-118.5317,Battery Crime,Bodily Harm,Violent Crimes,0.994782646
297895,02/03/2011,2011-03-01,Newton,47,M,H,6800 S  BROADWAY,33.9782,-118.2783,Theft,Property Crime,Non-Violent Crimes,0.994306216
298069,25/11/2011,2011-11-24,Southeast,20,F,B,9400 S  MAIN                         ST,33.9511,-118.2739,Battery Crime,Bodily Harm,Violent Crimes,0.994113875
298073,22/08/2011,2011-08-19,Pacific,38,M,W,3500 S  VINTON                       AV,34.027,-118.4074,Theft,Property Crime,Non-Violent Crimes,0.99737232
298107,08/09/2011,2011-08-27,Van Nuys,23,F,W,14300    SHERMAN                      WY,34.2012,-118.4444,Theft,Property Crime,Non-Violent Crimes,0.994493173
298520,17/04/2011,2011-04-16,West Valley,53,M,W,5900    LASAINE                      AV,34.1776,-118.5104,Theft,Property Crime,Non-Violent Crimes,0.990862127
298563,15/05/2011,2011-05-14,Pacific,33,M,B,7400    LA TIJERA                    BL,33.9706,-118.3794,Assault,Bodily Harm,Violent Crimes,0.998842178
298726,10/03/2011,2011-03-09,Wilshire,58,F,B,1900 S  LONGWOOD                     AV,34.04,-118.3454,Battery Crime,Bodily Harm,Violent Crimes,0.997658176
298875,11/01/2011,2011-01-11,77th Street,19,F,O,7000    BONSALLO                     AV,33.9761,-118.286,Assault,Bodily Harm,Violent Crimes,0.990183253
298884,11/05/2011,2011-05-09,Mission,14,F,H,11000    OMELVENY                     AV,34.2699,-118.4394,Theft,Property Crime,Non-Violent Crimes,0.99017353
299195,20/07/2011,2011-07-20,Devonshire,20,M,H,18400    ROSCOE                       BL,34.2207,-118.5339,Theft,Property Crime,Non-Violent Crimes,0.99991302
299741,25/05/2011,2011-04-08,West Valley,20,F,B,5700    ETIWANDA                     AV,34.1749,-118.5308,Theft,Property Crime,Non-Violent Crimes,0.998570771
299791,09/11/2011,2011-11-09,Foothill,32,F,H,12900    MONTAGUE                     ST,34.2463,-118.4131,Assault,Bodily Harm,Violent Crimes,0.992144797
300247,03/05/2011,2011-04-28,Van Nuys,28,M,B,6300    VAN NUYS                     BL,34.1847,-118.4487,Theft,Property Crime,Non-Violent Crimes,0.990439762
300271,13/09/2011,2011-09-12,Van Nuys,35,F,W,6300    WOODMAN                      AV,34.1849,-118.4312,Theft,Property Crime,Non-Violent Crimes,0.999117277
300346,26/06/2011,2011-06-26,Newton,47,F,H,300 W  47TH                         ST,34.0011,-118.2783,Theft,Property Crime,Non-Violent Crimes,0.995165247
300392,23/09/2011,2011-09-23,Van Nuys,20,M,H,HAZELTINE,34.1939,-118.44,Assault,Bodily Harm,Violent Crimes,0.990945691
300571,03/09/2011,2011-09-03,Hollywood,40,M,W,FRANKLIN                     AV,34.1052,-118.3375,Battery Crime,Bodily Harm,Violent Crimes,0.998231768
301150,06/12/2011,2011-12-06,Harbor,39,F,H,1100 S  PACIFIC                      AV,33.7342,-118.2879,Robbery,Robbery,Violent Crimes,0.997481736
301221,24/06/2011,2011-06-24,Rampart,33,M,H,VERMONT,34.0909,-118.2917,Assault,Bodily Harm,Violent Crimes,0.994402728
301253,22/12/2011,2011-11-01,77th Street,73,M,B,900 E  73RD                         ST,33.9739,-118.2586,Theft,Property Crime,Non-Violent Crimes,0.990496767
301412,13/12/2011,2011-12-13,Van Nuys,13,M,W,5000    SUNNYSLOPE                   AV,34.1613,-118.4268,Battery Crime,Bodily Harm,Violent Crimes,0.990166433
301429,26/02/2011,2011-02-26,Topanga,40,M,H,SHERMAN                      WY,34.201,-118.5943,Theft,Property Crime,Non-Violent Crimes,0.999536278
301702,02/07/2011,2011-07-01,77th Street,46,F,H,5300    5TH                          AV,33.9941,-118.3225,Assault,Bodily Harm,Violent Crimes,0.993895676
301833,12/08/2011,2011-08-12,Central,38,F,H,500 W  7TH                          ST,34.0467,-118.2556,Assault,Bodily Harm,Violent Crimes,0.997907335
302116,08/05/2011,2011-05-03,Rampart,30,M,H,8TH                          ST,34.0549,-118.2778,Battery Crime,Bodily Harm,Violent Crimes,0.991184981
302203,15/08/2011,2011-08-15,Van Nuys,26,F,H,6100    SEPULVEDA                    BL,34.1806,-118.4662,Theft,Property Crime,Non-Violent Crimes,0.997154967
302490,18/03/2011,2011-03-18,Olympic,20,F,H,15TH,34.0454,-118.3116,Battery Crime,Bodily Harm,Violent Crimes,0.994771513
302856,10/10/2011,2011-10-10,77th Street,18,F,H,7600    WADSWORTH                    AV,33.9712,-118.2586,Assault,Bodily Harm,Violent Crimes,0.999037599
302945,28/10/2011,2011-10-15,Foothill,53,F,W,10300    KURT                         ST,34.2772,-118.3545,Theft,Property Crime,Non-Violent Crimes,0.995947668
303038,06/10/2011,2011-10-02,Pacific,37,M,W,8500    BARNSLEY                     AV,33.961,-118.3846,Theft,Property Crime,Non-Violent Crimes,0.99928286
303310,16/04/2011,2011-04-15,Central,48,F,H,500 S  LOS ANGELES                  ST,34.0461,-118.2476,Theft,Property Crime,Non-Violent Crimes,0.99650329
304245,20/10/2011,2011-10-20,Northeast,85,M,O,1400 W  SUNSET                       BL,34.0742,-118.2519,Theft,Property Crime,Non-Violent Crimes,0.994465651
304781,24/08/2011,2011-08-22,Pacific,24,F,W,400    SUNSET                       AV,33.996,-118.4735,Theft,Property Crime,Non-Violent Crimes,0.998360867
305172,29/07/2011,2011-07-19,77th Street,63,M,B,7600 S  SAN PEDRO                    ST,33.9713,-118.2695,Theft,Property Crime,Non-Violent Crimes,0.995478828
305353,25/06/2011,2011-06-25,N Hollywood,27,F,H,6900    HINDS                        AV,34.1959,-118.391,Assault,Bodily Harm,Violent Crimes,0.990775336
305382,18/05/2011,2011-05-18,Topanga,33,F,A,6100    TOPANGA CANYON               BL,34.1811,-118.6059,Theft,Property Crime,Non-Violent Crimes,0.998083365
305494,22/07/2011,2011-07-21,Rampart,83,M,A,600 N  LAFAYETTE PARK               PL,34.0764,-118.2748,Theft,Property Crime,Non-Violent Crimes,0.99654997
305655,10/01/2011,2011-01-10,77th Street,18,M,B,7200 S  VERMONT                      AV,33.9746,-118.2914,Robbery,Robbery,Violent Crimes,0.996531511
305700,25/03/2011,2011-03-02,West LA,50,M,W,2000    CENTURY PARK,34.0604,-118.4136,Theft,Property Crime,Non-Violent Crimes,0.996222999
305892,24/12/2011,2011-12-24,Southeast,23,M,H,11700    BELHAVEN                     ST,33.9271,-118.255,Theft,Property Crime,Non-Violent Crimes,0.994330538
306453,12/01/2011,2011-01-12,Hollywood,52,M,O,6600    LELAND                       WY,34.097,-118.3332,Theft,Property Crime,Non-Violent Crimes,0.99390105
307106,08/08/2011,2011-07-11,N Hollywood,36,M,B,4200    COLDWATER CANYON             AV,34.1451,-118.4137,Theft,Property Crime,Non-Violent Crimes,0.993535319
307375,11/03/2011,2011-03-10,Central,22,M,W,6TH,34.0463,-118.2515,Theft,Property Crime,Non-Violent Crimes,0.998253051
307437,15/07/2011,2011-07-13,77th Street,76,F,B,5300    8TH                          AV,33.9941,-118.3258,Theft,Property Crime,Non-Violent Crimes,0.996192377
307619,21/08/2011,2011-08-17,Northeast,34,F,W,3800    AGUILAR                      ST,34.1253,-118.2359,Theft,Property Crime,Non-Violent Crimes,0.994362295
308358,19/04/2011,2011-04-18,Central,18,F,O,600 N  HILL                         ST,34.0591,-118.2412,Theft,Property Crime,Non-Violent Crimes,0.994219069
308448,08/02/2011,2011-02-04,Southwest,82,F,W,3100    6TH                          AV,34.0263,-118.3236,Theft,Property Crime,Non-Violent Crimes,0.992330486
308528,07/09/2011,2011-09-07,Rampart,58,F,B,2000 W  8TH                          ST,34.0544,-118.2767,Assault,Bodily Harm,Violent Crimes,0.990513668
308894,28/08/2011,2011-08-28,Newton,17,M,H,3800 S  GRAND                        AV,34.0152,-118.2793,Battery Crime,Bodily Harm,Violent Crimes,0.995380996
308933,16/09/2011,2011-09-16,Rampart,32,M,H,SHATTO                       ST,34.0564,-118.2702,Theft,Property Crime,Non-Violent Crimes,0.991388427
309018,10/03/2011,2011-02-10,West LA,44,M,W,800    LINDA FLORA                  DR,34.0819,-118.4645,Theft,Property Crime,Non-Violent Crimes,0.998443638
309094,16/02/2011,2011-02-16,Van Nuys,43,F,W,5900    SEPULVEDA                    BL,34.1776,-118.4662,Theft,Property Crime,Non-Violent Crimes,0.997065981
309228,20/05/2011,2011-05-19,Southeast,49,F,B,9600 S  SAN PEDRO                    ST,33.9492,-118.2695,Assault,Bodily Harm,Violent Crimes,0.996991913
309334,30/11/2011,2011-11-23,Van Nuys,48,F,W,4700    KESTER                       AV,34.1561,-118.4574,Rape,Rape,Violent Crimes,0.999110191
309344,09/12/2011,2011-12-08,Van Nuys,42,M,O,12800    RIVERSIDE                    DR,34.1576,-118.412,Theft,Property Crime,Non-Violent Crimes,0.993648571
309558,20/12/2011,2011-12-19,Mission,21,M,O,8000    CHERRYSTONE                  AV,34.2164,-118.4372,Theft,Property Crime,Non-Violent Crimes,0.998972083
309740,12/11/2011,2011-11-11,West LA,32,F,W,100 S  BARRINGTON                   PL,34.0665,-118.4704,Theft,Property Crime,Non-Violent Crimes,0.991653481
310224,27/04/2011,2011-04-26,Mission,54,M,W,8400    RANCHITO                     AV,34.2238,-118.4367,Theft,Property Crime,Non-Violent Crimes,0.997884999
310370,27/09/2011,2011-09-14,Newton,25,M,W,800 E  52ND                         ST,33.9958,-118.2617,Theft,Property Crime,Non-Violent Crimes,0.992755682
310664,14/09/2011,2011-09-06,Pacific,38,F,W,8500    NAYLOR                       AV,33.9612,-118.3954,Battery Crime,Bodily Harm,Violent Crimes,0.999783778
310672,13/05/2011,2011-05-13,Southwest,33,M,B,4200 S  BRONSON                      AV,34.0085,-118.3333,Battery Crime,Bodily Harm,Violent Crimes,0.999034004
310948,28/11/2011,2011-11-28,Newton,49,M,B,CENTRAL                      AV,34.0021,-118.2565,Robbery,Robbery,Violent Crimes,0.994924007
310993,26/01/2011,2011-01-26,Harbor,32,M,W,700 W  SEPULVEDA                    ST,33.7456,-118.2923,Theft,Property Crime,Non-Violent Crimes,0.996540023
311036,22/02/2011,2011-02-22,Olympic,29,F,H,100 S  MANHATTAN                    PL,34.0731,-118.3102,Theft,Property Crime,Non-Violent Crimes,0.993781264
311055,17/11/2011,2011-11-15,77th Street,23,M,B,5700    HILLCREST                    DR,33.9908,-118.3367,Theft,Property Crime,Non-Violent Crimes,0.995317074
311114,27/01/2011,2011-01-10,77th Street,18,M,B,7200 S  VERMONT                      AV,33.9746,-118.2914,Assault,Bodily Harm,Violent Crimes,0.992441564
311245,26/07/2017,2011-09-20,Southeast,25,F,B,200 W  105TH                        ST,33.941,-118.2762,Theft,Property Crime,Non-Violent Crimes,0.991431482
311704,19/02/2011,2011-02-19,Southeast,22,M,B,99TH                         PL,33.9472,-118.2309,Robbery,Robbery,Violent Crimes,0.996581149
311982,02/03/2011,2011-02-28,77th Street,46,M,B,600 W  58TH                         ST,33.9897,-118.2842,Assault,Bodily Harm,Violent Crimes,0.996704584
312016,25/02/2011,2011-02-25,West LA,29,M,W,SEPULVEDA,34.0459,-118.4428,Theft,Property Crime,Non-Violent Crimes,0.995425218
312311,06/05/2011,2011-05-04,N Hollywood,40,M,W,11600    MARGATE                      ST,34.1676,-118.3855,Theft,Property Crime,Non-Violent Crimes,0.999066552
312480,19/11/2011,2011-11-19,Southwest,19,M,W,3100    MC CLINTOCK                  AV,34.0269,-118.2858,Theft,Property Crime,Non-Violent Crimes,0.990770807
312501,07/12/2011,2011-12-07,77th Street,24,F,B,NORMANDIE                    AV,34.0037,-118.3002,Robbery,Robbery,Violent Crimes,0.998111327
312663,14/04/2011,2011-04-13,Hollenbeck,59,M,A,PASADENA                     AV,34.0856,-118.2131,Robbery,Robbery,Violent Crimes,0.990048722
313050,30/12/2011,2011-12-29,Central,54,F,W,600 W  9TH                          ST,34.0451,-118.2604,Theft,Property Crime,Non-Violent Crimes,0.996975429
313081,01/07/2011,2011-01-01,West Valley,34,M,B,8200    BALBOA                       BL,34.2196,-118.5021,Theft,Property Crime,Non-Violent Crimes,0.997937235
313409,03/02/2011,2011-02-03,Olympic,12,F,H,1100 S  BERENDO                      ST,34.0509,-118.2937,Battery Crime,Bodily Harm,Violent Crimes,0.99504688
313737,17/02/2011,2011-02-17,Van Nuys,20,M,H,14000    BESSEMER                     ST,34.1813,-118.4377,Assault,Bodily Harm,Violent Crimes,0.998703338
313839,09/10/2011,2011-10-09,Topanga,25,F,B,22100    CANTLAY                      ST,34.202,-118.6081,Battery Crime,Bodily Harm,Violent Crimes,0.994304016
313958,29/03/2011,2011-03-28,N Hollywood,40,F,H,10900    BLUFFSIDE                    DR,34.1414,-118.3686,Theft,Property Crime,Non-Violent Crimes,0.99380795
314144,11/02/2011,2011-02-10,Northeast,39,F,O,4300    EAGLE ROCK                   BL,34.1227,-118.2233,Theft,Property Crime,Non-Violent Crimes,0.999455643
314267,25/01/2011,2011-01-24,77th Street,21,M,B,400 W  FLORENCE                     AV,33.9747,-118.2809,Theft,Property Crime,Non-Violent Crimes,0.997915685
314361,19/06/2011,2011-06-18,Southeast,51,M,B,102ND,33.9439,-118.2326,Robbery,Robbery,Violent Crimes,0.991916293
314641,07/05/2011,2011-05-07,Mission,29,M,H,7800    VAN NUYS                     BL,34.212,-118.4488,Theft,Property Crime,Non-Violent Crimes,0.996644023
314743,06/04/2011,2011-04-01,Southeast,24,F,B,10100    GRAPE                        ST,33.9449,-118.2367,Battery Crime,Bodily Harm,Violent Crimes,0.997049193
315006,22/09/2011,2011-09-22,Southeast,38,M,B,11100 S  BROADWAY,33.9348,-118.2781,Theft,Property Crime,Non-Violent Crimes,0.993105124
315193,30/11/2011,2011-11-30,West Valley,39,F,W,5500    SYLVIA                       AV,34.1709,-118.5523,Theft,Property Crime,Non-Violent Crimes,0.995216818
315195,09/04/2011,2011-04-09,Van Nuys,40,M,W,15100    COVELLO                      ST,34.2075,-118.4618,Assault,Bodily Harm,Violent Crimes,0.993900105
315262,02/02/2011,2011-02-01,77th Street,45,F,B,80TH                         ST,33.9669,-118.2827,Battery Crime,Bodily Harm,Violent Crimes,0.994104856
315626,29/04/2011,2011-04-25,Southeast,67,F,B,400 W  92ND                         ST,33.9528,-118.2805,Theft,Property Crime,Non-Violent Crimes,0.996496283
315646,11/04/2011,2011-04-10,Northeast,31,F,A,2400    KENILWORTH                   AV,34.1035,-118.2677,Theft,Property Crime,Non-Violent Crimes,0.993563471
315711,11/08/2011,2011-08-09,N Hollywood,25,F,W,COLDWATER CANYON,34.1504,-118.4138,Theft,Property Crime,Non-Violent Crimes,0.993599784
316231,04/07/2011,2011-07-04,Olympic,62,M,K,SHATTO                       PL,34.0652,-118.2899,Battery Crime,Bodily Harm,Violent Crimes,0.998429632
316404,26/07/2011,2011-07-26,Southeast,16,F,H,108TH,33.9383,-118.2739,Robbery,Robbery,Violent Crimes,0.996837506
316407,31/05/2011,2011-05-31,Southwest,25,M,B,7TH                          AV,34.0199,-118.3249,Assault,Bodily Harm,Violent Crimes,0.994624825
316542,08/03/2011,2011-03-06,77th Street,20,M,B,1700 W  82ND                         ST,33.9646,-118.3068,Theft,Property Crime,Non-Violent Crimes,0.994089859
316565,06/07/2011,2011-07-04,Hollenbeck,30,M,H,GRANDE VISTA,34.0216,-118.2095,Battery Crime,Bodily Harm,Violent Crimes,0.996191353
316697,21/01/2011,2011-01-10,Mission,26,F,H,CHASE,34.2248,-118.4488,Battery Crime,Bodily Harm,Violent Crimes,0.996527415
317526,23/07/2011,2011-07-22,West LA,47,F,W,2100    BENEDICT CANYON              DR,34.1091,-118.436,Theft,Property Crime,Non-Violent Crimes,0.991703026
317674,27/01/2011,2011-01-27,77th Street,21,F,O,AVALON,33.9721,-118.2652,Assault,Bodily Harm,Violent Crimes,0.994575882
317802,22/08/2011,2011-08-21,Newton,33,F,B,1100 E  46TH                         ST,34.0021,-118.2565,Assault,Bodily Harm,Violent Crimes,0.994871611
317879,27/08/2011,2011-08-27,Wilshire,19,F,H,1100 S  FAIRFAX                      AV,34.0558,-118.3649,Assault,Bodily Harm,Violent Crimes,0.99909807
317916,03/05/2011,2011-04-26,Mission,64,F,B,11500    INDIAN HILLS                 RD,34.279,-118.4589,Theft,Property Crime,Non-Violent Crimes,0.997251069
318186,21/03/2011,2011-03-17,Pacific,30,F,B,9000    VENICE                       BL,34.0281,-118.3904,Assault,Bodily Harm,Violent Crimes,0.996827438
318187,12/07/2011,2011-07-11,Mission,21,F,H,14200    NORDHOFF                     ST,34.2353,-118.4419,Battery Crime,Bodily Harm,Violent Crimes,0.994759104
318268,11/05/2011,2011-05-11,Northeast,42,M,W,3400    RIVERSIDE                    DR,34.1129,-118.268,Theft,Property Crime,Non-Violent Crimes,0.994560364
318539,24/07/2011,2011-07-24,Hollywood,34,M,H,5300    VIRGINIA                     AV,34.092,-118.3046,Theft,Property Crime,Non-Violent Crimes,0.996647982
318682,07/10/2011,2011-10-06,West Valley,26,F,W,18400    HATTERAS                     ST,34.1775,-118.5338,Battery Crime,Bodily Harm,Violent Crimes,0.998381195
318794,25/12/2011,2011-12-25,Northeast,50,M,H,3000    FUTURE                       ST,34.1003,-118.2308,Assault,Bodily Harm,Violent Crimes,0.994376922
318833,15/10/2011,2011-10-13,Hollywood,21,F,O,1700 N  HIGHLAND                     AV,34.1016,-118.3387,Theft,Property Crime,Non-Violent Crimes,0.997417243
319753,03/12/2011,2011-12-01,Hollywood,18,M,W,1200 N  SAINT ANDREWS                PL,34.0928,-118.3109,Theft,Property Crime,Non-Violent Crimes,0.993897528
319973,03/08/2011,2011-08-02,Hollenbeck,25,F,H,3200    PORTOLA                      AV,34.0827,-118.173,Theft,Property Crime,Non-Violent Crimes,0.998473092
320012,25/07/2011,2011-07-25,Devonshire,54,M,O,18000    NORDHOFF                     ST,34.2356,-118.5253,Theft,Property Crime,Non-Violent Crimes,0.991104011
320056,04/01/2012,2011-12-30,77th Street,31,M,B,6500 S  WESTERN                      AV,33.9806,-118.309,Theft,Property Crime,Non-Violent Crimes,0.990406631
320096,05/06/2011,2011-06-05,77th Street,18,F,H,57TH,33.991,-118.3089,Robbery,Robbery,Violent Crimes,0.994559837
320697,07/11/2011,2011-10-20,Mission,12,F,H,13600    GAVINA                       AV,34.3185,-118.4008,Assault,Bodily Harm,Violent Crimes,0.998164825
320825,05/03/2011,2011-03-04,77th Street,35,M,B,10400    RUTHELEN                     ST,33.9419,-118.3123,Theft,Property Crime,Non-Violent Crimes,0.995299148
320945,03/03/2011,2011-03-02,Pacific,48,F,H,CULVER                       DR,33.9895,-118.4114,Battery Crime,Bodily Harm,Violent Crimes,0.991252557
321647,16/07/2011,2011-07-16,Newton,19,F,H,SLAUSON                      AV,33.9892,-118.2783,Battery Crime,Bodily Harm,Violent Crimes,0.9988226
322191,30/12/2011,2011-03-14,N Hollywood,53,M,O,7300    LAUREL CANYON                BL,34.2031,-118.3965,Theft,Property Crime,Non-Violent Crimes,0.998035098
322343,10/04/2011,2011-04-10,Southwest,25,M,H,2400    RAYMOND                      AV,34.0346,-118.2975,Murder,Murder,Violent Crimes,0.995775008
322407,25/11/2011,2011-11-25,N Hollywood,82,M,W,7500    CAMELLIA                     AV,34.2067,-118.3823,Theft,Property Crime,Non-Violent Crimes,0.998295245
322419,05/05/2011,2011-05-04,Rampart,49,F,W,600    WITMER                       ST,34.0555,-118.2655,Assault,Bodily Harm,Violent Crimes,0.998493242
322479,14/02/2011,2011-02-13,Hollenbeck,43,F,H,4400    ALPHA                        ST,34.0961,-118.1598,Theft,Property Crime,Non-Violent Crimes,0.994502207
322613,08/09/2011,2011-09-07,77th Street,31,F,B,9100 S  HOBART                       BL,33.9545,-118.3079,Battery Crime,Bodily Harm,Violent Crimes,0.99312707
322706,23/03/2011,2011-03-23,Northeast,56,F,W,3000    ROSWELL                      ST,34.1142,-118.2451,Theft,Property Crime,Non-Violent Crimes,0.99621523
322808,15/07/2011,2011-07-15,Topanga,48,M,H,20100    VENTURA                      BL,34.171,-118.5709,Fraud,White Collar Crime,Non-Violent Crimes,0.990763852
322843,04/05/2011,2011-05-04,77th Street,19,F,B,FLORENCE                     AV,33.9746,-118.309,Battery Crime,Bodily Harm,Violent Crimes,0.990270455
323026,28/09/2011,2011-09-21,Northeast,39,M,W,3400    GLENALBYN                    DR,34.0888,-118.2169,Theft,Property Crime,Non-Violent Crimes,0.997648909
323289,27/12/2011,2011-12-27,Newton,41,M,B,700 E  41ST                         ST,34.0092,-118.2634,Theft,Property Crime,Non-Violent Crimes,0.998684469
323295,03/06/2011,2011-06-03,West LA,46,M,A,1400 S  LA CIENEGA                   BL,34.0534,-118.3762,Theft,Property Crime,Non-Violent Crimes,0.994324263
323302,02/04/2011,2011-02-24,Foothill,56,F,W,10400    KAILUA                       LN,34.2575,-118.3002,Theft,Property Crime,Non-Violent Crimes,0.993974164
323408,24/10/2011,2011-10-24,Hollenbeck,21,M,O,1100 S  LORENA                       ST,34.0239,-118.2034,Theft,Property Crime,Non-Violent Crimes,0.999341015
323513,11/06/2011,2011-06-11,Topanga,28,F,O,6600    FALLBROOK                    AV,34.1907,-118.6234,Theft,Property Crime,Non-Violent Crimes,0.994605747
323647,17/10/2011,2011-10-17,Devonshire,28,F,H,16300    NORDHOFF                     ST,34.2357,-118.4873,Assault,Bodily Harm,Violent Crimes,0.999061244
323674,23/05/2011,2011-05-22,77th Street,13,F,H,VERMONT                      AV,33.9892,-118.2915,Robbery,Robbery,Violent Crimes,0.992763134
323814,01/01/2012,2011-12-31,Southeast,45,F,B,600 E  88TH                         PL,33.9565,-118.2651,Assault,Bodily Harm,Violent Crimes,0.990404062
324100,19/06/2011,2011-06-19,Southwest,30,M,O,3700    CRENSHAW                     BL,34.0182,-118.3349,Theft,Property Crime,Non-Violent Crimes,0.994088577
324205,21/05/2011,2011-05-20,Van Nuys,49,M,W,6600    CANTALOUPE                   AV,34.1903,-118.4345,Theft,Property Crime,Non-Violent Crimes,0.993907884
324246,03/06/2011,2011-06-02,N Hollywood,27,M,W,5300    DENNY                        AV,34.1667,-118.3643,Theft,Property Crime,Non-Violent Crimes,0.992524998
324306,06/09/2011,2011-08-08,Harbor,51,M,H,AVALON,33.7829,-118.2627,Theft,Property Crime,Non-Violent Crimes,0.992815276
324432,14/05/2011,2011-05-14,77th Street,23,M,H,FLORENCE,33.9746,-118.2914,Robbery,Robbery,Violent Crimes,0.994523991
324711,10/01/2011,2011-01-08,Southeast,59,M,H,11900 S  VERMONT                      AV,33.9251,-118.2915,Battery Crime,Bodily Harm,Violent Crimes,0.995627125
324789,30/12/2011,2011-12-29,Southwest,60,M,B,600 W  43RD                         ST,34.0054,-118.2842,Battery Crime,Bodily Harm,Violent Crimes,0.995378844
324916,09/09/2011,2011-09-09,Newton,16,F,H,MAPLE                        AV,34.0273,-118.263,Robbery,Robbery,Violent Crimes,0.996081091
324965,26/08/2011,2011-08-25,Southeast,33,M,B,1200 E  112TH                        ST,33.9331,-118.2542,Theft,Property Crime,Non-Violent Crimes,0.998509949
325496,18/07/2011,2011-07-18,Van Nuys,25,M,H,VENTURA CANYON               AV,34.1903,-118.429,Assault,Bodily Harm,Violent Crimes,0.997105317
325515,04/01/2011,2011-01-04,Central,21,F,B,700 S  OLIVE                        ST,34.0467,-118.2556,Assault,Bodily Harm,Violent Crimes,0.996796824
325584,30/04/2011,2011-04-29,Rampart,21,M,H,BONNIE BRAE,34.0585,-118.2724,Robbery,Robbery,Violent Crimes,0.995415531
325888,05/07/2011,2011-07-03,Olympic,21,M,O,100 N  MARIPOSA                     AV,34.0728,-118.2994,Theft,Property Crime,Non-Violent Crimes,0.993193488
325890,01/08/2011,2011-08-01,Southwest,37,M,B,2800    LA SALLE                     AV,34.03,-118.3054,Theft,Property Crime,Non-Violent Crimes,0.991182442
326135,01/06/2011,2011-05-31,Wilshire,52,M,B,2100    CLYDE                        AV,34.0392,-118.3648,Battery Crime,Bodily Harm,Violent Crimes,0.994087853
326170,15/09/2011,2011-09-15,Southwest,26,F,H,3700    CIMARRON                     ST,34.0181,-118.3161,Battery Crime,Bodily Harm,Violent Crimes,0.99633657
326227,26/01/2011,2011-01-25,Topanga,50,M,W,20000    VANOWEN                      ST,34.1938,-118.5688,Assault,Bodily Harm,Violent Crimes,0.993996187
326269,21/04/2011,2011-04-21,Van Nuys,37,M,B,6300    ATOLL                        AV,34.1849,-118.4203,Theft,Property Crime,Non-Violent Crimes,0.993304325
326471,08/10/2011,2011-10-07,Harbor,12,M,B,1500 S  CABRILLO                     AV,33.7306,-118.2946,Battery Crime,Bodily Harm,Violent Crimes,0.991029633
326500,13/02/2011,2011-02-13,Southeast,29,M,H,9000 S  FIGUEROA                     ST,33.9551,-118.2827,Battery Crime,Bodily Harm,Violent Crimes,0.997783859
326850,15/07/2011,2011-07-14,Hollywood,40,M,W,5900    GRACIOSA                     DR,34.1126,-118.3188,Theft,Property Crime,Non-Violent Crimes,0.990628
326888,05/09/2011,2011-09-05,Foothill,46,M,H,12100    LULL                         ST,34.2094,-118.3983,Theft,Property Crime,Non-Violent Crimes,0.996199944
327105,27/03/2011,2011-02-23,Van Nuys,38,M,H,7300 N  SEPULVEDA                    BL,34.203,-118.4662,Theft,Property Crime,Non-Violent Crimes,0.995520574
327107,05/11/2011,2011-11-04,Pacific,40,F,W,4000    GLENCOE                      AV,33.992,-118.4448,Theft,Property Crime,Non-Violent Crimes,0.991486059
327232,12/07/2011,2011-07-11,Northeast,43,F,W,4900 W  SUNSET                       BL,34.0982,-118.2961,Theft,Property Crime,Non-Violent Crimes,0.999728935
327562,12/03/2011,2011-03-12,West LA,10,X,X,10200    SANTA MONICA                 BL,34.0605,-118.4193,Theft,Property Crime,Non-Violent Crimes,0.993023524
327739,02/02/2011,2011-01-29,Central,67,M,H,700 S  SPRING                       ST,34.0445,-118.2523,Battery Crime,Bodily Harm,Violent Crimes,0.998960917
327845,04/11/2011,2011-11-04,Olympic,39,M,H,NORMANDIE,34.0618,-118.3004,Assault,Bodily Harm,Violent Crimes,0.99136068
327851,05/11/2011,2011-11-04,N Hollywood,50,F,O,5200    LAUREL CANYON                BL,34.1649,-118.3965,Theft,Property Crime,Non-Violent Crimes,0.997050427
328111,30/09/2011,2011-09-29,Wilshire,52,F,O,1400 S  ORANGE GROVE                 AV,34.0513,-118.3655,Theft,Property Crime,Non-Violent Crimes,0.991589753
328172,07/07/2011,2011-07-06,Southwest,46,M,B,3800    LOCKLAND                     DR,34.0092,-118.3403,Theft,Property Crime,Non-Violent Crimes,0.999220065
328279,15/11/2011,2011-11-15,Newton,54,M,B,5100 S  BROADWAY,33.9965,-118.2783,Assault,Bodily Harm,Violent Crimes,0.997902196
328802,10/01/2011,2011-01-07,Devonshire,39,M,A,18200    SAN JOSE                     ST,34.261,-118.53,Theft,Property Crime,Non-Violent Crimes,0.995069867
328834,29/04/2011,2011-04-29,Hollywood,28,M,H,CASSIL,34.098,-118.3338,Theft,Property Crime,Non-Violent Crimes,0.995461208
328877,08/05/2011,2011-05-08,West Valley,28,F,H,ROSCOE                       BL,34.2212,-118.5027,Assault,Bodily Harm,Violent Crimes,0.996267417
328933,03/08/2011,2011-08-02,Hollenbeck,54,M,H,700 S  BOYLE                        AV,34.0366,-118.2189,Theft,Property Crime,Non-Violent Crimes,0.997442523
329205,21/12/2011,2011-12-21,N Hollywood,43,M,W,7100    BELLAIRE                     AV,34.1994,-118.4094,Assault,Bodily Harm,Violent Crimes,0.992304997
329335,14/02/2011,2011-02-13,Southeast,29,F,B,500 W  90TH                         ST,33.9551,-118.2827,Assault,Bodily Harm,Violent Crimes,0.999999212
329468,10/06/2011,2011-05-31,West Valley,27,M,H,19200    VANOWEN                      ST,34.1939,-118.5516,Theft,Property Crime,Non-Violent Crimes,0.993726962
329482,17/09/2011,2011-09-17,Newton,21,M,H,ADAMS                        BL,34.0193,-118.2562,Assault,Bodily Harm,Violent Crimes,0.998375871
329490,29/11/2011,2011-11-29,N Hollywood,26,F,O,12200    HART                         ST,34.1976,-118.399,Kidnapping,Abduction,Violent Crimes,0.990362721
329669,26/12/2011,2011-12-25,Harbor,31,M,H,1300 W  255TH                        ST,33.7925,-118.2999,Theft,Property Crime,Non-Violent Crimes,0.990366198
329947,28/09/2011,2011-09-28,Central,22,M,H,100 W  ELMYRA                       ST,34.0661,-118.2334,Assault,Bodily Harm,Violent Crimes,0.998980461
330081,10/12/2011,2011-12-06,West LA,68,F,O,3000    ELVILL                       DR,34.1268,-118.4881,Theft,Property Crime,Non-Violent Crimes,0.991075869
330372,15/09/2011,2011-09-15,Mission,35,F,H,8800    VAN NUYS                     BL,34.2299,-118.4503,Battery Crime,Bodily Harm,Violent Crimes,0.996601544
331034,28/10/2011,2011-10-27,Mission,13,F,H,15400    MONTE                        ST,34.3184,-118.467,Assault,Bodily Harm,Violent Crimes,0.999229402
331067,01/12/2011,2011-11-30,Hollywood,44,F,W,1400    DEVLIN                       DR,34.0952,-118.3864,Theft,Property Crime,Non-Violent Crimes,0.992876649
331391,14/08/2011,2011-08-14,Southwest,52,M,B,1700 W  37TH                         DR,34.0194,-118.3089,Assault,Bodily Harm,Violent Crimes,0.990369539
331484,04/10/2011,2011-10-02,Newton,32,F,H,1100 E  47TH                         PL,34.0006,-118.2565,Theft,Property Crime,Non-Violent Crimes,0.994273438
331500,25/11/2011,2011-11-24,Southeast,23,M,B,103RD                        ST,33.9431,-118.2296,Battery Crime,Bodily Harm,Violent Crimes,0.994413742
331654,28/09/2011,2011-09-27,West Valley,27,F,W,17700    VENTURA                      BL,34.1625,-118.5186,Theft,Property Crime,Non-Violent Crimes,0.995524041
332051,16/03/2011,2011-03-15,Wilshire,70,M,W,100 S  GARDNER                      ST,34.0736,-118.3532,Theft,Property Crime,Non-Violent Crimes,0.991517892
332251,23/04/2012,2011-08-01,Southeast,10,M,H,200 W  118TH                        PL,33.9256,-118.2761,Assault,Bodily Harm,Violent Crimes,0.992031105
332540,01/12/2011,2011-12-01,West Valley,14,M,H,VANOWEN                      ST,34.1939,-118.5011,Battery Crime,Bodily Harm,Violent Crimes,0.992168869
332615,05/08/2011,2011-03-24,Wilshire,64,F,H,7200    WILLOUGHBY                   AV,34.0871,-118.3462,Theft,Property Crime,Non-Violent Crimes,0.995581152
332892,11/02/2011,2011-02-11,Hollywood,25,M,H,YUCCA,34.1032,-118.3348,Battery Crime,Bodily Harm,Violent Crimes,0.994000475
333038,15/11/2011,2011-11-14,Wilshire,56,M,O,EDGEWOOD,34.0549,-118.3501,Fraud,White Collar Crime,Non-Violent Crimes,0.999588776
333347,16/12/2011,2011-12-16,Pacific,34,F,H,4700    LINCOLN                      BL,33.9805,-118.439,Theft,Property Crime,Non-Violent Crimes,0.991273958
333681,15/11/2011,2011-11-04,Olympic,62,M,K,4000    LEEWARD                      AV,34.059,-118.3143,Theft,Property Crime,Non-Violent Crimes,0.998660291
333749,20/10/2011,2011-10-19,Harbor,38,M,W,22ND,33.7243,-118.299,Robbery,Robbery,Violent Crimes,0.992594162
334376,20/10/2011,2011-10-19,Pacific,57,M,W,3500    MOUNTAIN VIEW                AV,34.0125,-118.4353,Theft,Property Crime,Non-Violent Crimes,0.99651261
334613,22/07/2011,2011-07-19,Hollywood,49,F,W,1800 N  CHEROKEE                     AV,34.1032,-118.3348,Theft,Property Crime,Non-Violent Crimes,0.999459775
334683,19/10/2011,2011-10-18,N Hollywood,22,M,B,TROOST                       ST,34.2067,-118.3866,Assault,Bodily Harm,Violent Crimes,0.991867929
334928,05/04/2011,2011-04-05,Van Nuys,47,F,O,14400    GREENLEAF                    ST,34.1477,-118.4465,Theft,Property Crime,Non-Violent Crimes,0.998604736
335165,10/08/2011,2011-08-10,Central,31,F,B,800 N  ALAMEDA                      ST,34.0563,-118.2374,Theft,Property Crime,Non-Violent Crimes,0.997705726
335443,23/05/2011,2011-05-23,Central,30,M,O,SAN PEDRO                    ST,34.0458,-118.243,Theft,Property Crime,Non-Violent Crimes,0.998472884
335466,28/09/2011,2011-09-27,77th Street,30,F,B,8100 S  FIGUEROA                     ST,33.9657,-118.2827,Assault,Bodily Harm,Violent Crimes,0.998550226
335558,10/02/2011,2011-02-10,Newton,21,M,H,14TH                         PL,34.0281,-118.2487,Robbery,Robbery,Violent Crimes,0.992940094
335667,01/12/2011,2011-11-26,West LA,44,M,W,10300    GLENBARR                     AV,34.0394,-118.4072,Theft,Property Crime,Non-Violent Crimes,0.994246481
335777,06/09/2011,2011-09-01,Topanga,34,M,W,05300    FALLBROOK                    AV,34.166,-118.6233,Theft,Property Crime,Non-Violent Crimes,0.993525333
336092,13/06/2011,2011-06-11,West Valley,64,M,B,17400    HAMLIN                       ST,34.1885,-118.5122,Theft,Property Crime,Non-Violent Crimes,0.994280066
336154,17/07/2011,2011-07-17,Northeast,33,F,B,1600 N  ALEXANDRIA                   AV,34.1,-118.2984,Theft,Property Crime,Non-Violent Crimes,0.992776078
336487,14/11/2011,2011-02-07,Van Nuys,65,F,W,15100    VENTURA                      BL,34.1531,-118.4616,Theft,Property Crime,Non-Violent Crimes,0.998719408
336749,01/10/2011,2011-10-01,N Hollywood,21,M,B,6300    LANKERSHIM                   BL,34.1849,-118.3867,Battery Crime,Bodily Harm,Violent Crimes,0.995541886
337141,23/05/2011,2011-05-23,77th Street,27,F,B,200 W  79TH                         ST,33.9679,-118.2761,Battery Crime,Bodily Harm,Violent Crimes,0.997319672
337235,28/11/2011,2011-11-28,Southwest,39,M,B,2800    WEST                         BL,34.0311,-118.3417,Assault,Bodily Harm,Violent Crimes,0.991524834
337320,29/11/2011,2011-11-28,Southeast,29,M,H,300 E  99TH                         ST,33.9465,-118.2695,Theft,Property Crime,Non-Violent Crimes,0.990726733
337556,10/12/2011,2011-12-10,Southwest,41,F,B,4000    GELBER                       PL,34.0133,-118.3486,Assault,Bodily Harm,Violent Crimes,0.991597565
337638,30/10/2011,2011-10-30,N Hollywood,70,F,W,11100    CAMARILLO                    ST,34.1577,-118.3727,Battery Crime,Bodily Harm,Violent Crimes,0.991568246
337900,31/01/2011,2011-01-29,Olympic,55,M,H,2800    LEEWARD                      AV,34.0588,-118.2842,Theft,Property Crime,Non-Violent Crimes,0.997092498
337920,28/02/2011,2011-02-26,N Hollywood,27,F,W,3900    RIVERTON                     AV,34.1401,-118.3668,Theft,Property Crime,Non-Violent Crimes,0.997077824
338029,08/03/2016,2011-01-01,Van Nuys,42,M,O,4300    FULTON                       AV,34.1493,-118.4307,Theft,Property Crime,Non-Violent Crimes,0.99570053
338035,09/08/2011,2011-08-08,Mission,57,M,W,16600    FOOTHILL                     BL,34.3216,-118.4958,Theft,Property Crime,Non-Violent Crimes,0.993328795
338158,27/09/2011,2011-09-06,Southwest,41,M,O,3900    HILLCREST                    DR,34.0163,-118.3441,Theft,Property Crime,Non-Violent Crimes,0.990902649
338228,20/10/2011,2011-10-20,Pacific,41,M,H,ROSE                         AV,34.0014,-118.4679,Theft,Property Crime,Non-Violent Crimes,0.991872913
338229,07/08/2011,2011-06-18,Northeast,37,F,O,1300    EAGLE VISTA                  DR,34.1424,-118.1924,Theft,Property Crime,Non-Violent Crimes,0.997379815
338525,11/02/2011,2011-02-10,Southwest,49,M,B,2600    BRIGHTON                     AV,34.0327,-118.3015,Assault,Bodily Harm,Violent Crimes,0.998666831
338833,07/01/2011,2011-01-07,N Hollywood,28,M,O,12200    VENTURA                      BL,34.1434,-118.3978,Fraud,White Collar Crime,Non-Violent Crimes,0.994790424
339001,08/03/2011,2011-03-07,Van Nuys,42,M,H,FRIAR                        ST,34.1857,-118.4465,Assault,Bodily Harm,Violent Crimes,0.993872415
339044,23/03/2011,2011-03-23,Northeast,12,M,D,1400    HEPNER                       AV,34.1318,-118.1957,Assault,Bodily Harm,Violent Crimes,0.998252831
339053,13/02/2011,2011-02-12,Southwest,26,M,B,4000    CRENSHAW                     BL,34.0124,-118.3351,Theft,Property Crime,Non-Violent Crimes,0.995776766
339133,08/07/2011,2011-07-08,Southwest,38,F,B,3900    HILLCREST                    DR,34.0163,-118.3441,Theft,Property Crime,Non-Violent Crimes,0.997854257
339369,23/12/2011,2011-12-23,Topanga,25,M,X,21900    VENTURA                      BL,34.1685,-118.6038,Theft,Property Crime,Non-Violent Crimes,0.999711388
339459,07/03/2011,2011-02-26,Newton,21,F,H,MAIN                         ST,34.0187,-118.2726,Theft,Property Crime,Non-Violent Crimes,0.990649451
339489,27/01/2011,2011-01-27,Wilshire,36,M,H,21ST                         ST,34.038,-118.3248,Assault,Bodily Harm,Violent Crimes,0.991167268
339516,19/07/2011,2011-07-16,N Hollywood,20,F,W,11100    VENTURA                      BL,34.1411,-118.372,Rape,Rape,Violent Crimes,0.991659837
339542,22/08/2011,2011-08-20,Wilshire,33,F,B,5800    WILSHIRE                     BL,34.0625,-118.3549,Theft,Property Crime,Non-Violent Crimes,0.998846934
339609,18/08/2011,2011-08-18,Rampart,23,F,H,GLENDALE,34.0682,-118.2609,Assault,Bodily Harm,Violent Crimes,0.998497617
340649,30/07/2011,2011-07-30,Van Nuys,34,M,O,15300    VENTURA                      BL,34.1538,-118.4662,Theft,Property Crime,Non-Violent Crimes,0.999888787
341361,27/11/2011,2011-11-26,Rampart,27,F,O,ECHO PARK,34.0727,-118.2597,Theft,Property Crime,Non-Violent Crimes,0.990308564
342203,09/08/2011,2011-08-08,Newton,51,F,H,900 E  56TH                         ST,33.9916,-118.2593,Battery Crime,Bodily Harm,Violent Crimes,0.997400895
342532,18/11/2011,2011-11-18,Central,43,F,H,500    SAN JULIAN                   ST,34.0446,-118.245,Assault,Bodily Harm,Violent Crimes,0.994360479
342569,26/09/2011,2011-09-26,77th Street,14,F,B,MANCHESTER,33.96,-118.3003,Assault,Bodily Harm,Violent Crimes,0.998033721
342625,16/05/2011,2011-05-13,Van Nuys,77,F,H,5400 N  SEPULVEDA                    BL,34.1685,-118.4662,Theft,Property Crime,Non-Violent Crimes,0.993926609
342800,11/10/2011,2011-10-11,Foothill,24,F,O,8400    GLENOAKS                     BL,34.2237,-118.3605,Theft,Property Crime,Non-Violent Crimes,0.99186908
342861,07/08/2011,2011-08-07,Van Nuys,24,F,H,15400    SHERMAN                      WY,34.2012,-118.4684,Assault,Bodily Harm,Violent Crimes,0.995510085
343103,20/12/2011,2011-12-19,Mission,26,M,H,9000    VAN NUYS                     BL,34.2332,-118.4503,Robbery,Robbery,Violent Crimes,0.992505648
343276,26/08/2011,2011-08-16,Southeast,25,M,B,105TH                        ST,33.9406,-118.2322,Robbery,Robbery,Violent Crimes,0.995928188
343468,22/07/2011,2011-07-21,Van Nuys,21,F,H,6500    WOODMAN                      AV,34.1886,-118.4312,Rape,Rape,Violent Crimes,0.995246948
343474,25/11/2011,2011-11-25,Rampart,23,F,B,400 S  RAMPART                      BL,34.0649,-118.2797,Assault,Bodily Harm,Violent Crimes,0.995354032
343633,24/04/2011,2011-04-24,Southwest,19,F,H,3700 S  HOBART                       BL,34.0182,-118.3078,Battery Crime,Bodily Harm,Violent Crimes,0.999401513
343797,18/01/2011,2011-01-05,77th Street,29,F,H,200 W  78TH                         ST,33.9689,-118.2761,Theft,Property Crime,Non-Violent Crimes,0.994342926
344017,19/09/2011,2011-09-05,N Hollywood,77,M,W,6200    AGNES                        AV,34.184,-118.3954,Theft,Property Crime,Non-Violent Crimes,0.99508101
344209,13/06/2011,2011-06-13,Devonshire,68,M,W,15700    RAYEN                        ST,34.232,-118.4742,Theft,Property Crime,Non-Violent Crimes,0.990379174
344311,22/06/2011,2011-06-22,Wilshire,19,M,H,OLYMPIC                      BL,34.0553,-118.3279,Assault,Bodily Harm,Violent Crimes,0.999015026
344313,10/12/2011,2011-12-10,Harbor,10,M,O,700 S  GAFFEY                       ST,33.7379,-118.2923,Theft,Property Crime,Non-Violent Crimes,0.994551909
344511,09/04/2011,2011-04-09,Devonshire,84,M,W,12100    LONGACRE                     AV,34.2893,-118.5298,Battery Crime,Bodily Harm,Violent Crimes,0.990620099
344542,12/04/2011,2011-04-11,Southeast,49,F,B,8900 S  MAIN                         ST,33.9556,-118.2739,Theft,Property Crime,Non-Violent Crimes,0.99623588
344665,08/10/2011,2011-10-07,Rampart,35,M,H,OLYMPIC                      BL,34.052,-118.2804,Robbery,Robbery,Violent Crimes,0.994939842
345463,10/06/2011,2011-06-09,Harbor,17,M,H,2600    CAROLINA                     ST,33.7206,-118.2907,Theft,Property Crime,Non-Violent Crimes,0.99867944
345580,16/09/2011,2011-09-16,Southwest,43,F,B,4900    2ND                          AV,33.9991,-118.3192,Assault,Bodily Harm,Violent Crimes,0.99148052
345716,15/07/2011,2011-07-14,West LA,46,M,B,1900 S  BUNDY                        DR,34.0353,-118.4571,Theft,Property Crime,Non-Violent Crimes,0.999168378
345754,15/05/2011,2011-05-15,Southeast,20,M,H,1300 E  108TH                        ST,33.9378,-118.2518,Assault,Bodily Harm,Violent Crimes,0.994703539
346200,14/05/2011,2011-05-14,Hollenbeck,25,M,H,5100    HUNTINGTON D,34.0949,-118.1645,Assault,Bodily Harm,Violent Crimes,0.996439479
346402,30/09/2011,2011-09-30,Wilshire,25,M,W,CLINTON                      AV,34.0817,-118.3227,Theft,Property Crime,Non-Violent Crimes,0.994405944
346444,17/01/2011,2011-01-17,Rampart,17,M,H,300 N  BERENDO                      ST,34.0763,-118.2944,Battery Crime,Bodily Harm,Violent Crimes,0.998874565
346492,27/04/2011,2011-04-24,Hollenbeck,24,F,H,3500 E  7TH                          ST,34.0246,-118.1998,Battery Crime,Bodily Harm,Violent Crimes,0.998223048
346793,19/04/2011,2011-04-18,Central,47,F,W,500    CROCKER                      ST,34.0435,-118.2427,Battery Crime,Bodily Harm,Violent Crimes,0.998528267
346938,29/06/2011,2011-06-29,Southwest,48,F,B,JEFFERSON,34.0256,-118.3417,Theft,Property Crime,Non-Violent Crimes,0.994527832
346977,25/05/2011,2011-05-25,Topanga,55,F,W,5600    DE SOTO                      AV,34.172,-118.5882,Theft,Property Crime,Non-Violent Crimes,0.998003616
347006,23/01/2011,2011-01-23,West LA,32,M,O,9800    NATIONAL                     BL,34.0314,-118.3998,Theft,Property Crime,Non-Violent Crimes,0.991736073
347377,22/08/2011,2011-08-22,Devonshire,39,F,W,RESEDA                       BL,34.2533,-118.5361,Theft,Property Crime,Non-Violent Crimes,0.994778305
347459,17/09/2011,2011-09-17,Rampart,23,M,H,TEMPLE,34.0726,-118.2749,Assault,Bodily Harm,Violent Crimes,0.993344222
347538,23/07/2011,2011-07-16,Topanga,45,M,W,8300    ETON                         AV,34.2211,-118.5951,Theft,Property Crime,Non-Violent Crimes,0.999504248
347819,27/02/2011,2011-02-27,Hollenbeck,28,M,H,1ST                          ST,34.0472,-118.2198,Assault,Bodily Harm,Violent Crimes,0.99195067
347983,24/08/2011,2011-08-10,N Hollywood,33,F,W,12100    EMELITA                      ST,34.1763,-118.3965,Theft,Property Crime,Non-Violent Crimes,0.997498796
348036,19/03/2011,2011-03-19,Harbor,39,F,H,1000    FRIGATE                      AV,33.7821,-118.278,Assault,Bodily Harm,Violent Crimes,0.997745383
348040,29/07/2011,2011-07-24,Foothill,30,M,H,12900    CORRENTI                     ST,34.2486,-118.4136,Theft,Property Crime,Non-Violent Crimes,0.994625743
348495,15/09/2011,2011-09-14,Harbor,51,M,B,1400 W  LOMITA                       BL,33.7978,-118.3011,Theft,Property Crime,Non-Violent Crimes,0.993794554
348548,04/02/2011,2011-02-04,Southwest,51,F,W,KENWOOD,34.0309,-118.2991,Fraud,White Collar Crime,Non-Violent Crimes,0.996464672
348919,04/09/2014,2011-12-31,N Hollywood,52,M,W,12800    MOORPARK                     ST,34.1504,-118.4116,Theft,Property Crime,Non-Violent Crimes,0.995948171
348948,01/10/2011,2011-10-01,Devonshire,39,F,W,16800    SAN FERNANDO MISSION         BL,34.272,-118.4978,Battery Crime,Bodily Harm,Violent Crimes,0.999423389
349002,16/10/2011,2011-10-15,Mission,39,F,H,ASTORIA,34.3075,-118.4432,Theft,Property Crime,Non-Violent Crimes,0.995958332
349074,18/06/2011,2011-06-18,77th Street,47,F,B,5200 S  HOOVER                       ST,33.9954,-118.2871,Assault,Bodily Harm,Violent Crimes,0.993276097
349095,30/11/2011,2011-11-02,Pacific,39,M,H,11100    REGENT                       ST,34.017,-118.4152,Theft,Property Crime,Non-Violent Crimes,0.995485377
349161,06/04/2011,2011-04-05,77th Street,6,M,B,1500 W  51ST                         ST,33.9969,-118.3057,Assault,Bodily Harm,Violent Crimes,0.996581339
349411,11/10/2011,2011-10-10,Southeast,23,F,B,114TH,33.9315,-118.239,Assault,Bodily Harm,Violent Crimes,0.994877537
350337,18/11/2011,2011-11-17,Rampart,20,F,W,300 S  RENO                         ST,34.0682,-118.2833,Theft,Property Crime,Non-Violent Crimes,0.994628793
350377,18/03/2011,2011-03-18,Olympic,27,F,A,300 S  CATALINA                     ST,34.0691,-118.2954,Battery Crime,Bodily Harm,Violent Crimes,0.997190209
350444,02/03/2011,2011-03-02,Devonshire,17,M,H,NORDHOFF                     ST,34.2356,-118.4763,Assault,Bodily Harm,Violent Crimes,0.996241335
350472,21/07/2011,2011-07-21,Newton,28,M,H,5200    COMPTON                      AV,33.9957,-118.2478,Theft,Property Crime,Non-Violent Crimes,0.997939634
350936,06/09/2011,2011-07-27,Van Nuys,52,F,W,15200    CLARK                        ST,34.1685,-118.464,Fraud,White Collar Crime,Non-Violent Crimes,0.996318554
351009,12/12/2011,2011-12-11,Wilshire,22,F,W,WARING                       ST,34.0853,-118.3462,Robbery,Robbery,Violent Crimes,0.993520768
351133,14/02/2012,2011-01-01,Rampart,28,F,W,1300    MALTMAN                      AV,34.0869,-118.2787,Theft,Property Crime,Non-Violent Crimes,0.992927045
351227,03/10/2011,2011-10-02,West LA,38,F,O,11800    MAYFIELD                     AV,34.0505,-118.465,Theft,Property Crime,Non-Violent Crimes,0.994449549
351361,30/04/2011,2011-04-30,Central,30,F,W,500    CENTER                       ST,34.0518,-118.2314,Theft,Property Crime,Non-Violent Crimes,0.992003186
351576,27/10/2011,2011-10-27,Hollywood,41,M,B,1700    WILCOX                       AV,34.1016,-118.331,Robbery,Robbery,Violent Crimes,0.993286581
351949,04/02/2011,2011-02-04,N Hollywood,32,F,W,5000    DENNY                        AV,34.1613,-118.3648,Assault,Bodily Harm,Violent Crimes,0.991423665
351961,31/10/2011,2011-10-31,Northeast,56,M,H,700    ARAGON                       AV,34.0913,-118.2214,Battery Crime,Bodily Harm,Violent Crimes,0.999842632
352219,02/02/2011,2011-02-01,Central,23,F,W,3RD,34.0455,-118.2381,Theft,Property Crime,Non-Violent Crimes,0.993800871
352270,27/08/2011,2011-07-29,Hollywood,55,M,W,1500 N  MARTEL                       AV,34.098,-118.35,Theft,Property Crime,Non-Violent Crimes,0.997508194
352578,12/01/2011,2011-01-12,Harbor,42,F,H,ANAHEIM,33.7797,-118.2687,Theft,Property Crime,Non-Violent Crimes,0.990109517
352678,09/04/2011,2011-04-09,Topanga,53,F,W,4400    CANOGA                       AV,34.1495,-118.5955,Battery Crime,Bodily Harm,Violent Crimes,0.994510779
352769,06/06/2011,2011-06-06,Olympic,22,F,H,2100    VENICE                       BL,34.0436,-118.3028,Theft,Property Crime,Non-Violent Crimes,0.993042888
352907,03/09/2011,2011-09-01,Topanga,63,F,B,7500    VASSAR                       AV,34.2065,-118.6044,Theft,Property Crime,Non-Violent Crimes,0.993296373
353237,20/05/2011,2011-05-20,Southeast,15,M,H,700 E  111TH                        PL,33.9345,-118.263,Theft,Property Crime,Non-Violent Crimes,0.993362091
353495,30/03/2011,2011-03-30,Topanga,39,F,O,6100    TOPANGA CANYON               BL,34.1811,-118.6059,Theft,Property Crime,Non-Violent Crimes,0.998290307
354005,03/02/2011,2011-02-03,Harbor,14,F,B,LOMITA                       BL,33.7978,-118.3076,Battery Crime,Bodily Harm,Violent Crimes,0.991939206
354077,05/02/2011,2011-02-05,Newton,29,M,W,SANTA FE                     AV,34.0316,-118.23,Theft,Property Crime,Non-Violent Crimes,0.993726034
354308,19/02/2016,2011-09-28,Southeast,46,M,B,10800    AVALON                       BL,33.9345,-118.2623,Theft,Property Crime,Non-Violent Crimes,0.996671872
354561,19/11/2011,2011-11-18,77th Street,28,F,B,2300 W  FLORENCE                     AV,33.9746,-118.3187,Theft,Property Crime,Non-Violent Crimes,0.995199076
354628,08/02/2011,2011-02-07,77th Street,24,F,H,800 W  53RD                         ST,33.9942,-118.2871,Theft,Property Crime,Non-Violent Crimes,0.993343502
355129,10/01/2011,2011-01-09,Southwest,30,F,B,2800 S  ORANGE                       DR,34.0293,-118.3545,Battery Crime,Bodily Harm,Violent Crimes,0.999400581
355161,17/01/2012,2011-10-30,West LA,65,M,W,1300 S  BEVERLY GLEN                 BL,34.0641,-118.4273,Theft,Property Crime,Non-Violent Crimes,0.999069339
355619,31/03/2011,2011-03-31,77th Street,53,M,H,700 E  84TH                         ST,33.9629,-118.2629,Theft,Property Crime,Non-Violent Crimes,0.994571404
355657,07/10/2016,2011-01-01,Southwest,62,M,B,4100    PALMWOOD                     DR,34.0137,-118.3435,Theft,Property Crime,Non-Violent Crimes,0.991518707
356186,27/10/2011,2011-10-24,Wilshire,26,F,B,100 S  ROBERTSON                    BL,34.0753,-118.3837,Theft,Property Crime,Non-Violent Crimes,0.999809946
356191,03/06/2011,2011-06-03,Van Nuys,49,F,W,14100    GREENLEAF                    ST,34.147,-118.4407,Theft,Property Crime,Non-Violent Crimes,0.999435454
356333,24/07/2011,2011-07-24,Southwest,37,F,H,3900    GIBRALTAR                    AV,34.0161,-118.3547,Battery Crime,Bodily Harm,Violent Crimes,0.995501237
356570,25/07/2011,2011-07-25,Pacific,42,M,B,500    WORLD                        WY,33.9427,-118.4053,Theft,Property Crime,Non-Violent Crimes,0.990420872
356794,30/11/2011,2011-11-30,Southwest,24,M,H,3500 S  LA CIENEGA                   BL,34.0242,-118.3722,Theft,Property Crime,Non-Violent Crimes,0.99077435
356807,04/06/2011,2011-06-03,77th Street,54,F,B,800 E  73RD                         ST,33.9739,-118.2608,Robbery,Robbery,Violent Crimes,0.997290071
356819,07/08/2011,2011-08-02,Southeast,30,F,B,700    LACONIA                      BL,33.918,-118.287,Theft,Property Crime,Non-Violent Crimes,0.998959282
356831,11/02/2011,2011-02-10,77th Street,39,M,B,300 W  84TH                         PL,33.9624,-118.2783,Battery Crime,Bodily Harm,Violent Crimes,0.99425432
357082,21/06/2011,2011-06-21,Rampart,16,M,H,600    MICHELTORENA                 ST,34.0792,-118.2811,Battery Crime,Bodily Harm,Violent Crimes,0.992469783
357141,14/01/2011,2011-01-12,West LA,58,M,W,11600    WILSHIRE                     BL,34.0508,-118.4592,Theft,Property Crime,Non-Violent Crimes,0.999033759
357165,20/08/2011,2011-08-19,Southwest,36,F,B,4300    DON TOMASO                   DR,34.005,-118.349,Assault,Bodily Harm,Violent Crimes,0.994221233
357398,01/04/2011,2011-03-31,Devonshire,69,F,W,18800    SALT LAKE                    PL,34.2706,-118.5435,Theft,Property Crime,Non-Violent Crimes,0.998564486
357913,14/11/2011,2011-11-13,Topanga,28,F,H,7400    MADORA                       AV,34.2048,-118.5662,Theft,Property Crime,Non-Violent Crimes,0.999036718
357971,26/01/2011,2011-01-25,Van Nuys,86,M,W,7000    MATILIJA                     AV,34.1976,-118.4334,Theft,Property Crime,Non-Violent Crimes,0.991547611
358210,22/06/2011,2011-06-22,Olympic,62,M,W,3100 W  4TH                          ST,34.0667,-118.2871,Assault,Bodily Harm,Violent Crimes,0.991376049
358406,01/10/2011,2011-09-15,Pacific,62,F,W,2300    BOONE                        AV,33.9874,-118.4588,Theft,Property Crime,Non-Violent Crimes,0.990861152
358414,01/12/2011,2011-12-01,Foothill,54,F,H,10800    KEWEN                        AV,34.2661,-118.4311,Theft,Property Crime,Non-Violent Crimes,0.990853922
358960,26/04/2011,2011-04-20,Southwest,35,F,B,ADAMS,34.0326,-118.335,Battery Crime,Bodily Harm,Violent Crimes,0.998800004
359006,26/11/2011,2011-11-26,Wilshire,50,F,W,1400    STEARNS                      DR,34.0524,-118.3711,Theft,Property Crime,Non-Violent Crimes,0.998152076
359265,25/05/2011,2011-05-25,Hollenbeck,33,F,O,4100    RAYNOL                       ST,34.0839,-118.1988,Theft,Property Crime,Non-Violent Crimes,0.993689646
359603,07/01/2011,2011-01-06,Topanga,85,F,W,8100    FARRALONE                    AV,34.2164,-118.6105,Theft,Property Crime,Non-Violent Crimes,0.999235701
360054,01/11/2011,2011-10-26,Mission,69,M,H,12900    GLADSTONE                    AV,34.3046,-118.4211,Theft,Property Crime,Non-Violent Crimes,0.994171484
360297,15/08/2011,2011-08-14,Mission,22,M,O,POLK                         ST,34.2992,-118.4592,Robbery,Robbery,Violent Crimes,0.994472369
360437,18/08/2011,2011-08-18,Northeast,15,M,H,RESERVOIR,34.08,-118.2647,Robbery,Robbery,Violent Crimes,0.999323981
360469,21/04/2011,2011-04-21,Central,24,F,H,600 S  SAN PEDRO                    ST,34.0423,-118.2452,Battery Crime,Bodily Harm,Violent Crimes,0.991505033
360866,12/12/2011,2011-12-12,Newton,21,M,H,300 W  47TH                         ST,34.0011,-118.2783,Theft,Property Crime,Non-Violent Crimes,0.99810084
361576,03/02/2011,2011-02-03,Wilshire,29,F,H,1900    CARMONA                      AV,34.0401,-118.3612,Theft,Property Crime,Non-Violent Crimes,0.997216124
361584,04/11/2011,2011-11-03,Mission,25,F,H,9700    KESTER                       AV,34.2466,-118.4566,Battery Crime,Bodily Harm,Violent Crimes,0.990707053
361700,17/08/2011,2011-08-17,West LA,45,F,W,300 S  BARRINGTON                   AV,34.0626,-118.4684,Theft,Property Crime,Non-Violent Crimes,0.997501414
361879,19/09/2011,2011-09-19,Foothill,46,M,X,12400    BIG TUJUNGA                  RD,34.2796,-118.3046,Theft,Property Crime,Non-Violent Crimes,0.992533044
361894,02/05/2011,2011-04-11,77th Street,72,F,B,9500    DENKER                       AV,33.9496,-118.3046,Fraud,White Collar Crime,Non-Violent Crimes,0.997874116
361989,26/11/2011,2011-11-26,Central,28,F,H,SPRING                       ST,34.0549,-118.2426,Assault,Bodily Harm,Violent Crimes,0.998107359
362165,17/08/2011,2011-08-17,West LA,38,M,W,2700    GLENDON                      AV,34.0352,-118.4231,Theft,Property Crime,Non-Violent Crimes,0.992526746
362298,05/12/2011,2011-12-04,N Hollywood,27,F,O,5400    FAIR                         AV,34.1685,-118.3743,Theft,Property Crime,Non-Violent Crimes,0.999888018
362300,15/04/2011,2011-04-15,West Valley,44,M,W,17400    VALERIO                      ST,34.2055,-118.5122,Theft,Property Crime,Non-Violent Crimes,0.994243788
362557,27/12/2011,2011-12-24,Northeast,34,F,H,100    SAN PASCUAL                  AV,34.1136,-118.1791,Assault,Bodily Harm,Violent Crimes,0.990179283
362730,06/02/2011,2011-02-04,Southwest,22,M,H,2600 S  VERMONT                      AV,34.0328,-118.2915,Theft,Property Crime,Non-Violent Crimes,0.993977867
363138,30/01/2011,2011-01-30,Harbor,34,F,B,100 S  GAFFEY                       ST,33.7433,-118.2923,Theft,Property Crime,Non-Violent Crimes,0.991738712
364036,27/11/2011,2011-11-27,77th Street,24,F,H,100 W  MANCHESTER                   AV,33.9601,-118.2739,Robbery,Robbery,Violent Crimes,0.996141501
364567,24/06/2011,2011-06-24,Hollenbeck,43,F,A,3100    PHELPS                       AV,34.081,-118.1769,Assault,Bodily Harm,Violent Crimes,0.991146718
364651,28/10/2011,2011-10-28,Southwest,41,F,B,4000 S  HARVARD                      BL,34.0109,-118.3067,Battery Crime,Bodily Harm,Violent Crimes,0.990693968
365123,02/03/2011,2011-03-01,Northeast,26,M,W,1500    SILVERWOOD                   TR,34.0857,-118.2683,Theft,Property Crime,Non-Violent Crimes,0.994519343
365293,30/12/2011,2011-12-20,Hollywood,55,F,O,2300    MOUNT OLYMPUS                DR,34.1132,-118.3694,Theft,Property Crime,Non-Violent Crimes,0.999587757
365395,30/06/2011,2011-06-30,Hollywood,47,M,W,SUNSET                       BL,34.098,-118.3479,Battery Crime,Bodily Harm,Violent Crimes,0.996211506
365477,06/06/2011,2011-06-06,N Hollywood,46,F,W,TUJUNGA                      AV,34.1504,-118.379,Battery Crime,Bodily Harm,Violent Crimes,0.99407306
365559,08/02/2011,2011-02-08,Devonshire,60,M,H,10000    DE SOTO                      AV,34.2518,-118.5886,Fraud,White Collar Crime,Non-Violent Crimes,0.996001666
365675,07/07/2011,2011-07-07,Rampart,24,M,H,1200    COURT                        ST,34.0629,-118.254,Assault,Bodily Harm,Violent Crimes,0.996258156
365750,26/07/2011,2011-07-22,Hollenbeck,36,M,H,3100    FAIRMOUNT                    ST,34.0482,-118.1951,Theft,Property Crime,Non-Violent Crimes,0.998105183
365962,04/11/2011,2011-11-04,West LA,40,M,W,1000    GAYLEY                       AV,34.062,-118.448,Assault,Bodily Harm,Violent Crimes,0.996250302
365971,15/01/2011,2011-01-15,Newton,14,M,H,MARTIN LUTHER KING JR        BL,34.0111,-118.2774,Assault,Bodily Harm,Violent Crimes,0.992355946
365993,03/08/2011,2011-08-03,Devonshire,33,M,H,CHASE                        ST,34.2246,-118.5361,Robbery,Robbery,Violent Crimes,0.997821673
366054,25/01/2011,2011-01-06,77th Street,26,F,H,900 W  54TH                         ST,33.9932,-118.2893,Theft,Property Crime,Non-Violent Crimes,0.999729361
366106,02/07/2011,2011-07-02,Hollywood,23,M,B,1700 N  CHEROKEE                     AV,34.1016,-118.3348,Assault,Bodily Harm,Violent Crimes,0.995667426
366269,07/04/2011,2011-04-06,Harbor,14,M,A,1300 W  182ND                        ST,33.8663,-118.2974,Battery Crime,Bodily Harm,Violent Crimes,0.995565008
366293,12/07/2011,2011-07-09,N Hollywood,27,M,H,13100    CREWE                        ST,34.1967,-118.4194,Battery Crime,Bodily Harm,Violent Crimes,0.997933731
366372,10/07/2011,2011-07-10,Northeast,24,F,H,SUNSET                       BL,34.0982,-118.2918,Robbery,Robbery,Violent Crimes,0.993077041
366542,12/09/2011,2011-09-12,Foothill,44,M,H,LAUREL CANYON                BL,34.2469,-118.4195,Assault,Bodily Harm,Violent Crimes,0.991810704
366617,13/07/2011,2011-07-13,77th Street,43,M,H,7600 S  SAN PEDRO                    ST,33.9713,-118.2695,Battery Crime,Bodily Harm,Violent Crimes,0.998272317
366813,20/11/2011,2011-11-19,Pacific,12,F,W,13200    FIJI                         WY,33.981,-118.4332,Theft,Property Crime,Non-Violent Crimes,0.994447063
367165,31/03/2011,2011-03-29,West LA,51,M,W,700    AMALFI                       DR,34.0409,-118.5118,Theft,Property Crime,Non-Violent Crimes,0.996785051
367247,06/07/2011,2011-07-06,Southwest,19,F,W,2500    CRENSHAW                     BL,34.0337,-118.3344,Battery Crime,Bodily Harm,Violent Crimes,0.993191503
367728,20/04/2011,2011-04-19,N Hollywood,47,F,H,6800    WHITSETT                     AV,34.194,-118.4052,Battery Crime,Bodily Harm,Violent Crimes,0.992716734
367793,05/02/2011,2011-02-05,Topanga,26,M,W,6600    TOPANGA CANYON               BL,34.1905,-118.6059,Theft,Property Crime,Non-Violent Crimes,0.993547326
367928,11/02/2011,2011-02-11,Rampart,19,F,H,1200    HUNTLEY                      DR,34.0584,-118.2571,Robbery,Robbery,Violent Crimes,0.990119406
368301,06/05/2011,2011-05-06,Rampart,30,F,W,LAKE                         ST,34.0522,-118.281,Assault,Bodily Harm,Violent Crimes,0.999743089
368426,03/08/2011,2011-07-19,West LA,66,F,W,2000 S  BEDFORD                      ST,34.0416,-118.3836,Theft,Property Crime,Non-Violent Crimes,0.997810907
368475,16/03/2011,2011-03-14,West LA,28,M,H,2300 S  CORNING                      ST,34.0391,-118.3802,Theft,Property Crime,Non-Violent Crimes,0.999659663
368492,16/01/2011,2011-01-16,Rampart,55,F,H,2000 W  6TH                          ST,34.059,-118.2736,Robbery,Robbery,Violent Crimes,0.999911895
368499,22/07/2011,2011-07-22,Southwest,28,M,A,2900 S  FIGUEROA                     ST,34.0258,-118.2775,Battery Crime,Bodily Harm,Violent Crimes,0.997308891
368564,02/01/2011,2011-01-01,Harbor,48,M,B,1500 W  204TH                        ST,33.8449,-118.304,Assault,Bodily Harm,Violent Crimes,0.993532399
368622,21/06/2011,2011-06-21,Foothill,58,M,W,11200    LULL                         ST,34.2094,-118.3747,Battery Crime,Bodily Harm,Violent Crimes,0.994289773
368749,22/06/2011,2011-06-22,West Valley,50,M,B,18500    SHERMAN                      WY,34.2011,-118.536,Robbery,Robbery,Violent Crimes,0.998840462
368836,10/04/2011,2011-04-10,Southwest,32,F,B,3800    FLOWER                       DR,34.0158,-118.2816,Assault,Bodily Harm,Violent Crimes,0.996277476
368960,31/01/2011,2011-01-30,Southwest,20,F,B,600 W  41ST                         PL,34.0079,-118.2842,Assault,Bodily Harm,Violent Crimes,0.992023824
369103,31/08/2011,2011-08-31,Southeast,30,F,H,100 E  COLDEN                       AV,33.9492,-118.2739,Theft,Property Crime,Non-Violent Crimes,0.993770604
369151,25/11/2011,2011-11-25,West Valley,21,F,B,6800    ENCINO                       AV,34.1939,-118.5142,Assault,Bodily Harm,Violent Crimes,0.998051719
369292,27/05/2011,2011-05-23,Southwest,38,M,B,4100    MUIRFIELD                    RD,34.0111,-118.3477,Theft,Property Crime,Non-Violent Crimes,0.995530253
369871,25/12/2011,2011-12-25,Southeast,23,F,B,700 W  113TH                        ST,33.9322,-118.2869,Battery Crime,Bodily Harm,Violent Crimes,0.995738058
370013,22/10/2011,2011-10-21,Southeast,55,F,B,100 W  112TH                        ST,33.933,-118.2739,Assault,Bodily Harm,Violent Crimes,0.997888814
370098,21/06/2012,2011-09-06,Southeast,43,F,H,2200 E  99TH                         PL,33.9472,-118.2328,Theft,Property Crime,Non-Violent Crimes,0.990987308
370145,01/01/2012,2011-12-31,N Hollywood,30,F,H,13000    VANOWEN                      ST,34.194,-118.4163,Theft,Property Crime,Non-Violent Crimes,0.991393229
370225,20/01/2011,2011-01-20,Southeast,16,M,H,IMPERIAL                     HY,33.9295,-118.2462,Assault,Bodily Harm,Violent Crimes,0.997964363
370252,20/04/2011,2011-04-20,Foothill,56,F,W,11000    WOODWARD                     AV,34.2691,-118.3071,Assault,Bodily Harm,Violent Crimes,0.997215928
370282,26/04/2011,2011-04-25,Wilshire,18,M,H,1800    12TH                         AV,34.0412,-118.3279,Theft,Property Crime,Non-Violent Crimes,0.992047298
370624,25/03/2011,2011-03-23,Southwest,17,M,B,900 W  41ST                         ST,34.0092,-118.29,Assault,Bodily Harm,Violent Crimes,0.998230882
370848,08/05/2011,2011-05-07,Rampart,53,M,H,1700    TOBERMAN                     ST,34.0398,-118.278,Theft,Property Crime,Non-Violent Crimes,0.992802161
371422,23/01/2011,2011-01-23,Olympic,16,M,H,300 S  VERMONT                      AV,34.0691,-118.2917,Assault,Bodily Harm,Violent Crimes,0.993034962
371788,04/05/2011,2011-05-04,West LA,16,M,B,2000    CHARITON                     ST,34.0406,-118.378,Assault,Bodily Harm,Violent Crimes,0.995649992
372142,12/12/2011,2011-12-12,Northeast,47,M,B,1300 N  VERMONT                      AV,34.0956,-118.2918,Battery Crime,Bodily Harm,Violent Crimes,0.993816838
372186,13/12/2016,2011-01-01,Harbor,51,F,H,22300    HARVARD                      BL,33.8245,-118.3064,Theft,Property Crime,Non-Violent Crimes,0.99128359
372273,24/03/2011,2011-03-03,Devonshire,53,M,H,17900    CHASE                        ST,34.2246,-118.523,Theft,Property Crime,Non-Violent Crimes,0.997366588
372522,11/01/2011,2011-01-10,Topanga,57,F,O,22200    HART                         ST,34.1974,-118.6103,Theft,Property Crime,Non-Violent Crimes,0.990772854
372668,07/10/2011,2011-10-07,Hollenbeck,10,M,H,1500    MURCHISON                    ST,34.0594,-118.1958,Battery Crime,Bodily Harm,Violent Crimes,0.999793159
372961,21/10/2011,2011-10-11,Foothill,44,M,W,8300    DE GARMO                     AV,34.2222,-118.3607,Robbery,Robbery,Violent Crimes,0.99112435
373299,28/12/2011,2011-12-28,Rampart,47,M,H,1300    ALLISON                      AV,34.0729,-118.2512,Theft,Property Crime,Non-Violent Crimes,0.991883919
373416,23/08/2011,2011-08-23,Pacific,26,F,W,WESTMINSTER,33.9885,-118.475,Battery Crime,Bodily Harm,Violent Crimes,0.998167538
373697,11/12/2011,2011-12-11,West LA,43,M,W,10400    WILSHIRE                     BL,34.0669,-118.4288,Battery Crime,Bodily Harm,Violent Crimes,0.998665657
374003,16/02/2011,2011-02-15,77th Street,19,M,H,CRENSHAW                     BL,33.9806,-118.3309,Robbery,Robbery,Violent Crimes,0.994962021
374067,07/06/2011,2011-06-07,Topanga,20,M,X,6100    TOPANGA CANYON               BL,34.1811,-118.6059,Theft,Property Crime,Non-Violent Crimes,0.994651377
374321,21/11/2011,2011-11-16,Rampart,39,F,H,800 S  ALVARADO                     ST,34.0549,-118.2778,Rape,Rape,Violent Crimes,0.993623733
374514,26/08/2011,2011-07-10,Southeast,25,F,B,300 E  104TH                        ST,33.9419,-118.2695,Rape,Rape,Violent Crimes,0.995877992
374554,14/03/2011,2011-02-24,77th Street,27,F,B,6100 S  VICTORIA                     AV,33.9846,-118.3323,Theft,Property Crime,Non-Violent Crimes,0.99548493
374933,14/10/2011,2011-10-13,Rampart,49,M,H,1200 W  8TH                          ST,34.0496,-118.2677,Theft,Property Crime,Non-Violent Crimes,0.99285606
375025,08/02/2012,2011-12-12,N Hollywood,36,M,B,5300    WHITSETT                     AV,34.1668,-118.4052,Theft,Property Crime,Non-Violent Crimes,0.993128803
375054,16/11/2016,2011-01-01,Southeast,62,F,H,10000    BEACH                        ST,33.9457,-118.2419,Theft,Property Crime,Non-Violent Crimes,0.994019188
375311,16/02/2011,2011-02-16,Foothill,47,F,B,BRADLEY,34.2697,-118.4191,Assault,Bodily Harm,Violent Crimes,0.990316664
375335,15/04/2011,2011-04-14,Central,35,F,O,4TH                          ST,34.0488,-118.2483,Theft,Property Crime,Non-Violent Crimes,0.999001524
375492,17/09/2011,2011-09-16,Rampart,52,M,B,BEVERLY,34.0695,-118.2768,Battery Crime,Bodily Harm,Violent Crimes,0.994341961
375502,17/03/2011,2011-03-14,Central,32,F,B,7TH                          ST,34.0407,-118.2468,Assault,Bodily Harm,Violent Crimes,0.995919124
375515,30/08/2011,2011-08-26,Southeast,34,M,H,10500    GRAPE                        ST,33.9406,-118.2369,Theft,Property Crime,Non-Violent Crimes,0.998893644
375535,21/09/2011,2011-09-20,77th Street,19,F,B,1900 W  FLORENCE                     AV,33.9746,-118.3112,Battery Crime,Bodily Harm,Violent Crimes,0.995595606
375566,25/07/2011,2011-07-25,77th Street,41,F,B,4700 S  FIGUEROA                     ST,34.0009,-118.2827,Robbery,Robbery,Violent Crimes,0.996128998
375640,04/08/2011,2011-07-25,Rampart,64,M,W,700 N  KENMORE                      AV,34.0836,-118.297,Theft,Property Crime,Non-Violent Crimes,0.99898242
375862,22/06/2011,2011-06-21,Pacific,34,M,B,7100    ALVERN                       ST,33.975,-118.3774,Theft,Property Crime,Non-Violent Crimes,0.999480819
376217,10/08/2011,2011-08-10,Southwest,32,M,B,3800    DUBLIN                       AV,34.0173,-118.3224,Battery Crime,Bodily Harm,Violent Crimes,0.991701603
376433,25/01/2012,2011-12-01,West LA,29,F,W,2100    AVENUE OF THE STARS,34.0565,-118.4138,Fraud,White Collar Crime,Non-Violent Crimes,0.993550468
376948,27/07/2011,2011-07-26,Hollywood,28,M,O,6500    YUCCA                        ST,34.1039,-118.3311,Theft,Property Crime,Non-Violent Crimes,0.990521766
377192,10/11/2011,2011-11-10,Topanga,31,F,W,21700    VICTORY                      BL,34.1878,-118.6015,Theft,Property Crime,Non-Violent Crimes,0.998876843
377265,01/08/2011,2011-07-29,N Hollywood,50,M,W,12200    HESBY                        ST,34.1622,-118.3985,Theft,Property Crime,Non-Violent Crimes,0.998743239
377281,10/02/2011,2011-02-10,Van Nuys,27,F,H,13500    VICTORY                      BL,34.1867,-118.4268,Theft,Property Crime,Non-Violent Crimes,0.999318488
377386,28/08/2011,2011-08-28,Pacific,26,F,W,WINDWARD,33.9869,-118.4736,Theft,Property Crime,Non-Violent Crimes,0.993408309
377610,23/07/2011,2011-07-22,Topanga,16,M,B,22200    VICTORY                      BL,34.1865,-118.6103,Theft,Property Crime,Non-Violent Crimes,0.999745916
377703,28/12/2011,2011-12-28,Olympic,14,M,H,7TH,34.0597,-118.302,Theft,Property Crime,Non-Violent Crimes,0.997715412
377743,30/04/2011,2011-04-30,Newton,42,M,O,SAN PEDRO                    ST,33.9975,-118.2696,Assault,Bodily Harm,Violent Crimes,0.994988083
377907,19/01/2011,2011-01-13,Pacific,80,F,W,5300    PLAYA VISTA                  DR,33.9775,-118.4292,Theft,Property Crime,Non-Violent Crimes,0.999399586
378037,19/03/2014,2011-04-05,Topanga,39,F,W,4700    NATOMA                       AV,34.1555,-118.5794,Theft,Property Crime,Non-Violent Crimes,0.995599313
378095,11/06/2011,2011-06-11,N Hollywood,28,F,W,12000    VENTURA                      PL,34.1437,-118.3929,Theft,Property Crime,Non-Violent Crimes,0.992603809
378470,21/05/2011,2011-05-21,Mission,29,M,H,10000    ARLETA                       AV,34.252,-118.4365,Theft,Property Crime,Non-Violent Crimes,0.995391629
378486,03/11/2011,2011-11-01,Wilshire,47,M,B,4500 W  12TH                         ST,34.0519,-118.3324,Theft,Property Crime,Non-Violent Crimes,0.998980177
378730,13/01/2012,2011-11-12,Harbor,27,M,W,1900 W  1ST                          ST,33.7431,-118.3175,Theft,Property Crime,Non-Violent Crimes,0.997633091
378786,30/08/2011,2011-08-29,Olympic,34,F,K,3600    WILSHIRE                     BL,34.0617,-118.3048,Theft,Property Crime,Non-Violent Crimes,0.994844403
378874,20/06/2011,2011-06-18,Devonshire,43,F,W,17800    HALSTED                      ST,34.2449,-118.5216,Theft,Property Crime,Non-Violent Crimes,0.999869292
379345,20/01/2011,2011-01-19,Wilshire,44,F,B,5800 W  OLYMPIC                      BL,34.0575,-118.3559,Theft,Property Crime,Non-Violent Crimes,0.997733348
379658,11/05/2011,2011-05-10,77th Street,12,F,B,SLAUSON                      AV,33.989,-118.3308,Battery Crime,Bodily Harm,Violent Crimes,0.991340829
379775,10/06/2011,2011-06-09,West Valley,54,M,W,18600    COLLINS                      ST,34.1745,-118.5384,Theft,Property Crime,Non-Violent Crimes,0.993170924
379907,08/02/2011,2011-02-08,Topanga,32,M,X,21400    VICTORY                      BL,34.1884,-118.5975,Theft,Property Crime,Non-Violent Crimes,0.993938749
380055,05/03/2011,2011-03-04,Hollenbeck,45,F,W,WHITTIER                     BL,34.0323,-118.2111,Robbery,Robbery,Violent Crimes,0.991551921
380094,16/01/2011,2011-01-15,Hollenbeck,29,M,W,2500    LOMBARDY                     BL,34.0759,-118.1738,Theft,Property Crime,Non-Violent Crimes,0.996456502
380159,31/10/2011,2011-10-31,Wilshire,25,F,W,600 N  LUCERNE                      BL,34.0817,-118.3249,Theft,Property Crime,Non-Violent Crimes,0.998380758
380440,31/05/2011,2011-05-31,Van Nuys,33,M,W,GREENLEAF,34.1471,-118.4411,Robbery,Robbery,Violent Crimes,0.997991927
380482,03/12/2011,2011-11-29,Foothill,29,F,B,11000    CHIVERS                      AV,34.2702,-118.4008,Fraud,White Collar Crime,Non-Violent Crimes,0.997324089
381045,09/10/2011,2011-10-08,Rampart,49,F,W,500 S  RAMPART                      BL,34.0636,-118.2805,Theft,Property Crime,Non-Violent Crimes,0.990700486
381236,04/06/2011,2011-06-03,Olympic,33,M,H,900    MENLO                        AV,34.055,-118.2904,Theft,Property Crime,Non-Violent Crimes,0.992808605
381297,02/09/2011,2011-09-02,Van Nuys,33,M,W,SHERMAN                      WY,34.2012,-118.4706,Assault,Bodily Harm,Violent Crimes,0.998015465
381353,07/09/2011,2011-09-07,Harbor,21,M,H,2100 N  GAFFEY                       ST,33.7639,-118.2934,Theft,Property Crime,Non-Violent Crimes,0.990421575
381743,19/02/2011,2011-02-19,Rampart,24,M,H,1900 W  2ND                          ST,34.0644,-118.2686,Assault,Bodily Harm,Violent Crimes,0.993221394
381881,06/07/2011,2011-07-06,Southwest,32,F,B,5400    SMILEY                       DR,34.029,-118.3622,Battery Crime,Bodily Harm,Violent Crimes,0.992265366
381937,22/09/2011,2011-09-22,Topanga,50,M,O,20600    KITTRIDGE                    ST,34.1905,-118.5824,Theft,Property Crime,Non-Violent Crimes,0.993686428
381989,20/10/2011,2011-10-17,Van Nuys,21,F,H,7200    KESTER                       AV,34.2012,-118.4574,Theft,Property Crime,Non-Violent Crimes,0.991190854
382208,11/08/2011,2011-08-10,West LA,25,F,H,1400    WESTWOOD                     BL,34.0554,-118.4418,Fraud,White Collar Crime,Non-Violent Crimes,0.998813512
382301,01/04/2011,2011-04-01,Harbor,70,M,W,2300 S  PATTON                       AV,33.7234,-118.3056,Theft,Property Crime,Non-Violent Crimes,0.993024073
382351,12/12/2011,2011-11-24,Van Nuys,26,F,W,14200    DELANO                       ST,34.1827,-118.4422,Assault,Bodily Harm,Violent Crimes,0.991256223
382378,03/02/2011,2011-02-02,Pacific,32,F,W,200    WESTMINSTER                  AV,33.9901,-118.4726,Theft,Property Crime,Non-Violent Crimes,0.993796256
382384,21/05/2011,2011-05-21,Central,13,M,H,1200    LILAC                        PL,34.0721,-118.2479,Assault,Bodily Harm,Violent Crimes,0.992418886
382414,16/05/2011,2011-05-15,N Hollywood,38,F,H,4000    LANKERSHIM                   BL,34.1416,-118.361,Theft,Property Crime,Non-Violent Crimes,0.999476169
382691,05/11/2011,2011-11-03,Mission,31,M,H,15000    NORTHWIND                    LN,34.2389,-118.4588,Theft,Property Crime,Non-Violent Crimes,0.990086664
383004,30/06/2011,2011-06-30,Topanga,27,M,W,6400    FALLBROOK                    AV,34.1864,-118.6234,Theft,Property Crime,Non-Violent Crimes,0.995581288
383040,30/10/2011,2011-10-29,Wilshire,29,F,B,4600    LOMITA                       ST,34.0459,-118.3374,Theft,Property Crime,Non-Violent Crimes,0.994574502
383426,04/05/2011,2011-04-30,Pacific,22,F,O,7400    LA TIJERA                    BL,33.9706,-118.3794,Theft,Property Crime,Non-Violent Crimes,0.998600819
383546,20/12/2011,2011-12-20,Southeast,24,F,B,800 E  IMPERIAL                     HY,33.9309,-118.2603,Assault,Bodily Harm,Violent Crimes,0.997191627
383787,26/07/2011,2011-07-24,West Valley,55,M,W,4900    ODESSA                       AV,34.1587,-118.4912,Theft,Property Crime,Non-Violent Crimes,0.996224517
383899,27/03/2011,2011-03-27,Newton,23,F,B,100 E  FLORENCE                     AV,33.9747,-118.2739,Rape,Rape,Violent Crimes,0.993521574
383904,30/09/2011,2011-09-21,West LA,22,F,H,3100 S  HALM                         AV,34.0335,-118.3846,Rape,Rape,Violent Crimes,0.991961709
383967,06/10/2011,2011-09-30,Southeast,30,M,B,10500    AVALON                       BL,33.941,-118.2652,Theft,Property Crime,Non-Violent Crimes,0.991917681
384437,24/07/2011,2011-07-21,Wilshire,63,F,O,400 N  CROFT                        AV,34.0782,-118.3742,Theft,Property Crime,Non-Violent Crimes,0.991118319
384582,02/02/2011,2011-01-31,Northeast,58,F,W,4900 W  SUNSET                       BL,34.0982,-118.2961,Theft,Property Crime,Non-Violent Crimes,0.998431802
384856,30/09/2011,2011-09-30,Mission,16,M,H,ASTORIA,34.3129,-118.4373,Theft,Property Crime,Non-Violent Crimes,0.995881446
385552,24/07/2011,2011-07-23,Topanga,52,M,W,7000    JUMILLA                      AV,34.1975,-118.5634,Theft,Property Crime,Non-Violent Crimes,0.996089375
385693,08/09/2011,2011-09-05,Devonshire,21,M,A,10400    DENSMORE                     AV,34.2594,-118.4783,Theft,Property Crime,Non-Violent Crimes,0.990630587
385957,29/05/2011,2011-05-28,Rampart,26,F,W,700    GARLAND                      AV,34.0517,-118.2663,Theft,Property Crime,Non-Violent Crimes,0.993930912
385981,17/07/2011,2011-07-17,Hollenbeck,56,F,W,4900    TEMPLETON                    ST,34.082,-118.1769,Assault,Bodily Harm,Violent Crimes,0.994703406
386388,23/04/2011,2011-04-23,77th Street,42,F,B,600 E  78TH                         ST,33.9684,-118.2651,Battery Crime,Bodily Harm,Violent Crimes,0.999908426
386397,18/10/2011,2011-10-10,Wilshire,25,M,W,500 S  RIMPAU                       BL,34.0653,-118.331,Theft,Property Crime,Non-Violent Crimes,0.991845278
386639,24/07/2012,2011-03-01,77th Street,42,M,H,1100 W  60TH                         ST,33.9859,-118.2937,Theft,Property Crime,Non-Violent Crimes,0.999622557
386688,19/05/2011,2011-05-18,Van Nuys,50,M,H,5000    VAN NUYS                     BL,34.1613,-118.4486,Theft,Property Crime,Non-Violent Crimes,0.996576759
386747,09/08/2011,2011-08-09,Southwest,24,F,B,NORMANDIE,34.0109,-118.3002,Robbery,Robbery,Violent Crimes,0.993328218
386782,30/05/2011,2011-05-24,West LA,22,M,W,11600    CHENAULT                     ST,34.0582,-118.4657,Theft,Property Crime,Non-Violent Crimes,0.998661177
386945,09/08/2011,2011-08-06,77th Street,30,F,H,6400 S  HOOVER                       ST,33.9811,-118.287,Theft,Property Crime,Non-Violent Crimes,0.998950057
386963,28/01/2011,2011-01-28,Southwest,52,M,B,1800 W  38TH                         PL,34.0165,-118.3132,Theft,Property Crime,Non-Violent Crimes,0.998903533
386970,31/12/2011,2011-12-29,Mission,36,M,H,14000    COMMUNITY                    ST,34.2226,-118.4383,Theft,Property Crime,Non-Violent Crimes,0.99184588
387461,01/04/2011,2011-04-01,Central,44,F,B,1500 S  OLIVE                        ST,34.0359,-118.2648,Battery Crime,Bodily Harm,Violent Crimes,0.992074506
387779,13/04/2011,2011-04-13,Devonshire,25,F,H,8300    TAMPA                        AV,34.2205,-118.5536,Assault,Bodily Harm,Violent Crimes,0.992325431
387807,19/07/2011,2011-07-19,Harbor,19,F,H,1ST,33.7433,-118.2923,Assault,Bodily Harm,Violent Crimes,0.992920999
387883,21/11/2011,2011-11-20,West Valley,53,M,H,7700    TAMPA                        AV,34.2102,-118.5535,Theft,Property Crime,Non-Violent Crimes,0.997970551
387936,09/01/2011,2011-01-09,Topanga,28,M,H,VANOWEN,34.1938,-118.5884,Battery Crime,Bodily Harm,Violent Crimes,0.997973318
388046,13/02/2011,2011-02-13,Rampart,23,M,B,600 S  CARONDELET                   ST,34.0616,-118.2795,Battery Crime,Bodily Harm,Violent Crimes,0.999507114
388886,04/06/2011,2011-06-04,Newton,18,F,B,200 W  57TH                         ST,33.9906,-118.2761,Assault,Bodily Harm,Violent Crimes,0.994948208
388905,26/06/2011,2011-06-26,Newton,25,F,H,300 E  64TH                         ST,33.9815,-118.2695,Battery Crime,Bodily Harm,Violent Crimes,0.996088688
388906,23/06/2011,2011-06-22,Hollywood,31,M,W,6800    FOUNTAIN                     AV,34.0944,-118.3386,Theft,Property Crime,Non-Violent Crimes,0.991344808
388970,26/08/2011,2011-08-19,Newton,41,M,W,200 W  42ND                         ST,34.0073,-118.2762,Theft,Property Crime,Non-Violent Crimes,0.998385474
389053,14/02/2011,2011-02-13,Wilshire,28,F,H,4500    SAINT CHARLES                PL,34.0443,-118.3355,Theft,Property Crime,Non-Violent Crimes,0.996233879
389422,20/05/2011,2011-05-18,West Valley,73,M,O,18300    CLARK                        ST,34.1698,-118.5308,Theft,Property Crime,Non-Violent Crimes,0.997258638
389893,15/11/2011,2011-11-15,77th Street,56,F,B,4200 W  59TH                         ST,33.9871,-118.3475,Theft,Property Crime,Non-Violent Crimes,0.993140623
389911,28/08/2011,2011-08-28,Foothill,18,M,H,11500    KAMLOOPS                     ST,34.2771,-118.382,Assault,Bodily Harm,Violent Crimes,0.999914107
389934,25/08/2011,2011-08-24,N Hollywood,39,M,O,5200    HARMONY                      AV,34.1649,-118.3664,Battery Crime,Bodily Harm,Violent Crimes,0.996932059
389961,04/09/2011,2011-09-03,Wilshire,73,M,B,2300 S  COCHRAN                      AV,34.0371,-118.3566,Battery Crime,Bodily Harm,Violent Crimes,0.993623446
390191,16/11/2011,2011-06-17,Hollywood,58,M,W,1300 N  SIERRA BONITA                AV,34.0944,-118.3539,Theft,Property Crime,Non-Violent Crimes,0.997295379
390224,01/02/2016,2011-01-01,Wilshire,85,M,H,1700 S  MARVIN                       AV,34.0436,-118.3611,Theft,Property Crime,Non-Violent Crimes,0.994400373
390559,14/02/2011,2011-02-13,Van Nuys,49,M,H,14500    ARCHWOOD                     ST,34.193,-118.4487,Theft,Property Crime,Non-Violent Crimes,0.992300445
390664,09/02/2011,2011-02-09,Pacific,39,M,W,11500    BRADDOCK                     DR,33.9988,-118.41,Theft,Property Crime,Non-Violent Crimes,0.994083259
390987,19/04/2011,2011-04-19,Topanga,56,M,X,6400    FALLBROOK                    AV,34.1864,-118.6234,Counterfeiting,White Collar Crime,Non-Violent Crimes,0.99438105
391354,21/09/2011,2011-08-30,Devonshire,23,M,O,11300    YOLANDA                      AV,34.2762,-118.5453,Fraud,White Collar Crime,Non-Violent Crimes,0.994828899
391530,20/02/2011,2011-02-20,Southwest,60,M,H,1200 W  42ND                         ST,34.0073,-118.2959,Theft,Property Crime,Non-Violent Crimes,0.991709249
391795,08/03/2011,2011-03-07,Southeast,27,M,B,100 E  118TH                        PL,33.9256,-118.2739,Assault,Bodily Harm,Violent Crimes,0.999836392
392032,02/11/2011,2011-11-02,Southwest,36,F,O,HOOVER,34.0352,-118.284,Theft,Property Crime,Non-Violent Crimes,0.993461904
392077,15/11/2011,2011-11-15,Central,23,F,H,7TH,34.0419,-118.2485,Battery Crime,Bodily Harm,Violent Crimes,0.990828287
392128,03/09/2011,2011-09-02,Southwest,48,F,B,4100    CRENSHAW                     BL,34.0102,-118.3351,Theft,Property Crime,Non-Violent Crimes,0.994119213
392263,08/02/2011,2011-02-06,Southwest,27,M,B,1700 W  42ND                         ST,34.0073,-118.3089,Battery Crime,Bodily Harm,Violent Crimes,0.997363529
392561,08/07/2011,2011-07-08,Devonshire,54,M,W,9400    GEYSER                       AV,34.2405,-118.5425,Battery Crime,Bodily Harm,Violent Crimes,0.994624276
392574,30/03/2011,2011-03-29,Rampart,28,M,W,2500    KENT                         ST,34.0767,-118.2707,Theft,Property Crime,Non-Violent Crimes,0.99334793
392927,01/08/2011,2011-08-01,Harbor,40,M,H,AVALON                       BL,33.7812,-118.2625,Robbery,Robbery,Violent Crimes,0.991994485
393010,20/08/2011,2011-07-27,Hollenbeck,53,F,H,500 S  BERNAL                       AV,34.0328,-118.1993,Theft,Property Crime,Non-Violent Crimes,0.991813622
393210,11/05/2011,2011-05-05,West LA,35,F,W,3000    OAKHURST                     AV,34.0351,-118.3955,Theft,Property Crime,Non-Violent Crimes,0.997718185
393251,22/08/2011,2011-08-22,Hollenbeck,66,M,H,1100 S  CONCORD                      ST,34.0248,-118.2054,Battery Crime,Bodily Harm,Violent Crimes,0.994525803
393275,07/05/2011,2011-05-06,77th Street,41,M,B,5700 S  GRAMERCY                     PL,33.991,-118.3138,Assault,Bodily Harm,Violent Crimes,0.992960491
393488,23/03/2011,2011-03-23,Devonshire,38,M,W,9500    HAYVENHURST                  AV,34.243,-118.4937,Theft,Property Crime,Non-Violent Crimes,0.999061497
393585,29/06/2011,2011-06-27,Mission,54,M,H,11400    LAUREL CANYON                BL,34.2768,-118.4513,Theft,Property Crime,Non-Violent Crimes,0.996936275
393722,28/05/2011,2011-05-27,West Valley,23,F,H,7900    ETIWANDA                     AV,34.2139,-118.5317,Assault,Bodily Harm,Violent Crimes,0.99806285
394051,15/05/2011,2011-05-12,West Valley,48,M,W,19200    VICTORY                      BL,34.1866,-118.5516,Theft,Property Crime,Non-Violent Crimes,0.994107207
394790,21/11/2011,2011-11-15,West LA,21,F,W,900 S  BRINGHAM                     AV,34.0551,-118.4629,Theft,Property Crime,Non-Violent Crimes,0.997754241
394848,01/01/2012,2011-12-31,Southeast,25,F,B,300 W  120TH                        ST,33.9237,-118.2782,Theft,Property Crime,Non-Violent Crimes,0.994840356
395003,12/03/2012,2011-12-30,Devonshire,76,M,W,16800    LAHEY                        ST,34.273,-118.4977,Theft,Property Crime,Non-Violent Crimes,0.997565555
395193,19/02/2011,2011-02-19,Southwest,51,M,H,2900 S  SYCAMORE                     AV,34.0279,-118.3561,Battery Crime,Bodily Harm,Violent Crimes,0.997249892
395288,10/03/2011,2011-03-09,Central,32,M,W,600 N  HILL                         ST,34.0591,-118.2412,Assault,Bodily Harm,Violent Crimes,0.995463389
395334,03/04/2011,2011-04-03,Harbor,27,F,H,300 W  OLIVER                       ST,33.7469,-118.2835,Assault,Bodily Harm,Violent Crimes,0.997766062
395353,24/06/2011,2011-06-23,Rampart,40,M,H,200    COLUMBIA                     AV,34.0612,-118.2628,Theft,Property Crime,Non-Violent Crimes,0.991627786
395586,24/01/2011,2011-01-10,Southwest,66,F,O,1900 W  JEFFERSON                    BL,34.0256,-118.312,Fraud,White Collar Crime,Non-Violent Crimes,0.990912335
395617,31/08/2011,2011-08-31,Topanga,37,M,O,23700    CALIFA                       ST,34.1779,-118.643,Embezzlement,Property Crime,Non-Violent Crimes,0.9998576
396073,09/05/2011,2011-05-06,Pacific,27,F,W,ROSE,33.9976,-118.4751,Theft,Property Crime,Non-Violent Crimes,0.99097201
396179,05/11/2011,2011-11-04,77th Street,19,M,H,600 W  53RD                         ST,33.9942,-118.2842,Assault,Bodily Harm,Violent Crimes,0.991996622
396279,13/05/2011,2011-04-05,West LA,31,M,W,1800 S  LA CIENEGA                   BL,34.0445,-118.3768,Fraud,White Collar Crime,Non-Violent Crimes,0.997753016
396468,03/01/2011,2011-01-03,West LA,54,M,W,11100    MONTANA                      AV,34.0704,-118.455,Theft,Property Crime,Non-Violent Crimes,0.998620947
396500,25/02/2011,2011-02-25,Devonshire,45,M,H,19400    BLACKHAWK                    ST,34.258,-118.5561,Assault,Bodily Harm,Violent Crimes,0.997515123
396589,30/04/2011,2011-04-30,Harbor,27,F,H,GAFFEY,33.7433,-118.2923,Assault,Bodily Harm,Violent Crimes,0.999206443
396931,28/01/2011,2011-01-28,Devonshire,42,M,I,10000    HANNA                        AV,34.2515,-118.6075,Theft,Property Crime,Non-Violent Crimes,0.996777344
396960,04/10/2011,2011-07-28,Van Nuys,57,F,W,15100    MAGNOLIA                     BL,34.1649,-118.4618,Theft,Property Crime,Non-Violent Crimes,0.99852034
397105,21/01/2011,2011-01-14,West Valley,39,M,O,19200    VICTORY                      BL,34.1866,-118.5516,Theft,Property Crime,Non-Violent Crimes,0.993451134
397108,15/08/2011,2011-08-15,Rampart,21,F,H,1600 W  3RD                          ST,34.0599,-118.2655,Assault,Bodily Harm,Violent Crimes,0.990307199
397167,11/08/2011,2011-08-09,Southeast,25,F,B,108TH                        ST,33.9383,-118.2652,Battery Crime,Bodily Harm,Violent Crimes,0.993565752
397229,30/12/2011,2011-12-30,Hollywood,41,F,H,1000 N  SERRANO                      AV,34.0885,-118.3064,Robbery,Robbery,Violent Crimes,0.992046041
397290,23/02/2011,2011-02-22,77th Street,23,M,B,1000 W  64TH                         ST,33.9815,-118.2918,Assault,Bodily Harm,Violent Crimes,0.99922954
397387,09/11/2011,2011-11-08,77th Street,31,F,B,900 W  74TH                         ST,33.9727,-118.2893,Battery Crime,Bodily Harm,Violent Crimes,0.999393539
397622,05/05/2011,2011-05-02,Southeast,65,F,B,2300    SANTA ANA                    BL,33.9346,-118.2317,Battery Crime,Bodily Harm,Violent Crimes,0.997815831
397831,03/09/2011,2011-09-03,Mission,26,M,H,CHASE                        ST,34.2247,-118.4677,Robbery,Robbery,Violent Crimes,0.990947557
397908,02/06/2011,2011-06-02,Hollywood,68,M,O,1600 N  HOBART                       BL,34.1,-118.3056,Assault,Bodily Harm,Violent Crimes,0.992744478
397998,24/04/2011,2011-04-24,Hollenbeck,40,F,H,MARENGO,34.0556,-118.205,Theft,Property Crime,Non-Violent Crimes,0.991118704
398042,11/06/2011,2011-06-11,Wilshire,32,F,A,300 N  ALFRED                       ST,34.0761,-118.3753,Theft,Property Crime,Non-Violent Crimes,0.993562582
398117,22/11/2011,2011-11-21,77th Street,10,M,B,84TH                         ST,33.9625,-118.3003,Assault,Bodily Harm,Violent Crimes,0.990248044
398125,05/05/2011,2011-05-05,Harbor,48,M,B,600 W  22ND                         ST,33.7243,-118.2902,Battery Crime,Bodily Harm,Violent Crimes,0.996402603
398309,17/05/2011,2011-05-16,Newton,26,F,H,1200 E  43RD                         ST,34.0058,-118.2538,Battery Crime,Bodily Harm,Violent Crimes,0.998435043
398877,12/10/2011,2011-10-12,Van Nuys,33,F,A,13300    VALLEYHEART                  DR,34.149,-118.4225,Theft,Property Crime,Non-Violent Crimes,0.995118234
399098,01/07/2011,2011-06-26,Central,45,M,H,MAGDALENA                    ST,34.0643,-118.2299,Theft,Property Crime,Non-Violent Crimes,0.991370998
399213,23/06/2011,2011-06-23,N Hollywood,58,M,W,KITTRIDGE,34.1973,-118.4116,Theft,Property Crime,Non-Violent Crimes,0.995195486
399292,09/09/2011,2011-09-09,Devonshire,18,F,W,10200    PETIT                        AV,34.256,-118.4979,Assault,Bodily Harm,Violent Crimes,0.99200083
399321,03/04/2011,2011-04-03,N Hollywood,29,M,W,10900    CAMARILLO                    ST,34.1577,-118.368,Assault,Bodily Harm,Violent Crimes,0.990824619
399360,10/05/2011,2011-05-10,77th Street,15,F,B,1000 W  46TH                         ST,34.0017,-118.2915,Assault,Bodily Harm,Violent Crimes,0.996733952
399670,05/07/2011,2011-07-05,Northeast,54,F,H,1900    VESTAL                       AV,34.0869,-118.2534,Battery Crime,Bodily Harm,Violent Crimes,0.994315977
400708,28/08/2011,2011-08-28,Foothill,52,M,H,7700    LANKERSHIM                   BL,34.2103,-118.3878,Battery Crime,Bodily Harm,Violent Crimes,0.990833421
400858,17/06/2011,2011-06-17,Foothill,26,F,B,12900    EUSTACE                      ST,34.285,-118.4135,Robbery,Robbery,Violent Crimes,0.99926022
401136,19/09/2011,2011-09-17,Newton,49,M,B,BROADWAY,33.9807,-118.2783,Assault,Bodily Harm,Violent Crimes,0.990744594
401138,13/06/2011,2011-06-13,Newton,46,F,H,38TH                         ST,34.0121,-118.2696,Robbery,Robbery,Violent Crimes,0.996123213
401209,02/05/2011,2011-05-01,Olympic,19,F,H,300 S  OXFORD                       AV,34.069,-118.3079,Battery Crime,Bodily Harm,Violent Crimes,0.999729461
401350,26/02/2011,2011-02-26,Olympic,27,M,K,200 N  GRAMERCY                     PL,34.0746,-118.3125,Robbery,Robbery,Violent Crimes,0.995473004
401354,27/12/2011,2011-12-21,Harbor,51,M,W,25400    BAYSIDE                      PL,33.7935,-118.2916,Theft,Property Crime,Non-Violent Crimes,0.995546229
401382,19/01/2011,2011-01-19,N Hollywood,38,F,B,7400    LANKERSHIM                   BL,34.2049,-118.3878,Assault,Bodily Harm,Violent Crimes,0.996797054
401580,15/04/2011,2011-04-15,Devonshire,59,M,A,19000    BRASILIA                     DR,34.2881,-118.5448,Theft,Property Crime,Non-Violent Crimes,0.998244616
401664,25/07/2011,2011-07-23,West Valley,23,F,W,4600    LA CESTA                     PL,34.1543,-118.5431,Rape,Rape,Violent Crimes,0.999110568
402035,15/12/2011,2011-08-09,Devonshire,61,M,H,9100    CORBIN                       AV,34.2355,-118.5623,Fraud,White Collar Crime,Non-Violent Crimes,0.990887032
402303,31/08/2011,2011-08-31,Rampart,33,M,B,OLYMPIC,34.0478,-118.2711,Robbery,Robbery,Violent Crimes,0.99322444
402321,14/01/2011,2011-01-13,Southwest,86,M,B,3900    HUBERT                       AV,34.0142,-118.3281,Battery Crime,Bodily Harm,Violent Crimes,0.994557549
402439,16/11/2011,2011-11-16,Topanga,87,F,W,6400    RANDI                        AV,34.1865,-118.6103,Theft,Property Crime,Non-Violent Crimes,0.993530211
402562,14/01/2011,2011-01-14,Central,44,F,B,500    WALL                         ST,34.0449,-118.2458,Theft,Property Crime,Non-Violent Crimes,0.9967114
402596,15/11/2011,2011-11-15,Central,32,F,H,500 W  7TH                          ST,34.0467,-118.2556,Theft,Property Crime,Non-Violent Crimes,0.994454241
402628,30/05/2011,2011-05-27,Harbor,49,M,W,400    EUBANK                       AV,33.7746,-118.2542,Theft,Property Crime,Non-Violent Crimes,0.999900799
402643,05/03/2011,2011-03-04,Harbor,76,M,W,1400    DALMATIA                     DR,33.7646,-118.3054,Theft,Property Crime,Non-Violent Crimes,0.993116324
403018,11/02/2011,2011-02-11,Foothill,48,F,H,7700    VIA SORRENTO,34.2115,-118.343,Theft,Property Crime,Non-Violent Crimes,0.992117665
403300,18/09/2011,2011-09-18,Southwest,65,M,A,STOCKER,34.008,-118.3363,Assault,Bodily Harm,Violent Crimes,0.999961572
403601,10/08/2011,2011-08-01,Mission,66,M,B,15800    LARKSPUR                     ST,34.3049,-118.4756,Theft,Property Crime,Non-Violent Crimes,0.992883713
403705,27/12/2011,2011-12-21,Harbor,20,F,H,1300    PARK WESTERN                 DR,33.754,-118.3048,Theft,Property Crime,Non-Violent Crimes,0.992521845
403824,20/10/2011,2011-10-20,Van Nuys,23,M,H,13900    CANTLAY                      ST,34.2022,-118.4356,Assault,Bodily Harm,Violent Crimes,0.998199543
403853,16/02/2011,2011-02-15,Mission,46,F,H,16000    CIRCLE DIAMOND               RD,34.3241,-118.4795,Theft,Property Crime,Non-Violent Crimes,0.999935527
403903,17/03/2011,2011-03-15,Northeast,5,F,H,1300    SUTHERLAND                   ST,34.0751,-118.2535,Assault,Bodily Harm,Violent Crimes,0.998939307
403943,05/06/2011,2011-06-05,Van Nuys,17,F,H,4100    MARY ELLEN                   AV,34.1436,-118.4197,Battery Crime,Bodily Harm,Violent Crimes,0.993501353
404829,09/05/2011,2011-05-09,Hollywood,40,M,H,5900    CHULA VISTA                  WY,34.1074,-118.318,Theft,Property Crime,Non-Violent Crimes,0.995817835
405361,04/03/2011,2011-02-26,Hollywood,28,M,H,6100    HOLLYWOOD                    BL,34.1017,-118.3224,Theft,Property Crime,Non-Violent Crimes,0.996493226
405564,26/03/2011,2011-03-26,Van Nuys,36,F,W,VANOWEN,34.1939,-118.4662,Theft,Property Crime,Non-Violent Crimes,0.993846656
405775,22/05/2011,2011-05-22,Devonshire,43,M,H,15700    MAYALL                       ST,34.2537,-118.474,Theft,Property Crime,Non-Violent Crimes,0.990918789
406008,26/07/2011,2011-07-26,Devonshire,26,F,H,TOPANGA CANYON               BL,34.2645,-118.6061,Theft,Property Crime,Non-Violent Crimes,0.999311356
406158,02/04/2011,2011-04-01,Newton,54,F,H,300 W  47TH                         ST,34.0011,-118.2783,Theft,Property Crime,Non-Violent Crimes,0.997683933
406173,12/04/2011,2011-03-31,Topanga,17,F,H,21700    ROSCOE                       BL,34.2197,-118.6016,Battery Crime,Bodily Harm,Violent Crimes,0.990300132
406284,23/02/2011,2011-02-23,West Valley,19,F,H,18200    KITTRIDGE                    ST,34.1903,-118.53,Theft,Property Crime,Non-Violent Crimes,0.991402413
406672,27/04/2011,2011-04-27,Southwest,34,F,H,1300 W  MARTIN LUTHER KING JR        BL,34.0109,-118.298,Robbery,Robbery,Violent Crimes,0.992200518
406765,14/09/2011,2011-09-14,Devonshire,39,F,H,10200    RESEDA                       BL,34.256,-118.5361,Theft,Property Crime,Non-Violent Crimes,0.99860795
406826,20/12/2011,2011-12-19,Hollenbeck,46,F,H,400 N  FRESNO                       ST,34.0418,-118.1964,Theft,Property Crime,Non-Violent Crimes,0.997517622
407045,15/02/2011,2011-02-12,77th Street,8,F,H,1000 W  61ST                         ST,33.9842,-118.2915,Theft,Property Crime,Non-Violent Crimes,0.999162248
407129,20/04/2011,2011-04-19,Southeast,26,M,H,9900 S  SAN PEDRO                    ST,33.9465,-118.2695,Theft,Property Crime,Non-Violent Crimes,0.994464328
407160,20/06/2011,2011-06-20,Foothill,25,F,H,13100    GOLETA                       ST,34.2546,-118.4179,Assault,Bodily Harm,Violent Crimes,0.998823578
407251,09/11/2011,2011-11-09,Southwest,58,F,O,3600    CRENSHAW                     BL,34.0132,-118.335,Battery Crime,Bodily Harm,Violent Crimes,0.99004752
407394,08/03/2011,2011-03-07,Hollywood,27,M,O,1400 N  GARDNER                      ST,34.0962,-118.3528,Robbery,Robbery,Violent Crimes,0.992309062
407496,06/08/2011,2011-08-06,Harbor,18,F,W,15300    USS ANTIETAM,33.7785,-118.3041,Theft,Property Crime,Non-Violent Crimes,0.999030316
407618,09/01/2011,2011-01-09,Central,39,M,W,400 W  8TH                          ST,34.0445,-118.2558,Battery Crime,Bodily Harm,Violent Crimes,0.995296767
408537,22/06/2011,2011-06-18,Southwest,37,F,B,1500 W  MARTIN LUTHER KING JR        BL,34.0109,-118.3034,Theft,Property Crime,Non-Violent Crimes,0.990689849
408614,30/06/2011,2011-06-30,Van Nuys,25,F,A,SHERMAN                      WY,34.2012,-118.4487,Battery Crime,Bodily Harm,Violent Crimes,0.995627711
408913,19/09/2011,2011-09-18,Mission,33,F,H,RAYEN,34.2319,-118.4698,Assault,Bodily Harm,Violent Crimes,0.998040361
409268,23/01/2011,2011-01-19,Rampart,28,F,A,200 S  LAFAYETTE PARK               PL,34.0692,-118.2792,Theft,Property Crime,Non-Violent Crimes,0.998102885
409522,03/02/2011,2011-02-03,Newton,33,F,H,500 E  FLORENCE                     AV,33.9748,-118.2663,Theft,Property Crime,Non-Violent Crimes,0.99063679
409869,03/04/2011,2011-04-02,Newton,24,F,H,1400 E  21ST                         ST,34.021,-118.2498,Theft,Property Crime,Non-Violent Crimes,0.991903686
409936,04/05/2012,2012-05-04,Northeast,16,M,H,1700    YOSEMITE                     DR,34.133,-118.2031,Robbery,Robbery,Violent Crimes,0.993197932
410008,11/04/2012,2012-04-09,Van Nuys,30,F,W,4500    HAZELTINE                    AV,34.153,-118.44,Theft,Property Crime,Non-Violent Crimes,0.996862188
410026,12/02/2012,2012-02-12,Hollenbeck,34,F,H,2400 E  CESAR E CHAVEZ               AV,34.0468,-118.2078,Theft,Property Crime,Non-Violent Crimes,0.99541486
410204,07/06/2012,2012-06-07,Devonshire,46,F,W,17000    GALESBURG                    ST,34.2849,-118.5032,Theft,Property Crime,Non-Violent Crimes,0.99930458
410353,10/01/2012,2012-01-06,Central,46,F,W,400 S  FIGUEROA                     ST,34.0535,-118.256,Theft,Property Crime,Non-Violent Crimes,0.994414315
410363,15/06/2012,2012-06-15,Hollywood,46,M,B,HOLLYWOOD                    BL,34.1016,-118.3348,Battery Crime,Bodily Harm,Violent Crimes,0.993608352
410445,04/10/2012,2012-10-04,N Hollywood,45,M,W,3400    CAHUENGA                     BL,34.1316,-118.352,Theft,Property Crime,Non-Violent Crimes,0.99296238
410493,17/08/2012,2012-08-16,Southeast,31,M,H,1700 E  108TH                        ST,33.9379,-118.2425,Theft,Property Crime,Non-Violent Crimes,0.991603832
410652,11/05/2012,2012-05-10,N Hollywood,49,F,W,LAURELGROVE                  AV,34.164,-118.4008,Theft,Property Crime,Non-Violent Crimes,0.995374761
410993,19/07/2012,2012-07-19,77th Street,59,F,B,2100 W  94TH                         ST,33.9513,-118.3156,Battery Crime,Bodily Harm,Violent Crimes,0.99281042
411077,01/05/2012,2012-04-30,77th Street,36,M,H,100 E  83RD                         ST,33.9637,-118.2739,Theft,Property Crime,Non-Violent Crimes,0.991599575
411430,25/02/2012,2012-02-24,Southeast,16,F,B,112TH                        ST,33.933,-118.2652,Battery Crime,Bodily Harm,Violent Crimes,0.993370374
411469,24/05/2012,2012-03-28,N Hollywood,26,M,H,LANKERSHIM                   BL,34.1903,-118.3877,Fraud,White Collar Crime,Non-Violent Crimes,0.99664057
411610,22/08/2012,2012-08-21,Foothill,21,M,O,7700    LANKERSHIM                   BL,34.2103,-118.3878,Theft,Property Crime,Non-Violent Crimes,0.996202245
411614,10/06/2012,2012-06-09,Rampart,21,F,H,100    ROSEMONT                     AV,34.0678,-118.2728,Assault,Bodily Harm,Violent Crimes,0.996475664
411765,27/12/2012,2012-12-19,Olympic,19,F,B,2000 S  HARVARD                      BL,34.0389,-118.305,Battery Crime,Bodily Harm,Violent Crimes,0.995126432
411766,29/06/2012,2012-06-28,Southeast,43,M,H,1300 E  112TH                        ST,33.9332,-118.2522,Theft,Property Crime,Non-Violent Crimes,0.999204516
411770,13/12/2012,2012-11-30,Olympic,59,F,K,1200 S  WILTON                       PL,34.0494,-118.3145,Fraud,White Collar Crime,Non-Violent Crimes,0.999332629
412008,09/08/2012,2012-08-07,Southeast,23,F,B,200 W  IMPERIAL                     HY,33.931,-118.2761,Assault,Bodily Harm,Violent Crimes,0.999604494
412247,07/10/2012,2012-10-07,N Hollywood,35,F,W,4800    KLUMP                        AV,34.1577,-118.3757,Battery Crime,Bodily Harm,Violent Crimes,0.99110305
412442,06/01/2012,2012-01-06,West Valley,55,M,W,19500    STRATHERN                    ST,34.2156,-118.5579,Battery Crime,Bodily Harm,Violent Crimes,0.998390766
412613,31/08/2012,2012-08-31,West LA,37,F,W,10800 W  PICO                         BL,34.0406,-118.4275,Theft,Property Crime,Non-Violent Crimes,0.993095036
412719,07/01/2012,2012-01-06,Hollywood,56,M,W,1200 N  MANSFIELD                    AV,34.0926,-118.3404,Theft,Property Crime,Non-Violent Crimes,0.99032346
412973,09/05/2012,2012-05-08,Pacific,17,F,H,12700    PACIFIC                      AV,34.0005,-118.4373,Theft,Property Crime,Non-Violent Crimes,0.992144609
413056,01/01/2012,2012-01-01,Foothill,40,F,H,11600    HUNNEWELL                    AV,34.2806,-118.3972,Battery Crime,Bodily Harm,Violent Crimes,0.994560092
413314,03/02/2012,2012-02-03,77th Street,35,F,B,800 W  69TH                         ST,33.9773,-118.2871,Assault,Bodily Harm,Violent Crimes,0.996484362
413396,21/10/2012,2012-10-21,Topanga,35,M,H,20400    SHERMAN                      WY,34.201,-118.5776,Robbery,Robbery,Violent Crimes,0.993227046
413427,07/06/2017,2012-02-12,Van Nuys,5,F,H,14600    DELANO                       ST,34.1827,-118.4509,Battery Crime,Bodily Harm,Violent Crimes,0.99708011
413787,12/07/2012,2012-06-19,Topanga,49,F,O,6700    INDEPENDENCE                 AV,34.1921,-118.5906,Theft,Property Crime,Non-Violent Crimes,0.991816882
413967,13/09/2012,2012-09-12,Mission,23,F,B,8100 N  SEPULVEDA                    BL,34.2181,-118.4664,Assault,Bodily Harm,Violent Crimes,0.999199662
414052,28/05/2012,2012-05-28,Pacific,30,F,H,5300 W  99TH                         ST,33.9471,-118.3737,Battery Crime,Bodily Harm,Violent Crimes,0.99794024
414141,18/09/2012,2012-09-18,N Hollywood,30,M,H,10500    DUBNOFF                      WY,34.1867,-118.36,Battery Crime,Bodily Harm,Violent Crimes,0.991753738
414157,02/07/2012,2012-06-04,Wilshire,24,F,W,500 S  OGDEN                        DR,34.0667,-118.3604,Theft,Property Crime,Non-Violent Crimes,0.999201871
414228,12/07/2012,2012-07-12,Olympic,44,F,H,1800 S  OXFORD                       AV,34.0412,-118.3076,Rape,Rape,Violent Crimes,0.991327162
414503,07/12/2012,2012-12-06,Central,32,M,W,200 S  SPRING                       ST,34.0517,-118.2456,Theft,Property Crime,Non-Violent Crimes,0.993694269
414546,17/09/2012,2012-09-14,Hollywood,48,M,B,1600    WILCOX                       AV,34.0998,-118.331,Theft,Property Crime,Non-Violent Crimes,0.993844238
414729,14/07/2012,2012-07-13,Central,20,M,W,100 S  FIGUEROA                     ST,34.0578,-118.252,Assault,Bodily Harm,Violent Crimes,0.997520807
415071,26/04/2012,2012-04-26,Olympic,43,F,B,400 N  NORMANDIE                    AV,34.0777,-118.3004,Battery Crime,Bodily Harm,Violent Crimes,0.991094769
415091,14/08/2012,2012-08-14,Northeast,31,F,W,1300    GLENDALE                     BL,34.0782,-118.2604,Theft,Property Crime,Non-Violent Crimes,0.992237726
415111,07/09/2012,2012-09-07,Wilshire,24,M,W,300 N  SIERRA BONITA                AV,34.0762,-118.3543,Robbery,Robbery,Violent Crimes,0.992749049
415196,04/09/2012,2012-09-02,Central,38,M,B,500 W  OLYMPIC                      BL,34.043,-118.2606,Theft,Property Crime,Non-Violent Crimes,0.995443727
415552,12/04/2013,2012-11-01,Pacific,40,F,W,3400    MEIER                        ST,34.0083,-118.4451,Theft,Property Crime,Non-Violent Crimes,0.998008463
415705,03/08/2012,2012-08-02,Wilshire,56,M,O,7000    WARING                       AV,34.0853,-118.3416,Theft,Property Crime,Non-Violent Crimes,0.996921801
415722,13/08/2012,2012-08-13,Hollenbeck,28,F,H,7TH                          ST,34.0255,-118.2017,Robbery,Robbery,Violent Crimes,0.995940552
415873,17/01/2012,2012-01-16,Southeast,55,M,B,FIGUEROA                     ST,33.9601,-118.2827,Robbery,Robbery,Violent Crimes,0.997258474
415916,22/03/2012,2012-02-03,Foothill,44,M,B,12700    WENTWORTH                    ST,34.238,-118.4101,Theft,Property Crime,Non-Violent Crimes,0.990287146
416058,16/08/2012,2012-08-15,Southeast,33,M,B,900 E  101ST                        ST,33.9447,-118.2586,Assault,Bodily Harm,Violent Crimes,0.992600651
416068,11/12/2012,2012-06-01,Mission,45,M,H,9000    LANGDON                      AV,34.2338,-118.4698,Theft,Property Crime,Non-Violent Crimes,0.993742046
416119,18/06/2012,2012-06-17,Wilshire,70,M,B,1600 S  VICTORIA                     AV,34.0451,-118.3296,Theft,Property Crime,Non-Violent Crimes,0.991138307
416611,10/10/2012,2012-10-10,Newton,34,F,B,100 E  50TH                         ST,33.9974,-118.274,Battery Crime,Bodily Harm,Violent Crimes,0.998893235
416615,30/09/2012,2012-09-28,Rampart,26,F,H,1200 W  3RD                          ST,34.0565,-118.258,Theft,Property Crime,Non-Violent Crimes,0.995751574
416731,12/08/2012,2012-08-12,Southeast,16,F,H,90TH                         ST,33.9551,-118.2893,Rape,Rape,Violent Crimes,0.990797589
416775,22/02/2012,2012-02-22,Rampart,64,F,O,200 S  BONNIE BRAE                  ST,34.0644,-118.2686,Assault,Bodily Harm,Violent Crimes,0.998143035
416814,13/03/2012,2012-03-13,Topanga,49,M,W,24000    KIRKCALDY                    CI,34.1972,-118.6485,Assault,Bodily Harm,Violent Crimes,0.998040477
416822,22/05/2012,2012-05-22,Van Nuys,57,M,H,6200    VAN NUYS                     BL,34.1827,-118.4487,Battery Crime,Bodily Harm,Violent Crimes,0.997043469
416936,11/04/2012,2012-04-11,West Valley,31,M,W,15400    VENTURA                      BL,34.1543,-118.4691,Assault,Bodily Harm,Violent Crimes,0.99313547
416999,27/05/2012,2012-05-24,Rampart,48,F,H,700 S  HOOVER                       ST,34.0598,-118.2842,Assault,Bodily Harm,Violent Crimes,0.997367602
417224,17/01/2012,2012-01-16,Foothill,43,M,O,8100    MCGROARTY                    ST,34.2524,-118.3093,Theft,Property Crime,Non-Violent Crimes,0.99330326
417258,20/04/2012,2012-04-20,Southwest,19,F,B,3900 S  NORMANDIE                    AV,34.0155,-118.3002,Battery Crime,Bodily Harm,Violent Crimes,0.994198117
417301,14/09/2012,2012-09-14,77th Street,26,F,B,6300    DENVER                       AV,33.9819,-118.2838,Battery Crime,Bodily Harm,Violent Crimes,0.997917817
417484,01/11/2012,2012-11-01,Southwest,18,M,H,ADAMS,34.0327,-118.309,Battery Crime,Bodily Harm,Violent Crimes,0.990356572
417574,03/03/2012,2012-02-22,Hollenbeck,35,F,W,600 S  AVENUE 21,34.066,-118.2168,Assault,Bodily Harm,Violent Crimes,0.996057465
417677,13/04/2012,2012-02-01,Topanga,39,M,H,20300    COHASSET                     ST,34.2071,-118.5754,Theft,Property Crime,Non-Violent Crimes,0.991519324
417780,18/03/2012,2012-03-17,Hollywood,28,F,B,1600 N  FORMOSA                      AV,34.0998,-118.3468,Theft,Property Crime,Non-Violent Crimes,0.99034302
417936,20/03/2012,2012-03-02,Olympic,70,M,H,200 S  SERRANO                      AV,34.0712,-118.3067,Theft,Property Crime,Non-Violent Crimes,0.999778171
418174,17/12/2012,2012-12-16,Central,55,M,B,800 E  6TH                          ST,34.0408,-118.2428,Theft,Property Crime,Non-Violent Crimes,0.993258012
418875,13/04/2012,2012-04-13,Southwest,26,F,W,4100    CRENSHAW                     BL,34.0102,-118.3351,Theft,Property Crime,Non-Violent Crimes,0.99753236
418906,01/04/2012,2012-03-28,Central,36,M,O,800 S  GRAND                        AV,34.0459,-118.2579,Theft,Property Crime,Non-Violent Crimes,0.99598673
418973,01/11/2012,2012-11-01,Southeast,31,F,B,1600 E  103RD                        ST,33.9433,-118.2462,Theft,Property Crime,Non-Violent Crimes,0.999858705
419028,07/10/2016,2012-03-01,Topanga,51,F,H,21000    LULL                         ST,34.2094,-118.5906,Theft,Property Crime,Non-Violent Crimes,0.993956307
419244,25/07/2012,2012-07-25,Northeast,40,F,H,3500    ARROYO SECO                  AV,34.0878,-118.2151,Assault,Bodily Harm,Violent Crimes,0.993823821
419267,29/06/2012,2012-06-18,Southeast,30,F,H,8600 S  VERMONT                      AV,33.96,-118.2915,Fraud,White Collar Crime,Non-Violent Crimes,0.999930105
419299,17/10/2012,2012-10-17,Central,44,F,O,200    BOYD                         ST,34.0478,-118.2454,Theft,Property Crime,Non-Violent Crimes,0.99673631
419301,24/11/2012,2012-11-01,Pacific,40,F,W,13100    PSOMAS                       WY,34.0082,-118.4512,Theft,Property Crime,Non-Violent Crimes,0.990270636
419450,14/08/2012,2012-08-13,Olympic,27,F,H,7TH                          ST,34.0598,-118.2878,Theft,Property Crime,Non-Violent Crimes,0.991639638
419615,22/11/2012,2012-11-20,Mission,43,F,H,15500    RAYEN                        ST,34.2319,-118.4698,Theft,Property Crime,Non-Violent Crimes,0.995843278
419713,13/02/2013,2012-12-03,Mission,41,F,A,8100    CROSNOE                      AV,34.2177,-118.4258,Theft,Property Crime,Non-Violent Crimes,0.990628599
419760,19/02/2012,2012-02-19,West Valley,43,M,W,5700    BERTRAND                     AV,34.1746,-118.5245,Theft,Property Crime,Non-Violent Crimes,0.992116831
419920,22/12/2012,2012-12-22,Hollywood,26,M,W,LA BREA                      AV,34.0344,-118.3501,Robbery,Robbery,Violent Crimes,0.992768187
420074,27/08/2012,2012-03-24,Wilshire,48,F,B,6000    CADILLAC                     AV,34.0375,-118.3742,Theft,Property Crime,Non-Violent Crimes,0.994768241
420228,23/10/2012,2012-10-20,West LA,28,F,W,1700    COLDWATER CANYON             DR,34.1015,-118.4062,Theft,Property Crime,Non-Violent Crimes,0.994808328
420661,03/02/2013,2012-02-03,Southeast,37,F,H,MAIN,33.9456,-118.2739,Robbery,Robbery,Violent Crimes,0.992120816
420755,08/06/2013,2012-06-07,77th Street,52,M,B,3100    HYDE PARK                    BL,33.9807,-118.3265,Robbery,Robbery,Violent Crimes,0.995897428
420923,22/07/2012,2012-07-22,Devonshire,47,M,H,10600    HASKELL                      AV,34.2631,-118.4761,Assault,Bodily Harm,Violent Crimes,0.999470165
421289,20/06/2012,2012-06-20,Rampart,23,M,W,ALVARADO                     ST,34.0776,-118.2635,Battery Crime,Bodily Harm,Violent Crimes,0.990682291
421389,29/09/2012,2012-09-28,Southeast,35,F,B,100 E  120TH                        ST,33.9237,-118.2739,Battery Crime,Bodily Harm,Violent Crimes,0.994261378
421501,15/03/2012,2012-02-28,N Hollywood,44,M,W,4200    KRAFT                        AV,34.145,-118.3801,Theft,Property Crime,Non-Violent Crimes,0.998985682
421984,22/06/2012,2012-06-22,Southwest,26,F,B,4100 S  BUDLONG                      AV,34.0091,-118.2959,Theft,Property Crime,Non-Violent Crimes,0.998687308
422008,08/10/2012,2012-10-07,Central,34,M,W,LEBANON,34.0491,-118.2593,Theft,Property Crime,Non-Violent Crimes,0.990637543
422380,09/04/2012,2012-04-05,Topanga,57,M,W,7300    CORBIN                       AV,34.2031,-118.5623,Theft,Property Crime,Non-Violent Crimes,0.99630086
422382,08/11/2012,2012-11-07,77th Street,17,F,H,CRENSHAW                     BL,33.989,-118.3308,Robbery,Robbery,Violent Crimes,0.993165798
422630,24/06/2012,2012-06-24,Wilshire,56,M,O,1500 S  LA BREA                      AV,34.0467,-118.345,Robbery,Robbery,Violent Crimes,0.99320477
422890,10/08/2012,2012-08-10,Pacific,75,F,W,6000 W  82ND                         ST,33.9636,-118.3882,Theft,Property Crime,Non-Violent Crimes,0.996896351
423024,20/10/2012,2012-10-19,77th Street,44,F,B,6600    MENLO                        AV,33.9792,-118.2892,Theft,Property Crime,Non-Violent Crimes,0.999192598
423132,25/07/2012,2012-07-24,Southeast,59,F,B,800 W  92ND                         ST,33.9528,-118.2893,Theft,Property Crime,Non-Violent Crimes,0.993569967
423142,10/10/2012,2012-10-09,Van Nuys,35,F,O,14200    BURBANK                      BL,34.1721,-118.4422,Theft,Property Crime,Non-Violent Crimes,0.990856396
423424,08/06/2012,2012-06-01,Topanga,22,M,W,20800    VENTURA                      BL,34.1665,-118.5859,Theft,Property Crime,Non-Violent Crimes,0.996419025
423552,25/04/2012,2012-04-25,Hollywood,20,M,H,5900    BARTON                       AV,34.088,-118.3222,Assault,Bodily Harm,Violent Crimes,0.996596156
423736,05/07/2012,2012-07-04,Northeast,71,M,W,3000    HYPERION                     AV,34.1106,-118.2702,Theft,Property Crime,Non-Violent Crimes,0.999390381
424004,25/08/2012,2012-08-25,Olympic,46,F,H,2800 W  PICO                         BL,34.0472,-118.3003,Battery Crime,Bodily Harm,Violent Crimes,0.990091983
424014,06/10/2012,2012-10-05,Olympic,26,F,O,WILTON                       PL,34.0526,-118.315,Theft,Property Crime,Non-Violent Crimes,0.997896634
424023,18/10/2012,2012-10-18,Rampart,31,M,W,2700 W  SUNSET                       BL,34.0805,-118.2704,Theft,Property Crime,Non-Violent Crimes,0.999962349
424058,22/03/2012,2012-03-22,N Hollywood,23,F,O,11500    RIVERSIDE                    DR,34.1577,-118.3823,Theft,Property Crime,Non-Violent Crimes,0.99243708
424206,15/03/2012,2012-03-15,West LA,63,M,W,12300    MONTANA                      AV,34.0482,-118.4754,Theft,Property Crime,Non-Violent Crimes,0.999309434
424428,07/07/2012,2012-07-06,Southeast,11,M,H,109TH,33.9362,-118.239,Battery Crime,Bodily Harm,Violent Crimes,0.990483702
424486,18/02/2012,2012-01-23,Newton,31,M,H,700 E  55TH                         ST,33.9925,-118.263,Theft,Property Crime,Non-Violent Crimes,0.992546005
424536,11/08/2012,2012-08-11,Southwest,22,F,B,2900    11TH                         AV,34.0299,-118.3289,Assault,Bodily Harm,Violent Crimes,0.993682015
424669,22/06/2012,2012-04-03,West LA,55,M,W,300 N  BUNDY                        DR,34.0636,-118.4766,Theft,Property Crime,Non-Violent Crimes,0.991764341
424738,31/12/2012,2012-12-31,77th Street,21,F,B,61ST                         ST,33.979,-118.3112,Assault,Bodily Harm,Violent Crimes,0.997113498
425036,18/04/2012,2012-04-18,West Valley,34,M,W,17500    MARTHA                       ST,34.1732,-118.5142,Theft,Property Crime,Non-Violent Crimes,0.997449091
425083,13/06/2012,2012-06-09,Pacific,24,M,W,8600    LINCOLN                      BL,33.9598,-118.4193,Theft,Property Crime,Non-Violent Crimes,0.994515665
425291,13/06/2012,2012-06-12,Wilshire,39,M,H,2000    VINEYARD                     AV,34.0389,-118.3402,Theft,Property Crime,Non-Violent Crimes,0.999712509
425322,09/10/2012,2012-05-01,West Valley,53,M,O,17300    VENTURA                      BL,34.1609,-118.5098,Theft,Property Crime,Non-Violent Crimes,0.991857129
425411,20/04/2012,2012-04-20,Hollenbeck,15,F,H,500    BRITTANIA                    ST,34.0493,-118.2133,Battery Crime,Bodily Harm,Violent Crimes,0.997694882
425482,07/12/2012,2012-12-07,Central,22,M,H,700 S  LOS ANGELES                  ST,34.0433,-118.2504,Theft,Property Crime,Non-Violent Crimes,0.990310943
425499,29/09/2012,2012-03-15,Hollywood,64,F,W,1700    CAMINO PALMERO,34.1016,-118.35,Theft,Property Crime,Non-Violent Crimes,0.99748227
425534,08/11/2012,2012-11-08,West LA,11,X,X,11200 W  OLYMPIC                      BL,34.0389,-118.4401,Theft,Property Crime,Non-Violent Crimes,0.996061296
425569,25/06/2012,2012-06-24,Olympic,35,M,W,500 S  HOBART                       BL,34.0654,-118.3054,Theft,Property Crime,Non-Violent Crimes,0.998884311
425627,25/01/2012,2012-01-24,Pacific,65,M,W,700    PACIFIC                      AV,33.9929,-118.4764,Battery Crime,Bodily Harm,Violent Crimes,0.997171678
425763,14/05/2012,2012-04-28,Southwest,18,F,B,2900    ARLINGTON                    AV,34.0285,-118.3177,Theft,Property Crime,Non-Violent Crimes,0.992440635
425880,17/07/2012,2012-07-17,Central,60,M,B,500    MAPLE                        AV,34.0454,-118.2466,Theft,Property Crime,Non-Violent Crimes,0.996108624
425985,15/08/2012,2012-08-15,Southwest,29,M,H,4300 S  BUDLONG                      AV,34.0055,-118.2959,Theft,Property Crime,Non-Violent Crimes,0.998607609
426212,21/07/2012,2012-07-21,West LA,75,M,A,1700 S  LA CIENEGA                   BL,34.0471,-118.3762,Theft,Property Crime,Non-Violent Crimes,0.997953479
426284,05/09/2012,2012-09-05,Central,36,M,H,7TH,34.0419,-118.2485,Robbery,Robbery,Violent Crimes,0.993151574
426289,29/10/2012,2012-10-27,N Hollywood,28,M,O,5400    TUJUNGA                      AV,34.1689,-118.379,Theft,Property Crime,Non-Violent Crimes,0.997617729
426306,24/04/2012,2012-04-18,Newton,36,F,B,1100 E  32ND                         ST,34.0146,-118.2565,Theft,Property Crime,Non-Violent Crimes,0.999631719
426338,19/05/2012,2012-05-19,Hollenbeck,25,M,H,3300 E  2ND                          ST,34.0364,-118.1976,Assault,Bodily Harm,Violent Crimes,0.992950754
426402,16/08/2012,2012-08-15,77th Street,41,F,H,6200    MENLO                        AV,33.9824,-118.2892,Battery Crime,Bodily Harm,Violent Crimes,0.992844438
426444,12/01/2013,2012-12-30,Devonshire,67,F,W,9900    TUNNEY                       AV,34.25,-118.5579,Theft,Property Crime,Non-Violent Crimes,0.993737319
426537,02/12/2012,2012-12-02,Topanga,21,F,H,6500    TOPANGA CANYON               BL,34.1888,-118.6059,Theft,Property Crime,Non-Violent Crimes,0.998392829
426595,13/03/2012,2012-02-26,Harbor,46,M,B,500 W  189TH                        ST,33.864,-118.2815,Theft,Property Crime,Non-Violent Crimes,0.990438377
426675,18/04/2012,2012-04-11,Olympic,26,M,O,900    WESTCHESTER                  PL,34.0535,-118.316,Theft,Property Crime,Non-Violent Crimes,0.996783198
426714,18/02/2012,2012-02-18,Devonshire,48,M,A,DEVONSHIRE                   ST,34.2573,-118.5842,Assault,Bodily Harm,Violent Crimes,0.994173509
426783,06/01/2012,2012-01-01,Wilshire,33,M,H,LA BREA                      AV,34.046,-118.3453,Robbery,Robbery,Violent Crimes,0.998856788
426931,27/09/2012,2012-09-27,West LA,64,F,W,2600    MOTOR                        AV,34.0459,-118.4073,Theft,Property Crime,Non-Violent Crimes,0.995018661
427042,18/07/2012,2012-07-18,Harbor,29,F,H,800 W  3RD                          ST,33.7415,-118.2945,Battery Crime,Bodily Harm,Violent Crimes,0.991108823
427314,02/03/2012,2012-03-02,Hollywood,50,M,W,700 N  HUDSON                       AV,34.0835,-118.3321,Robbery,Robbery,Violent Crimes,0.990378038
427318,11/06/2012,2012-03-01,Central,40,F,O,1300 N  BROADWAY,34.0695,-118.2324,Theft,Property Crime,Non-Violent Crimes,0.993758551
427332,24/04/2012,2012-04-24,Newton,53,M,W,7TH                          ST,34.0241,-118.232,Robbery,Robbery,Violent Crimes,0.998944256
427459,19/04/2017,2012-06-04,West LA,49,M,W,9200 W  PICO                         BL,34.0553,-118.3921,Embezzlement,Property Crime,Non-Violent Crimes,0.994470383
427780,28/06/2012,2012-06-27,Southeast,38,M,H,11400 S  MONA                         BL,33.9312,-118.2308,Theft,Property Crime,Non-Violent Crimes,0.992111366
427785,21/02/2012,2012-01-01,Southeast,16,F,B,111TH                        ST,33.9348,-118.2652,Battery Crime,Bodily Harm,Violent Crimes,0.990462623
427804,22/08/2012,2012-07-21,Wilshire,37,F,H,1400 S  CLOVERDALE                   AV,34.0482,-118.3516,Theft,Property Crime,Non-Violent Crimes,0.992082839
427969,08/10/2012,2012-10-08,77th Street,57,F,B,1900 W  67TH                         ST,33.9785,-118.3112,Theft,Property Crime,Non-Violent Crimes,0.998326246
428007,21/06/2012,2012-06-19,77th Street,47,M,B,3300 W  54TH                         ST,33.9932,-118.3294,Theft,Property Crime,Non-Violent Crimes,0.995414874
428068,14/07/2012,2012-07-14,Southeast,21,F,H,87TH,33.9587,-118.2839,Theft,Property Crime,Non-Violent Crimes,0.999230902
428135,24/04/2012,2012-04-22,Devonshire,30,F,W,20800    ROSCOE                       BL,34.22,-118.5863,Theft,Property Crime,Non-Violent Crimes,0.998929074
428248,28/01/2012,2012-01-11,Topanga,65,M,H,8200    MASON                        AV,34.2182,-118.5798,Theft,Property Crime,Non-Violent Crimes,0.999846823
428377,18/04/2012,2012-04-17,Central,42,M,B,900 N  BROADWAY,34.064,-118.2375,Theft,Property Crime,Non-Violent Crimes,0.997058198
429014,26/03/2012,2012-03-26,Hollywood,32,M,W,SANTA MONICA                 BL,34.0907,-118.3332,Theft,Property Crime,Non-Violent Crimes,0.996241261
429382,08/08/2012,2012-08-08,Mission,17,M,A,RANCHITO,34.2226,-118.4367,Assault,Bodily Harm,Violent Crimes,0.995850366
429564,27/05/2012,2012-05-27,Olympic,42,M,H,PICO                         BL,34.0472,-118.309,Assault,Bodily Harm,Violent Crimes,0.992635976
429595,12/09/2012,2012-09-11,Mission,40,M,H,14400    SAN JOSE                     ST,34.262,-118.4472,Theft,Property Crime,Non-Violent Crimes,0.990968212
429651,26/12/2012,2012-12-26,Southwest,25,M,H,4300    CRENSHAW                     BL,34.0054,-118.3338,Theft,Property Crime,Non-Violent Crimes,0.997609758
429742,05/04/2012,2012-04-05,Devonshire,80,M,W,11700    THUNDERBIRD                  AV,34.2854,-118.5601,Theft,Property Crime,Non-Violent Crimes,0.99545311
429772,03/12/2012,2012-12-01,Topanga,51,M,W,5000    ESCOBEDO                     DR,34.161,-118.5915,Theft,Property Crime,Non-Violent Crimes,0.995474733
430002,02/06/2012,2012-06-01,Newton,28,M,H,100 W  59TH                         PL,33.9861,-118.2739,Theft,Property Crime,Non-Violent Crimes,0.999519029
430285,02/11/2012,2012-11-02,Rampart,46,F,H,6TH                          ST,34.0596,-118.2749,Robbery,Robbery,Violent Crimes,0.996474713
430428,20/04/2012,2012-04-19,Central,29,M,H,700    TRACTION                     AV,34.0457,-118.2364,Theft,Property Crime,Non-Violent Crimes,0.99713607
430467,28/08/2012,2012-08-27,Devonshire,32,F,H,16600    SAN FERNANDO MISSION         BL,34.272,-118.4935,Assault,Bodily Harm,Violent Crimes,0.992911872
430600,10/12/2012,2012-12-08,Northeast,24,M,W,5000 W  SUNSET                       BL,34.0981,-118.2983,Theft,Property Crime,Non-Violent Crimes,0.994305182
431354,28/11/2012,2012-11-09,Wilshire,39,M,H,5100 W  PICO                         BL,34.048,-118.3493,Fraud,White Collar Crime,Non-Violent Crimes,0.994080787
431948,01/01/2012,2012-01-01,Mission,51,F,O,8400    VAN NUYS                     BL,34.2232,-118.4488,Battery Crime,Bodily Harm,Violent Crimes,0.996617667
432347,04/04/2012,2012-04-04,West LA,43,M,O,12300    GORHAM                       AV,34.0473,-118.4743,Theft,Property Crime,Non-Violent Crimes,0.99551095
432446,29/08/2012,2012-08-28,Newton,31,F,B,400 E  FLORENCE                     AV,33.9747,-118.2674,Theft,Property Crime,Non-Violent Crimes,0.994409468
432602,29/11/2012,2012-11-28,Northeast,2,F,H,1500    GLENDALE                     BL,34.0819,-118.2601,Assault,Bodily Harm,Violent Crimes,0.994899901
432700,10/04/2012,2012-04-10,Pacific,50,M,B,600    WORLD                        WY,33.943,-118.4035,Theft,Property Crime,Non-Violent Crimes,0.992453843
432711,21/08/2012,2012-08-20,Southeast,45,M,B,100 W  86TH                         PL,33.9594,-118.2739,Assault,Bodily Harm,Violent Crimes,0.994306456
432751,31/08/2012,2012-07-09,Hollywood,61,M,W,700 N  VAN NESS                     AV,34.0835,-118.3157,Theft,Property Crime,Non-Violent Crimes,0.991268777
432932,02/12/2012,2012-11-23,Rampart,45,M,B,4000    MARATHON                     ST,34.0846,-118.2868,Battery Crime,Bodily Harm,Violent Crimes,0.992752472
433160,24/03/2012,2012-03-23,Devonshire,33,M,W,19600    TULSA                        ST,34.2691,-118.5615,Theft,Property Crime,Non-Violent Crimes,0.99805645
433695,07/02/2012,2012-02-07,77th Street,57,F,B,3100 W  SLAUSON                      AV,33.9891,-118.327,Theft,Property Crime,Non-Violent Crimes,0.995865384
433977,29/10/2012,2012-10-29,Olympic,30,F,H,1200    ELDEN                        AV,34.0491,-118.2877,Robbery,Robbery,Violent Crimes,0.994317188
434069,23/02/2012,2012-02-21,Foothill,21,M,H,9700    LAUREL CANYON                BL,34.2459,-118.4185,Theft,Property Crime,Non-Violent Crimes,0.996811292
434197,08/07/2012,2012-07-08,Northeast,37,F,H,3400    FLETCHER                     DR,34.1186,-118.2404,Assault,Bodily Harm,Violent Crimes,0.994006156
434230,27/09/2012,2012-09-27,Southwest,42,F,H,700 W  43RD                         ST,34.0054,-118.2857,Assault,Bodily Harm,Violent Crimes,0.991309128
434426,31/10/2012,2012-10-31,Hollenbeck,23,F,H,TERRACE,34.0376,-118.2166,Battery Crime,Bodily Harm,Violent Crimes,0.995930891
434588,21/04/2012,2012-04-21,Hollenbeck,24,M,H,EASTERN,34.0861,-118.1782,Theft,Property Crime,Non-Violent Crimes,0.990743614
434615,07/04/2012,2012-04-07,Harbor,31,F,H,1500 W  204TH                        ST,33.8449,-118.304,Assault,Bodily Harm,Violent Crimes,0.992644241
434651,30/09/2012,2012-09-30,Wilshire,36,F,B,SAN VICENTE                  BL,34.0528,-118.3509,Battery Crime,Bodily Harm,Violent Crimes,0.992418461
434654,06/09/2012,2012-09-06,Southwest,39,M,H,W  ADAMS                        BL,34.0326,-118.335,Robbery,Robbery,Violent Crimes,0.99176996
434744,28/04/2012,2012-04-27,77th Street,20,M,H,RAYMOND,34.0037,-118.298,Battery Crime,Bodily Harm,Violent Crimes,0.995614383
435283,23/11/2012,2012-11-23,Southwest,57,M,A,3300 S  HOOVER                       ST,34.0255,-118.2839,Theft,Property Crime,Non-Violent Crimes,0.990937505
435868,19/11/2012,2012-11-18,77th Street,24,M,H,1400 W  69TH                         ST,33.977,-118.3003,Theft,Property Crime,Non-Violent Crimes,0.996244826
435889,20/09/2012,2012-09-20,Newton,43,M,H,5900    WALL                         ST,33.9873,-118.2718,Robbery,Robbery,Violent Crimes,0.991348752
436083,17/08/2012,2012-08-17,77th Street,31,F,B,FLORENCE                     AV,33.9747,-118.2871,Assault,Bodily Harm,Violent Crimes,0.998920059
436353,08/04/2012,2012-04-08,Southwest,31,F,H,5300    SMILEY                       DR,34.0285,-118.3606,Battery Crime,Bodily Harm,Violent Crimes,0.99046293
436557,01/03/2012,2012-03-01,Devonshire,35,F,B,20900    GRESHAM                      ST,34.2306,-118.5885,Assault,Bodily Harm,Violent Crimes,0.993979384
436575,29/01/2012,2012-01-29,Hollywood,31,M,W,VISTA DEL MAR                AV,34.1017,-118.3245,Theft,Property Crime,Non-Violent Crimes,0.991340417
437085,29/06/2012,2012-02-16,Harbor,28,M,A,23700    PRESIDENT                    AV,33.8115,-118.3055,Theft,Property Crime,Non-Violent Crimes,0.999170139
437258,12/12/2012,2012-12-12,Newton,51,F,H,100 W  61ST                         ST,33.9843,-118.2739,Battery Crime,Bodily Harm,Violent Crimes,0.990710028
437705,23/10/2012,2012-10-23,Mission,20,M,H,ROSCOE,34.2215,-118.4553,Robbery,Robbery,Violent Crimes,0.99423021
437800,08/10/2012,2012-10-06,Rampart,43,F,O,100 N  DILLON                       ST,34.0723,-118.2831,Theft,Property Crime,Non-Violent Crimes,0.995158654
437998,29/09/2012,2012-09-29,Topanga,30,F,H,22400    VENTURA                      BL,34.1688,-118.6145,Robbery,Robbery,Violent Crimes,0.992516013
438087,18/11/2012,2012-11-18,Rampart,40,M,B,300    WITMER                       ST,34.0591,-118.2635,Theft,Property Crime,Non-Violent Crimes,0.991782435
438711,10/07/2012,2012-07-10,Southwest,53,F,H,2900    KENWOOD                      AV,34.0291,-118.2991,Rape,Rape,Violent Crimes,0.993778242
438957,12/07/2012,2012-07-12,Topanga,62,F,W,22300    BRYANT                       ST,34.2269,-118.613,Theft,Property Crime,Non-Violent Crimes,0.99397739
439151,16/10/2012,2012-10-15,West LA,33,F,X,1600    CAMDEN                       AV,34.0502,-118.4439,Theft,Property Crime,Non-Violent Crimes,0.991685557
439213,17/04/2012,2012-04-11,N Hollywood,35,F,H,11200    CALVERT                      ST,34.1813,-118.3746,Assault,Bodily Harm,Violent Crimes,0.992154313
439416,31/05/2012,2012-05-31,77th Street,36,M,B,FLORENCE,33.9746,-118.2916,Assault,Bodily Harm,Violent Crimes,0.994340888
439587,08/09/2012,2012-09-08,Rampart,39,F,W,700 N  EDGEMONT                     ST,34.0836,-118.296,Theft,Property Crime,Non-Violent Crimes,0.992529048
439776,29/08/2012,2012-08-26,Newton,19,F,H,41ST                         PL,34.0082,-118.2696,Theft,Property Crime,Non-Violent Crimes,0.996454169
439824,02/02/2012,2012-02-01,Foothill,48,M,H,9200    KEWEN                        AV,34.2371,-118.4004,Theft,Property Crime,Non-Violent Crimes,0.992833108
440331,28/11/2012,2012-11-26,77th Street,25,F,W,2000 W  68TH                         ST,33.9778,-118.3133,Theft,Property Crime,Non-Violent Crimes,0.990081101
440593,23/05/2012,2012-05-23,Southeast,55,F,B,119TH                        ST,33.9249,-118.2848,Theft,Property Crime,Non-Violent Crimes,0.994211252
440614,25/03/2012,2012-03-23,Rampart,30,M,H,SUNSET                       BL,34.0776,-118.2635,Theft,Property Crime,Non-Violent Crimes,0.996915673
440646,25/02/2012,2012-02-22,West Valley,37,M,O,6000    ETIWANDA                     AV,34.1791,-118.5308,Theft,Property Crime,Non-Violent Crimes,0.994586818
440927,31/07/2012,2012-07-30,77th Street,28,M,B,CRENSHAW,0,0,Robbery,Robbery,Violent Crimes,0.990603458
441032,17/07/2012,2012-04-01,Southwest,30,F,B,4200    GARTHWAITE                   AV,34.0071,-118.326,Assault,Bodily Harm,Violent Crimes,0.995381482
441094,18/05/2012,2012-05-08,Southeast,27,F,H,1700 E  112TH                        ST,33.933,-118.2434,Theft,Property Crime,Non-Violent Crimes,0.997823488
441279,09/06/2012,2012-04-21,Newton,50,F,B,200 W  66TH                         ST,33.9798,-118.2761,Fraud,White Collar Crime,Non-Violent Crimes,0.995233397
441574,02/06/2012,2012-06-02,Foothill,26,M,H,OSBORNE,34.2582,-118.404,Battery Crime,Bodily Harm,Violent Crimes,0.991046036
441806,11/07/2012,2012-06-04,Olympic,58,F,B,500 S  VAN NESS                     AV,34.0653,-118.3156,Theft,Property Crime,Non-Violent Crimes,0.999125277
442242,10/11/2012,2012-11-10,Rampart,24,F,H,BEVERLY                      BL,34.0714,-118.2813,Robbery,Robbery,Violent Crimes,0.991808296
442286,27/06/2012,2012-06-27,Central,48,M,O,1300 S  HOPE                         ST,34.0395,-118.2656,Battery Crime,Bodily Harm,Violent Crimes,0.993733797
442328,12/08/2012,2012-08-12,Topanga,38,F,H,7100    MILWOOD                      AV,34.1992,-118.5943,Battery Crime,Bodily Harm,Violent Crimes,0.994846312
442776,15/02/2012,2012-02-10,Mission,45,F,H,9000    LANGDON                      AV,34.2338,-118.4698,Theft,Property Crime,Non-Violent Crimes,0.992768057
442862,02/05/2012,2012-05-02,Wilshire,35,M,H,1800    HI POINT                     ST,34.0435,-118.3713,Theft,Property Crime,Non-Violent Crimes,0.99889737
442952,13/12/2012,2012-12-12,West LA,44,M,W,10500    ASHTON                       AV,34.0638,-118.4309,Theft,Property Crime,Non-Violent Crimes,0.990954406
443212,10/12/2012,2012-11-30,Foothill,58,F,H,7400    APPERSON                     ST,34.256,-118.2932,Theft,Property Crime,Non-Violent Crimes,0.992134755
443480,02/05/2013,2012-10-15,Hollenbeck,74,F,K,49000    VIA MARISOL                  AV,34.0934,-118.1881,Theft,Property Crime,Non-Violent Crimes,0.998476176
443576,26/11/2012,2012-11-23,Hollywood,20,M,B,1200 N  EL CENTRO                    AV,34.0926,-118.3244,Theft,Property Crime,Non-Violent Crimes,0.991357079
443584,10/08/2012,2012-08-10,Devonshire,44,F,B,RESEDA                       BL,34.2355,-118.5361,Theft,Property Crime,Non-Violent Crimes,0.992850651
443643,26/04/2012,2012-04-23,Van Nuys,27,F,A,14900    OXNARD                       ST,34.1794,-118.4574,Theft,Property Crime,Non-Violent Crimes,0.992932835
443731,25/12/2012,2012-12-25,Topanga,23,M,H,20200    SHERMAN                      WY,34.2012,-118.5732,Robbery,Robbery,Violent Crimes,0.997665775
443742,14/07/2012,2012-07-13,Foothill,20,F,H,11600    GOLETA                       ST,34.2789,-118.3858,Battery Crime,Bodily Harm,Violent Crimes,0.991702039
444265,30/03/2012,2012-03-01,Rampart,47,M,H,200    LAKE SHORE                   TR,34.0644,-118.2609,Fraud,White Collar Crime,Non-Violent Crimes,0.994820004
444525,25/11/2012,2012-11-15,Topanga,36,F,B,20300    LANARK                       ST,34.218,-118.5754,Theft,Property Crime,Non-Violent Crimes,0.990685706
444604,23/08/2014,2012-01-01,Hollywood,40,M,O,5400    BARTON                       AV,34.0876,-118.3091,Theft,Property Crime,Non-Violent Crimes,0.995987207
444675,04/09/2012,2012-08-27,Northeast,22,F,H,1500 N  VERMONT                      AV,34.0982,-118.2918,Theft,Property Crime,Non-Violent Crimes,0.999650016
445375,20/11/2012,2012-11-20,Newton,56,F,H,56TH                         ST,33.9916,-118.2608,Robbery,Robbery,Violent Crimes,0.992207451
445552,27/10/2012,2012-10-26,West Valley,23,M,W,AMESTOY                      AV,34.2012,-118.5058,Theft,Property Crime,Non-Violent Crimes,0.995718785
445611,18/10/2012,2012-10-18,Harbor,28,F,H,ANAHEIM,33.78,-118.2618,Assault,Bodily Harm,Violent Crimes,0.993006871
445906,15/10/2012,2012-10-15,Pacific,57,M,W,3400    BEETHOVEN                    ST,34.0078,-118.448,Theft,Property Crime,Non-Violent Crimes,0.993241151
446428,29/04/2012,2012-04-29,Topanga,23,M,X,6400    FALLBROOK                    AV,34.1864,-118.6234,Theft,Property Crime,Non-Violent Crimes,0.993519457
446509,23/02/2012,2012-02-22,Southeast,22,F,B,10300    WILMINGTON                   AV,33.9431,-118.2391,Assault,Bodily Harm,Violent Crimes,0.998235836
446692,08/12/2012,2012-12-07,77th Street,26,F,H,1500 W  59TH                         PL,33.9867,-118.3024,Assault,Bodily Harm,Violent Crimes,0.991945478
446734,25/06/2012,2012-06-24,Devonshire,74,M,H,10300    LINDLEY                      AV,34.2573,-118.5273,Theft,Property Crime,Non-Violent Crimes,0.991785925
447254,26/04/2012,2012-04-15,West Valley,82,M,W,7800    RESEDA                       BL,34.212,-118.5361,Theft,Property Crime,Non-Violent Crimes,0.990232697
447322,11/02/2012,2012-02-10,Mission,31,F,H,14800    CALAHAN                      ST,34.2364,-118.4555,Battery Crime,Bodily Harm,Violent Crimes,0.991749982
447591,19/11/2012,2012-11-18,Rampart,29,F,H,700 S  BONNIE BRAE                  ST,34.0554,-118.2745,Assault,Bodily Harm,Violent Crimes,0.998226593
447690,09/10/2012,2012-10-08,Northeast,33,F,H,100 S  AVENUE 49,34.1023,-118.203,Theft,Property Crime,Non-Violent Crimes,0.993682682
447881,21/01/2012,2012-01-20,West Valley,24,M,H,7100    HASKELL                      AV,34.1994,-118.4749,Theft,Property Crime,Non-Violent Crimes,0.991165193
447910,08/04/2012,2012-04-06,77th Street,32,F,O,4100 W  SLAUSON                      AV,33.9889,-118.3461,Theft,Property Crime,Non-Violent Crimes,0.999801634
448287,13/04/2012,2012-04-05,Rampart,55,F,H,2500 W  4TH                          ST,34.0642,-118.2771,Theft,Property Crime,Non-Violent Crimes,0.990331486
448473,24/10/2012,2012-10-05,Pacific,67,M,B,6400 W  84TH                         PL,33.9621,-118.3993,Theft,Property Crime,Non-Violent Crimes,0.996854677
448849,04/02/2012,2012-02-04,Northeast,46,F,W,2100    MONTANA                      ST,34.0805,-118.2617,Assault,Bodily Harm,Violent Crimes,0.99823897
448859,19/09/2012,2012-09-18,77th Street,28,M,B,8900 S  MANHATTAN                    PL,33.9564,-118.3101,Battery Crime,Bodily Harm,Violent Crimes,0.998784793
449007,22/06/2012,2012-06-22,Hollenbeck,45,M,O,100 W  AVENUE 31,34.0813,-118.2142,Assault,Bodily Harm,Violent Crimes,0.992130236
449426,24/11/2012,2012-06-02,Pacific,28,M,W,500    ROSE                         AV,33.9981,-118.4741,Theft,Property Crime,Non-Violent Crimes,0.997289434
450061,14/09/2012,2012-09-11,Newton,66,M,B,4000 S  CENTRAL                      AV,34.0101,-118.2565,Theft,Property Crime,Non-Violent Crimes,0.99309745
450162,17/10/2012,2012-10-16,Southwest,52,F,W,3500 S  LA CIENEGA                   BL,34.0242,-118.3722,Theft,Property Crime,Non-Violent Crimes,0.990918185
450428,01/09/2012,2012-08-30,Northeast,57,M,W,600    CHESTNUT                     AV,34.1163,-118.1731,Theft,Property Crime,Non-Violent Crimes,0.995067116
450451,10/06/2012,2012-06-10,Van Nuys,38,M,H,4300    WOODMAN                      AV,34.148,-118.4312,Battery Crime,Bodily Harm,Violent Crimes,0.997849927
450761,01/04/2012,2012-03-26,Hollenbeck,26,M,H,2000    PENNSYLVANIA                 AV,34.0464,-118.2144,Theft,Property Crime,Non-Violent Crimes,0.990238152
450869,29/07/2012,2012-07-29,Central,31,M,H,17TH                         ST,34.0373,-118.2707,Theft,Property Crime,Non-Violent Crimes,0.997679689
450919,10/11/2012,2012-11-09,West Valley,52,M,H,VOSE,34.1985,-118.4837,Theft,Property Crime,Non-Violent Crimes,0.993634092
450937,26/01/2012,2012-01-26,Van Nuys,42,M,O,13600    BURBANK                      BL,34.1722,-118.429,Theft,Property Crime,Non-Violent Crimes,0.993185509
450943,23/04/2012,2012-04-22,Pacific,32,M,W,CENTINELA                    AV,33.9906,-118.4204,Theft,Property Crime,Non-Violent Crimes,0.994472515
451124,26/11/2012,2012-11-26,Topanga,21,F,H,6700    INDEPENDENCE                 AV,34.1921,-118.5906,Assault,Bodily Harm,Violent Crimes,0.991203486
451132,12/06/2012,2012-06-12,Olympic,21,M,H,1400 S  VERMONT                      AV,34.0463,-118.2916,Assault,Bodily Harm,Violent Crimes,0.990881259
451339,12/07/2012,2012-07-12,West LA,27,M,O,VENICE                       BL,34.0321,-118.3836,Theft,Property Crime,Non-Violent Crimes,0.999440301
451700,02/06/2012,2012-06-01,77th Street,17,M,B,1400 W  56TH                         ST,33.9915,-118.3002,Assault,Bodily Harm,Violent Crimes,0.996734565
451829,03/11/2012,2012-11-03,Pacific,27,M,W,00    MARKET                       ST,33.9881,-118.473,Battery Crime,Bodily Harm,Violent Crimes,0.995489482
451886,15/10/2012,2012-10-14,Olympic,45,M,W,WESTERN,34.0617,-118.3091,Theft,Property Crime,Non-Violent Crimes,0.996324825
451890,17/05/2012,2012-05-17,77th Street,16,M,H,ARLINGTON,33.9932,-118.3177,Robbery,Robbery,Violent Crimes,0.99915432
451967,28/02/2012,2012-02-28,N Hollywood,57,M,O,12000    BURBANK                      BL,34.1722,-118.3946,Battery Crime,Bodily Harm,Violent Crimes,0.994514526
452172,25/10/2012,2012-10-25,N Hollywood,48,F,W,4300    COLFAX                       AV,34.1479,-118.3877,Theft,Property Crime,Non-Violent Crimes,0.997264158
452174,26/11/2012,2012-11-25,Pacific,24,M,O,11900    VENICE                       BL,34.0071,-118.4272,Theft,Property Crime,Non-Violent Crimes,0.992160926
452222,20/03/2012,2012-03-20,Pacific,35,M,H,11300    NATIONAL                     BL,34.0263,-118.4314,Theft,Property Crime,Non-Violent Crimes,0.999379146
452442,01/03/2012,2012-03-01,Olympic,46,M,K,BERENDO                      ST,34.0636,-118.2941,Battery Crime,Bodily Harm,Violent Crimes,0.994085394
452556,09/03/2012,2012-03-09,Olympic,21,F,A,600 S  VAN NESS                     AV,34.0632,-118.3154,Battery Crime,Bodily Harm,Violent Crimes,0.991222821
452676,22/03/2012,2012-03-20,Mission,25,F,O,13600    FOOTHILL                     BL,34.307,-118.4297,Battery Crime,Bodily Harm,Violent Crimes,0.998940811
453006,08/05/2012,2012-05-08,Harbor,36,M,H,PACIFIC COAST                HY,33.7909,-118.2481,Assault,Bodily Harm,Violent Crimes,0.990765144
453039,02/08/2012,2012-08-02,Van Nuys,53,M,W,4400    NOBLE                        AV,34.1506,-118.4622,Theft,Property Crime,Non-Violent Crimes,0.996719773
453063,07/06/2012,2012-06-07,Wilshire,27,F,W,8200    MELROSE                      AV,34.0837,-118.368,Theft,Property Crime,Non-Violent Crimes,0.995942056
453219,14/10/2012,2012-10-12,Rampart,45,M,W,700 N  OCCIDENTAL                   BL,34.0785,-118.2748,Theft,Property Crime,Non-Violent Crimes,0.998286084
453243,25/07/2012,2012-07-24,Southeast,61,F,B,1200 E  112TH                        ST,33.9331,-118.2542,Theft,Property Crime,Non-Violent Crimes,0.991597121
454175,12/01/2012,2012-01-12,Southeast,22,F,H,9500    COMPTON                      AV,33.9507,-118.2461,Battery Crime,Bodily Harm,Violent Crimes,0.991375217
454288,30/07/2012,2012-03-20,West LA,24,F,W,1100 S  BEDFORD                      ST,0,0,Theft,Property Crime,Non-Violent Crimes,0.993910938
454290,16/04/2012,2012-04-16,Hollywood,48,M,W,3300    DERONDA                      DR,34.1271,-118.3196,Theft,Property Crime,Non-Violent Crimes,0.997034768
454295,02/12/2012,2012-11-21,N Hollywood,26,M,W,11500    MOORPARK                     ST,34.1504,-118.3823,Theft,Property Crime,Non-Violent Crimes,0.991415627
454451,03/09/2012,2012-09-02,Devonshire,30,F,H,ROSCOE                       BL,34.2214,-118.4731,Assault,Bodily Harm,Violent Crimes,0.990868535
454452,18/03/2012,2012-03-18,Northeast,13,F,H,CYPRESS,34.0864,-118.219,Battery Crime,Bodily Harm,Violent Crimes,0.999121321
455291,23/03/2012,2012-03-23,Southeast,20,M,H,117TH,33.9274,-118.2916,Battery Crime,Bodily Harm,Violent Crimes,0.990933849
455295,05/01/2012,2012-01-04,Devonshire,50,F,H,10100    BALBOA                       BL,34.2539,-118.5024,Theft,Property Crime,Non-Violent Crimes,0.995747749
455338,12/03/2012,2012-02-02,Central,50,M,B,600 S  SAN PEDRO                    ST,34.0423,-118.2452,Theft,Property Crime,Non-Violent Crimes,0.995307746
455390,30/11/2012,2012-11-30,Topanga,37,F,O,6300    VARIEL                       AV,34.1847,-118.5928,Theft,Property Crime,Non-Violent Crimes,0.994604392
455756,14/08/2012,2012-08-01,West LA,48,M,W,2100    COTNER                       AV,34.0407,-118.4405,Theft,Property Crime,Non-Violent Crimes,0.998778973
455993,08/03/2012,2012-03-08,West LA,64,F,W,1200 N  BUNDY                        DR,34.0808,-118.4829,Theft,Property Crime,Non-Violent Crimes,0.999466762
455994,13/02/2012,2012-02-13,Northeast,35,F,H,6300 N  FIGUEROA                     ST,34.1155,-118.1843,Theft,Property Crime,Non-Violent Crimes,0.990628496
456020,23/09/2012,2012-09-23,Southeast,22,F,H,600 E  109TH                        PL,33.9365,-118.2652,Assault,Bodily Harm,Violent Crimes,0.996737179
456129,29/02/2012,2012-02-13,Southwest,36,F,H,2600 W  52ND                         ST,33.995,-118.3214,Theft,Property Crime,Non-Violent Crimes,0.990358845
456142,07/06/2012,2012-06-07,N Hollywood,39,F,W,12400    SARAH                        ST,34.154,-118.403,Battery Crime,Bodily Harm,Violent Crimes,0.998855604
456304,18/01/2013,2012-12-10,Southwest,76,F,O,3800 S  NORTON                       AV,34.0173,-118.3329,Fraud,White Collar Crime,Non-Violent Crimes,0.997301322
456652,17/07/2012,2012-07-17,Newton,21,M,H,67TH                         ST,33.979,-118.2739,Battery Crime,Bodily Harm,Violent Crimes,0.998417809
456949,16/02/2012,2012-02-16,Newton,25,M,O,18TH                         ST,34.0277,-118.2549,Theft,Property Crime,Non-Violent Crimes,0.999278093
456986,10/06/2012,2012-06-10,Central,21,F,H,5TH                          ST,34.0489,-118.2519,Theft,Property Crime,Non-Violent Crimes,0.990157123
457051,25/07/2012,2012-07-24,Olympic,30,M,A,3000 W  12TH                         PL,34.0482,-118.3063,Theft,Property Crime,Non-Violent Crimes,0.99781197
457160,28/04/2012,2012-04-28,Hollenbeck,30,F,H,200 N  BREED                        ST,34.0456,-118.2101,Battery Crime,Bodily Harm,Violent Crimes,0.990780618
457244,19/01/2012,2012-01-19,Olympic,22,F,H,4TH                          ST,34.0674,-118.2916,Theft,Property Crime,Non-Violent Crimes,0.999874141
457253,13/09/2012,2012-08-06,Hollywood,26,F,W,1700 N  MC CADDEN                    PL,34.1016,-118.3374,Theft,Property Crime,Non-Violent Crimes,0.990625951
457288,01/01/2012,2012-01-01,Pacific,42,M,O,600    WORLD                        WY,33.943,-118.4035,Battery Crime,Bodily Harm,Violent Crimes,0.997164449
457412,01/08/2012,2012-08-01,West LA,59,M,O,8500    PICKFORD                     ST,34.0491,-118.3761,Theft,Property Crime,Non-Violent Crimes,0.996765666
457464,23/10/2012,2012-10-07,Van Nuys,28,M,W,4700    FULTON                       AV,34.1558,-118.4225,Theft,Property Crime,Non-Violent Crimes,0.999638562
458072,17/12/2012,2012-10-11,Northeast,88,M,W,1900 N  ALVARADO                     ST,34.0884,-118.2569,Theft,Property Crime,Non-Violent Crimes,0.992021047
458097,05/12/2014,2012-12-05,N Hollywood,59,F,H,11100    CANTLAY                      ST,34.2022,-118.3725,Theft,Property Crime,Non-Violent Crimes,0.990863812
458149,24/12/2012,2012-12-15,Newton,55,M,H,100 W  56TH                         ST,33.9915,-118.2739,Theft,Property Crime,Non-Violent Crimes,0.998155102
458200,24/03/2012,2012-03-24,Van Nuys,52,F,H,14100    RUNNYMEDE                    ST,34.2058,-118.44,Theft,Property Crime,Non-Violent Crimes,0.997357264
458229,15/01/2012,2012-01-15,Southeast,22,M,B,1600 E  103RD                        ST,33.9433,-118.2462,Robbery,Robbery,Violent Crimes,0.994722378
458230,24/12/2012,2012-12-07,Mission,27,F,H,8500    WILLIS                       AV,34.2247,-118.4553,Theft,Property Crime,Non-Violent Crimes,0.993066407
458286,06/08/2012,2012-08-05,Southeast,71,M,B,9100 S  FIGUEROA                     ST,33.9543,-118.2827,Battery Crime,Bodily Harm,Violent Crimes,0.999807535
458348,12/09/2012,2012-09-12,Harbor,44,M,H,100 S  GAFFEY                       ST,33.7433,-118.2923,Assault,Bodily Harm,Violent Crimes,0.991653439
459179,09/04/2012,2012-04-08,Pacific,50,M,H,5300    PLAYA VISTA                  DR,33.9775,-118.4292,Theft,Property Crime,Non-Violent Crimes,0.998270387
459192,11/03/2012,2012-03-11,Northeast,26,F,W,3700    MONON                        ST,34.1097,-118.2739,Theft,Property Crime,Non-Violent Crimes,0.999420982
459305,10/07/2012,2012-07-04,West Valley,68,F,B,8000    CANBY                        AV,34.2157,-118.5345,Theft,Property Crime,Non-Violent Crimes,0.996660658
459340,08/07/2012,2012-07-07,Rampart,15,F,H,3400    BELLEVUE                     AV,34.0792,-118.2811,Assault,Bodily Harm,Violent Crimes,0.99053436
459386,11/06/2012,2012-06-10,Hollywood,25,M,W,1500    VINE                         ST,34.098,-118.3267,Theft,Property Crime,Non-Violent Crimes,0.999690062
459422,08/08/2012,2012-07-31,Van Nuys,27,M,B,14900    SATICOY                      ST,34.2085,-118.4575,Theft,Property Crime,Non-Violent Crimes,0.994109732
459973,06/12/2012,2012-12-05,Southeast,41,F,H,11300    CROESUS                      AV,33.9325,-118.2335,Theft,Property Crime,Non-Violent Crimes,0.999831473
460266,04/04/2012,2012-04-04,Newton,46,M,B,9TH                          ST,34.035,-118.2478,Robbery,Robbery,Violent Crimes,0.993421478
460287,28/10/2012,2012-10-28,Wilshire,33,M,O,600 N  LA CIENEGA                   BL,34.0889,-118.3764,Battery Crime,Bodily Harm,Violent Crimes,0.991471339
460474,22/07/2012,2012-07-22,Central,33,M,W,1300 S  HOPE                         ST,34.0395,-118.2656,Battery Crime,Bodily Harm,Violent Crimes,0.99003532
460592,15/03/2012,2012-03-15,Rampart,36,M,H,800 S  ALVARADO                     ST,34.0549,-118.2778,Assault,Bodily Harm,Violent Crimes,0.996863828
461071,24/07/2012,2012-07-20,Mission,69,F,H,13100    WOODCOCK                     AV,34.3082,-118.4579,Theft,Property Crime,Non-Violent Crimes,0.995806909
461178,30/08/2014,2012-07-04,Newton,41,M,H,VERNON                       AV,34.0039,-118.2696,Assault,Bodily Harm,Violent Crimes,0.996987386
461443,07/12/2012,2012-12-07,Mission,39,F,H,12700    BROMONT                      AV,34.3008,-118.4259,Theft,Property Crime,Non-Violent Crimes,0.995477094
461450,08/10/2012,2012-10-08,Pacific,44,M,O,3600    GREENFIELD                   AV,34.0191,-118.4163,Battery Crime,Bodily Harm,Violent Crimes,0.997587036
461767,30/12/2012,2012-11-30,Van Nuys,25,M,W,15300    HATTERAS                     ST,34.1758,-118.4662,Theft,Property Crime,Non-Violent Crimes,0.999921418
461920,25/08/2012,2012-08-25,Newton,29,F,H,5500 S  CENTRAL                      AV,33.9926,-118.2564,Kidnapping,Abduction,Violent Crimes,0.995413265
462098,15/05/2012,2012-05-14,West LA,50,F,O,12300    TEXAS                        AV,34.0415,-118.4677,Theft,Property Crime,Non-Violent Crimes,0.993659966
462171,04/05/2012,2012-05-03,Southwest,64,F,B,1900 W  43RD                         ST,34.0055,-118.3138,Battery Crime,Bodily Harm,Violent Crimes,0.999712631
462520,14/12/2012,2012-12-14,Hollenbeck,38,M,W,1900    MARENGO                      ST,34.0578,-118.2102,Battery Crime,Bodily Harm,Violent Crimes,0.997628749
462567,14/07/2012,2012-07-14,Topanga,34,M,O,21600    BURBANK                      BL,34.1733,-118.6002,Theft,Property Crime,Non-Violent Crimes,0.992298709
462571,30/10/2012,2012-10-26,Rampart,69,F,H,1800    JAMES M WOOD                 BL,34.0519,-118.2755,Theft,Property Crime,Non-Violent Crimes,0.997216363
462734,21/11/2012,2012-11-17,Mission,63,M,H,9500    DORRINGTON                   AV,34.2444,-118.4452,Theft,Property Crime,Non-Violent Crimes,0.999806102
462890,14/07/2012,2012-07-13,Foothill,46,F,H,VAN NUYS                     BL,34.2725,-118.4133,Robbery,Robbery,Violent Crimes,0.999037835
463096,05/07/2012,2012-06-17,Devonshire,34,M,H,RESEDA                       BL,34.2355,-118.5361,Assault,Bodily Harm,Violent Crimes,0.996037745
463156,02/09/2012,2012-08-26,Topanga,49,M,H,7700    PENFIELD                     AV,34.2107,-118.5689,Theft,Property Crime,Non-Violent Crimes,0.990285516
463552,30/12/2016,2012-02-01,West Valley,53,F,W,18800    CANTLAY                      ST,34.2021,-118.5426,Theft,Property Crime,Non-Violent Crimes,0.99439144
463579,20/07/2012,2012-07-20,Hollywood,26,F,H,HOLLYWOOD                    BL,34.1016,-118.331,Assault,Bodily Harm,Violent Crimes,0.998077943
464026,05/09/2012,2012-09-05,Topanga,48,F,W,CANOGA,34.2083,-118.5975,Battery Crime,Bodily Harm,Violent Crimes,0.999008042
464302,17/03/2012,2012-03-13,Mission,40,M,H,12700    SAN FERNANDO                 RD,34.2997,-118.4598,Theft,Property Crime,Non-Violent Crimes,0.995741083
464338,08/06/2012,2012-06-08,Southeast,55,F,B,10300 S  CENTRAL                      AV,33.9433,-118.2541,Theft,Property Crime,Non-Violent Crimes,0.993375069
464394,28/03/2012,2012-03-28,Northeast,18,F,H,6000 N  FIGUEROA                     ST,34.1114,-118.1891,Theft,Property Crime,Non-Violent Crimes,0.990624893
464546,05/06/2012,2012-06-03,Mission,20,M,H,12500    SAN FERNANDO                 RD,34.2968,-118.4553,Battery Crime,Bodily Harm,Violent Crimes,0.990056759
464831,29/08/2012,2012-08-28,77th Street,50,M,B,6100    10TH                         AV,33.9846,-118.3279,Battery Crime,Bodily Harm,Violent Crimes,0.996547315
464929,19/03/2012,2012-03-19,77th Street,41,M,B,9600 S  VAN NESS                     AV,33.9491,-118.3177,Theft,Property Crime,Non-Violent Crimes,0.997309211
465081,04/11/2012,2012-11-04,Rampart,30,M,H,BURLINGTON                   AV,34.055,-118.2735,Robbery,Robbery,Violent Crimes,0.992581515
465122,04/06/2012,2012-06-01,Van Nuys,58,F,W,13900    VENTURA                      BL,34.1489,-118.4363,Theft,Property Crime,Non-Violent Crimes,0.999472453
465301,20/07/2012,2012-07-19,West LA,69,M,W,12400    TEXAS                        AV,34.0408,-118.4685,Battery Crime,Bodily Harm,Violent Crimes,0.993256215
465882,05/05/2012,2012-05-04,Southwest,25,M,H,3500 S  LA CIENEGA                   BL,34.0242,-118.3722,Theft,Property Crime,Non-Violent Crimes,0.995457345
465981,25/10/2012,2012-10-23,Topanga,46,M,W,7500    WINNETKA                     AV,34.2059,-118.571,Theft,Property Crime,Non-Violent Crimes,0.992070759
466047,13/06/2012,2012-06-13,Rampart,74,F,H,UNION                        AV,34.043,-118.2779,Robbery,Robbery,Violent Crimes,0.999923004
466058,28/03/2012,2012-03-28,Rampart,41,F,B,200 S  LAKE                         ST,34.0663,-118.2719,Theft,Property Crime,Non-Violent Crimes,0.999222763
466106,13/06/2012,2012-06-03,Van Nuys,34,F,W,4400    VISTA DEL MONTE              AV,34.1521,-118.4499,Theft,Property Crime,Non-Violent Crimes,0.998717649
466629,05/10/2012,2012-10-05,West Valley,9,M,H,SHERMAN                      WY,34.2012,-118.4837,Assault,Bodily Harm,Violent Crimes,0.99560322
466922,16/08/2012,2012-08-14,Southeast,25,F,B,400 E  120TH                        ST,33.9237,-118.2681,Theft,Property Crime,Non-Violent Crimes,0.990727837
467236,26/09/2012,2012-08-29,West Valley,46,M,O,17600    VENTURA                      BL,34.162,-118.5166,Fraud,White Collar Crime,Non-Violent Crimes,0.998752372
467306,16/07/2012,2012-07-13,Wilshire,26,F,W,8400    MELROSE                      AV,34.0835,-118.3734,Theft,Property Crime,Non-Violent Crimes,0.990282996
467345,01/12/2012,2012-11-30,Hollywood,24,M,H,6300    HOLLYWOOD                    BL,34.1016,-118.3267,Theft,Property Crime,Non-Violent Crimes,0.998134665
467399,16/03/2012,2012-03-15,Mission,30,F,H,8100 N  SEPULVEDA                    BL,34.2181,-118.4664,Assault,Bodily Harm,Violent Crimes,0.995085519
467487,26/02/2012,2012-02-22,West Valley,90,M,W,16400    GILMORE                      ST,34.1876,-118.4902,Theft,Property Crime,Non-Violent Crimes,0.992350307
467493,27/01/2012,2012-01-27,Hollywood,30,M,O,ARGYLE                       ST,34.1016,-118.3252,Fraud,White Collar Crime,Non-Violent Crimes,0.991519604
467846,04/12/2012,2012-12-03,Southwest,51,M,H,3700    HILLCREST                    DR,34.0199,-118.3432,Theft,Property Crime,Non-Violent Crimes,0.995645461
467860,01/10/2012,2012-10-01,Central,57,F,H,5TH                          ST,34.0481,-118.2507,Theft,Property Crime,Non-Violent Crimes,0.998169364
467994,15/01/2012,2012-01-15,Northeast,46,M,O,1400    GLENDALE                     BL,34.0798,-118.2602,Robbery,Robbery,Violent Crimes,0.991548531
468442,01/12/2012,2012-12-01,Southwest,22,F,H,1400 W  ADAMS                        BL,34.0328,-118.2915,Battery Crime,Bodily Harm,Violent Crimes,0.99003029
468556,20/03/2012,2012-03-20,Mission,19,F,H,15000    RINALDI                      ST,34.279,-118.4589,Assault,Bodily Harm,Violent Crimes,0.997706756
468587,10/04/2012,2012-04-02,Northeast,36,M,H,5900    PIEDMONT                     AV,34.1119,-118.1918,Theft,Property Crime,Non-Violent Crimes,0.990901334
468677,29/12/2012,2012-12-29,Hollenbeck,17,F,H,600 S  SOTO                         ST,34.0375,-118.2137,Battery Crime,Bodily Harm,Violent Crimes,0.996677131
468769,04/05/2012,2012-05-03,Newton,21,F,B,5500    AVALON                       BL,33.9925,-118.2652,Theft,Property Crime,Non-Violent Crimes,0.997771175
469079,08/08/2012,2012-08-07,West LA,41,F,W,1000    AMHERST                      AV,34.0459,-118.4712,Theft,Property Crime,Non-Violent Crimes,0.993419588
469130,01/12/2012,2012-12-01,Olympic,29,F,H,800 S  GRAMERCY                     PL,34.0581,-118.3132,Battery Crime,Bodily Harm,Violent Crimes,0.991618793
469231,30/05/2012,2012-05-29,Van Nuys,40,M,O,7000    WOODMAN                      AV,34.1976,-118.4312,Theft,Property Crime,Non-Violent Crimes,0.999324109
469281,10/07/2012,2012-06-01,N Hollywood,40,M,H,7800    BEEMAN                       AV,34.2125,-118.4092,Theft,Property Crime,Non-Violent Crimes,0.996017795
469287,14/03/2012,2012-03-14,Rampart,22,M,H,1200    JAMES M WOOD                 BL,34.0484,-118.2676,Theft,Property Crime,Non-Violent Crimes,0.996618469
469348,16/11/2012,2012-01-21,Foothill,66,M,O,7600    FOOTHILL                     BL,34.2564,-118.2999,Theft,Property Crime,Non-Violent Crimes,0.997083147
469505,11/05/2012,2012-05-11,Central,27,M,H,6TH                          ST,34.0446,-118.249,Assault,Bodily Harm,Violent Crimes,0.99160899
469629,15/10/2012,2012-10-15,Wilshire,51,M,B,800 N  LA BREA                      AV,34.0853,-118.3441,Battery Crime,Bodily Harm,Violent Crimes,0.996745696
469759,10/04/2012,2012-04-10,Topanga,45,F,W,22100    CLARENDON                    ST,34.1697,-118.608,Theft,Property Crime,Non-Violent Crimes,0.999801239
469861,22/09/2012,2012-09-22,Mission,50,F,W,8700    WOODMAN                      AV,34.228,-118.4344,Assault,Bodily Harm,Violent Crimes,0.999860216
469887,08/03/2013,2012-12-28,Devonshire,39,F,O,10200    MASON                        AV,34.2555,-118.5798,Theft,Property Crime,Non-Violent Crimes,0.994399199
470120,06/06/2012,2012-05-18,Southwest,54,F,H,4100    MENLO                        AV,34.0092,-118.29,Theft,Property Crime,Non-Violent Crimes,0.991647747
470206,30/10/2012,2012-10-30,Rampart,22,F,H,1600 W  12TH                         ST,34.0462,-118.276,Assault,Bodily Harm,Violent Crimes,0.991203709
470295,19/02/2012,2012-02-19,Hollywood,34,F,H,1100    VINE                         ST,34.0908,-118.3266,Assault,Bodily Harm,Violent Crimes,0.995685307
470385,09/11/2012,2012-10-22,Central,46,F,O,500 S  ALAMEDA                      ST,34.0414,-118.2382,Theft,Property Crime,Non-Violent Crimes,0.999637716
470859,17/11/2012,2012-11-17,Central,54,M,B,6TH,34.0423,-118.2452,Theft,Property Crime,Non-Violent Crimes,0.990324976
470869,06/05/2012,2012-05-06,Southeast,54,F,H,120TH                        ST,33.9237,-118.2652,Robbery,Robbery,Violent Crimes,0.991922736
471075,21/09/2012,2012-09-21,Harbor,78,M,W,900    EUBANK                       AV,33.7818,-118.2551,Assault,Bodily Harm,Violent Crimes,0.99474051
471499,17/08/2012,2012-08-16,Devonshire,43,M,H,10600    WOODLEY                      AV,34.2629,-118.4848,Theft,Property Crime,Non-Violent Crimes,0.99059016
471705,15/05/2012,2012-05-15,Newton,28,F,B,100 E  57TH                         ST,33.9907,-118.2739,Theft,Property Crime,Non-Violent Crimes,0.996948757
472221,29/01/2012,2012-01-28,West LA,65,F,W,1800    COMSTOCK                     AV,34.0575,-118.422,Theft,Property Crime,Non-Violent Crimes,0.990564775
472468,25/05/2012,2012-05-25,Central,24,M,H,1000 S  HILL                         ST,34.0416,-118.2584,Battery Crime,Bodily Harm,Violent Crimes,0.991725109
472566,02/06/2012,2012-06-02,Southeast,25,F,H,10900 S  SPRING                       ST,33.9374,-118.2762,Assault,Bodily Harm,Violent Crimes,0.99169295
472611,31/08/2012,2012-08-28,West Valley,19,M,O,18500    VENTURA                      BL,34.1687,-118.5359,Robbery,Robbery,Violent Crimes,0.99111902
472674,06/04/2012,2012-04-04,Newton,24,F,B,MARTIN LUTHER KING JR        BL,34.011,-118.2589,Assault,Bodily Harm,Violent Crimes,0.990088754
472970,26/07/2012,2012-07-25,Foothill,39,M,H,VAN NUYS                     BL,34.263,-118.4264,Battery Crime,Bodily Harm,Violent Crimes,0.998613402
473098,22/12/2012,2012-12-22,Northeast,70,F,H,3400    THE PASEO,34.1117,-118.2333,Assault,Bodily Harm,Violent Crimes,0.994278873
473099,23/05/2012,2012-05-19,Southwest,45,M,H,800 W  WASHINGTON                   BL,34.0361,-118.2757,Theft,Property Crime,Non-Violent Crimes,0.999277851
473106,08/01/2013,2012-12-26,N Hollywood,23,M,H,5500    BONNER                       AV,34.17,-118.3741,Theft,Property Crime,Non-Violent Crimes,0.990349122
473320,19/12/2012,2012-12-16,Harbor,42,F,H,1000    SANFORD                      AV,33.7835,-118.2505,Theft,Property Crime,Non-Violent Crimes,0.991417614
473341,22/07/2012,2012-07-22,Topanga,31,M,A,5900    FALLBROOK                    AV,34.1774,-118.6233,Theft,Property Crime,Non-Violent Crimes,0.990743727
473787,01/04/2012,2012-04-01,Harbor,41,F,H,24800    AVALON                       BL,33.801,-118.264,Battery Crime,Bodily Harm,Violent Crimes,0.993189086
473803,08/01/2012,2012-01-08,Pacific,44,M,W,8500 S  SEPULVEDA                    BL,33.961,-118.3962,Battery Crime,Bodily Harm,Violent Crimes,0.993268677
473965,07/09/2012,2012-03-18,Northeast,35,F,H,3200    DREW                         ST,34.1186,-118.245,Assault,Bodily Harm,Violent Crimes,0.999078005
474040,04/07/2012,2012-07-04,Rampart,60,M,H,7TH,34.0591,-118.2827,Robbery,Robbery,Violent Crimes,0.996907473
474173,14/08/2012,2012-08-14,Harbor,49,M,O,22900 S  WESTERN                      AV,33.818,-118.3089,Theft,Property Crime,Non-Violent Crimes,0.99171105
474253,03/01/2012,2012-01-03,Pacific,22,F,A,3400    SAWTELLE                     BL,34.0115,-118.4198,Theft,Property Crime,Non-Violent Crimes,0.998589768
474323,20/06/2012,2012-06-19,Pacific,44,M,H,STONER                       AV,33.9943,-118.4132,Theft,Property Crime,Non-Violent Crimes,0.993133418
474346,22/06/2012,2012-06-22,Topanga,24,F,H,ROSCOE,34.2197,-118.6016,Battery Crime,Bodily Harm,Violent Crimes,0.991362237
474584,31/05/2012,2012-05-10,Topanga,21,M,H,6700    TOPANGA CANYON               BL,34.1926,-118.6059,Theft,Property Crime,Non-Violent Crimes,0.998485104
474723,16/08/2012,2012-08-13,West Valley,47,M,H,5700    RESEDA                       BL,34.175,-118.536,Fraud,White Collar Crime,Non-Violent Crimes,0.99493991
475038,09/01/2016,2012-12-31,Rampart,49,F,W,800    CORONADO                     TR,34.076,-118.2692,Theft,Property Crime,Non-Violent Crimes,0.996535285
475276,25/03/2012,2012-03-25,Rampart,23,F,H,400    GRAND VIEW                   ST,34.063,-118.2753,Assault,Bodily Harm,Violent Crimes,0.990609184
475704,15/01/2012,2012-01-15,West LA,26,M,W,10200    SANTA MONICA                 BL,34.0605,-118.4193,Theft,Property Crime,Non-Violent Crimes,0.995405331
475766,04/10/2012,2012-10-02,N Hollywood,39,M,W,11500    RIVERSIDE                    DR,34.1577,-118.3823,Theft,Property Crime,Non-Violent Crimes,0.99630473
475797,22/07/2012,2012-07-22,Southwest,27,M,H,4000    STEVELY                      AV,34.015,-118.3536,Battery Crime,Bodily Harm,Violent Crimes,0.999963976
475946,25/05/2012,2012-05-25,Topanga,26,M,B,21800    VICTORY                      BL,34.1875,-118.603,Theft,Property Crime,Non-Violent Crimes,0.996605285
476035,07/06/2012,2012-06-07,N Hollywood,27,M,W,5400    COLFAX                       AV,34.1687,-118.3877,Theft,Property Crime,Non-Violent Crimes,0.995724261
476515,14/02/2012,2012-02-13,Southeast,22,F,B,500 W  CENTURY                      BL,33.9456,-118.2826,Battery Crime,Bodily Harm,Violent Crimes,0.99703504
476968,21/05/2012,2012-05-01,Newton,44,M,H,600 E  42ND                         ST,34.0076,-118.2653,Theft,Property Crime,Non-Violent Crimes,0.999431976
476970,15/08/2012,2012-08-15,N Hollywood,25,M,H,11000    HARTSOOK                     ST,34.164,-118.3706,Battery Crime,Bodily Harm,Violent Crimes,0.994361666
476986,16/05/2012,2012-05-16,West LA,29,F,H,1900 S  HOLT                         AV,34.0434,-118.3807,Battery Crime,Bodily Harm,Violent Crimes,0.992587282
477383,01/09/2012,2012-09-01,Central,53,F,B,CROCKER                      ST,34.0435,-118.2427,Assault,Bodily Harm,Violent Crimes,0.995238372
477562,22/03/2012,2012-03-20,77th Street,59,F,B,6200    EILEEN                       AV,33.9835,-118.3429,Theft,Property Crime,Non-Violent Crimes,0.990468939
477875,23/08/2012,2012-08-23,Southeast,55,F,A,16000 S  HOOVER                       ST,33.8863,-118.2871,Theft,Property Crime,Non-Violent Crimes,0.995020933
477900,16/12/2012,2012-12-16,Devonshire,32,M,H,19300    NORDHOFF                     ST,34.2355,-118.5536,Theft,Property Crime,Non-Violent Crimes,0.997043223
478073,09/08/2012,2012-08-09,Rampart,46,F,H,400    UNION                        DR,34.0592,-118.2674,Assault,Bodily Harm,Violent Crimes,0.998905977
478245,21/04/2012,2012-04-21,Hollenbeck,28,F,B,1900    MICHIGAN                     AV,34.0483,-118.2163,Theft,Property Crime,Non-Violent Crimes,0.994538796
478279,23/03/2012,2012-03-22,Harbor,51,M,O,3600 S  GAFFEY                       ST,33.7115,-118.2928,Theft,Property Crime,Non-Violent Crimes,0.998908517
478569,30/10/2012,2012-10-29,Harbor,61,M,W,600 W  13TH                         ST,33.7324,-118.2902,Theft,Property Crime,Non-Violent Crimes,0.992603866
478649,11/12/2012,2012-11-24,Mission,43,F,H,8500    ORION                        AV,34.2247,-118.4721,Theft,Property Crime,Non-Violent Crimes,0.992126845
478765,02/04/2012,2012-03-22,Mission,45,F,H,9800    SHARP                        AV,34.2482,-118.4267,Theft,Property Crime,Non-Violent Crimes,0.995397863
478809,23/01/2012,2012-01-21,Van Nuys,39,M,W,14800    BESSEMER                     ST,34.1808,-118.4553,Theft,Property Crime,Non-Violent Crimes,0.999810217
479051,25/08/2012,2012-08-25,West Valley,37,F,H,7900    RESEDA                       BL,34.2139,-118.5361,Assault,Bodily Harm,Violent Crimes,0.998547154
479241,27/10/2012,2012-10-24,Hollywood,76,M,W,2000    VINE                         ST,34.1068,-118.3267,Theft,Property Crime,Non-Violent Crimes,0.991594511
479396,29/03/2012,2012-03-29,Topanga,36,F,O,7200    TOPANGA CANYON               BL,34.201,-118.6059,Theft,Property Crime,Non-Violent Crimes,0.994482111
479525,20/08/2012,2012-08-20,Van Nuys,64,M,B,14600    VENTURA                      BL,34.1513,-118.4509,Theft,Property Crime,Non-Violent Crimes,0.99141502
479854,25/04/2012,2012-04-25,Foothill,7,F,H,11000    ARMINTA                      ST,34.2139,-118.3703,Assault,Bodily Harm,Violent Crimes,0.999552482
480038,02/11/2012,2012-11-02,Rampart,14,M,H,12TH                         ST,34.0488,-118.2817,Robbery,Robbery,Violent Crimes,0.9999305
480115,30/04/2012,2012-04-29,Southeast,36,F,B,500 W  107TH                        ST,33.9391,-118.2826,Battery Crime,Bodily Harm,Violent Crimes,0.997084632
480298,30/09/2012,2012-09-30,Foothill,43,F,H,9200    TAMARACK                     AV,34.2374,-118.3964,Assault,Bodily Harm,Violent Crimes,0.994098933
480518,16/03/2012,2012-03-16,Wilshire,48,M,W,300 S  DOHENY                       DR,34.0736,-118.3897,Battery Crime,Bodily Harm,Violent Crimes,0.999793873
481256,30/09/2012,2012-09-30,West LA,22,M,H,2300    ROSCOMARE                    RD,34.1152,-118.4635,Battery Crime,Bodily Harm,Violent Crimes,0.99556265
481447,02/02/2012,2012-02-02,West Valley,43,F,W,SHERMAN                      WY,34.2012,-118.5535,Battery Crime,Bodily Harm,Violent Crimes,0.99108271
481494,08/12/2017,2012-11-05,Wilshire,53,F,W,500 S  CRESCENT HEIGHTS             BL,34.0678,-118.3646,Theft,Property Crime,Non-Violent Crimes,0.997208873
482028,09/07/2012,2012-07-09,Rampart,31,M,H,6TH                          ST,34.0601,-118.2761,Assault,Bodily Harm,Violent Crimes,0.994453157
482091,29/07/2012,2012-07-28,Southeast,28,M,H,FIGUEROA,33.9601,-118.2827,Theft,Property Crime,Non-Violent Crimes,0.999819776
482202,01/03/2012,2012-03-01,Hollenbeck,26,M,H,300 W  AVENUE 26,34.0798,-118.2184,Theft,Property Crime,Non-Violent Crimes,0.998472517
482388,29/10/2012,2012-10-28,77th Street,41,M,B,6900 S  VAN NESS                     AV,33.977,-118.3177,Theft,Property Crime,Non-Violent Crimes,0.99049681
482463,10/09/2012,2012-09-10,Pacific,49,M,B,OCEAN FRONT                  WK,33.988,-118.4745,Battery Crime,Bodily Harm,Violent Crimes,0.991272462
482606,20/06/2012,2012-06-02,77th Street,51,F,B,1900 W  54TH                         ST,33.9933,-118.3113,Theft,Property Crime,Non-Violent Crimes,0.994964826
482683,13/01/2012,2012-01-12,West Valley,46,M,W,17400    HATTERAS                     ST,34.1762,-118.5122,Theft,Property Crime,Non-Violent Crimes,0.99017718
483065,25/03/2012,2012-03-15,Mission,26,M,H,8900    ORION                        AV,34.2319,-118.472,Theft,Property Crime,Non-Violent Crimes,0.998276211
483070,15/05/2012,2012-05-08,Topanga,83,F,W,21500    ERWIN                        ST,34.1829,-118.5988,Theft,Property Crime,Non-Violent Crimes,0.999401758
483155,01/07/2012,2012-07-01,Southwest,37,M,B,600 W  35TH                         ST,34.0204,-118.2809,Theft,Property Crime,Non-Violent Crimes,0.995950828
483404,02/01/2013,2012-12-31,Olympic,30,M,H,FEDORA,34.0526,-118.2979,Theft,Property Crime,Non-Violent Crimes,0.994001384
483504,14/11/2012,2012-10-27,Northeast,57,M,O,1100 N  COMMONWEALTH                 AV,34.0909,-118.2855,Theft,Property Crime,Non-Violent Crimes,0.995101526
483515,16/07/2012,2012-07-16,Foothill,30,F,H,12400    FILMORE                      ST,34.2842,-118.4045,Assault,Bodily Harm,Violent Crimes,0.994976688
483534,17/04/2012,2012-04-16,Southeast,27,M,H,132ND                        ST,33.9123,-118.2916,Robbery,Robbery,Violent Crimes,0.999811274
483669,20/03/2012,2012-03-20,Rampart,27,F,B,3300    DESCANSO                     DR,34.0847,-118.2762,Theft,Property Crime,Non-Violent Crimes,0.99339136
483936,25/04/2012,2012-04-25,Van Nuys,36,F,O,14000    RIVERSIDE                    DR,34.1576,-118.438,Theft,Property Crime,Non-Violent Crimes,0.996211118
484064,21/05/2012,2012-05-21,Central,51,M,B,5TH,34.0446,-118.245,Assault,Bodily Harm,Violent Crimes,0.996501937
484067,27/11/2012,2012-11-26,77th Street,13,M,H,5700 S  VAN NESS                     AV,33.991,-118.3171,Robbery,Robbery,Violent Crimes,0.998705473
484353,23/02/2012,2012-02-23,Topanga,30,M,X,6100    CANOGA                       AV,34.1805,-118.5975,Theft,Property Crime,Non-Violent Crimes,0.990987771
484371,24/09/2012,2012-09-24,Topanga,55,M,O,20100    VANOWEN                      ST,34.1938,-118.571,Theft,Property Crime,Non-Violent Crimes,0.997414566
484486,14/07/2012,2012-07-13,West LA,33,F,W,1700    AMHERST                      AV,34.0367,-118.4605,Theft,Property Crime,Non-Violent Crimes,0.992959947
485787,28/08/2012,2012-08-28,Hollywood,49,F,W,3200 N  BEACHWOOD                    DR,34.1278,-118.3166,Theft,Property Crime,Non-Violent Crimes,0.990034885
486454,12/07/2012,2012-07-12,Northeast,23,F,W,1800 N  NEW HAMPSHIRE                AV,34.1036,-118.2933,Theft,Property Crime,Non-Violent Crimes,0.990109646
486852,08/01/2012,2012-01-08,Olympic,56,F,O,3900    WILSHIRE                     BL,34.0617,-118.3115,Theft,Property Crime,Non-Violent Crimes,0.999161654
486978,02/12/2012,2012-12-02,Wilshire,55,F,W,500 S  CURSON                       AV,34.0657,-118.3552,Theft,Property Crime,Non-Violent Crimes,0.999610131
486990,11/05/2012,2012-05-11,Southeast,13,F,H,103RD                        ST,33.9432,-118.2385,Battery Crime,Bodily Harm,Violent Crimes,0.991123848
486992,13/11/2012,2012-11-13,Southwest,43,M,H,ARLINGTON,34.0189,-118.3177,Robbery,Robbery,Violent Crimes,0.999117187
487021,07/04/2012,2012-04-07,Olympic,34,M,H,1300 S  VERMONT                      AV,34.0473,-118.2916,Battery Crime,Bodily Harm,Violent Crimes,0.99526003
487205,22/12/2012,2012-12-22,Northeast,15,M,H,ELMGROVE                     ST,34.0883,-118.2296,Robbery,Robbery,Violent Crimes,0.993182515
487344,29/03/2012,2012-03-29,Devonshire,47,F,O,19000    NORDHOFF                     ST,34.2355,-118.5471,Theft,Property Crime,Non-Violent Crimes,0.990541922
487407,25/04/2012,2012-04-20,Southwest,88,M,B,3900    LA SALLE                     AV,34.0146,-118.3057,Theft,Property Crime,Non-Violent Crimes,0.992185931
487466,29/12/2012,2012-12-28,77th Street,25,F,B,VAN NESS                     AV,33.9932,-118.3171,Battery Crime,Bodily Harm,Violent Crimes,0.996992644
487553,08/04/2012,2012-04-08,Southeast,24,F,H,10200    AVALON                       BL,33.9442,-118.2652,Theft,Property Crime,Non-Violent Crimes,0.990139482
487616,24/05/2012,2012-05-21,Harbor,3,F,H,1000    WILMINGTON                   BL,33.7823,-118.2744,Assault,Bodily Harm,Violent Crimes,0.995939839
487818,28/02/2012,2012-02-28,Central,39,F,H,5TH,34.0449,-118.2458,Battery Crime,Bodily Harm,Violent Crimes,0.991377296
488197,08/05/2012,2012-05-03,Topanga,57,M,W,7600    POMELO                       DR,34.2084,-118.6416,Theft,Property Crime,Non-Violent Crimes,0.997548409
488285,25/05/2012,2012-05-25,77th Street,34,F,B,600 W  81ST                         ST,33.9656,-118.2842,Assault,Bodily Harm,Violent Crimes,0.995156773
488558,25/02/2013,2012-12-25,N Hollywood,53,F,W,3600    FREDONIA                     DR,34.1343,-118.3591,Theft,Property Crime,Non-Violent Crimes,0.999268761
488613,18/04/2012,2012-04-18,Newton,32,M,H,4900 S  BROADWAY,33.9983,-118.2783,Theft,Property Crime,Non-Violent Crimes,0.992160827
488661,16/02/2012,2012-02-08,West Valley,39,F,W,8200    BALBOA                       BL,34.2196,-118.5021,Theft,Property Crime,Non-Violent Crimes,0.996208013
488769,18/09/2012,2012-09-18,77th Street,40,F,H,7300 S  SAN PEDRO                    ST,33.9739,-118.2695,Battery Crime,Bodily Harm,Violent Crimes,0.994976723
488810,28/08/2012,2012-08-22,Van Nuys,40,F,H,6300    RANCHITO                     AV,34.1849,-118.4356,Theft,Property Crime,Non-Violent Crimes,0.995782224
488828,09/04/2012,2012-04-06,Devonshire,86,M,W,9200    WHITAKER                     AV,34.2381,-118.4989,Theft,Property Crime,Non-Violent Crimes,0.993028382
489077,24/05/2013,2012-07-01,Foothill,34,F,H,12000    SHELDON                      ST,34.2393,-118.3938,Theft,Property Crime,Non-Violent Crimes,0.996055514
489731,11/08/2012,2012-08-11,Hollywood,29,M,O,MC CADDEN,34.1016,-118.3374,Assault,Bodily Harm,Violent Crimes,0.998296883
489740,21/01/2012,2012-01-20,Van Nuys,39,M,B,14800    DELANO                       ST,34.1827,-118.4553,Assault,Bodily Harm,Violent Crimes,0.993837439
489784,07/05/2012,2012-04-12,Central,61,M,B,600    WALL                         ST,34.0435,-118.2471,Theft,Property Crime,Non-Violent Crimes,0.99159736
489789,08/08/2012,2012-08-04,Wilshire,35,F,B,2000    3RD                          AV,34.0387,-118.3201,Battery Crime,Bodily Harm,Violent Crimes,0.995825542
490069,10/12/2012,2012-11-26,Devonshire,67,M,O,15800    CELTIC                       ST,34.2691,-118.4771,Theft,Property Crime,Non-Violent Crimes,0.9912668
490589,23/06/2012,2012-06-15,Rampart,47,M,H,ALVARADO,34.0517,-118.2798,Robbery,Robbery,Violent Crimes,0.990263979
490769,13/02/2012,2012-02-11,Hollywood,29,F,H,HOLLYWOOD                    BL,34.1016,-118.3387,Assault,Bodily Harm,Violent Crimes,0.997642297
490807,18/09/2012,2012-09-18,Southwest,29,M,B,2900    11TH                         AV,34.0299,-118.3289,Theft,Property Crime,Non-Violent Crimes,0.999091972
491004,08/08/2012,2012-07-15,Mission,55,M,H,14500    TYLER                        ST,34.3143,-118.4487,Theft,Property Crime,Non-Violent Crimes,0.993753338
491111,18/06/2012,2012-06-18,Hollywood,18,M,H,HOLLYWOOD                    BL,34.1016,-118.3387,Assault,Bodily Harm,Violent Crimes,0.990054246
491163,11/09/2014,2012-02-29,Southwest,63,M,B,3400    CRENSHAW                     BL,34.0256,-118.3351,Theft,Property Crime,Non-Violent Crimes,0.993829158
491207,03/12/2012,2012-11-27,N Hollywood,33,M,W,10900    MAGNOLIA                     BL,34.1649,-118.3683,Theft,Property Crime,Non-Violent Crimes,0.998155077
491456,14/04/2012,2012-04-10,Newton,67,M,B,1000 E  42ND                         PL,34.0067,-118.2582,Theft,Property Crime,Non-Violent Crimes,0.99326401
491783,30/08/2012,2012-08-17,Northeast,60,F,H,400    LEWIS                        ST,34.1201,-118.1801,Theft,Property Crime,Non-Violent Crimes,0.99734375
492041,19/02/2012,2012-02-18,Northeast,46,M,H,700    ACADEMY                      RD,34.0772,-118.2328,Theft,Property Crime,Non-Violent Crimes,0.994783961
492217,02/01/2012,2012-01-02,Newton,36,F,H,5000    WALL                         ST,33.9975,-118.2718,Theft,Property Crime,Non-Violent Crimes,0.998647833
492315,07/06/2012,2012-06-06,Hollenbeck,18,M,H,8TH                          ST,34.0257,-118.2139,Robbery,Robbery,Violent Crimes,0.994720349
492663,10/02/2012,2012-02-09,Central,28,M,O,1100 S  GRAND                        AV,34.0416,-118.262,Theft,Property Crime,Non-Violent Crimes,0.991009645
492774,24/11/2012,2012-11-23,Southeast,31,M,B,500 W  GARDENA                      BL,33.8819,-118.2826,Theft,Property Crime,Non-Violent Crimes,0.993725578
493144,19/10/2012,2012-10-18,Topanga,15,F,H,6800    KELVIN                       AV,34.1938,-118.5865,Battery Crime,Bodily Harm,Violent Crimes,0.993515723
493193,19/07/2012,2012-07-19,Central,75,F,H,600 W  6TH                          ST,34.0488,-118.2553,Battery Crime,Bodily Harm,Violent Crimes,0.99607735
493434,22/04/2013,2012-04-21,West LA,24,M,W,3400    MANNING                      AV,34.0307,-118.4051,Theft,Property Crime,Non-Violent Crimes,0.992050493
493457,06/09/2012,2012-09-06,Southwest,56,F,B,2900    POTOMAC                      AV,34.0294,-118.3439,Theft,Property Crime,Non-Violent Crimes,0.990292979
493774,18/11/2012,2012-11-13,West Valley,58,M,W,5200    MELVIN                       AV,34.1658,-118.5599,Theft,Property Crime,Non-Violent Crimes,0.991476503
493830,06/11/2012,2012-11-05,Central,41,M,W,800 W  6TH                          ST,34.0502,-118.2574,Theft,Property Crime,Non-Violent Crimes,0.990936143
493986,12/10/2012,2012-10-12,Mission,54,F,H,15100    PARTHENIA                    ST,34.2283,-118.4611,Theft,Property Crime,Non-Violent Crimes,0.994437367
494006,17/01/2013,2012-11-07,Wilshire,30,F,B,5800    ERNEST                       AV,34.0345,-118.3727,Theft,Property Crime,Non-Violent Crimes,0.991590944
494089,28/11/2012,2012-11-28,Pacific,42,M,A,9600    AVIATION                     BL,33.9498,-118.3776,Robbery,Robbery,Violent Crimes,0.995662377
494101,07/10/2012,2012-10-05,Hollenbeck,37,F,W,4400    BOWMAN                       BL,34.0796,-118.1879,Theft,Property Crime,Non-Violent Crimes,0.997801657
494649,12/04/2012,2012-04-11,Devonshire,18,M,H,9600    WILBUR                       AV,34.2449,-118.5448,Battery Crime,Bodily Harm,Violent Crimes,0.990913588
495066,11/09/2012,2012-09-11,Central,24,F,H,1000 S  BROADWAY,34.0409,-118.2574,Assault,Bodily Harm,Violent Crimes,0.999461249
495070,07/05/2012,2012-05-06,Wilshire,40,M,H,4600 W  18TH                         ST,34.0414,-118.3392,Theft,Property Crime,Non-Violent Crimes,0.99267573
495151,01/01/2012,2012-01-01,Hollywood,18,F,O,6600    HOLLYWOOD                    BL,34.1016,-118.3333,Assault,Bodily Harm,Violent Crimes,0.993279574
495288,20/06/2012,2012-05-26,Olympic,11,F,H,HOBART,34.0545,-118.3053,Rape,Rape,Violent Crimes,0.992899334
495352,14/06/2012,2012-06-02,Wilshire,54,M,B,1100 S  FAIRFAX                      AV,34.0558,-118.3649,Theft,Property Crime,Non-Violent Crimes,0.998734683
495364,02/08/2012,2012-08-02,Hollywood,32,M,O,SUNSET                       BL,34.098,-118.3287,Theft,Property Crime,Non-Violent Crimes,0.992781449
495396,11/11/2012,2012-11-11,Central,33,M,W,500 N  FIGUEROA                     ST,34.0617,-118.2469,Assault,Bodily Harm,Violent Crimes,0.993717273
495815,28/09/2012,2012-09-28,Rampart,30,M,H,SUNSET                       BL,34.0829,-118.2733,Battery Crime,Bodily Harm,Violent Crimes,0.999247537
495916,05/04/2012,2012-04-02,Wilshire,52,F,A,900 S  LUCERNE                      BL,34.0576,-118.3265,Theft,Property Crime,Non-Violent Crimes,0.992550632
496155,05/08/2012,2012-08-02,Harbor,51,F,H,1600    VAN TRESS                    AV,33.795,-118.2794,Theft,Property Crime,Non-Violent Crimes,0.995656199
496178,05/06/2012,2012-06-05,Hollenbeck,15,M,H,8TH                          ST,34.0257,-118.2139,Robbery,Robbery,Violent Crimes,0.992182411
496207,04/12/2012,2012-12-04,N Hollywood,58,F,W,5700    AGNES                        AV,34.1739,-118.3954,Theft,Property Crime,Non-Violent Crimes,0.994213805
496338,17/04/2012,2012-04-16,Devonshire,43,F,H,19100    MALDEN                       ST,34.2255,-118.5492,Assault,Bodily Harm,Violent Crimes,0.992587176
496506,27/01/2013,2012-10-01,Van Nuys,48,F,W,6900 N  SEPULVEDA                    BL,34.1958,-118.4662,Theft,Property Crime,Non-Violent Crimes,0.999539569
496763,30/05/2012,2012-05-30,Northeast,32,F,H,4900    MALTA                        ST,34.1072,-118.2055,Theft,Property Crime,Non-Violent Crimes,0.998111918
497077,31/01/2012,2012-01-02,Hollenbeck,29,M,H,4700    CATALPA                      ST,34.064,-118.1826,Theft,Property Crime,Non-Violent Crimes,0.99917007
497451,26/03/2012,2012-03-24,Olympic,39,M,H,3600    BEVERLY                      BL,34.0749,-118.2868,Assault,Bodily Harm,Violent Crimes,0.990563949
497482,27/12/2012,2012-12-27,N Hollywood,59,M,W,11900    VENTURA                      BL,34.1427,-118.3908,Theft,Property Crime,Non-Violent Crimes,0.998219315
497706,28/06/2012,2012-06-28,Mission,45,M,O,13100    FOOTHILL                     BL,34.2978,-118.4198,Battery Crime,Bodily Harm,Violent Crimes,0.997520146
497719,24/06/2012,2012-06-24,Wilshire,31,F,O,400 S  LA CIENEGA                   BL,34.0711,-118.3764,Theft,Property Crime,Non-Violent Crimes,0.99454042
497746,06/07/2012,2012-07-06,West Valley,59,M,O,19200    SATICOY                      ST,34.2084,-118.5514,Robbery,Robbery,Violent Crimes,0.992984893
497870,11/10/2012,2012-10-10,Devonshire,43,F,H,9200    HASKELL                      AV,34.2374,-118.4763,Theft,Property Crime,Non-Violent Crimes,0.993209294
497873,15/02/2012,2012-02-09,Foothill,42,F,W,9500    HILLHAVEN                    AV,34.2421,-118.2923,Theft,Property Crime,Non-Violent Crimes,0.994522176
498259,11/04/2012,2012-04-11,Foothill,31,M,H,13500    VAN NUYS                     BL,34.2624,-118.4272,Robbery,Robbery,Violent Crimes,0.993721474
498413,25/01/2012,2012-01-25,Van Nuys,40,F,B,14500    CLARK                        ST,34.1685,-118.4487,Theft,Property Crime,Non-Violent Crimes,0.99387352
498503,29/08/2012,2012-08-29,Newton,40,M,H,15TH                         ST,34.0312,-118.2554,Theft,Property Crime,Non-Violent Crimes,0.992160346
498509,14/03/2012,2012-03-14,Olympic,31,M,W,2700    FRANCIS                      AV,34.0568,-118.2842,Assault,Bodily Harm,Violent Crimes,0.995902711
498738,28/04/2012,2012-04-28,Foothill,23,M,H,12900    MONTAGUE                     ST,34.2463,-118.4131,Theft,Property Crime,Non-Violent Crimes,0.992263866
498819,02/05/2012,2012-04-06,Devonshire,61,F,W,9400    RESEDA                       BL,34.241,-118.5361,Fraud,White Collar Crime,Non-Violent Crimes,0.995262647
499049,26/06/2012,2012-06-25,N Hollywood,57,M,W,5400    ALCOVE                       AV,34.1692,-118.4125,Theft,Property Crime,Non-Violent Crimes,0.995546678
499072,18/08/2012,2012-08-17,Pacific,43,F,W,8100    TRUXTON                      AV,33.965,-118.3934,Theft,Property Crime,Non-Violent Crimes,0.994425508
499139,14/05/2012,2012-05-12,Topanga,41,F,W,6400    PLATT                        AV,34.1866,-118.6428,Fraud,White Collar Crime,Non-Violent Crimes,0.999101407
499230,08/08/2012,2012-08-08,Southeast,41,F,B,11300    SOUTHWEST                    BL,33.9322,-118.29,Theft,Property Crime,Non-Violent Crimes,0.995409787
499232,01/08/2012,2012-07-16,Northeast,44,F,W,4000    LOS FELIZ                    BL,34.1134,-118.2791,Theft,Property Crime,Non-Violent Crimes,0.994126226
499381,22/11/2012,2012-11-22,Harbor,42,F,W,1300    CAPITOL                      DR,33.7542,-118.3071,Assault,Bodily Harm,Violent Crimes,0.991770945
499434,02/07/2012,2012-07-02,Southwest,29,M,W,MUIRFIELD,34.0111,-118.3477,Robbery,Robbery,Violent Crimes,0.999462469
499563,09/06/2012,2012-06-09,Olympic,21,F,H,100 S  BERENDO                      ST,34.0727,-118.2942,Assault,Bodily Harm,Violent Crimes,0.994648774
499624,22/05/2013,2012-11-02,N Hollywood,37,F,W,10900    PEACH GROVE                  ST,34.159,-118.3681,Theft,Property Crime,Non-Violent Crimes,0.99638246
499668,28/08/2012,2012-08-28,Central,54,M,B,700 S  MAIN                         ST,34.0439,-118.2514,Theft,Property Crime,Non-Violent Crimes,0.990475464
499866,17/04/2012,2012-04-17,Pacific,36,F,H,700    WORLD WAY,33.9432,-118.4013,Battery Crime,Bodily Harm,Violent Crimes,0.993195858
499878,24/04/2012,2012-04-18,Southwest,40,F,H,700    STATE                        DR,34.0164,-118.2851,Theft,Property Crime,Non-Violent Crimes,0.991841866
500055,16/05/2012,2012-05-14,West Valley,62,M,H,17900    LULL                         ST,34.2093,-118.523,Theft,Property Crime,Non-Violent Crimes,0.998117384
500228,24/06/2012,2012-06-23,Olympic,17,M,H,HARVARD                      BL,34.04,-118.3057,Robbery,Robbery,Violent Crimes,0.999732761
500299,02/01/2012,2012-01-02,Wilshire,23,F,B,1500 S  LA CIENEGA                   BL,34.0507,-118.3761,Assault,Bodily Harm,Violent Crimes,0.993960161
500510,09/07/2012,2012-07-09,Wilshire,24,F,B,2000    PALM GROVE                   AV,34.0384,-118.342,Battery Crime,Bodily Harm,Violent Crimes,0.99215623
500614,03/12/2012,2012-12-02,Devonshire,49,F,W,8800    MONOGRAM                     AV,34.2307,-118.4927,Fraud,White Collar Crime,Non-Violent Crimes,0.995235156
500710,09/11/2012,2012-11-07,Central,38,M,O,7TH                          ST,34.0494,-118.2599,Theft,Property Crime,Non-Violent Crimes,0.997617731
501021,10/06/2012,2012-06-10,Olympic,42,M,W,2200 W  20TH                         ST,34.0388,-118.312,Battery Crime,Bodily Harm,Violent Crimes,0.993255653
501094,27/10/2012,2012-10-12,Northeast,45,F,A,4500    KINGSWELL                    AV,34.1027,-118.2874,Theft,Property Crime,Non-Violent Crimes,0.99603644
501263,12/04/2012,2012-04-12,Pacific,58,F,W,CENTINELA,34.0032,-118.4332,Battery Crime,Bodily Harm,Violent Crimes,0.99908371
501624,28/08/2012,2012-08-28,Topanga,11,M,H,20800    BURBANK                      BL,34.172,-118.5854,Battery Crime,Bodily Harm,Violent Crimes,0.994917267
501687,17/08/2012,2012-08-17,Pacific,93,M,W,7200    ARIZONA                      AV,33.9755,-118.396,Theft,Property Crime,Non-Violent Crimes,0.990581433
501692,16/02/2012,2012-02-15,Topanga,32,M,O,6600    TOPANGA CANYON               BL,34.1905,-118.6059,Theft,Property Crime,Non-Violent Crimes,0.993479108
502244,24/07/2012,2012-07-24,Hollywood,48,M,O,1200 N  ORANGE                       DR,34.0926,-118.3416,Theft,Property Crime,Non-Violent Crimes,0.999691064
502316,10/05/2012,2012-05-05,Southeast,43,F,B,8700    MENLO                        AV,33.959,-118.2904,Battery Crime,Bodily Harm,Violent Crimes,0.992947804
502390,12/04/2012,2012-04-06,Central,22,M,H,1500 S  HOPE                         ST,34.0371,-118.2672,Theft,Property Crime,Non-Violent Crimes,0.999959117
502594,25/09/2012,2012-09-25,Harbor,21,F,H,900 N  FRIES                        AV,33.7815,-118.265,Assault,Bodily Harm,Violent Crimes,0.99279846
502853,31/07/2012,2012-07-31,Olympic,54,F,B,MAGNOLIA,34.0401,-118.2864,Theft,Property Crime,Non-Violent Crimes,0.994627089
502860,03/03/2012,2012-03-03,Southwest,31,M,W,STOCKER,34.008,-118.3351,Robbery,Robbery,Violent Crimes,0.999601842
502884,17/07/2012,2012-07-17,Wilshire,33,F,W,WILSHIRE                     BL,34.0624,-118.3514,Battery Crime,Bodily Harm,Violent Crimes,0.998748192
503257,23/10/2012,2012-10-17,Pacific,45,F,H,10400    NATIONAL                     BL,34.0292,-118.4107,Theft,Property Crime,Non-Violent Crimes,0.997609113
503849,01/03/2012,2012-02-29,77th Street,19,F,B,1400 W  79TH                         ST,33.9673,-118.3003,Assault,Bodily Harm,Violent Crimes,0.994412013
503854,30/04/2013,2012-09-28,Foothill,28,F,H,11100    NORRIS                       AV,34.2719,-118.4178,Theft,Property Crime,Non-Violent Crimes,0.999933498
503998,15/03/2012,2012-03-10,Foothill,55,F,O,6400    DAY                          ST,34.2522,-118.2714,Theft,Property Crime,Non-Violent Crimes,0.998604296
504297,08/03/2012,2012-02-09,Topanga,20,M,B,SATICOY,34.2083,-118.6029,Theft,Property Crime,Non-Violent Crimes,0.994698735
504671,17/12/2012,2012-12-15,Northeast,31,F,O,1800    COLORADO                     BL,34.1394,-118.2062,Theft,Property Crime,Non-Violent Crimes,0.996588096
504972,22/09/2012,2012-09-22,West LA,74,M,H,12000    SANTA MONICA                 BL,34.041,-118.4624,Battery Crime,Bodily Harm,Violent Crimes,0.997612238
505001,27/05/2012,2012-05-27,Foothill,45,F,H,11200    STAGG                        ST,34.2121,-118.3747,Theft,Property Crime,Non-Violent Crimes,0.999988536
505017,28/11/2012,2012-11-27,Topanga,30,F,H,7700    SUNNY BRAE                   AV,34.2105,-118.5808,Theft,Property Crime,Non-Violent Crimes,0.998303185
505076,20/10/2012,2012-10-20,Foothill,18,F,H,10200    OMELVENY                     AV,34.2554,-118.4241,Battery Crime,Bodily Harm,Violent Crimes,0.998012619
505086,06/02/2012,2012-02-06,N Hollywood,39,F,W,5400    FAIR                         AV,34.1685,-118.3743,Theft,Property Crime,Non-Violent Crimes,0.99893212
505321,12/09/2012,2012-09-05,West Valley,58,F,H,7800    GEYSER                       AV,34.212,-118.5425,Fraud,White Collar Crime,Non-Violent Crimes,0.990501668
505353,20/02/2012,2012-02-20,West LA,21,M,O,800 S  WOOSTER                      ST,34.063,-118.3823,Theft,Property Crime,Non-Violent Crimes,0.993210345
505367,28/01/2012,2012-01-28,Newton,35,M,O,7100 S  MAIN                         ST,33.9754,-118.2739,Assault,Bodily Harm,Violent Crimes,0.998998903
505604,27/05/2012,2012-05-26,Central,32,F,A,SANTEE,34.0335,-118.2619,Theft,Property Crime,Non-Violent Crimes,0.995618788
505717,15/04/2012,2012-04-14,77th Street,66,F,B,400 E  76TH                         ST,33.9713,-118.2673,Theft,Property Crime,Non-Violent Crimes,0.991840708
506070,10/06/2012,2012-06-10,Southwest,36,F,B,3800    2ND                          AV,34.0183,-118.3193,Assault,Bodily Harm,Violent Crimes,0.998531792
506714,05/03/2012,2012-02-28,Topanga,61,F,O,22300    LULL                         ST,34.2088,-118.6127,Theft,Property Crime,Non-Violent Crimes,0.996092482
506795,15/07/2012,2012-07-15,Hollywood,28,M,H,1700 N  LAS PALMAS                   AV,34.1016,-118.3361,Battery Crime,Bodily Harm,Violent Crimes,0.999262904
506806,14/08/2012,2012-08-14,Newton,18,F,H,500 E  62ND                         ST,33.9834,-118.2663,Battery Crime,Bodily Harm,Violent Crimes,0.997878069
506991,25/12/2012,2012-12-24,Northeast,27,F,H,100 S  AVENUE 53,34.1068,-118.1984,Theft,Property Crime,Non-Violent Crimes,0.990930109
507007,22/09/2012,2012-08-31,Hollywood,48,M,H,1000 N  WESTERN                      AV,34.0885,-118.3092,Fraud,White Collar Crime,Non-Violent Crimes,0.99141457
507093,24/02/2012,2012-01-19,Devonshire,37,F,A,11300    VERDI                        LN,34.2773,-118.5875,Theft,Property Crime,Non-Violent Crimes,0.996077161
507123,04/06/2012,2012-06-04,N Hollywood,53,M,H,11600    VICTORY                      BL,34.1867,-118.3851,Battery Crime,Bodily Harm,Violent Crimes,0.993847311
507338,04/02/2012,2012-02-04,Devonshire,34,M,W,18400    PLUMMER                      ST,34.2428,-118.5336,Theft,Property Crime,Non-Violent Crimes,0.992680061
508228,21/05/2012,2012-05-21,Hollenbeck,45,F,H,LORENA                       ST,34.0278,-118.201,Robbery,Robbery,Violent Crimes,0.991390146
508320,02/08/2012,2012-08-02,Southeast,27,M,B,10500    ANTWERP                      ST,33.9404,-118.2486,Assault,Bodily Harm,Violent Crimes,0.995267787
508548,26/01/2012,2012-01-25,Rampart,17,M,H,300    LUCAS                        AV,34.0583,-118.2616,Theft,Property Crime,Non-Violent Crimes,0.992956285
508748,21/11/2016,2012-09-17,Olympic,-3,X,X,3200    WILSHIRE                     BL,34.0618,-118.2916,Fraud,White Collar Crime,Non-Violent Crimes,0.991862115
508878,30/09/2012,2012-09-28,Pacific,34,M,W,HORIZON,33.988,-118.474,Robbery,Robbery,Violent Crimes,0.996682145
508890,27/07/2012,2012-07-25,Devonshire,90,F,W,16700    ARMSTEAD                     ST,34.2819,-118.4961,Theft,Property Crime,Non-Violent Crimes,0.993159496
508943,26/07/2012,2012-07-19,77th Street,40,M,B,1500 W  82ND                         ST,33.9646,-118.3025,Theft,Property Crime,Non-Violent Crimes,0.999834621
508974,08/07/2014,2012-01-01,Topanga,61,M,W,19800    BUTTONWILLOW                 DR,34.2116,-118.5652,Theft,Property Crime,Non-Violent Crimes,0.99040001
509009,16/06/2012,2012-06-16,Hollywood,42,F,H,VIRGINIA                     AV,34.0918,-118.3109,Robbery,Robbery,Violent Crimes,0.993476592
509137,05/08/2012,2012-08-05,Southwest,26,F,B,3700    SANTA ROSALIA                DR,34.0072,-118.3373,Theft,Property Crime,Non-Violent Crimes,0.991822199
509255,19/06/2012,2012-04-18,Central,19,M,W,700 S  LOS ANGELES                  ST,34.0433,-118.2504,Theft,Property Crime,Non-Violent Crimes,0.993255712
509351,06/12/2012,2012-12-03,Mission,87,F,W,RINALDI,34.279,-118.4589,Battery Crime,Bodily Harm,Violent Crimes,0.994948384
509437,06/06/2012,2012-06-05,Van Nuys,35,M,W,6500    WOODMAN                      AV,34.1886,-118.4312,Theft,Property Crime,Non-Violent Crimes,0.999120436
509680,17/11/2012,2012-11-17,Pacific,61,M,W,VENICE                       BL,33.9941,-118.4529,Theft,Property Crime,Non-Violent Crimes,0.999482377
509893,07/05/2012,2012-05-07,Central,21,M,H,GRAND                        AV,34.0349,-118.2669,Robbery,Robbery,Violent Crimes,0.990526232
510339,14/06/2012,2012-06-13,Southwest,32,M,B,4200 S  FIGUEROA                     ST,34.0072,-118.2827,Theft,Property Crime,Non-Violent Crimes,0.997882165
510578,12/08/2012,2012-08-12,Newton,21,M,W,5400    BANDERA                      ST,33.9938,-118.2407,Assault,Bodily Harm,Violent Crimes,0.997673718
510675,03/08/2012,2012-06-15,Northeast,78,F,W,1900    LUCILE                       AV,34.0961,-118.2738,Theft,Property Crime,Non-Violent Crimes,0.994616871
511231,29/07/2012,2012-07-25,77th Street,39,M,H,700 W  81ST                         ST,33.9655,-118.2856,Theft,Property Crime,Non-Violent Crimes,0.991050845
511240,05/08/2012,2012-08-05,N Hollywood,62,M,H,5900    VINELAND                     AV,34.1776,-118.3703,Theft,Property Crime,Non-Violent Crimes,0.99347194
511324,01/11/2012,2012-10-31,Mission,40,M,H,8100    LANGDON                      AV,34.218,-118.4688,Theft,Property Crime,Non-Violent Crimes,0.998821747
511369,27/02/2012,2012-02-26,77th Street,36,F,H,5800    BONSALLO                     AV,33.9883,-118.2859,Assault,Bodily Harm,Violent Crimes,0.997969317
511516,03/08/2012,2012-08-01,Devonshire,65,F,W,9600    SAGEBRUSH                    AV,34.2445,-118.6163,Theft,Property Crime,Non-Violent Crimes,0.997218401
511882,19/04/2012,2012-04-17,Harbor,55,F,H,25500    PRESIDENT                    AV,33.7925,-118.3043,Theft,Property Crime,Non-Violent Crimes,0.99348748
512001,25/02/2012,2012-02-25,Rampart,49,M,B,700 S  WESTLAKE                     AV,34.0559,-118.2756,Assault,Bodily Harm,Violent Crimes,0.995088711
512439,09/06/2012,2012-06-08,West LA,59,M,W,11900    KEARSARGE                    ST,34.0603,-118.4717,Theft,Property Crime,Non-Violent Crimes,0.993568527
512767,02/12/2012,2012-12-02,Southwest,40,M,H,FIGUEROA,34.0274,-118.2765,Theft,Property Crime,Non-Violent Crimes,0.991548659
512774,23/07/2012,2012-07-23,Southwest,61,F,W,3800    3RD                          AV,34.0183,-118.3204,Theft,Property Crime,Non-Violent Crimes,0.991845786
512928,22/03/2012,2012-02-25,Rampart,13,M,H,300 S  RAMPART                      BL,34.0663,-118.2789,Assault,Bodily Harm,Violent Crimes,0.992680721
513154,08/12/2012,2012-12-07,Wilshire,66,M,W,100    THE GROVE                    DR,34.0761,-118.3563,Theft,Property Crime,Non-Violent Crimes,0.997834522
513187,29/03/2012,2012-03-02,Olympic,23,F,H,200 S  COMMONWEALTH                 AV,34.0705,-118.2857,Fraud,White Collar Crime,Non-Violent Crimes,0.992947644
513263,01/06/2012,2012-06-01,Van Nuys,44,F,W,4800    COLDWATER CANYON             AV,34.1576,-118.4138,Theft,Property Crime,Non-Violent Crimes,0.993644646
513488,22/07/2012,2012-07-22,Newton,44,M,H,300 W  43RD                         ST,34.0056,-118.2784,Assault,Bodily Harm,Violent Crimes,0.99922626
513503,01/06/2012,2012-05-31,N Hollywood,20,F,O,5100    TUJUNGA                      AV,34.163,-118.379,Theft,Property Crime,Non-Violent Crimes,0.991945262
513571,06/11/2012,2012-11-06,Southeast,48,M,H,107TH                        ST,33.9393,-118.2541,Theft,Property Crime,Non-Violent Crimes,0.999481324
514090,30/05/2012,2012-05-29,Wilshire,26,F,B,5200    BANGOR                       ST,34.0366,-118.3547,Theft,Property Crime,Non-Violent Crimes,0.99955953
514687,12/02/2012,2012-02-11,Mission,20,F,H,12600    TELFAIR                      AV,34.2993,-118.4661,Theft,Property Crime,Non-Violent Crimes,0.997477479
514725,20/11/2013,2012-05-01,Northeast,62,F,H,5500    ASH                          ST,34.1113,-118.1977,Theft,Property Crime,Non-Violent Crimes,0.998486693
515217,15/11/2012,2012-11-15,West Valley,23,M,H,7100    GEYSER                       AV,34.1993,-118.5426,Robbery,Robbery,Violent Crimes,0.998809757
515287,27/06/2012,2012-06-27,Rampart,45,F,H,700 S  ALVARADO                     ST,34.0565,-118.2768,Battery Crime,Bodily Harm,Violent Crimes,0.994358209
515473,19/10/2012,2012-10-18,77th Street,21,F,B,1500 W  57TH                         ST,33.9906,-118.3023,Theft,Property Crime,Non-Violent Crimes,0.993284191
515660,20/07/2012,2012-07-20,Olympic,25,F,W,3900 W  OLYMPIC                      BL,34.0535,-118.3196,Assault,Bodily Harm,Violent Crimes,0.993714588
516144,07/08/2012,2012-08-07,Foothill,25,M,H,7300    FOOTHILL                     BL,34.25,-118.2909,Theft,Property Crime,Non-Violent Crimes,0.990737258
516174,05/10/2012,2012-10-04,Southeast,69,M,B,11700 S  HOOVER                       ST,33.9274,-118.287,Theft,Property Crime,Non-Violent Crimes,0.994401376
516195,05/05/2012,2012-05-04,77th Street,22,F,H,6300    MADDEN                       AV,33.9827,-118.3255,Battery Crime,Bodily Harm,Violent Crimes,0.995132888
516218,13/02/2012,2012-02-11,Mission,29,F,H,13200    CROWLEY                      ST,34.2299,-118.4197,Theft,Property Crime,Non-Violent Crimes,0.999259828
516240,05/12/2012,2012-12-03,Southwest,22,F,O,2600    ELLENDALE                    PL,34.0328,-118.2888,Theft,Property Crime,Non-Violent Crimes,0.995243671
516251,03/05/2012,2012-05-02,West LA,21,F,O,10400    SUMMER HOLLY                 CI,34.1254,-118.4448,Theft,Property Crime,Non-Violent Crimes,0.99599007
516344,10/07/2012,2012-07-10,Rampart,67,F,O,JAMES M WOOD,34.0544,-118.2809,Robbery,Robbery,Violent Crimes,0.996575451
516866,12/08/2012,2012-08-12,Harbor,22,M,H,00    BERTH,33.7257,-118.2766,Theft,Property Crime,Non-Violent Crimes,0.995366302
516945,09/10/2012,2012-10-08,Harbor,89,F,W,2200 W  25TH                         ST,33.727,-118.3242,Theft,Property Crime,Non-Violent Crimes,0.995597672
517229,30/04/2012,2012-04-29,Central,40,M,B,1200 S  FIGUEROA                     ST,34.0423,-118.2666,Battery Crime,Bodily Harm,Violent Crimes,0.991799392
517343,12/06/2012,2012-06-11,Mission,20,F,W,9400    VAN NUYS                     BL,34.2412,-118.4502,Theft,Property Crime,Non-Violent Crimes,0.99735135
517429,18/08/2012,2012-08-18,77th Street,8,M,B,5300 S  VAN NESS                     AV,33.9941,-118.3171,Assault,Bodily Harm,Violent Crimes,0.997210965
517543,20/05/2012,2012-05-20,Newton,31,F,H,71ST,33.9756,-118.2783,Assault,Bodily Harm,Violent Crimes,0.991644383
517912,12/04/2012,2012-03-29,Foothill,17,M,H,SUMMITROSE,34.2596,-118.2979,Theft,Property Crime,Non-Violent Crimes,0.990949871
518213,09/04/2012,2012-04-08,Southeast,24,F,H,9700    GRAHAM                       AV,33.9482,-118.243,Theft,Property Crime,Non-Violent Crimes,0.997089211
518442,07/10/2012,2012-10-06,Van Nuys,55,F,W,14400    DUNBAR                       PL,34.147,-118.4474,Theft,Property Crime,Non-Violent Crimes,0.994854158
518741,12/05/2012,2012-05-12,Olympic,21,M,O,3500    WILSHIRE                     BL,34.0618,-118.3004,Theft,Property Crime,Non-Violent Crimes,0.999372347
518813,11/12/2012,2012-12-11,Van Nuys,46,F,O,3900    KNOBHILL                     DR,34.1418,-118.448,Theft,Property Crime,Non-Violent Crimes,0.995859944
518968,03/07/2012,2012-07-03,Southeast,23,F,B,108TH                        ST,33.9379,-118.2462,Robbery,Robbery,Violent Crimes,0.998308557
519081,20/04/2012,2012-04-20,Topanga,22,F,B,21900    WYANDOTTE                    ST,34.2029,-118.6044,Theft,Property Crime,Non-Violent Crimes,0.991939756
519105,22/12/2012,2012-12-22,Southwest,25,F,A,2600    ELLENDALE                    PL,34.0328,-118.2888,Theft,Property Crime,Non-Violent Crimes,0.995830072
519258,01/01/2012,2012-01-01,Devonshire,40,M,B,19300    NORDHOFF                     WY,34.2355,-118.5536,Theft,Property Crime,Non-Violent Crimes,0.99215419
519292,07/12/2012,2012-12-07,Hollenbeck,49,F,H,STATE                        ST,34.0535,-118.2129,Assault,Bodily Harm,Violent Crimes,0.996694593
519398,20/01/2012,2012-01-20,Southwest,38,M,H,700 W  ADAMS                        BL,34.0293,-118.2785,Theft,Property Crime,Non-Violent Crimes,0.998874603
519455,24/09/2012,2012-09-24,Central,33,F,A,900    FIGUEROA                     TR,34.0663,-118.2441,Theft,Property Crime,Non-Violent Crimes,0.996786224
519552,06/01/2012,2012-01-06,Wilshire,27,M,O,5100    WILSHIRE                     BL,34.0622,-118.3408,Battery Crime,Bodily Harm,Violent Crimes,0.99827307
519599,09/01/2012,2012-01-09,Wilshire,56,M,B,1100    STEARNS                      DR,34.0563,-118.3692,Theft,Property Crime,Non-Violent Crimes,0.999886864
519673,27/01/2012,2012-01-25,Hollywood,24,F,O,1100    SUNSET HILLS                 RD,34.0919,-118.3921,Rape,Rape,Violent Crimes,0.994025911
519683,22/09/2012,2012-09-21,Southwest,25,F,H,3100    HALLDALE                     AV,34.0262,-118.3027,Theft,Property Crime,Non-Violent Crimes,0.996071392
520518,09/01/2012,2012-01-07,Northeast,29,F,W,3100    LOS FELIZ                    BL,34.1245,-118.2666,Theft,Property Crime,Non-Violent Crimes,0.993863406
520619,21/09/2012,2012-09-21,Southeast,22,F,B,MAIN                         ST,33.9601,-118.2739,Battery Crime,Bodily Harm,Violent Crimes,0.999158055
521146,07/10/2012,2012-10-06,Hollenbeck,65,F,H,2600 N  BROADWAY,34.0736,-118.2156,Assault,Bodily Harm,Violent Crimes,0.990460811
521329,17/01/2012,2012-01-16,Wilshire,21,M,H,5900    PICO                         BL,34.0517,-118.3674,Robbery,Robbery,Violent Crimes,0.990231537
521338,16/09/2012,2012-09-16,Newton,50,F,H,300 E  47TH                         PL,34.0002,-118.2707,Assault,Bodily Harm,Violent Crimes,0.9980742
521443,27/07/2012,2012-07-27,Southwest,64,M,B,4000 W  MARTIN LUTHER KING JR        BL,34.0151,-118.3422,Theft,Property Crime,Non-Violent Crimes,0.990560296
521528,06/07/2012,2012-07-04,77th Street,47,M,H,50TH                         ST,33.9974,-118.2827,Assault,Bodily Harm,Violent Crimes,0.993795055
521532,07/02/2012,2012-01-31,Topanga,64,F,H,VARIEL,34.2083,-118.5929,Theft,Property Crime,Non-Violent Crimes,0.995162781
521655,06/02/2012,2012-02-05,Hollywood,33,M,B,CAHUENGA                     BL,34.1016,-118.3297,Battery Crime,Bodily Harm,Violent Crimes,0.996634144
522039,28/11/2012,2012-11-28,Southwest,47,F,B,EDGEHILL,34.0256,-118.3305,Robbery,Robbery,Violent Crimes,0.99040855
522357,28/11/2012,2012-09-28,Olympic,69,M,O,200 S  KENMORE                      AV,34.0712,-118.2966,Fraud,White Collar Crime,Non-Violent Crimes,0.997619398
523034,31/10/2012,2012-10-01,Devonshire,21,F,H,21900    LASSEN                       ST,34.25,-118.605,Battery Crime,Bodily Harm,Violent Crimes,0.991348608
523524,10/07/2012,2012-07-06,Newton,41,F,B,500 E  47TH                         ST,34.0007,-118.2674,Battery Crime,Bodily Harm,Violent Crimes,0.995593747
523658,14/06/2012,2012-06-13,N Hollywood,33,F,W,3400    OAK GLEN                     DR,34.131,-118.3529,Theft,Property Crime,Non-Violent Crimes,0.999181776
523665,05/07/2012,2012-07-03,Van Nuys,33,M,W,14700    OTSEGO                       ST,34.1631,-118.4531,Theft,Property Crime,Non-Violent Crimes,0.995192267
523731,09/08/2012,2012-08-09,Wilshire,49,M,H,400 S  FULLER                       AV,34.0673,-118.3525,Assault,Bodily Harm,Violent Crimes,0.990850801
523823,27/10/2012,2012-10-10,Devonshire,58,M,O,9000    GLADBECK                     AV,34.2333,-118.539,Theft,Property Crime,Non-Violent Crimes,0.999752721
523983,03/05/2012,2012-05-02,Van Nuys,44,F,O,VANOWEN                      ST,34.194,-118.4356,Theft,Property Crime,Non-Violent Crimes,0.996011649
524053,21/09/2012,2012-09-21,N Hollywood,80,F,W,6100    BLUEBELL                     AV,34.1817,-118.4105,Theft,Property Crime,Non-Violent Crimes,0.995091929
524226,15/05/2012,2012-05-15,Central,30,M,B,400 E  7TH                          ST,34.0419,-118.2485,Assault,Bodily Harm,Violent Crimes,0.999119989
524396,20/01/2012,2012-01-20,Harbor,21,M,H,400 W  PACIFIC COAST                HY,33.791,-118.267,Battery Crime,Bodily Harm,Violent Crimes,0.990824985
524433,27/02/2012,2012-02-21,Pacific,20,M,A,7100    ALVERN                       ST,33.975,-118.3774,Theft,Property Crime,Non-Violent Crimes,0.997136702
524813,19/09/2012,2012-09-19,Foothill,65,F,H,13000    CARL                         ST,34.2688,-118.4158,Theft,Property Crime,Non-Violent Crimes,0.997812202
524927,21/11/2012,2012-11-21,West Valley,39,M,W,FRIAR                        ST,34.1857,-118.5491,Theft,Property Crime,Non-Violent Crimes,0.993590771
525005,14/03/2012,2012-03-14,West LA,44,F,W,2000    PROSSER                      AV,34.0513,-118.4273,Theft,Property Crime,Non-Violent Crimes,0.999427637
525122,13/06/2012,2012-06-08,Rampart,53,M,B,600 S  BIXEL                        ST,34.0541,-118.2621,Fraud,White Collar Crime,Non-Violent Crimes,0.992427537
525171,10/07/2012,2012-07-08,Foothill,67,F,H,12500    CORRENTI                     ST,34.2544,-118.4057,Battery Crime,Bodily Harm,Violent Crimes,0.999191073
525336,03/05/2012,2012-05-02,Harbor,44,M,H,259TH                        ST,33.7882,-118.2999,Theft,Property Crime,Non-Violent Crimes,0.995619281
525528,28/11/2012,2012-11-27,West Valley,69,M,W,7200    SHIRLEY                      AV,34.2012,-118.5579,Theft,Property Crime,Non-Violent Crimes,0.993495315
526193,29/10/2012,2012-10-28,Van Nuys,25,F,W,15400    SHERMAN                      WY,34.2012,-118.4684,Theft,Property Crime,Non-Violent Crimes,0.997806236
526402,24/03/2012,2012-03-23,77th Street,34,F,H,100 W  73RD                         ST,33.9737,-118.2739,Theft,Property Crime,Non-Violent Crimes,0.99939203
526618,05/05/2012,2012-05-05,Rampart,24,M,H,3RD,34.0606,-118.2672,Robbery,Robbery,Violent Crimes,0.997986688
526628,04/11/2012,2012-11-04,Hollywood,35,M,H,6300    YUCCA                        ST,34.1038,-118.3267,Robbery,Robbery,Violent Crimes,0.992526351
526957,29/12/2012,2012-12-28,Northeast,43,M,W,1500    ALLESANDRO                   ST,34.0823,-118.2621,Theft,Property Crime,Non-Violent Crimes,0.992681262
527009,19/11/2013,2012-11-19,West LA,45,M,W,800 S  BUNDY                        DR,34.0506,-118.4726,Theft,Property Crime,Non-Violent Crimes,0.996028138
527164,01/01/2013,2012-12-31,Pacific,28,F,W,2500 S  CENTINELA                    AV,34.0257,-118.451,Battery Crime,Bodily Harm,Violent Crimes,0.993229019
527526,01/05/2012,2012-05-01,N Hollywood,52,F,W,12700    HATTERAS                     ST,34.1758,-118.4094,Theft,Property Crime,Non-Violent Crimes,0.998768821
527570,11/12/2012,2012-11-27,Southeast,49,M,B,11800    ORCHARD                      AV,33.9265,-118.2881,Theft,Property Crime,Non-Violent Crimes,0.999740086
527668,17/04/2012,2012-04-02,Southwest,49,M,B,4000    ABOURNE                      RD,34.0125,-118.3435,Theft,Property Crime,Non-Violent Crimes,0.99461891
527775,11/02/2012,2012-02-11,Van Nuys,31,F,W,4400 N  SEPULVEDA                    BL,34.15,-118.4674,Assault,Bodily Harm,Violent Crimes,0.992964511
527790,01/10/2012,2012-09-30,Hollywood,21,M,O,HIGHLAND                     AV,34.0889,-118.3386,Robbery,Robbery,Violent Crimes,0.9966249
527803,28/05/2012,2012-05-25,Mission,58,F,H,8100    LANGDON                      AV,34.218,-118.4688,Theft,Property Crime,Non-Violent Crimes,0.998825688
528617,27/01/2012,2012-01-25,Northeast,30,M,H,6900 N  FIGUEROA                     ST,34.1275,-118.1872,Battery Crime,Bodily Harm,Violent Crimes,0.997841268
528703,24/08/2012,2012-08-23,Southeast,23,F,B,600 W  117TH                        ST,33.9274,-118.2848,Assault,Bodily Harm,Violent Crimes,0.995757504
528930,19/12/2012,2012-12-19,Southeast,46,F,B,600 W  102ND                        ST,33.9438,-118.2848,Battery Crime,Bodily Harm,Violent Crimes,0.992863402
529019,09/09/2012,2012-09-06,Mission,27,F,B,9300    VARNA                        AV,34.2393,-118.4371,Theft,Property Crime,Non-Violent Crimes,0.990462219
529040,19/12/2012,2012-12-18,Southeast,24,M,B,12000 S  CENTRAL                      AV,33.9237,-118.2543,Theft,Property Crime,Non-Violent Crimes,0.996244477
529134,17/12/2012,2012-12-17,Southwest,52,M,H,1300 W  36TH                         ST,34.0229,-118.2974,Robbery,Robbery,Violent Crimes,0.999944742
529361,15/11/2012,2012-11-15,Van Nuys,51,F,H,7300    WOODMAN                      AV,34.2031,-118.4313,Battery Crime,Bodily Harm,Violent Crimes,0.99496854
529890,11/07/2012,2012-07-10,Mission,44,F,H,COLUMBUS,34.2309,-118.4655,Battery Crime,Bodily Harm,Violent Crimes,0.99889809
530416,13/02/2012,2012-02-13,West Valley,31,F,H,16000    SHERMAN                      WY,34.2012,-118.4815,Robbery,Robbery,Violent Crimes,0.990853833
530659,19/11/2012,2012-04-13,Pacific,73,M,O,3800    LYCEUM                       AV,33.9994,-118.442,Theft,Property Crime,Non-Violent Crimes,0.992263753
530775,04/04/2012,2012-04-01,N Hollywood,33,F,O,11300    MORRISON                     ST,34.1608,-118.3774,Assault,Bodily Harm,Violent Crimes,0.999931576
530826,06/09/2017,2012-02-06,Foothill,42,M,A,11000    IRMA                         AV,34.2688,-118.3006,Theft,Property Crime,Non-Violent Crimes,0.999017989
530897,24/08/2012,2012-08-21,Wilshire,52,M,W,1100 S  LONGWOOD                     AV,34.0557,-118.3389,Theft,Property Crime,Non-Violent Crimes,0.994798648
531097,27/04/2012,2012-04-22,West Valley,72,M,W,6900    WHITAKER                     AV,34.1957,-118.4981,Theft,Property Crime,Non-Violent Crimes,0.998423994
531307,13/04/2012,2012-04-12,Hollywood,21,M,H,GOWER                        ST,34.1017,-118.3224,Theft,Property Crime,Non-Violent Crimes,0.993326622
531368,27/02/2012,2012-02-26,Northeast,44,F,W,1800    EASTERLY                     TR,34.0907,-118.2661,Theft,Property Crime,Non-Violent Crimes,0.995518631
531749,26/11/2012,2012-11-11,West LA,57,M,W,600    ERSKINE                      DR,34.0431,-118.5336,Theft,Property Crime,Non-Violent Crimes,0.996322974
531834,06/03/2012,2012-03-06,N Hollywood,27,F,W,6100    HAZELHURST                   PL,34.1811,-118.3867,Assault,Bodily Harm,Violent Crimes,0.99687477
531985,28/05/2012,2012-05-28,Van Nuys,37,F,H,14100    GILMORE                      ST,34.1877,-118.44,Assault,Bodily Harm,Violent Crimes,0.991598888
531988,02/05/2012,2012-05-02,Harbor,63,M,W,1400 W  260TH                        ST,33.7869,-118.3015,Theft,Property Crime,Non-Violent Crimes,0.993937795
532228,30/05/2012,2012-05-30,Harbor,30,F,H,900 W  SANTA CRUZ                   ST,33.7447,-118.2979,Battery Crime,Bodily Harm,Violent Crimes,0.995065557
532613,30/01/2012,2012-01-29,Foothill,32,F,H,10800    LEHIGH                       AV,34.2665,-118.4144,Assault,Bodily Harm,Violent Crimes,0.995752149
532918,18/06/2012,2012-05-29,Rampart,18,F,H,200 S  LAKE                         ST,34.0663,-118.2719,Theft,Property Crime,Non-Violent Crimes,0.99374853
533120,07/10/2012,2012-10-07,West Valley,29,F,H,7200    BALBOA                       BL,34.2012,-118.5011,Theft,Property Crime,Non-Violent Crimes,0.99579188
533158,16/07/2012,2012-07-15,77th Street,56,F,B,800 E  84TH                         ST,33.9629,-118.2608,Theft,Property Crime,Non-Violent Crimes,0.993774717
533262,09/10/2012,2012-10-08,Hollywood,32,F,W,6700    HOLLYWOOD                    BL,34.1016,-118.3361,Theft,Property Crime,Non-Violent Crimes,0.99683422
533307,14/09/2012,2012-09-14,Mission,19,M,H,15000    POLK                         ST,34.2992,-118.4592,Assault,Bodily Harm,Violent Crimes,0.9971548
533359,21/08/2012,2012-08-20,Southeast,55,F,B,8800 S  HOOVER                       ST,33.958,-118.2869,Theft,Property Crime,Non-Violent Crimes,0.99515438
533387,05/06/2012,2012-06-04,Southwest,26,M,B,4000    ABOURNE                      RD,34.0125,-118.3435,Theft,Property Crime,Non-Violent Crimes,0.998362925
533445,20/09/2012,2012-09-20,Devonshire,32,F,H,15600    KALISHER                     ST,34.2764,-118.4723,Assault,Bodily Harm,Violent Crimes,0.999448704
533691,27/04/2012,2012-04-18,Devonshire,52,M,W,20600    DEVONSHIRE                   ST,34.2573,-118.582,Fraud,White Collar Crime,Non-Violent Crimes,0.993668198
533725,02/04/2012,2012-04-02,Southwest,17,F,B,4000    GELBER                       PL,34.0133,-118.3486,Battery Crime,Bodily Harm,Violent Crimes,0.993658907
533914,27/08/2012,2012-08-26,Mission,42,F,H,8600    WILLIS                       AV,34.2265,-118.4553,Battery Crime,Bodily Harm,Violent Crimes,0.995444897
533969,27/01/2012,2012-01-27,West Valley,53,M,H,BALBOA,34.1939,-118.5011,Assault,Bodily Harm,Violent Crimes,0.99332729
534200,30/01/2012,2012-01-30,Central,44,M,W,LOS ANGELES                  ST,34.0323,-118.2621,Robbery,Robbery,Violent Crimes,0.993784928
534461,12/10/2012,2012-10-12,N Hollywood,25,M,H,12000    ALBERS                       ST,34.1704,-118.3943,Theft,Property Crime,Non-Violent Crimes,0.991586172
534637,11/03/2012,2012-03-11,Central,61,M,O,800 W  8TH                          ST,34.0473,-118.2601,Theft,Property Crime,Non-Violent Crimes,0.995234143
535130,11/02/2012,2012-02-06,Devonshire,36,F,H,11400    DANUBE                       AV,34.2772,-118.4749,Theft,Property Crime,Non-Violent Crimes,0.990037915
535186,25/03/2012,2012-03-24,Northeast,27,F,H,2200    VALENTINE                    ST,34.0906,-118.2473,Theft,Property Crime,Non-Violent Crimes,0.994109724
535289,24/06/2012,2012-06-24,Wilshire,22,F,H,8500    BEVERLY                      BL,34.0761,-118.3766,Theft,Property Crime,Non-Violent Crimes,0.991847021
535890,13/08/2012,2012-08-12,77th Street,21,F,H,1300 W  55TH                         ST,33.9923,-118.298,Battery Crime,Bodily Harm,Violent Crimes,0.995723546
535955,26/04/2012,2012-04-26,Olympic,47,M,H,600 S  VERMONT                      AV,34.0637,-118.2916,Fraud,White Collar Crime,Non-Violent Crimes,0.998607582
536039,12/04/2012,2012-04-12,Foothill,5,M,H,9900    EL DORADO                    AV,34.25,-118.408,Assault,Bodily Harm,Violent Crimes,0.992346135
536115,20/10/2012,2012-10-19,Northeast,41,F,H,100 S  AVENUE 58,34.11,-118.192,Assault,Bodily Harm,Violent Crimes,0.995262154
536245,03/06/2012,2012-06-03,Van Nuys,36,F,B,4400    MURIETTA                     AV,34.1504,-118.4383,Assault,Bodily Harm,Violent Crimes,0.994254071
536628,05/07/2012,2012-07-04,West Valley,69,F,W,16500    ADLON                        RD,34.1455,-118.4931,Theft,Property Crime,Non-Violent Crimes,0.995161508
536674,01/07/2012,2012-06-15,Topanga,22,F,W,22800    VANOWEN                      ST,34.1937,-118.6234,Theft,Property Crime,Non-Violent Crimes,0.997023266
536944,19/03/2012,2012-03-19,West Valley,73,M,W,17500    EMBASSY                      DR,34.1633,-118.5142,Theft,Property Crime,Non-Violent Crimes,0.999884467
537149,17/05/2012,2012-05-17,Harbor,25,M,H,1000 W  253RD                        ST,33.7947,-118.2928,Battery Crime,Bodily Harm,Violent Crimes,0.996223829
537310,12/09/2012,2012-09-11,N Hollywood,38,M,H,5600    COLFAX                       AV,34.1722,-118.3877,Battery Crime,Bodily Harm,Violent Crimes,0.996908284
537351,05/12/2012,2012-12-04,Southwest,14,M,H,3500    FARMDALE                     AV,34.0239,-118.346,Theft,Property Crime,Non-Violent Crimes,0.991071076
537468,05/07/2012,2012-07-05,Central,61,M,B,200 W  6TH                          ST,34.046,-118.2509,Assault,Bodily Harm,Violent Crimes,0.999828189
537486,28/09/2012,2012-09-28,Hollenbeck,46,M,H,4TH                          ST,34.0346,-118.1979,Robbery,Robbery,Violent Crimes,0.995373392
537527,02/11/2012,2012-11-02,Southwest,17,M,H,5000    11TH                         AV,33.998,-118.3294,Battery Crime,Bodily Harm,Violent Crimes,0.99589781
537635,28/05/2012,2012-05-28,Olympic,32,M,H,MARIPOSA                     AV,34.0526,-118.2989,Assault,Bodily Harm,Violent Crimes,0.990176344
537983,01/09/2012,2012-09-01,Central,23,M,W,600 W  5TH                          ST,34.0502,-118.254,Theft,Property Crime,Non-Violent Crimes,0.998099494
538033,13/07/2012,2012-07-13,Southwest,28,F,B,43RD,34.0043,-118.3306,Battery Crime,Bodily Harm,Violent Crimes,0.997742797
538092,25/03/2013,2012-12-30,Pacific,50,F,W,13600    MARINA POINTE                DR,33.9857,-118.4435,Theft,Property Crime,Non-Violent Crimes,0.996298112
538100,20/10/2012,2012-10-19,Foothill,50,F,O,11700    SATICOY                      ST,34.2085,-118.3878,Theft,Property Crime,Non-Violent Crimes,0.998193649
538297,10/07/2012,2012-07-10,N Hollywood,27,M,H,10700    BLOOMFIELD                   ST,34.1496,-118.3636,Theft,Property Crime,Non-Violent Crimes,0.996203215
538465,17/09/2012,2012-09-16,Southeast,23,F,B,10200 S  BROADWAY,33.9438,-118.2781,Theft,Property Crime,Non-Violent Crimes,0.994070833
538670,17/04/2012,2012-04-17,Hollywood,31,M,O,1600 N  POINSETTIA                   PL,34.0998,-118.3479,Battery Crime,Bodily Harm,Violent Crimes,0.99951052
538747,23/07/2012,2012-07-23,Hollywood,34,M,H,6500    HOLLYWOOD                    BL,34.1016,-118.331,Theft,Property Crime,Non-Violent Crimes,0.996064855
538756,06/05/2012,2012-05-06,Harbor,32,F,H,1200 W  DENNI                        ST,33.7842,-118.2779,Assault,Bodily Harm,Violent Crimes,0.99759152
538825,22/08/2012,2012-08-22,West LA,44,M,W,700    VIA SANTA YNEZ,34.0478,-118.5498,Battery Crime,Bodily Harm,Violent Crimes,0.991929394
538905,08/02/2012,2012-02-08,Topanga,46,M,W,22100    SHERMAN                      WY,34.201,-118.6081,Robbery,Robbery,Violent Crimes,0.990968879
539939,03/11/2012,2012-11-01,N Hollywood,46,F,W,11300    CALIFA                       ST,34.1776,-118.3768,Theft,Property Crime,Non-Violent Crimes,0.995907293
540283,24/09/2012,2012-09-24,Hollywood,33,M,H,5500    SANTA MONICA                 BL,34.0908,-118.3092,Assault,Bodily Harm,Violent Crimes,0.991840217
540312,26/10/2012,2012-04-29,Topanga,72,F,W,23500    STYLES                       ST,34.1839,-118.6391,Theft,Property Crime,Non-Violent Crimes,0.998672354
540519,19/05/2012,2012-05-19,Olympic,46,M,H,2600    SAN MARINO                   ST,34.055,-118.2842,Assault,Bodily Harm,Violent Crimes,0.995772384
540534,13/07/2012,2012-07-13,Newton,23,M,H,52ND                         ST,33.9953,-118.274,Assault,Bodily Harm,Violent Crimes,0.994315658
540685,30/11/2012,2012-11-21,Olympic,57,F,H,1300 W  20TH                         ST,34.0382,-118.284,Theft,Property Crime,Non-Violent Crimes,0.999297686
540729,05/04/2012,2012-04-05,Southeast,49,M,B,8700    BARING CROSS                 AV,33.959,-118.2893,Assault,Bodily Harm,Violent Crimes,0.993387356
540817,02/08/2012,2012-07-25,Southwest,22,M,B,2700    ORCHARD                      AV,34.0303,-118.2874,Theft,Property Crime,Non-Violent Crimes,0.990240268
540849,17/04/2012,2012-04-17,77th Street,27,M,B,63RD                         ST,33.9829,-118.3279,Assault,Bodily Harm,Violent Crimes,0.998659635
541190,01/06/2012,2012-05-31,Mission,42,M,H,14400    LANARK                       ST,34.218,-118.4465,Robbery,Robbery,Violent Crimes,0.990175603
541259,24/09/2012,2012-09-24,Wilshire,32,F,B,SAINT ELMO,34.0437,-118.3439,Battery Crime,Bodily Harm,Violent Crimes,0.993001849
541483,07/01/2014,2012-01-01,Newton,17,F,H,100 E  27TH                         ST,34.024,-118.2692,Theft,Property Crime,Non-Violent Crimes,0.994734961
541527,10/10/2012,2012-10-09,N Hollywood,29,F,H,5800    COLFAX                       AV,34.1758,-118.3877,Theft,Property Crime,Non-Violent Crimes,0.997583027
541946,09/10/2012,2012-10-06,West LA,48,F,W,10200    BRIARWOOD                    DR,34.1161,-118.4435,Theft,Property Crime,Non-Violent Crimes,0.990647563
542000,20/03/2012,2012-03-19,77th Street,56,M,H,4600 S  BUDLONG                      AV,34.0017,-118.2959,Theft,Property Crime,Non-Violent Crimes,0.990853744
542237,03/04/2012,2012-03-08,Southeast,56,M,B,9900    WILMINGTON                   AV,33.9465,-118.239,Fraud,White Collar Crime,Non-Violent Crimes,0.997762577
542253,17/11/2012,2012-11-17,Wilshire,32,F,W,300 N  LA CIENEGA                   BL,34.0761,-118.3766,Theft,Property Crime,Non-Violent Crimes,0.992655846
542379,16/08/2012,2012-08-15,Southeast,50,M,H,700 E  98TH                         ST,33.9475,-118.263,Theft,Property Crime,Non-Violent Crimes,0.994785913
542873,21/03/2012,2012-03-20,77th Street,61,M,B,6400 S  VERMONT                      AV,33.981,-118.2914,Robbery,Robbery,Violent Crimes,0.995119925
543269,11/10/2012,2012-08-19,Topanga,82,F,W,23000    BURBANK                      BL,34.1719,-118.628,Theft,Property Crime,Non-Violent Crimes,0.99488893
543760,25/06/2012,2012-06-23,Wilshire,22,M,W,7200    WARING                       AV,34.0853,-118.3462,Theft,Property Crime,Non-Violent Crimes,0.990385295
543769,04/03/2012,2012-03-02,Topanga,34,M,O,23200    CALVERT                      ST,34.1812,-118.6315,Theft,Property Crime,Non-Violent Crimes,0.995052617
543777,12/12/2012,2012-12-11,Central,60,M,W,200 E  6TH                          ST,34.0446,-118.249,Theft,Property Crime,Non-Violent Crimes,0.997998179
543855,08/03/2012,2012-03-04,West LA,41,M,W,11300    SANTA MONICA                 BL,34.0465,-118.4484,Theft,Property Crime,Non-Violent Crimes,0.991305925
543875,07/08/2012,2012-08-07,Mission,32,M,H,15100    ROSCOE                       BL,34.2215,-118.4617,Assault,Bodily Harm,Violent Crimes,0.990576533
544030,10/10/2012,2012-10-09,77th Street,51,M,H,8400    AVALON                       BL,33.9629,-118.2651,Battery Crime,Bodily Harm,Violent Crimes,0.990372314
544062,15/06/2012,2012-06-15,Topanga,24,M,H,GAULT,34.1992,-118.6059,Assault,Bodily Harm,Violent Crimes,0.996556585
544200,27/08/2012,2012-08-14,Hollywood,55,F,W,6900    ROMAINE                      ST,34.0889,-118.3404,Theft,Property Crime,Non-Violent Crimes,0.998928283
544402,08/08/2012,2012-08-08,N Hollywood,26,M,W,LANKERSHIM,34.1888,-118.3877,Battery Crime,Bodily Harm,Violent Crimes,0.994560605
545177,24/04/2012,2012-03-24,Wilshire,19,F,H,1900 S  LA BREA                      AV,34.0404,-118.3475,Fraud,White Collar Crime,Non-Violent Crimes,0.994975158
545197,22/11/2012,2012-11-22,Wilshire,51,F,H,ARLINGTON                    AV,34.0399,-118.3177,Battery Crime,Bodily Harm,Violent Crimes,0.990168837
545569,25/10/2012,2012-10-24,Southeast,32,F,B,98TH                         ST,33.9473,-118.2869,Assault,Bodily Harm,Violent Crimes,0.99317984
545641,05/10/2012,2012-10-05,West LA,39,M,H,8900    CADILLAC                     AV,34.0403,-118.3846,Robbery,Robbery,Violent Crimes,0.999664921
546600,27/01/2017,2012-01-01,Devonshire,71,F,H,16300    CHASE                        ST,34.2248,-118.4872,Theft,Property Crime,Non-Violent Crimes,0.99795252
547022,30/09/2012,2012-09-12,Mission,29,M,H,8800    MOONBEAM                     AV,34.2306,-118.4429,Theft,Property Crime,Non-Violent Crimes,0.998372299
547049,15/07/2012,2012-07-15,Harbor,45,F,H,1100    BROAD                        AV,33.7849,-118.2612,Battery Crime,Bodily Harm,Violent Crimes,0.996357353
547088,08/07/2012,2012-07-07,Topanga,23,F,W,6700    VARIEL                       AV,34.1921,-118.5928,Theft,Property Crime,Non-Violent Crimes,0.998659219
547195,29/10/2012,2012-10-29,Southeast,14,M,H,FIGUEROA                     ST,33.9274,-118.2826,Robbery,Robbery,Violent Crimes,0.990899992
547443,22/05/2012,2012-05-21,77th Street,70,F,B,4000 W  59TH                         PL,33.9862,-118.344,Theft,Property Crime,Non-Violent Crimes,0.998824864
547467,22/09/2012,2012-09-22,Southwest,45,M,W,3900 S  FIGUEROA                     ST,34.014,-118.2827,Battery Crime,Bodily Harm,Violent Crimes,0.991750383
547470,15/02/2012,2012-02-15,West LA,32,M,W,2900    MOTOR                        AV,34.0397,-118.4067,Theft,Property Crime,Non-Violent Crimes,0.991952334
547611,18/04/2012,2012-04-18,Rampart,20,M,B,200    WITMER                       ST,34.061,-118.2615,Assault,Bodily Harm,Violent Crimes,0.992990692
547798,28/04/2012,2012-04-27,77th Street,52,F,B,6300    WEST                         BL,33.9827,-118.3352,Battery Crime,Bodily Harm,Violent Crimes,0.991160324
547852,05/11/2012,2012-11-01,N Hollywood,22,F,B,6900    LAUREL CANYON                BL,34.1959,-118.3965,Theft,Property Crime,Non-Violent Crimes,0.991153403
548010,23/04/2012,2012-04-23,Foothill,57,M,W,8900    TELFAIR                      AV,34.2308,-118.3909,Battery Crime,Bodily Harm,Violent Crimes,0.996108377
548342,03/04/2012,2012-04-03,Hollywood,41,F,H,5400    HOLLYWOOD                    BL,34.1018,-118.3071,Battery Crime,Bodily Harm,Violent Crimes,0.994724905
548625,08/11/2012,2012-11-08,N Hollywood,31,M,B,6600    LEMP                         AV,34.1903,-118.3845,Battery Crime,Bodily Harm,Violent Crimes,0.993729522
548763,06/07/2012,2012-07-05,West LA,53,F,O,900 S  SHERBOURNE                   DR,34.061,-118.3793,Theft,Property Crime,Non-Violent Crimes,0.995834977
549053,04/12/2012,2012-12-03,Olympic,46,F,H,4200 W  4TH                          ST,34.0672,-118.3098,Theft,Property Crime,Non-Violent Crimes,0.991338305
549059,22/08/2012,2012-08-21,West LA,35,M,W,11800    KIOWA                        AV,34.0498,-118.4642,Theft,Property Crime,Non-Violent Crimes,0.998504012
549091,25/09/2012,2012-09-25,Pacific,59,M,W,3700    WATSEKA                      AV,34.0267,-118.3986,Battery Crime,Bodily Harm,Violent Crimes,0.99992083
549092,04/09/2012,2012-07-11,Devonshire,73,F,W,17300    HALSEY                       ST,34.2813,-118.5109,Theft,Property Crime,Non-Violent Crimes,0.995668158
549555,18/05/2012,2012-05-18,Newton,21,M,H,100 E  49TH                         ST,33.9984,-118.274,Battery Crime,Bodily Harm,Violent Crimes,0.994058649
549711,15/10/2012,2012-10-13,77th Street,72,F,B,2400 W  SLAUSON                      AV,33.9891,-118.3196,Theft,Property Crime,Non-Violent Crimes,0.995825914
550128,27/12/2012,2012-12-27,Northeast,24,M,W,4500    COLORADO                     BL,34.1417,-118.2697,Theft,Property Crime,Non-Violent Crimes,0.998683156
550131,26/05/2012,2012-05-25,Hollenbeck,32,F,H,200 N  MISSION                      RD,34.0497,-118.2275,Theft,Property Crime,Non-Violent Crimes,0.990241144
550389,05/12/2012,2012-12-05,West Valley,20,F,H,15800    SATICOY                      ST,34.2085,-118.4771,Assault,Bodily Harm,Violent Crimes,0.997450007
550395,26/01/2013,2012-12-06,Southwest,22,M,H,3000 S  FLOWER                       ST,34.0245,-118.2768,Theft,Property Crime,Non-Violent Crimes,0.999162626
550965,15/09/2012,2012-09-15,N Hollywood,40,M,H,6400    GILSON                       AV,34.1876,-118.4099,Assault,Bodily Harm,Violent Crimes,0.996070218
551271,13/06/2012,2012-06-13,Newton,32,F,H,700 E  VERNON                       AV,34.0039,-118.2635,Assault,Bodily Harm,Violent Crimes,0.99776884
551285,04/10/2012,2012-10-03,West Valley,22,M,W,19000    SHERMAN                      WY,34.2011,-118.547,Battery Crime,Bodily Harm,Violent Crimes,0.99921209
551477,17/03/2012,2012-03-17,Central,43,M,H,800    WILSHIRE                     BL,34.0494,-118.2581,Battery Crime,Bodily Harm,Violent Crimes,0.992981892
551535,03/02/2012,2012-02-03,Wilshire,36,F,W,100 N  LA BREA                      AV,34.0736,-118.344,Theft,Property Crime,Non-Violent Crimes,0.990848745
552017,27/10/2012,2012-09-26,Northeast,48,F,A,6400 N  FIGUEROA                     ST,34.1179,-118.1835,Theft,Property Crime,Non-Violent Crimes,0.996992813
552116,23/11/2012,2012-11-23,Foothill,63,F,W,10200    GLORY                        AV,34.2538,-118.2811,Assault,Bodily Harm,Violent Crimes,0.993331993
552335,17/01/2012,2012-01-17,Northeast,23,F,H,1400    LAKE SHORE                   AV,34.0795,-118.2596,Battery Crime,Bodily Harm,Violent Crimes,0.994941959
552388,21/02/2012,2012-02-18,West Valley,25,F,H,6800    LOUISE                       AV,34.1939,-118.5098,Assault,Bodily Harm,Violent Crimes,0.999053017
552508,19/10/2012,2012-10-18,Devonshire,49,F,B,10200    LURLINE                      AV,34.2554,-118.5842,Assault,Bodily Harm,Violent Crimes,0.993424559
552908,02/07/2012,2012-02-23,Central,50,M,F,500    SAN JULIAN                   ST,34.0446,-118.245,Theft,Property Crime,Non-Violent Crimes,0.996200212
552972,08/05/2012,2012-05-08,West LA,20,M,O,LEVERING,34.0665,-118.4534,Robbery,Robbery,Violent Crimes,0.992076103
552990,29/06/2012,2012-06-28,Southeast,56,F,B,8900    BARING CROSS                 AV,33.9565,-118.2893,Theft,Property Crime,Non-Violent Crimes,0.991702997
553076,08/12/2012,2012-12-07,Southeast,49,F,B,10500 S  VERMONT                      AV,33.9407,-118.2916,Robbery,Robbery,Violent Crimes,0.997797931
553311,31/08/2012,2012-08-31,77th Street,55,M,H,7100    ESTRELLA                     AV,33.9756,-118.2849,Theft,Property Crime,Non-Violent Crimes,0.995265539
553381,22/04/2013,2012-12-15,West Valley,54,M,O,6800    CORBIN                       AV,34.1938,-118.5623,Theft,Property Crime,Non-Violent Crimes,0.990152967
553453,05/07/2012,2012-07-05,N Hollywood,30,F,W,6000    BONNER                       AV,34.1795,-118.3741,Battery Crime,Bodily Harm,Violent Crimes,0.994017916
553785,23/09/2012,2012-09-22,Foothill,32,M,O,12200    LULL                         ST,34.2094,-118.3995,Theft,Property Crime,Non-Violent Crimes,0.998239443
553896,21/08/2012,2012-08-21,Topanga,41,M,O,20700    VENTURA                      BL,34.167,-118.5835,Fraud,White Collar Crime,Non-Violent Crimes,0.99039286
553998,30/06/2012,2012-06-26,Southeast,20,F,B,200 W  89TH                         ST,33.9555,-118.2761,Battery Crime,Bodily Harm,Violent Crimes,0.99852348
554095,20/08/2012,2012-08-20,Van Nuys,41,F,B,14300    FRIAR                        ST,34.1857,-118.4444,Assault,Bodily Harm,Violent Crimes,0.999806241
554407,29/09/2012,2012-07-20,Van Nuys,25,F,O,13400    VENTURA                      BL,34.147,-118.4249,Fraud,White Collar Crime,Non-Violent Crimes,0.990367228
554494,04/04/2012,2012-02-01,Mission,51,F,H,15500    MCKEEVER                     ST,34.2748,-118.4699,Theft,Property Crime,Non-Violent Crimes,0.999441986
554757,28/10/2012,2012-10-28,Southwest,55,M,H,W  JEFFERSON                    BL,34.0256,-118.3248,Robbery,Robbery,Violent Crimes,0.996149847
555337,02/08/2012,2012-07-31,Southwest,19,F,B,3100    STOCKER                      ST,34.0085,-118.3274,Theft,Property Crime,Non-Violent Crimes,0.996959293
555367,08/08/2012,2012-07-31,Harbor,64,F,H,1100    MCDONALD                     AV,33.7845,-118.2714,Theft,Property Crime,Non-Violent Crimes,0.996052461
555581,01/08/2012,2012-07-14,Central,33,F,O,1200 S  FIGUEROA                     ST,34.0423,-118.2666,Rape,Rape,Violent Crimes,0.998090011
555593,14/02/2012,2012-02-14,Newton,42,M,B,SAN PEDRO                    PL,34.0039,-118.2726,Assault,Bodily Harm,Violent Crimes,0.996338298
555638,02/07/2012,2012-05-04,Harbor,28,M,O,3700    STEPHEN M WHITE              DR,33.7105,-118.286,Theft,Property Crime,Non-Violent Crimes,0.999330565
555941,04/02/2012,2012-02-03,Southeast,28,F,B,10900    WILLOWBROOK                  AV,33.9371,-118.2421,Assault,Bodily Harm,Violent Crimes,0.996264183
556144,22/10/2012,2012-10-22,West Valley,62,F,W,6400    WHITE OAK                    AV,34.1861,-118.5185,Theft,Property Crime,Non-Violent Crimes,0.996421864
556331,12/10/2012,2012-10-05,West Valley,37,F,W,7400    CLAIRE                       AV,34.2048,-118.5502,Theft,Property Crime,Non-Violent Crimes,0.990370599
556601,10/04/2012,2012-04-10,Wilshire,22,M,H,1500 S  LA BREA                      AV,34.0467,-118.345,Battery Crime,Bodily Harm,Violent Crimes,0.991071759
556751,01/07/2012,2012-06-22,Topanga,26,M,W,20900    LULL                         ST,34.2093,-118.5897,Theft,Property Crime,Non-Violent Crimes,0.997411618
556906,04/05/2012,2012-05-04,Rampart,45,F,H,300 N  VIRGIL                       AV,34.0765,-118.2868,Rape,Rape,Violent Crimes,0.991886701
557189,02/02/2012,2012-01-30,Harbor,33,F,H,2000 S  PACIFIC                      AV,33.7261,-118.288,Battery Crime,Bodily Harm,Violent Crimes,0.995533823
557202,26/09/2012,2012-09-25,N Hollywood,57,M,A,5100    VINELAND                     AV,34.1627,-118.3704,Theft,Property Crime,Non-Violent Crimes,0.998314722
557434,30/05/2012,2012-05-27,Mission,38,F,H,13000    BRADWELL                     AV,34.3068,-118.457,Battery Crime,Bodily Harm,Violent Crimes,0.995211871
557571,07/01/2012,2012-01-07,Harbor,27,F,H,300 W  1ST                          ST,33.7433,-118.2835,Assault,Bodily Harm,Violent Crimes,0.993365152
558038,29/08/2012,2012-08-29,Mission,25,F,H,11000    OMELVENY                     AV,34.2699,-118.4394,Assault,Bodily Harm,Violent Crimes,0.999440002
558136,21/04/2012,2012-04-21,Newton,47,F,W,HOPE                         ST,34.022,-118.277,Theft,Property Crime,Non-Violent Crimes,0.994189907
558541,12/06/2012,2012-06-12,Northeast,33,F,H,3900    TRACY                        ST,34.1072,-118.277,Battery Crime,Bodily Harm,Violent Crimes,0.991674281
558901,24/02/2012,2012-02-24,Hollywood,46,M,W,5100    HOLLYWOOD                    BL,34.1018,-118.3005,Battery Crime,Bodily Harm,Violent Crimes,0.991604195
559058,08/12/2012,2012-12-08,Topanga,31,M,W,6300    VARIEL                       AV,34.1847,-118.5928,Theft,Property Crime,Non-Violent Crimes,0.998902613
559181,19/05/2012,2012-05-18,Northeast,26,M,W,3400    VERDUGO                      RD,34.1137,-118.2353,Theft,Property Crime,Non-Violent Crimes,0.998268719
559202,03/06/2012,2012-05-28,Devonshire,60,M,W,11700    MONTE LEON                   WY,34.2843,-118.5479,Theft,Property Crime,Non-Violent Crimes,0.998036948
559211,22/10/2012,2012-10-22,Rampart,21,F,B,UNION                        AV,34.0523,-118.2722,Assault,Bodily Harm,Violent Crimes,0.997376753
559307,09/12/2012,2012-12-09,Southwest,20,F,B,3600 W  MARTIN LUTHER KING JR        BL,34.011,-118.3351,Assault,Bodily Harm,Violent Crimes,0.990439515
559380,01/10/2012,2012-09-29,Hollenbeck,14,F,H,300 E  6TH                          ST,34.0312,-118.1997,Battery Crime,Bodily Harm,Violent Crimes,0.999663808
559668,10/04/2012,2012-04-10,Devonshire,58,F,W,16000    CHASE                        ST,34.2248,-118.4809,Theft,Property Crime,Non-Violent Crimes,0.992113822
559829,03/10/2012,2012-10-02,Harbor,11,M,O,900    STATLER                      ST,33.7641,-118.2978,Assault,Bodily Harm,Violent Crimes,0.99739001
560150,14/02/2012,2012-02-06,Northeast,17,M,H,300 N  AVENUE 54,34.1098,-118.1984,Robbery,Robbery,Violent Crimes,0.994302971
560322,10/09/2012,2012-09-10,Hollenbeck,66,M,W,4300    KEWANEE                      ST,34.078,-118.1902,Theft,Property Crime,Non-Violent Crimes,0.999961975
560861,18/09/2012,2012-09-18,Foothill,40,F,W,SUNLAND,34.2598,-118.3223,Assault,Bodily Harm,Violent Crimes,0.999786254
561539,20/05/2012,2012-05-19,Devonshire,71,F,W,17000    LASSEN                       ST,34.2503,-118.5024,Theft,Property Crime,Non-Violent Crimes,0.999383437
561722,24/04/2012,2012-04-22,N Hollywood,40,M,W,4300    LAURELGROVE                  AV,34.1486,-118.4008,Theft,Property Crime,Non-Violent Crimes,0.992737786
561850,26/05/2012,2012-05-25,Devonshire,33,M,W,9200    WINNETKA                     AV,34.2375,-118.5711,Theft,Property Crime,Non-Violent Crimes,0.997000713
562138,04/11/2012,2012-10-27,Wilshire,37,M,B,2300 S  LONGWOOD                     AV,34.0361,-118.3474,Theft,Property Crime,Non-Violent Crimes,0.992487638
562157,19/11/2012,2012-11-19,Northeast,40,F,H,4700 W  SUNSET                       BL,34.0982,-118.2918,Theft,Property Crime,Non-Violent Crimes,0.992361996
562443,06/09/2012,2012-09-04,West LA,52,F,B,10200 W  PICO                         BL,34.05,-118.4106,Theft,Property Crime,Non-Violent Crimes,0.990922278
562758,06/07/2012,2012-07-05,Harbor,22,M,W,26300    ZEPHYR                       AV,33.7837,-118.306,Theft,Property Crime,Non-Violent Crimes,0.991808497
562827,31/12/2012,2012-12-31,Central,57,M,B,500 E  4TH                          ST,34.0449,-118.2415,Theft,Property Crime,Non-Violent Crimes,0.998723048
563219,27/01/2012,2012-01-27,N Hollywood,46,F,W,4600    LAUREL CANYON                BL,34.1549,-118.3965,Battery Crime,Bodily Harm,Violent Crimes,0.998041756
563253,03/03/2012,2012-03-03,Harbor,47,F,H,400 N  MESA                         ST,33.746,-118.2857,Assault,Bodily Harm,Violent Crimes,0.997970451
563506,11/04/2012,2012-03-01,Southeast,33,M,H,600 W  COLDEN                       AV,33.9492,-118.2848,Theft,Property Crime,Non-Violent Crimes,0.995417046
563740,09/08/2012,2012-08-09,West LA,27,F,H,1500    STONER                       AV,34.0433,-118.4571,Battery Crime,Bodily Harm,Violent Crimes,0.998110161
563803,21/05/2012,2012-05-20,77th Street,28,F,B,6200 S  VAN NESS                     AV,33.9834,-118.3177,Battery Crime,Bodily Harm,Violent Crimes,0.992949499
563828,23/09/2016,2012-09-11,Van Nuys,21,M,W,5200    KESTER                       AV,34.1649,-118.4574,Theft,Property Crime,Non-Violent Crimes,0.991805697
563929,25/12/2012,2012-12-25,Rampart,28,F,H,300    DOUGLAS                      ST,34.0647,-118.2583,Assault,Bodily Harm,Violent Crimes,0.994880097
564099,21/06/2012,2012-05-07,Rampart,20,F,B,2200 W  8TH                          ST,34.0554,-118.2789,Theft,Property Crime,Non-Violent Crimes,0.99275648
564296,04/08/2017,2012-06-01,Central,74,M,W,800 W  1ST                          ST,34.0571,-118.2509,Theft,Property Crime,Non-Violent Crimes,0.991925065
564386,04/10/2012,2012-09-15,Foothill,54,M,O,8100    WILKINSON                    AV,34.2181,-118.4041,Theft,Property Crime,Non-Violent Crimes,0.992809578
564487,23/11/2012,2012-11-22,Van Nuys,40,F,H,15500    VANOWEN                      ST,34.1939,-118.4705,Battery Crime,Bodily Harm,Violent Crimes,0.991650109
564500,21/01/2012,2012-01-19,Rampart,24,F,H,1100    BELLEVUE                     AV,34.0653,-118.2493,Assault,Bodily Harm,Violent Crimes,0.993838927
564522,21/05/2012,2012-05-21,Hollenbeck,24,F,W,VALLEY                       BL,34.0645,-118.1967,Theft,Property Crime,Non-Violent Crimes,0.999897307
564631,08/06/2012,2012-06-07,Harbor,20,F,W,1000 W  15TH                         ST,33.7306,-118.299,Theft,Property Crime,Non-Violent Crimes,0.997824022
565186,25/01/2012,2012-01-19,Harbor,9,F,H,300 W  E                            ST,33.7755,-118.2647,Assault,Bodily Harm,Violent Crimes,0.993152169
565769,10/03/2012,2012-03-10,Foothill,25,M,H,GLENOAKS,34.2737,-118.4117,Assault,Bodily Harm,Violent Crimes,0.999489247
566022,03/03/2012,2012-03-03,Southeast,68,M,B,WILMINGTON                   AV,33.9383,-118.239,Theft,Property Crime,Non-Violent Crimes,0.993803074
566227,09/05/2012,2012-05-04,Devonshire,70,M,W,9000    HAYVENHURST                  AV,34.2339,-118.4938,Fraud,White Collar Crime,Non-Violent Crimes,0.995304482
566293,14/05/2012,2012-05-14,Harbor,44,F,W,1000 W  WERBEL                       PL,33.7628,-118.2993,Theft,Property Crime,Non-Violent Crimes,0.995948349
566426,05/08/2012,2012-08-05,N Hollywood,27,M,B,BARHAM,34.131,-118.3452,Battery Crime,Bodily Harm,Violent Crimes,0.999279393
567030,12/04/2012,2012-04-12,Topanga,28,M,W,7300    MCLAREN                      AV,34.2026,-118.6246,Theft,Property Crime,Non-Violent Crimes,0.996802971
567031,06/02/2012,2012-02-06,N Hollywood,30,M,H,RIVERSIDE                    DR,34.1577,-118.3877,Battery Crime,Bodily Harm,Violent Crimes,0.999971431
567296,26/07/2012,2012-07-25,Harbor,62,F,W,2200    STONEWOOD                    CT,33.7649,-118.3076,Assault,Bodily Harm,Violent Crimes,0.99989817
567300,25/06/2012,2012-04-11,N Hollywood,59,M,W,12400    VENTURA                      BL,34.1429,-118.403,Theft,Property Crime,Non-Violent Crimes,0.997003321
567412,04/09/2012,2012-07-17,N Hollywood,24,F,W,10900    BLOOMFIELD                   ST,34.1493,-118.3678,Theft,Property Crime,Non-Violent Crimes,0.99393997
567545,31/03/2012,2012-03-31,Hollywood,48,M,W,ARGYLE,34.1037,-118.3252,Assault,Bodily Harm,Violent Crimes,0.998888219
568847,04/05/2012,2012-04-19,Northeast,32,M,W,3100    RIVERSIDE                    DR,34.1128,-118.2679,Theft,Property Crime,Non-Violent Crimes,0.99997412
568982,11/09/2012,2012-09-01,West Valley,58,F,W,6500    YOLANDA                      AV,34.1888,-118.5404,Theft,Property Crime,Non-Violent Crimes,0.991826856
569397,11/02/2015,2012-12-17,Devonshire,45,M,W,16600    DEVONSHIRE                   ST,34.2575,-118.4936,Fraud,White Collar Crime,Non-Violent Crimes,0.990554903
569461,27/03/2012,2012-03-24,Southwest,25,F,B,2400 S  SAINT ANDREWS                PL,34.0348,-118.3113,Theft,Property Crime,Non-Violent Crimes,0.993126811
569533,08/11/2012,2012-11-07,Wilshire,20,M,H,VENICE                       BL,34.0436,-118.3213,Assault,Bodily Harm,Violent Crimes,0.993378233
569695,30/11/2012,2012-11-28,Southeast,7,F,B,2000 E  115TH                        ST,33.9305,-118.2363,Assault,Bodily Harm,Violent Crimes,0.999300001
569934,17/05/2012,2012-05-16,Hollenbeck,16,F,H,2500    LANCASTER                    AV,34.0588,-118.1989,Assault,Bodily Harm,Violent Crimes,0.99187239
569945,20/01/2012,2012-01-20,Northeast,13,F,H,FLETCHER,34.1078,-118.2544,Assault,Bodily Harm,Violent Crimes,0.999437098
570144,05/10/2012,2012-09-14,Van Nuys,30,F,W,4500    WOODMAN                      AV,34.153,-118.4312,Theft,Property Crime,Non-Violent Crimes,0.992991147
570735,11/12/2012,2012-12-11,Central,53,M,B,5TH,34.0454,-118.2466,Battery Crime,Bodily Harm,Violent Crimes,0.999914468
570804,30/10/2012,2012-10-30,Harbor,28,M,H,1500 W  224TH                        ST,33.8234,-118.3038,Assault,Bodily Harm,Violent Crimes,0.992753504
570864,20/08/2012,2012-08-20,Olympic,64,F,H,PICO,34.0473,-118.2864,Robbery,Robbery,Violent Crimes,0.992987765
570913,15/09/2012,2012-03-09,Van Nuys,16,F,H,13000    OXNARD                       ST,34.1794,-118.4162,Rape,Rape,Violent Crimes,0.991184038
570966,07/10/2012,2012-10-07,77th Street,30,F,B,6000    3RD                          AV,33.9855,-118.3206,Battery Crime,Bodily Harm,Violent Crimes,0.994022328
571132,25/06/2012,2012-06-22,Central,57,M,O,400 S  ALAMEDA                      ST,34.0433,-118.2381,Theft,Property Crime,Non-Violent Crimes,0.996080853
571246,01/02/2012,2012-02-01,77th Street,49,F,H,6600    ESTRELLA                     AV,33.9795,-118.2849,Theft,Property Crime,Non-Violent Crimes,0.996072936
571395,05/04/2012,2012-04-05,Van Nuys,41,F,W,WHITSETT,34.1576,-118.4052,Theft,Property Crime,Non-Violent Crimes,0.99782848
571552,23/08/2012,2012-08-23,Pacific,26,F,H,8900    VENICE                       BL,34.0294,-118.3881,Theft,Property Crime,Non-Violent Crimes,0.993024915
571822,24/05/2012,2012-05-24,Northeast,20,M,H,1600 N  NORMANDIE                    AV,34.1004,-118.3005,Battery Crime,Bodily Harm,Violent Crimes,0.997665748
572101,23/09/2012,2012-09-23,Rampart,24,M,H,BEVERLY                      BL,34.0719,-118.2822,Robbery,Robbery,Violent Crimes,0.992682978
572190,15/09/2012,2012-09-15,Southwest,36,F,B,4100    SANTA ROSALIA                DR,34.0125,-118.3435,Theft,Property Crime,Non-Violent Crimes,0.997220373
572387,24/05/2012,2012-05-23,Topanga,54,F,W,6300    DE SOTO                      AV,34.1847,-118.5888,Theft,Property Crime,Non-Violent Crimes,0.992889054
572447,03/05/2012,2012-04-01,Van Nuys,31,M,O,6700    FULTON                       AV,34.1926,-118.4225,Theft,Property Crime,Non-Violent Crimes,0.995604964
572511,10/05/2012,2012-05-09,Foothill,45,M,W,10500    SUNLAND                      BL,34.2598,-118.3246,Theft,Property Crime,Non-Violent Crimes,0.991263853
572752,22/06/2012,2012-06-10,Southwest,55,F,B,3800    DUBLIN                       AV,34.0173,-118.3224,Theft,Property Crime,Non-Violent Crimes,0.999341365
573955,10/01/2012,2012-01-03,West LA,66,F,W,10300    LOUISIANA                    AV,34.0533,-118.4185,Theft,Property Crime,Non-Violent Crimes,0.992839256
574014,31/08/2012,2012-08-28,Rampart,40,F,H,100 S  LAFAYETTE PARK               PL,34.0703,-118.2786,Theft,Property Crime,Non-Violent Crimes,0.991099917
574416,19/08/2012,2012-08-19,77th Street,29,F,H,1600 W  69TH                         ST,33.977,-118.3046,Assault,Bodily Harm,Violent Crimes,0.991086608
574420,26/02/2013,2012-11-30,West Valley,27,F,W,18200    INGOMAR                      ST,34.212,-118.5298,Theft,Property Crime,Non-Violent Crimes,0.994514943
574821,21/12/2012,2012-12-19,West Valley,49,M,H,16000    CANTLAY                      ST,34.2022,-118.4815,Theft,Property Crime,Non-Violent Crimes,0.995647851
575171,14/05/2012,2012-04-18,Pacific,29,F,W,8700    PERSHING                     DR,33.9547,-118.4413,Theft,Property Crime,Non-Violent Crimes,0.996141772
575202,04/07/2012,2012-07-03,Hollywood,24,F,A,1600 N  HARVARD                      BL,34.1,-118.3044,Battery Crime,Bodily Harm,Violent Crimes,0.991415383
575213,25/08/2012,2012-08-25,Olympic,49,M,O,WILSHIRE                     BL,34.0618,-118.2979,Theft,Property Crime,Non-Violent Crimes,0.993115576
575457,16/02/2012,2012-02-16,Van Nuys,19,M,H,STANSBURY,34.1994,-118.4411,Robbery,Robbery,Violent Crimes,0.995994225
575836,22/08/2012,2012-08-22,Mission,20,F,H,15100    PARTHENIA                    ST,34.2283,-118.4611,Theft,Property Crime,Non-Violent Crimes,0.992045226
575889,22/11/2012,2012-11-21,N Hollywood,48,M,W,4300    LEMP                         AV,34.1479,-118.3845,Theft,Property Crime,Non-Violent Crimes,0.993272276
576026,24/05/2012,2012-05-24,Devonshire,30,M,O,12000    WOOD RANCH                   RD,34.2895,-118.5227,Theft,Property Crime,Non-Violent Crimes,0.999446625
576420,04/07/2012,2012-07-04,Pacific,39,F,W,12900    PANAMA                       ST,33.9843,-118.4278,Battery Crime,Bodily Harm,Violent Crimes,0.996950065
576469,06/06/2012,2012-06-05,Central,23,M,W,800 E  3RD                          ST,34.0457,-118.2364,Theft,Property Crime,Non-Violent Crimes,0.99118673
577274,29/03/2012,2012-03-28,Mission,50,M,W,14400    FOOTHILL                     BL,34.321,-118.4478,Theft,Property Crime,Non-Violent Crimes,0.992410818
577514,16/02/2012,2012-02-15,Foothill,18,M,H,12400    VAN NUYS                     BL,34.2799,-118.4032,Battery Crime,Bodily Harm,Violent Crimes,0.997711195
577624,09/04/2012,2012-04-09,Southwest,43,M,H,38TH,34.0158,-118.2828,Assault,Bodily Harm,Violent Crimes,0.992953265
577876,16/01/2012,2012-01-16,Northeast,52,M,W,1800    MORTON                       AV,34.0831,-118.2509,Assault,Bodily Harm,Violent Crimes,0.992310007
578142,24/11/2012,2012-11-24,Topanga,21,F,H,6100    TOPANGA CANYON               BL,34.1811,-118.6059,Theft,Property Crime,Non-Violent Crimes,0.992501594
578193,14/05/2012,2012-05-13,Devonshire,39,M,W,17700    KINZIE                       ST,34.2486,-118.5199,Theft,Property Crime,Non-Violent Crimes,0.991983999
580087,17/10/2014,2012-04-14,77th Street,31,M,H,1200 W  49TH                         ST,33.9987,-118.2959,Theft,Property Crime,Non-Violent Crimes,0.991042421
580148,27/08/2012,2012-08-25,Van Nuys,76,M,H,14400    CALIFA                       ST,34.1776,-118.4465,Theft,Property Crime,Non-Violent Crimes,0.994780682
580149,29/02/2012,2012-02-07,77th Street,43,F,H,800 W  81ST                         ST,33.9655,-118.2871,Theft,Property Crime,Non-Violent Crimes,0.999980839
580381,04/11/2012,2012-11-03,77th Street,39,M,H,5400 S  HOOVER                       ST,33.9933,-118.2871,Assault,Bodily Harm,Violent Crimes,0.995167278
581111,16/11/2012,2012-03-23,N Hollywood,21,F,H,6300    WHITSETT                     AV,34.1849,-118.4052,Rape,Rape,Violent Crimes,0.996948933
581119,25/04/2012,2012-04-25,West LA,22,M,W,BROXTON                      AV,34.0608,-118.4456,Battery Crime,Bodily Harm,Violent Crimes,0.993516274
581123,30/07/2012,2012-07-23,Harbor,39,M,W,3100 S  DENISON                      AV,0,0,Theft,Property Crime,Non-Violent Crimes,0.995656019
581143,24/10/2012,2012-10-20,Van Nuys,30,F,B,14200    CALVERT                      ST,34.1817,-118.4422,Rape,Rape,Violent Crimes,0.994363132
581432,01/06/2012,2012-05-19,Southwest,51,M,H,3900    FLOWER                       DR,34.014,-118.2816,Theft,Property Crime,Non-Violent Crimes,0.998239837
581658,18/09/2012,2012-09-18,77th Street,32,M,B,WESTERN                      AV,33.9525,-118.1278,Assault,Bodily Harm,Violent Crimes,0.999002822
581723,29/11/2012,2012-11-29,77th Street,99,F,B,AVALON                       BL,33.9675,-118.2651,Battery Crime,Bodily Harm,Violent Crimes,0.993442426
581910,30/03/2012,2012-03-28,Hollywood,21,M,W,3400    BARHAM                       BL,34.1333,-118.3438,Theft,Property Crime,Non-Violent Crimes,0.99584182
582136,09/12/2012,2012-12-08,West LA,28,M,W,1900    BELOIT                       AV,34.0431,-118.444,Theft,Property Crime,Non-Violent Crimes,0.999070173
582221,20/10/2012,2012-10-17,Southwest,23,F,H,3600    7TH                          AV,34.023,-118.3248,Battery Crime,Bodily Harm,Violent Crimes,0.997578962
582374,15/01/2013,2012-12-19,Northeast,22,M,W,1800 N  NEW HAMPSHIRE                AV,34.1036,-118.2933,Theft,Property Crime,Non-Violent Crimes,0.994160934
582375,28/08/2012,2012-08-20,West LA,20,M,H,2600 S  CORNING                      ST,34.0356,-118.3816,Fraud,White Collar Crime,Non-Violent Crimes,0.994605003
582389,03/06/2012,2012-06-03,Olympic,50,F,B,500 S  WESTMORELAND                 AV,34.0652,-118.2884,Battery Crime,Bodily Harm,Violent Crimes,0.99306315
582531,09/09/2012,2012-09-09,Devonshire,32,M,W,9900    JORDAN                       AV,34.25,-118.6039,Theft,Property Crime,Non-Violent Crimes,0.997443333
582672,11/11/2012,2012-11-11,Harbor,70,M,W,200 W  11TH                         ST,33.7342,-118.2814,Assault,Bodily Harm,Violent Crimes,0.997167375
582986,14/12/2012,2012-11-24,Southeast,61,F,B,1500 E  112TH                        ST,33.9332,-118.2485,Theft,Property Crime,Non-Violent Crimes,0.990672987
583862,29/09/2012,2012-09-29,Southeast,25,M,B,10500 S  FIGUEROA                     ST,33.9408,-118.2826,Assault,Bodily Harm,Violent Crimes,0.996324347
584061,22/07/2012,2012-07-22,Topanga,21,M,O,6200    VARIEL                       AV,34.1829,-118.5928,Theft,Property Crime,Non-Violent Crimes,0.995364444
584168,08/04/2012,2012-04-08,West Valley,39,F,B,TAMPA,34.1793,-118.5535,Assault,Bodily Harm,Violent Crimes,0.997682677
584299,01/11/2012,2012-09-11,West Valley,82,F,W,18200    CANTARA                      ST,34.2193,-118.5298,Theft,Property Crime,Non-Violent Crimes,0.994419781
584558,30/03/2012,2012-03-29,77th Street,19,F,H,7600 S  SAN PEDRO                    ST,33.9713,-118.2695,Robbery,Robbery,Violent Crimes,0.99154404
584776,04/12/2012,2012-12-04,West LA,30,M,W,1800 S  LA CIENEGA                   BL,34.0445,-118.3768,Theft,Property Crime,Non-Violent Crimes,0.992525633
584805,27/04/2012,2012-04-26,Hollywood,44,M,W,1600 N  LAS PALMAS                   AV,34.0997,-118.3361,Theft,Property Crime,Non-Violent Crimes,0.997272865
584952,15/02/2012,2012-02-13,N Hollywood,16,F,H,COLDWATER CANYON,34.1904,-118.4138,Battery Crime,Bodily Harm,Violent Crimes,0.990024662
585415,29/10/2012,2012-10-29,Hollywood,42,M,H,WESTERN                      AV,34.0885,-118.3092,Theft,Property Crime,Non-Violent Crimes,0.998002608
586137,08/12/2012,2012-12-08,Olympic,23,M,H,6TH                          ST,34.0635,-118.3078,Battery Crime,Bodily Harm,Violent Crimes,0.991472685
586856,23/04/2012,2012-04-23,Hollenbeck,27,F,O,5300 N  HUNTINGTON                   DR,34.0906,-118.1648,Battery Crime,Bodily Harm,Violent Crimes,0.996318727
587127,01/10/2012,2012-09-28,Topanga,27,M,W,PARTHENIA,34.2282,-118.597,Theft,Property Crime,Non-Violent Crimes,0.995134506
587138,27/09/2012,2012-09-27,Pacific,70,F,W,4400    ALLA                         RD,33.988,-118.4333,Theft,Property Crime,Non-Violent Crimes,0.99811387
587463,22/08/2012,2012-08-22,77th Street,66,M,B,1800 W  SLAUSON                      AV,33.9892,-118.3089,Theft,Property Crime,Non-Violent Crimes,0.990830465
587560,13/03/2012,2012-03-13,Harbor,51,M,H,PACIFIC COAST                HY,33.7907,-118.2828,Robbery,Robbery,Violent Crimes,0.994569339
587644,10/08/2012,2012-08-10,Foothill,31,M,H,9700    LAUREL CANYON                BL,34.2459,-118.4185,Robbery,Robbery,Violent Crimes,0.994139624
587776,10/05/2012,2012-05-10,Devonshire,45,F,W,9600    QUARTZ                       AV,34.2439,-118.565,Theft,Property Crime,Non-Violent Crimes,0.993072856
587806,31/07/2012,2012-07-31,Pacific,56,M,W,4300    GLENCOE                      AV,33.9873,-118.4403,Theft,Property Crime,Non-Violent Crimes,0.990073971
587819,25/01/2012,2012-01-24,West Valley,57,M,W,7500    JAMIESON                     AV,34.2066,-118.5219,Theft,Property Crime,Non-Violent Crimes,0.999247056
587938,08/04/2012,2012-04-08,Rampart,31,F,H,1400 W  11TH                         ST,34.0464,-118.2721,Assault,Bodily Harm,Violent Crimes,0.998501484
588261,10/04/2012,2012-04-10,Topanga,36,F,J,21000    SHERMAN                      WY,34.201,-118.5906,Theft,Property Crime,Non-Violent Crimes,0.996842021
588554,12/12/2012,2012-12-11,Topanga,14,M,H,23800    CALIFA                       ST,34.1779,-118.6445,Battery Crime,Bodily Harm,Violent Crimes,0.995000803
588775,01/08/2012,2012-08-01,Southwest,20,F,H,2800    CRENSHAW                     BL,34.0312,-118.3351,Robbery,Robbery,Violent Crimes,0.999777209
589306,10/01/2012,2012-01-04,West LA,78,M,W,400    UPPER MESA                   RD,34.0333,-118.5152,Theft,Property Crime,Non-Violent Crimes,0.99264991
589948,18/01/2013,2012-12-23,Hollywood,63,F,W,6600    FRANKLIN                     AV,34.1052,-118.3333,Theft,Property Crime,Non-Violent Crimes,0.997598768
590424,23/09/2012,2012-09-22,Central,42,M,H,1000 S  HILL                         ST,34.0416,-118.2584,Battery Crime,Bodily Harm,Violent Crimes,0.991811984
590538,24/08/2012,2012-08-23,Mission,15,F,H,NORDHOFF,34.2355,-118.461,Assault,Bodily Harm,Violent Crimes,0.993571666
590625,06/11/2012,2012-11-06,77th Street,24,F,H,62ND                         ST,33.9833,-118.298,Assault,Bodily Harm,Violent Crimes,0.999606753
590943,01/08/2012,2012-08-01,Foothill,38,M,H,GLENOAKS                     BL,34.2287,-118.3665,Theft,Property Crime,Non-Violent Crimes,0.994831235
590990,14/03/2012,2012-01-01,Rampart,44,F,H,3000 W  SUNSET                       BL,34.0839,-118.2741,Theft,Property Crime,Non-Violent Crimes,0.991713554
591016,29/03/2012,2012-03-27,77th Street,26,F,H,400 W  67TH                         ST,33.979,-118.2809,Assault,Bodily Harm,Violent Crimes,0.990894172
591046,28/03/2012,2012-03-26,Southeast,25,F,H,1600 E  111TH                        ST,33.9348,-118.2463,Assault,Bodily Harm,Violent Crimes,0.995978942
591165,28/06/2012,2012-06-08,Northeast,41,F,A,2700    RIVERSIDE                    DR,34.1085,-118.2608,Theft,Property Crime,Non-Violent Crimes,0.997659071
